question,answer,contexts,used_reranker,k_init,top_n,num_initial_docs,num_final_docs,runtime_seconds,factuality_score,question_type,chunk_size,chunk_overlap,ground_truths,context_precision,faithfulness,answer_relevancy,context_recall,answer_correctness,answer_similarity
why washington warn us about permanent foreign alliances and how he say we should keep neutrality in foreign policy in his farewell address?,"Original Answer: In his farewell address, George Washington warned against the dangers of permanent foreign alliances and advised Americans to keep neutrality in foreign policy. He believed that such alliances could be subversive of America's national interest and could lead to entangling foreign affairs with domestic concerns. Washington also recognized the importance of maintaining good relations with other countries, but he believed that temporary associations for extraordinary emergencies were necessary. Overall, Washington's message in his farewell address was to prioritize the safety and stability of the Republic over political factionalism and interference from foreign powers.","['Introduction Page \n(No page folio)INTRODUCTION\nPrepared by the United States Senate Historical Office\nIn September 1796, worn out by burdens of the presidency and attacks \nof political foes, George Washington announced his decision not to seek a third term. With the assistance of Alexander Hamilton and James Madison, Washington composed in a “Farewell Address” his political testament to the nation. Designed to inspire and guide future genera-tions, the address also set forth Washington’s defense of his administra-tion’s record and embodied a classic statement of Federalist doctrine. Washington’s principal concern was for the safety of the eight-year-\nold Constitution. He believed that the stability of the Republic was threatened by the forces of geographical sectionalism, political faction-alism, and interference by foreign powers in the nation’s domestic af-fairs. He urged Americans to subordinate sectional jealousies to com-mon national interests. Writing at a time before political parties had become accepted as vital extraconstitutional, opinion-focusing agen-cies, Washington feared that they carried the seeds of the nation’s de-struction through petty factionalism. Although Washington was in nosense the father of American isolationism, since he recognized the ne-cessity of temporary associations for “extraordinary emergencies,” he did counsel against the establishment of “permanent alliances with other countries,” connections that he warned would inevitably be sub-versive of America’s national interest. Washington did not publicly deliver his Farewell Address. It first ap-\npeared on September 19, 1796, in the Philadelphia \nDaily American \nAdvertiser and then in papers around the country. In January 1862, with the Constitution endangered by civil war, a thou-\nsand citizens of Philadelphia petitioned Congress to commemorate theforthcoming 130th anniversary of George Washington ’s birth by provid-\ning that “the Farewell Address of Washington be read aloud on the morn-\ning of that day in one or the other of the Houses of Congress. ” Both \nhouses agreed and assembled in the House of Representatives ’ chamber \non February 22, 1862, where Secretary of the Senate John W. Forney “ren-\ndered ‘The Farewell Address ’ very effectively, ” as one observer recalled. The practice of reading the Farewell Address did not immediately be-\ncome a tradition. The address was first read in regular legislative ses-sions of the Senate in 1888 and the House in 1899. (The House continuedthe practice until 1984.) Since 1893 the Senate has observed Washington ’s birthday by selecting one of its members to read the \nFarewell Address. The assignment alternates between members of each political party. At the conclusion of each reading, the appointed sena-tor inscribes his or her name and brief remarks in a black, leather-bound book maintained by the secretary of the Senate. The version of the address printed here is taken from the original of \nthe final manuscript in the New York Public Library provided courtesy of The Papers of George Washington. The only changes have been to modernize spelling, capitalization, and punctuation.', 'The Lansdowne portrait (1796)Washington stressed that national identity was paramount, and said that the ""nam e of AMERICAN... must\nalways exalt the just pride of patriotism"".[226] Washington warned against the dangers of political parties\nand entangling foreign alliances with domestic affairs.[227] He counseled friendship and commerce  with\nall nations, but advised against involvement in European wars.[228] He stressed the importance of\nreligion, asserting that ""religion and morality are indispensable supports"" in a republic.[229]\nHe closed the address by reflecting on his legacy: ""I fervently beseech the Almighty to avert or mitigate\nthe evils to which [my unintentioned errors] may tend. I shall also carry with me the hope that my country\nwill never cease to view them with indulgence, and that, after forty-five years of my life dedicated to its\nservice with an upright zeal, the faults of incompetent abilities will be consigned to oblivion, as myself\nmust soon be to the mansions of rest.""[230] After initial publication, many Repu blicans, including\nMadison, criticized the address and described it as an anti-French campaign document, with Madison\nbelieving that Washington was strongly pro-British.[231] In 1972, the Washington scholar James Flexner\nreferred to the Farewell Address as receiving as much acclaim as Thomas Jefferson\'s Declaration of\nIndependence  and Abraham Lincoln \'s Gettysbur g Address .[232] In 2010, Chernow called the ""Farewell\nAddress"" one of the most influential statements on republicanism .[233]\nWashington retired to Mount Vernon in March 1797 and\ndevoted time to his business interests.[234] His plantation\noperations were minimally profitable,[33] and his lands in the\nwest (on the Piedmont ) yielded little income; he attempted to\nsell these but was unable to.[235] He became an even more\ncommitted Federalist. He vocally supported the Alien and\nSedition Acts and convinced Federalist John Marshall  to run\nfor Congress to weaken the Jeffersonian hold on Virginia .[236]\nFrench privateers began seizing American ships in 1798, and\ndeteriorating relations led to the ""Quasi-W ar"".', 'Why quit our own to stand upon foreign ground? Why, by interweaving our destiny with that of any part of Europe, entangle our peace and prosperity in the toils of European ambition, rival-ship, interest, humor, or caprice? It is our true policy to steer clear of permanent \nalliances with any portion of the foreign world —so \nfar, I mean, as we are now at liberty to do it, for let me not be understood as capable of patronizing in-fidelity to existing engagements (I hold the maxim no less applicable to public than to private affairs, that honesty is always the best policy) —I repeat it \ntherefore, let those engagements be observed in\n[27]WASHINGTON ’S FAREWELL ADDRESS067-155*WashFarewell.qrk  3/29/01  6:16 AM  Page 27']",False,10,3,10,3,2.384888172149658,0.5101988315582275,multi_hop_abstract_query_synthesizer,0,0,"[""In his Farewell Address, George Washington warned against the establishment of permanent alliances with other countries because he believed such connections would inevitably be subversive to America's national interest. He emphasized the importance of neutrality in foreign policy, explaining that the United States had the right and duty to take a neutral position in the ongoing European war. Washington maintained this neutrality with moderation, perseverance, and firmness, aiming to protect the young nation’s institutions and allow it to grow strong and independent without interruption. He viewed neutrality as a duty grounded in justice and humanity, preserving peace and amity with other nations.""]",0.9999999999666667,1.0,0.8709107491999145,,0.6812502397200692,0.9602950765273355
"How did George Washington's 1754 expedition to the Ohio Valley, including the conflict with French forces and the construction of Fort Necessity, influence his military rank and subsequent role in the French and Indian War, considering Governor Dinwiddie's mission and the political ramifications of Jumonville's death?","Original Answer:  George Washington's 1754 expedition to the Ohio Valley, including the conflict with French forces and the construction of Fort Necessity, had a significant impact on his military rank and subsequent role in the French and Indian War. Although the mission was not successful in achieving its primary objective of forcing the French to leave the Ohio River Valley, Washington's actions during this expedition helped establish him as a capable military leader. His successful ambush against the French force of 50 men, which resulted in the death of Joseph Coulon de Jumonville and other French soldiers, raised his profile both in the Colonies and abroad. Additionally, the construction of Fort Necessity demonstrated Washington's ability to adapt to changing circumstances and make strategic decisions under pressure.

Governor Dinwiddie's mission to demand the French forces vacate land claimed by the British and make peace with the Iroquois Confederacy also played a role in Washington's subsequent military rank and role in the French and Indian War. Although the mission was ultimately unsuccessful, it provided Washington with valuable experience in diplomacy and negotiation, which would be useful in future military campaigns.

Ey","['. to drive \nthem off by force of arms.”5  \n \nJoined by a  small band of outdoorsmen and a French interpreter, Washington set off \ninto the Ohio wilderness, where he quickly became plagued by miserably cold weather \nand freezing rain. Nevertheless, he made contact with local Iroquois Indians, who guided \nWashington to a French trading post; from there, they made their way to the French Fort \nLe Boeuf, arriving at the fort (in present day northwest Pennsylvania) in mid -December. The French were not keen to obey Washington’s request that they leave, and Washington \nhurri edly returned to Williamsburg to report the news. Presenting Governor Dinwiddie \nwith the French reply, along with his own estimates of French military power and a \ndetailed journal of the expedition, Washington impressed his superiors with the diligence \nwith which he undertook the mission. His reports were soon published in newspapers \nacross the Colonies and in Great Britain, making the young George Washington instantly \nfamous —and setting the stage for the soon -to-come French and Indian War. A few months l ater, the now -Lieutenant Colonel Washington led about a hundred \nmilitiamen and a number of Mingo Iroquois warriors back into the wilderness, this time \nto confront the French. In an ambush by Washington against a French force of about 35 \nmen, a French envoy , Joseph Coulon de Villiers de Jumonville, who carried a message to \nthe British, was killed, setting off a diplomatic nightmare. (Washington claimed that the \nFrench were spying on his party and preparing to launch their own ambush.) Aware that \nthe French w ould retaliate, Washington swiftly began constructing defenses, which he \nlabeled Fort Necessity. On July 3, 1754, the French finally attacked, killing a third of \nWashington’s soldiers while only suffering three dead of their own. By nightfall, the \nFrench c ommander —who was the fallen Jumonville’s brother —accepted Washington’s \nsurrender and allowed him and his men to return to Virginia. The failed expedition raised Washington’s profile both in the Colonies and abroad, \nthough not in the way the ambitious you ng officer desired: while many Americans \n                                                 \n5 Chernow, 32. ', 'Map showing key locations in the French and\nIndian WarLawrence Washington\'s service as adjutant general of the Virginia militia  inspired Geor ge to seek a\nmilitia commission . Virginia\'s lieutenant governor , Robert Dinwiddie , appointed Washington as a major\nand commander of one of the four milit ia districts. The British and French were competing for control of\nthe Ohio River Valley : the British were constructing forts along the river, and the French between the\nriver and Lake Erie .[17]\nIn October 1753, Dinwiddie appointed Washington as a special envoy  to demand the French forces vacate\nland that was claimed by the British. Washington was also directed to make peace with the Iroquois\nConfederacy  and to gather intelligence about the French forces.[18] Washington met with Iroquois leader\nTanacharison  at Logstown .[19] Washington said that at this meeting Tanacharison named him\nConotocaurius . This name, meaning ""devourer of villages"", had previously been given to his great-\ngrandfather John Washington  in the late 17th century by the Susquehannock .[20]\nWashington\'s party reached the Ohio River in November 1753 and was interc epted by a French patrol. The party was escorted to Fort Le Boeuf , where Washington was received in a friendly manner .', ""He\ndelivered the British demand to vacate to the French commander Jacques Legardeur de Saint-Pierre , but\nthe French refused to leave. Saint-Pierre gave Washington his official answer after a few days' delay , as\nwell as food and winter clothing for his party's journey back to Virginia.[21] Washington completed the\nprecarious mission in difficult winter conditions, achieving a measure of distinction when his report was\npublished in Virginia and London.[22]\nIn February 1754, Dinwiddie promoted Washington to\nlieutenant colonel and second-in-com mand of the\n300-strong Virginia Regiment , with orders to confront\nthe French at the Forks of the Ohio .[23] Washington\nset out with half the regiment in April and was soon\naware that a French force of 1,000 had begun\nconstruction of Fort Duquesne  there. In May, having\nestablished a defensive position  at Great Meadows,\nWashington learned that the French had made camp\nseven miles (11 km) away; he decided to take the\noffensive.[24] The French detachment proved to be\nonly about 50 men, so on May 28 Washington\ncommanded an ambush . His small force of Virginians\nand Indian allies[c][26] killed the French, including\ntheir commander Joseph Coulon de Jumonville , who\nhad been carrying a diplomatic message for the\nBritish. The French later found their countrymen dead\nand scalped , blaming Washington, who had retreat ed\nto Fort Necessity .[27]Colonial military car eer (1752–1758)\nFrench and Indian War""]",False,10,3,10,3,3.40775203704834,0.530589759349823,multi_hop_abstract_query_synthesizer,0,0,"[""In 1754, George Washington, newly promoted to Lieutenant Colonel of the Virginia Militia, led an expedition to the Ohio Valley under Governor Dinwiddie's orders to build English forts and assert territorial claims against French intrusion. During this mission, Washington encountered a French diplomatic party led by Ensign Joseph de Jumonville. Mistaking them for an attack force, Washington's men ambushed the French, resulting in Jumonville's death, which had significant political and diplomatic consequences, as the French portrayed it as an assassination of a diplomat. Anticipating a French retaliation, Washington hastily constructed Fort Necessity at the Great Meadows, but its poor location below surrounding terrain and the onset of heavy rain rendered the fort indefensible. On July 3, 1754, Washington surrendered Fort Necessity to superior French forces, signing a surrender document in French without fully understanding its implications, which admitted to the 'assassination' of Jumonville. This event was a source of embarrassment for both Washington and Governor Dinwiddie and dashed Washington's hopes of becoming a regular Royal Army officer. Following the death of Colonel Joshua Fry, Washington assumed command as a full Colonel of the Virginia forces. Despite the setback, Washington's leadership during these engagements elevated his military reputation. Later, during the French and Indian War, Washington was appointed Colonel of the reestablished Virginia Regiment and participated in further military campaigns, including serving as an aide to General Braddock. His early experiences, shaped by Dinwiddie's mission and the fallout from Jumonville's death, were pivotal in defining his military career and role in the conflict.""]",0.9999999999666667,1.0,0.9128993284008459,,0.3194938249442504,0.9446419664436683
"How did George Washington's early military career, including his ambush of the French diplomatic mission and his role in the Braddock Expedition, reflect the conflict between British and French forces in the Ohio Valley?","Original Answer:  George Washington's early military career, including his ambush of the French diplomatic mission and his role in the Braddock Expedition, reflected the conflict between British and French forces in the Ohio Valley. During this time, tensions were high between the two powers as they vied for control over the valuable resources and territory in the region. Washington's actions, such as his ambush of the French diplomatic mission and his role in the Braddock Expedition, demonstrated his willingness to take bold and decisive action in order to protect British interests and gain an advantage over the French. Additionally, these events highlighted the challenges and dangers that both sides faced in navigating the complex and often treacherous terrain of the Ohio Valley, as well as the importance of effective communication and coordination among military forces. Overall, Washington's early military career provided a glimpse into the larger conflict between British and French forces in the region and the key factors that shaped their interactions with one another.","[""Two-thirds of the British force became casualties in the ensuing Battle of the Monongahela , and\nBraddock was killed. Under the comma nd of Lieutenant Colonel Thomas Gage , Washington rallied the\nsurvivors and formed a rear guard , allowing the remnants of the force to retreat.[35] During the\nengagement, Washington had two horses shot out from under him, and his hat and coat were pierced by\nbullets.[36] His conduct redeemed his reputation among critics of his command in the Battle of Fort\nNecessity ,[37] but he was not included by the succeeding commander (Colonel Thomas Dunbar) in\nplanning subsequent operations.[38]\nThe Virginia Regiment was reconstituted in August 1755, and Dinwiddie appointed Washington its\ncommander , again with the rank of colonel. Washington clashed over seniority  almost immediately , this\ntime with Captain John Dagworthy , who commanded a detachment of Marylanders at the regiment's\nheadquarters in Fort Cumberland .[39] Washington, impatient for an offensive against Fort Duquesne, was\nconvinced Braddock would have granted him a royal commission and pressed his case in February 1756\nwith Braddock's successor as Commander -in-Chief , William Shirley , and again in January 1757 with\nShirley's successor , Lord Loudoun . Loudoun humiliated Washington, refused him a royal commission,\nand agreed only to relieve him of the responsibility of manning Fort Cumberland.[40]\nIn 1758, the Virginia Regiment was assigned to the British Forbes Expedition  to capture Fort\nDuquesne.[41][31] General John Forbes  took Washington's advice on some aspects of the expedition but\nrejected his opinion on the best route to the fort.[42] Forbes nevertheless made Washington a brevet\nbrigadier general and gave him comma nd of one of the three brigades that was assigned to assault the"", '. to drive \nthem off by force of arms.”5  \n \nJoined by a  small band of outdoorsmen and a French interpreter, Washington set off \ninto the Ohio wilderness, where he quickly became plagued by miserably cold weather \nand freezing rain. Nevertheless, he made contact with local Iroquois Indians, who guided \nWashington to a French trading post; from there, they made their way to the French Fort \nLe Boeuf, arriving at the fort (in present day northwest Pennsylvania) in mid -December. The French were not keen to obey Washington’s request that they leave, and Washington \nhurri edly returned to Williamsburg to report the news. Presenting Governor Dinwiddie \nwith the French reply, along with his own estimates of French military power and a \ndetailed journal of the expedition, Washington impressed his superiors with the diligence \nwith which he undertook the mission. His reports were soon published in newspapers \nacross the Colonies and in Great Britain, making the young George Washington instantly \nfamous —and setting the stage for the soon -to-come French and Indian War. A few months l ater, the now -Lieutenant Colonel Washington led about a hundred \nmilitiamen and a number of Mingo Iroquois warriors back into the wilderness, this time \nto confront the French. In an ambush by Washington against a French force of about 35 \nmen, a French envoy , Joseph Coulon de Villiers de Jumonville, who carried a message to \nthe British, was killed, setting off a diplomatic nightmare. (Washington claimed that the \nFrench were spying on his party and preparing to launch their own ambush.) Aware that \nthe French w ould retaliate, Washington swiftly began constructing defenses, which he \nlabeled Fort Necessity. On July 3, 1754, the French finally attacked, killing a third of \nWashington’s soldiers while only suffering three dead of their own. By nightfall, the \nFrench c ommander —who was the fallen Jumonville’s brother —accepted Washington’s \nsurrender and allowed him and his men to return to Virginia. The failed expedition raised Washington’s profile both in the Colonies and abroad, \nthough not in the way the ambitious you ng officer desired: while many Americans \n                                                 \n5 Chernow, 32. ', 'Washington the Soldier, an 1834 portrait of\nWashington on horseback during the Battle of the\nMonongahelaThe rest of the Virginia Regiment joined Washington\nthe following month with news that he had been\npromoted to the rank of colonel and given command\nof the full regiment. They were reinforced by an\nindependent company of a hundred South Carolinians\nled by Captain James Mackay ; his royal commission\noutranked Washington\'s and a conflict of command\nensued. On July 3, 900 French soldiers attacked Fort\nNecessity , and the ensuing battle  ended in\nWashington\'s surrender .[28] Washington did not speak\nFrench, but signed a surrender document in which he\nunwittingly took responsibility for ""assassinating""\nJumonville, later blaming the translator for not\nproperly translating it.[29] The Virginia Regiment was\ndivided and Washington was offered a captaincy in\none of the newly formed regiments. He refused, as it would have been a demotion—the British had\nordered that ""colonials"" could not be ranked any higher than captain—and instead resigned his\ncommission.[30][31] The Jumonville affair became the incident which ignited the French and Indian\nWar.[32]\nIn 1755, Washington volunteered as an aide to General Edward Braddock , who led a British expedition  to\nexpel the French from Fort Duquesne and the Ohio Country .[33] On Washington\'s recommendation,\nBraddock split the army into one main column and a smaller ""flying column"".[34] Washington was\nsuffering from severe dysentery  so did not initially travel with the expedition forces. When he rejoined\nBraddock at Monongahela, still very ill, the French and their Indian allies ambushed the divided army .']",False,10,3,10,3,3.0065994262695312,0.4568043053150177,multi_hop_abstract_query_synthesizer,0,0,"[""George Washington's early military career was marked by significant involvement in the escalating conflict between British and French forces in the Ohio Valley. In January 1754, at age 22, Washington was ambushed by a traitorous Indian guide but managed to reach John Frazier's trading post. He then continued alone to report back to the Colonial government in Williamsburg, producing a detailed 7000-word report and map of French forts along the upper Ohio River, which was published and gained him notoriety on both sides of the Atlantic. In April 1754, as a newly promoted Lieutenant Colonel, Washington led 140 men to the Forks of the Ohio, where a smaller English group had been chased away by a superior French force. Washington cut a road to the Ohio Company’s storehouse and ambushed a French diplomatic mission led by Ensign Joseph de Jumonville, mistakenly assuming it was an attack party. This ambush resulted in the death of Jumonville and others, escalating tensions. Later, during the Braddock Expedition, Washington served alongside notable figures such as Daniel Boone and Horatio Gates. Despite his advice to General Braddock to dispense with wagons and adopt more flexible tactics, Braddock refused, leading to a disastrous ambush by French forces and their Indian allies near the Monongahela River. Washington played a significant role in the battle, surviving when many British officers were wounded or killed, and helping to rally the colonial troops. These events illustrate Washington's early military leadership amid the broader conflict between British and French forces vying for control of the Ohio Valley.""]",0.9999999999666667,1.0,0.9081565277743372,,0.33956646884048597,0.9582484146515765
