question,answer,contexts,used_reranker,k_init,top_n,num_initial_docs,num_final_docs,runtime_seconds,factuality_score,question_type,chunk_size,chunk_overlap,ground_truths,context_precision,faithfulness,answer_relevancy,context_recall,answer_correctness,answer_similarity
"How did George Washington's leadership during the siege of York-town, including the strategic positioning of troops and coordination with French forces, contribute to the decisive victory over Cornwallis?","Original Answer:  George Washington's leadership during the siege of Yorktown was crucial to the decisive victory over Cornwallis. He strategically positioned his troops and coordinated with French forces to block any hope Cornwallis had for retreat or reinforcement. Washington also coolly steered British officer Charles O'Hara to Washington's own second in command, Major General Benjamin Lincoln, when O'Hara attempted to deliver Cornwallis' sword to French General Rochambeau. This effectively ended the war and secured the victory for the colonists.","['Cornwallis spent a year chasing the Continental Army in the\xa0South. Then came the battle of Kings Mountain, along the North and South \nCarolina border. At Kings Mountain, the Continental Army defeated a large Loyalist force. Cornwallis realized the British plan for the South would not work. He decided to move his army to Virginia. If he could \ndefeat the Continental Army in Virginia, he would crush the rebellion. In the summer of 1781, Cornwallis chose a small Virginia town \ncalled Yorktown for his base. Yorktown is located on the York River, which flows into the sea. At Yorktown, the British navy could bring Cornwallis troops and supplies. 122The Big Question\nHow does the \nchapter title explain the outcome of the American Revolution?', '••Yorktown will be remembered as WashingtonYorktown will be remembered as Washington ’’s one convincing defeat of s one convincing defeat of \nthe British forces. Lord Genera l Charles Cornwallis was forced the British forces. Lord Genera l Charles Cornwallis was forced to to \nsurrender 9,700 troops on October 17th, 1781.surrender 9,700 troops on October 17th, 1781. ••The colonistThe colonist ’’s alliance with the French secured the victory.', ""Washington s alliance with the French secured the victory. Washington \nwas aided on land by was aided on land by French General RochambeauFrench General Rochambeau ’’s 6,000 regularss 6,000 regulars , , \nwhile while French Admiral de GrasseFrench Admiral de Grasse ’’s fleets fleet raced north from the West Indies raced north from the West Indies \nto block any hope Cornwallis had for retreat or reinforcement vito block any hope Cornwallis had for retreat or reinforcement vi a the a the \nChesapeake Bay. Chesapeake Bay. ••Without the French Naval Blockade, the British would have extracWithout the French Naval Blockade, the British would have extrac ted ted \nthemselves and the war would most certainly have dragged on. themselves and the war would most certainly have dragged on. ••It was the greatest American tr iumph during a long and bitter wa It was the greatest American triumph during a long and bitter wa r.r.Cornwallis' second-in-\ncommand, Charles O'Hara , \nattempted to deliver \nCornwallis's sword to \nFrench General Comte de \nRochambeau . But, \nRochambeau directed \nO'Hara to American \nGeneral George \nWashington , who coolly \nsteered the British officer \nto Washington's own \nsecond in command, Major \nGeneral Benjamin Lincoln .""]",False,10,3,10,3,2.493528127670288,0.512718915939331,multi_hop_specific_query_synthesizer,0,0,"[""During the siege of York-town, George Washington demonstrated calm and courageous leadership as he directed the combined American and French forces. The troops marched to positions near York-town, with Americans on the east side and the French on the west side of Beaver Dam Creek. The French fleet, led by the Count de Grasse, remained in Lynn Haven Bay to prevent British naval aid. Washington oversaw the construction of trenches and earthworks under cover of darkness, enabling the first line of attack. He personally ignited the first cannon fire, initiating a sustained bombardment that inflicted significant damage on British fortifications and ships. The American troops, led by Alexander Hamilton, successfully stormed the fortifications with minimal losses, while the French captured the fort at the Point. Washington's presence on the battlefield inspired his men despite the dangers, and his strategic coordination with French forces effectively trapped Cornwallis, who ultimately attempted a failed escape. This combined effort led to Cornwallis's surrender, marking a decisive victory in the American Revolutionary War.""]",0.9999999999666667,0.8,0.9324116200354041,,0.43319619564347056,0.9327847825738822
"How did Sir Henry Clinton's leadership influence Benedict Arnold's treasonous plan to surrender West Point during the American Revolution, and what were the key events that led to the exposure of this scheme?","Eyewitness: As a historian, I can attest to the fact that Sir Henry Clinton's leadership did not directly influence Benedict Arnold's treasonous plan to surrender West Point during the American Revolution. However, it is important to note that Arnold was a British spy who provided sensitive information to the British spymaster John André, which allowed the British to capture West Point and gain control of the Hudson River. The key events that led to the exposure of this scheme were the discovery of Arnold's plans by militia who captured André, after which Arnold escaped to New York. Washington recalled the commanders positioned under Arnold at key points around the fort to prevent any complicity and assumed personal command at West Point, reorganizing its defenses.","['His future in the American army was bright. In 1780, General Washington placed Benedict Arnold in command of West Point, a fort on the Hudson\xa0River. Despite his success, Benedict Arnold did not feel appreciated \nenough. He also liked to spend more money than he could afford on luxuries. So in exchange for a large sum of money, Arnold\xa0agreed to turn over West Point to the British. The plot was discovered in time, but \nArnold himself escaped and joined the \nBritish forces. Americans were shocked to \nlearn of Benedict Arnold’s treason . Vocabulary\ntreason,  n. disloyalty \nto a country by \nhelping an enemy', ""Map of the Siege of Yorktownfrom a surprise British attack, which was itself based on intelligence from Washington's general turned\nBritish spy Benedict Arnold.[127]\nWashington had disregarded incidents of disloyalty by Arnold, who had distinguished himself in many\ncampaigns, including the invasion of Quebec .[128] In 1779, Arnold began supplying the British spymaster\nJohn André  with sensitive information intended to allow the British to capture West Point , a key\nAmerican defensive position on the Hudson River .[129] On September 21, Arnold gave André plans to\ntake over the garrison.[130] André was captured by militia who discovered the plans, after which Arnold\nescaped to New York.[131] On being told about Arnold's treason, Washington recalled the commanders\npositioned under Arnold at key points around the fort to prevent any complicity . He assumed personal\ncommand at West Point and reor ganized its defenses.[132]\nBy June 1780, the British had occupied the South Carolina\nPiedmont  and had firm control of the South."", ""Washington was impressed by Alexander Hamilton 's intelligence and bravery; he would later promote\nHamilton to colonel and appoint him his aide-de-camp .[73]\nWashington initially banned the enlistment of Black soldiers, both free and enslaved. The British saw an\nopportunity to divide the colonies: the colonial governor of Virginia issued a proclamation  promising\nfreedom to slaves if they joined the British forces.[74] In response to this proclamation and the need for\ntroops, Washington soon overturned his ban.[75] By the end of the war, around one-tenth of the soldiers in\nthe Continental Army were Black, with some obtaining freedom.[76]\nIn April 1775, in response to the growing rebellious movement, British troops  occupied Boston , led by\nGeneral Thomas Gage , commander of British forces in America.[77] Local militias surrounded the city\nand trapped the British troops, resulting in a standof f.[78] As Washington headed for Boston, he was\ngreeted by cheering crowds and politica l ceremony; he became a symbol of the Patriot  cause.[79] Upon\nWashington's arrival on July 2, he went to inspect the army , but found undis ciplined militia.[80] After\nconsultation, he initiated Benjamin Franklin 's suggested reforms, instituting military drills and imposing\nstrict disciplinary measures.[81] Washington promoted some of the soldiers who had performed well at\nBunker Hill to officer rank, and removed officers who he saw as incompetent.[82] In October , King\nGeor ge III declared that the colonies were in open rebellion and relieved Gage of command, replacing\nhim with General William Howe .[83]\nWhen the Charles River  froze over, Washington was eager to cross and storm Boston, but Gates and\nothers were opposed to having untrained militia attempt to assault well-garrisoned fortifications. Instead,\nWashington agreed to secure the Dorchester Heights  above Boston to try to force the British out.[84] On\nMarch 17, 8,906 British troops, 1,100 Loyalists , and 1,220 women and children began a chaotic naval\nevacuation.""]",False,10,3,10,3,2.096364736557007,0.4818844497203827,multi_hop_specific_query_synthesizer,0,0,"[""Sir Henry Clinton played a pivotal role in Benedict Arnold's treasonous plan during the American Revolution. Arnold, once a respected American general, grew resentful after being court-martialed and sought to join the British cause. He secretly communicated with Sir Henry Clinton, proposing to surrender the strategic post of West Point to the British. Although Clinton initially did not make use of Arnold's offers, Arnold persisted and eventually gained command of West Point, from where he coordinated with Clinton's aide-de-camp, John André, who used the alias John Anderson. Arnold planned to deliver West Point to Clinton's forces while General Washington was away. On September 11, 1780, Arnold arranged to meet André at Dobbs Ferry to finalize the plan. However, due to a delay caused by Arnold being fired upon by guard boats, the meeting was postponed. André later traveled covertly by boat to meet Arnold, but after their secret discussions, André was captured by American militia while carrying plans to take over West Point. This led to the exposure of Arnold's scheme. Upon learning of Arnold's betrayal, Washington took personal command of West Point and reorganized its defenses to prevent any further British advantage.""]",0.99999999995,0.75,0.9459916377376624,,0.5195787443489287,0.9533164481648597
"How did Washington emphasize the importance of unity among Americans in his Farewell Address, and how did the joint efforts of American and French troops at Yorktown contribute to the American cause?","Original Answer: In his Farewell Address, Washington emphasized the importance of unity among Americans by warning against the dangers of political parties and sectionalism. He believed that these forces could threaten the stability of the Republic and subvert its national interest. Washington urged Americans to subordinate their sectional jealousies to common national interests.","['Introduction Page \n(No page folio)INTRODUCTION\nPrepared by the United States Senate Historical Office\nIn September 1796, worn out by burdens of the presidency and attacks \nof political foes, George Washington announced his decision not to seek a third term. With the assistance of Alexander Hamilton and James Madison, Washington composed in a “Farewell Address” his political testament to the nation. Designed to inspire and guide future genera-tions, the address also set forth Washington’s defense of his administra-tion’s record and embodied a classic statement of Federalist doctrine. Washington’s principal concern was for the safety of the eight-year-\nold Constitution. He believed that the stability of the Republic was threatened by the forces of geographical sectionalism, political faction-alism, and interference by foreign powers in the nation’s domestic af-fairs. He urged Americans to subordinate sectional jealousies to com-mon national interests. Writing at a time before political parties had become accepted as vital extraconstitutional, opinion-focusing agen-cies, Washington feared that they carried the seeds of the nation’s de-struction through petty factionalism. Although Washington was in nosense the father of American isolationism, since he recognized the ne-cessity of temporary associations for “extraordinary emergencies,” he did counsel against the establishment of “permanent alliances with other countries,” connections that he warned would inevitably be sub-versive of America’s national interest. Washington did not publicly deliver his Farewell Address. It first ap-\npeared on September 19, 1796, in the Philadelphia \nDaily American \nAdvertiser and then in papers around the country. In January 1862, with the Constitution endangered by civil war, a thou-\nsand citizens of Philadelphia petitioned Congress to commemorate theforthcoming 130th anniversary of George Washington ’s birth by provid-\ning that “the Farewell Address of Washington be read aloud on the morn-\ning of that day in one or the other of the Houses of Congress. ” Both \nhouses agreed and assembled in the House of Representatives ’ chamber \non February 22, 1862, where Secretary of the Senate John W. Forney “ren-\ndered ‘The Farewell Address ’ very effectively, ” as one observer recalled. The practice of reading the Farewell Address did not immediately be-\ncome a tradition. The address was first read in regular legislative ses-sions of the Senate in 1888 and the House in 1899. (The House continuedthe practice until 1984.) Since 1893 the Senate has observed Washington ’s birthday by selecting one of its members to read the \nFarewell Address. The assignment alternates between members of each political party. At the conclusion of each reading, the appointed sena-tor inscribes his or her name and brief remarks in a black, leather-bound book maintained by the secretary of the Senate. The version of the address printed here is taken from the original of \nthe final manuscript in the New York Public Library provided courtesy of The Papers of George Washington. The only changes have been to modernize spelling, capitalization, and punctuation.', 'The Lansdowne portrait (1796)Washington stressed that national identity was paramount, and said that the ""nam e of AMERICAN... must\nalways exalt the just pride of patriotism"".[226] Washington warned against the dangers of political parties\nand entangling foreign alliances with domestic affairs.[227] He counseled friendship and commerce  with\nall nations, but advised against involvement in European wars.[228] He stressed the importance of\nreligion, asserting that ""religion and morality are indispensable supports"" in a republic.[229]\nHe closed the address by reflecting on his legacy: ""I fervently beseech the Almighty to avert or mitigate\nthe evils to which [my unintentioned errors] may tend. I shall also carry with me the hope that my country\nwill never cease to view them with indulgence, and that, after forty-five years of my life dedicated to its\nservice with an upright zeal, the faults of incompetent abilities will be consigned to oblivion, as myself\nmust soon be to the mansions of rest.""[230] After initial publication, many Repu blicans, including\nMadison, criticized the address and described it as an anti-French campaign document, with Madison\nbelieving that Washington was strongly pro-British.[231] In 1972, the Washington scholar James Flexner\nreferred to the Farewell Address as receiving as much acclaim as Thomas Jefferson\'s Declaration of\nIndependence  and Abraham Lincoln \'s Gettysbur g Address .[232] In 2010, Chernow called the ""Farewell\nAddress"" one of the most influential statements on republicanism .[233]\nWashington retired to Mount Vernon in March 1797 and\ndevoted time to his business interests.[234] His plantation\noperations were minimally profitable,[33] and his lands in the\nwest (on the Piedmont ) yielded little income; he attempted to\nsell these but was unable to.[235] He became an even more\ncommitted Federalist. He vocally supported the Alien and\nSedition Acts and convinced Federalist John Marshall  to run\nfor Congress to weaken the Jeffersonian hold on Virginia .[236]\nFrench privateers began seizing American ships in 1798, and\ndeteriorating relations led to the ""Quasi-W ar"".', '. to drive \nthem off by force of arms.”5  \n \nJoined by a  small band of outdoorsmen and a French interpreter, Washington set off \ninto the Ohio wilderness, where he quickly became plagued by miserably cold weather \nand freezing rain. Nevertheless, he made contact with local Iroquois Indians, who guided \nWashington to a French trading post; from there, they made their way to the French Fort \nLe Boeuf, arriving at the fort (in present day northwest Pennsylvania) in mid -December. The French were not keen to obey Washington’s request that they leave, and Washington \nhurri edly returned to Williamsburg to report the news. Presenting Governor Dinwiddie \nwith the French reply, along with his own estimates of French military power and a \ndetailed journal of the expedition, Washington impressed his superiors with the diligence \nwith which he undertook the mission. His reports were soon published in newspapers \nacross the Colonies and in Great Britain, making the young George Washington instantly \nfamous —and setting the stage for the soon -to-come French and Indian War. A few months l ater, the now -Lieutenant Colonel Washington led about a hundred \nmilitiamen and a number of Mingo Iroquois warriors back into the wilderness, this time \nto confront the French. In an ambush by Washington against a French force of about 35 \nmen, a French envoy , Joseph Coulon de Villiers de Jumonville, who carried a message to \nthe British, was killed, setting off a diplomatic nightmare. (Washington claimed that the \nFrench were spying on his party and preparing to launch their own ambush.) Aware that \nthe French w ould retaliate, Washington swiftly began constructing defenses, which he \nlabeled Fort Necessity. On July 3, 1754, the French finally attacked, killing a third of \nWashington’s soldiers while only suffering three dead of their own. By nightfall, the \nFrench c ommander —who was the fallen Jumonville’s brother —accepted Washington’s \nsurrender and allowed him and his men to return to Virginia. The failed expedition raised Washington’s profile both in the Colonies and abroad, \nthough not in the way the ambitious you ng officer desired: while many Americans \n                                                 \n5 Chernow, 32. ']",False,10,3,10,3,2.2015445232391357,0.6379205584526062,multi_hop_specific_query_synthesizer,0,0,"[""In his Farewell Address, Washington emphasized the importance of unity among Americans by urging them to cherish an immovable attachment to the national Union, describing it as the main pillar of their real independence, tranquility, peace, safety, prosperity, and liberty. He warned against internal and external enemies seeking to weaken this unity and stressed that the name 'American' should exalt the just pride of patriotism above local distinctions. Washington highlighted the mutual benefits of union among different regions, such as the North, South, East, and West, in commerce, agriculture, navigation, and security, and portrayed the Union as essential to avoiding internal conflicts and maintaining liberty. Regarding the military efforts, the joint American and French troops played a decisive role at the Siege of Yorktown, where Cornwallis was forced to surrender after Washington rejected unfavorable terms and insisted on his own. The American troops lined up on one side of the road and the French on the other as the British marched out to lay down their arms. This victory was a death-blow to the British war effort, leading to great joy throughout the land and eventual British evacuation of New York. Washington praised all troops for their bravery, and this combined effort significantly advanced the American cause for independence.""]",0.99999999995,0.75,0.8959410175473922,,0.7606944493860435,0.9251307387206447
