question,answer,contexts,used_reranker,k_init,top_n,num_initial_docs,num_final_docs,runtime_seconds,factuality_score,question_type,chunk_size,chunk_overlap,ground_truths,context_precision,faithfulness,answer_relevancy,context_recall,answer_correctness,answer_similarity
What role does the National Park Service play in preserving sites related to the American Revolution?,"Original Answer: The National Park Service plays a crucial role in preserving sites related to the American Revolution. They are responsible for managing and protecting Independence National Historical Park, which is located in Philadelphia, Pennsylvania. This park includes many important historical landmarks and artifacts related to the American Revolution, such as the Liberty Bell, Independence Hall, and the National Archives at Philadelphia. The National Park Service also works to educate visitors about the history of the American Revolution and its significance to the United States.","['1 \n Argument Writing Lesson  \nBackground Information  \n National Park Service  \nU.S. Department of the Interior  \n \nIndependence National Historical Park  \nPhiladelphia, Pennsylvania  \n \nAmerican Revolution Overview  \nThe Revolutionary War (1775 -1783) began as a conflict between Great Britain and her North American \ncolonies. It ended as a global war, pitting European powers against each other in a time of intense \nimperial rivalry. In the end, the American colonies gai ned their independence, ruling themselves under \nthe “firm league of friendship” known as the Articles of Confederation. In 1789, the U.S.', 'The British actively sought help from the African American community. They\xa0promised \nfreedom to any enslaved person who fought for the king. The Patriots had their own \nsources of help. The Patriot side also had support from African Americans. It had important support from\xa0women, too. Women played many roles \nin the American Revolution. Working in army camps, ', 'George Washington\nCrispus Attucks\nStamp Act CrisisReaderHistory  and GeoGrap Hy\nThe American  \nRevolution\nPaul Revere’s ride\n']",False,10,3,10,3,2.1397929191589355,0.4279025197029114,single_hop_specifc_query_synthesizer,0,0,"['The National Park Service, part of the U.S. Department of the Interior, manages Independence National Historical Park in Philadelphia, Pennsylvania, which preserves important sites related to the American Revolution, including Independence Hall where key events such as the Second Continental Congress meetings and the signing of the Declaration of Independence took place.']",0.8333333332916666,1.0,0.999999999999999,1.0,0.5708193578264504,0.9499440979724683
What grievances did the American colonists have against the King in the Declaration of Independence?,"Original Answer: The American colonists had several grievances against the King in the Declaration of Independence. They accused the King of ignoring or changing their colonial governments, as well as their rights to a trial by jury. They also claimed that the King had sent a hired army to force them to obey unjust laws and was ""unfit to be the ruler of a free people.""","['The Second \nContinental Congress re moved whole sections. Jefferson was most angered by the removal of one \nparticular clause, a clause blaming the King for forcing the slave trade upon the American colonies. The final draft of the Declaration of Independence contains a preamble, a list of grievances, a formal \ndeclaration of independence, and signatures. Preamble  \nThis first of the Declaration contains an assertion of individual rights. Perhaps the most famous line \nstates, “We hold these truths to be self -evident, that all men are created  equal, that they are endowed \nby their Creator with certain unalienable rights, that among these are Life, Liberty and the Pursuit of \nHappiness.”  This part goes on to say that if the government tries to take these rights away, the people \nhave the right to  form a new government. Jefferson also addresses a counterclaim in this section, \nacknowledging that “Prudence, indeed, will dictate that Governments long established should not be \nchanged for light and transient causes…” He counters by reminding his audi ence of the “ long train of \nabuses and usurpations”  that makes it “… their right, it is their duty, to throw off such Government, and \nto provide new Guards for their future security.”  \nGrievances  \nThe longest part of the Declaration lists the unfair actions of the British king and Parliament. In their \ncomplaints, the colonists make it clear that they are angry with the British king and government for \ntaking away their rights as English citizens. They point out that the king has ignored or changed their \ncolo nial governments, as well as their rights to a trial by jury. The colonists accuse the king of sending a \nhired army to force them to obey unjust laws. They say the king is “unfit to be the ruler of a free \npeople.”  ', 'They shared their anger at the British government. They issued a Declaration  \nof Rights. The declaration said that as British colonists, they were entitled to all the “rights of Englishmen.” They listed the ways \nParliament had taken their rights away since the French and Indian \nWar. They also told King George III that the colonists were still loyal to him. They asked him to consider their complaints.Vocabulary\nSupreme Court,  n. the highest court in \nthe land\ndeclaration,  n. a \nformal statement', '90argued, shouldn’t the colonists defend their rights and liberties? It \nwas a very tough decision.']",False,10,3,10,3,1.8036739826202393,0.5809693336486816,single_hop_specifc_query_synthesizer,0,0,"['The American colonists accused the British king of taking away their rights as English citizens, ignoring or changing their colonial governments, and denying their rights to a trial by jury. They also complained that the king sent a hired army to force them to obey unjust laws and declared that the king was ""unfit to be the ruler of a free people.""']",0.99999999995,1.0,0.9892968895416411,1.0,0.690436408768409,0.9617456350736362
"What role did Thomas Jefferson play in the drafting of the Declaration of Independence, and how was his contribution recognized by his contemporaries?","Original Answer: Thomas Jefferson played a significant role in the drafting of the Declaration of Independence. He was chosen by Benjamin Franklin and John Adams to write the document, and his contribution was recognized by his contemporaries as being crucial to its success. The Declaration of Independence became the most famous document not only in American history but also in the history of the entire world, and it is widely regarded as one of the greatest achievements in human history. Jefferson's ability to articulate the principles of liberty and equality in a clear and persuasive manner helped to convince the world that the American colonies were justified in their pursuit of independence from Great Britain.","['92of the declaration was to explain why the colonies were breaking \naway from Great\xa0Britain. The committee chosen to write the declaration included \nJohn\xa0Adams, Benjamin Franklin, and Thomas Jefferson. Which \ncommittee member should do the main writing? Benjamin Franklin and George Washington were probably the two most famous Americans alive. John Adams was one of the first leaders to speak out in favor of independence. Thomas Jefferson, however, was known as a fine writer. Franklin and Adams chose him to write the declaration. What Jefferson produced became the most famous document not \nonly in American history, but also in the history of the entire world. Jefferson wanted the world to know all the bad things this\xa0king had done and all the rights he had taken away.', '2 \n On July 2, 1776, the Second Continental Congress voted to adopt Lee’s resolution for independence. This is the day that John Adams thought should be celebrated with “ Pomp and Parade, with  Shews, \nGames, Sports, Guns, Bells, Bonfires and Illuminations from one End of this Continent to the other from \nthis Time forward forever more.” (John Adams to Abigail Adams, July 3, 1 776)  \nBetween July 2 and July 4, Congress argued over every word in Jefferson’s draft of the declaration, \nmaking numerous changes. On July 4, Congress voted again –  this time to approve the wording of the \nDeclaration of Independence. They didn’t actually sign the document that day. After New York’s \ndelegates received instructions from home to vote for independence (they had initially abstained), the \ndocument was sent to Timothy Matlack to be engrossed (handwritten). Fifty of the 56 men signed the \nengross ed Declaration of Independence inside Independence Hall on August 2, 1776. The Declaration of Independence as an Argument  \nLooking back on the Declaration of Independence almost 50 years later, Thomas Jefferson explained \nthat the document’s purpose was never meant  to be thoroughly original; its purpose wasn’t to articulate \nanything that hadn’t be said before, but to make the case for the American colonies in plain terms and \npersuade the world to see common sense. “It was intended to be an expression of t he American mind,” \nJefferson explains. He goes on to claim that “[the Declaration’s] authority rests then on the harmonizing \nsentiments of the day.”  (Jefferson to Henry Lee, May 8, 1825)  \nJefferson finished his timeless defense of “life, liberty and the pu rsuit of happiness” in little more than \ntwo weeks, and like most writers, he was no stranger to the revision process. Between the Committee of \nFive and the Second Continental Congress, there were 86 edits to the document.', 'Portrait of Thomas JeffersonWashington opposed political factionalism and remained non-partisan throughout his presidency (the only\nUnited States president to do so). He was sympathetic to a Federalist form of government.[192]\nWashington\'s closest advisors formed two factions, portending the First Party System . Hamilton formed\nthe Federalist Party  to promote national credit and a financially powerful nation. Jefferson opposed\nHamilton\'s agenda and founded the Jeffersonian Republicans . Washington favored Hamilton\'s agenda,\nhowever , and it ultimately went into effect—resulting in bitter controversy .[193] Other domestic issues\nduring Washington\'s first term included the planning of a permanent capital,[194] the passage of several\nconstitutional amendments including the Bill of Rights , and continuing debates concerning slavery[195]\nand expansion into Native American territory .[196] Washington proclaimed November 26, 1789, as a day\nof Thanksgiving  to encourage national unity .[197]\nWashington initially planned to retire after his first term,\nweary of office and in poor health. After dealing with the\ninfighting in his cabinet and with partisan critics, he showed\nlittle enthusiasm for a second term, and Martha wanted him\nnot to run.[198] Washington\'s nephew Geor ge Augustine\nWashington, managing Mount Vernon in his absence, was\ncritically ill, further increasing Washington\'s desire to\nretire.[199] Many , however , urged him to run for a second\nterm. Madison told him that his absence would allow the\ndangerous political rift in his cabinet and the House to\nworsen. Jefferson also pleaded with him not to retire,\npledging to drop his attacks on Hamilton.[200] Hamilton\nmaintained that Washington\'s absence would be ""deplored as\nthe greatest evil"" to the country .[201] With the election of 1792\nnearing, Washington agreed to run.[202] On February 13,\n1793, the Electoral College  unanimously re-elected\nWashington president, while John Adams was re-elected as\nvice president by a vote of 77 to 50.[202] Washington was sworn into office by Associate Justice William\nCushing  on March 4, 1793, in Congress Hall  in Philadelphia.[203]\nOn April 22, 1793, after the French Revolutionary Wars broke out, Washington issued a proclamation\ndeclaring American neutrality . He was resolved to pursue ""a conduct friendly and impartial toward the\nbelligerent Powers"" while warning Americans not to intervene in the conflict.[204] Although Washington\nrecognized France\'s revolutionary gover nment, he eventually asked that the French minister to the United\nStates, Edmond-Charles Genêt , be recalled.[205] Genêt was a diplomatic troublemaker who was openly\nhostile toward Washington\'s neutrality policy . He procured four American ships as privateers to strike at\nSpanish forces (British allies) in Florida  while organizing militias to strike at other British possessions.']",False,10,3,10,3,2.4800562858581543,0.4622962772846222,single_hop_specifc_query_synthesizer,0,0,"[""Thomas Jefferson took the lead on drafting the Declaration of Independence as part of a committee appointed by Congress, which also included John Adams, Benjamin Franklin, Roger Sherman, and Robert R. Livingston. Jefferson's rough draft, which is preserved in the Library of Congress, was edited by Adams and Franklin before the final version was approved. His contemporaries recognized the significance of the Declaration and Jefferson's role in it, as reflected in letters such as Jefferson's own to Henry Lee, where he described the Declaration as an expression of the American mind intended to justify the colonies' stand for independence. Additionally, the committee's work and the solemnity of the occasion were noted by figures like Benjamin Rush and John Adams, underscoring the importance of Jefferson's contribution to this foundational document.""]",0.99999999995,0.8,0.8599951657047661,1.0,0.5833336037586834,0.9487124148883175
Who was Timothy Matlack and what was his role related to the Declaration of Independence?,Original Answer: Timothy Matlack was a scribe who was responsible for engrossing (handwriting) the Declaration of Independence. He was chosen by Congress to do this task after New York's delegates received instructions from home to vote for independence and the document was sent to him for engrossing.,"['92of the declaration was to explain why the colonies were breaking \naway from Great\xa0Britain. The committee chosen to write the declaration included \nJohn\xa0Adams, Benjamin Franklin, and Thomas Jefferson. Which \ncommittee member should do the main writing? Benjamin Franklin and George Washington were probably the two most famous Americans alive. John Adams was one of the first leaders to speak out in favor of independence. Thomas Jefferson, however, was known as a fine writer. Franklin and Adams chose him to write the declaration. What Jefferson produced became the most famous document not \nonly in American history, but also in the history of the entire world. Jefferson wanted the world to know all the bad things this\xa0king had done and all the rights he had taken away.', 'Constitution –\nestablishing the legislative, executive, and judicial branches - superseded the Articles of Confederatio n. Timeline of major American Revolution actions:  \n• April 19, 1775:   First shots fired at Lexington and Concord in Massachusetts. No one knows who \nfired first – the British troops or the colonists. • May 10, 1775:   Second Continental Congress convenes in the Pennsylvania State House (now \nknown as Independence Hall). • July 2, 1776:   Second Continental Congress approves the resolution for independence. • October 17, 1777:   British General Burgoyne and 6,000 British troops surrender to the \nAmericans at Saratoga, New  York. • February 6, 1778:  The United States and France enter into an alliance. • May 12, 1780:   Fighting shifts south as the British take Charleston, SC, capturing a large patriot \narmy. • March 2, 1781:   Articles of Confederation adopted. • October 19, 1781:   British General Cornwallis surrenders after American and French forces \nsurround his troops on land and sea. • November 30, 1782:   British and American forces sign preliminary Articles of Peace. • September 3, 1783:   U.S. and British sign the Treaty of Paris,  ending the war and recognizing \nAmerican independence. • September 17, 1787:   Delegates to the Federal (Constitutional) Convention sign the U.S. Constitution. • April 30, 1789:   George Washington sworn in as first President of the United States. The Second Con tinental Congress and the Declaration of Independence  \nThe Second Continental Congress met inside Independence Hall beginning in May 1775. It was just a \nmonth after shots had been fired at Lexington and Concord in Massachusetts, and the Congress was \npreparing for war. They established a Continental army and elected George Washington as Commander-\nin-Chief, but the delegates also drafted the Olive Branch Petition and sent it to King George III in hopes \nof reaching a peaceful resolution. The king refused to hear the petition and declared the American \ncolonies in revolt. On June 7, 1776, Virginia delegate Richard Henry Lee put forth the resolution for independence:  \n“Resolved, that these united colonies are, and of right ought to be, free and independent states …”  \nVoting was postponed while some of the delegates worked to convince others to support \nindependence, but a committee of five men was assigned to draft a document of independence: John \nAdams (MA), Benjamin Franklin (PA), Thomas Jefferson (VA), Roger Sherman (CT), and Robert R. Livingston (NY).', '2 \n On July 2, 1776, the Second Continental Congress voted to adopt Lee’s resolution for independence. This is the day that John Adams thought should be celebrated with “ Pomp and Parade, with  Shews, \nGames, Sports, Guns, Bells, Bonfires and Illuminations from one End of this Continent to the other from \nthis Time forward forever more.” (John Adams to Abigail Adams, July 3, 1 776)  \nBetween July 2 and July 4, Congress argued over every word in Jefferson’s draft of the declaration, \nmaking numerous changes. On July 4, Congress voted again –  this time to approve the wording of the \nDeclaration of Independence. They didn’t actually sign the document that day. After New York’s \ndelegates received instructions from home to vote for independence (they had initially abstained), the \ndocument was sent to Timothy Matlack to be engrossed (handwritten). Fifty of the 56 men signed the \nengross ed Declaration of Independence inside Independence Hall on August 2, 1776. The Declaration of Independence as an Argument  \nLooking back on the Declaration of Independence almost 50 years later, Thomas Jefferson explained \nthat the document’s purpose was never meant  to be thoroughly original; its purpose wasn’t to articulate \nanything that hadn’t be said before, but to make the case for the American colonies in plain terms and \npersuade the world to see common sense. “It was intended to be an expression of t he American mind,” \nJefferson explains. He goes on to claim that “[the Declaration’s] authority rests then on the harmonizing \nsentiments of the day.”  (Jefferson to Henry Lee, May 8, 1825)  \nJefferson finished his timeless defense of “life, liberty and the pu rsuit of happiness” in little more than \ntwo weeks, and like most writers, he was no stranger to the revision process. Between the Committee of \nFive and the Second Continental Congress, there were 86 edits to the document.']",False,10,3,10,3,1.7918906211853027,0.41977208852767944,single_hop_specifc_query_synthesizer,0,0,"['Timothy Matlack was the engrosser of the Declaration of Independence, meaning he was responsible for creating the official handwritten copy of the document.']",0.5833333333041666,0.6666666666666666,0.8546935967210595,1.0,0.5399163116966621,0.9596652467866484
