question,answer,contexts,used_reranker,k_init,top_n,num_initial_docs,num_final_docs,runtime_seconds,factuality_score,question_type
What did the 'Third Force' in French politics represent?,"Eyewitness: I'm here in France and can tell you that the 'Third Force' is still a significant player in French politics. They are advocating for social spending preservation while pushing back against rising defense costs, but their approach has become more nuanced over time.","['the domestic – economic account argues that third force leaders conceived the edc to preserve social spending despite u. s. pressure for rising defense outlays, bysharing the latter among europeans. french support for the edc declined after early1952, when the third force was replaced by a conservative coalition with no suchsocial agenda. 62 the problem with both explanations, as suggested in older french accounts, is that neither french elites in general nor third force leaders in particular ever agreed on the edc. 63nor did any changes in constraints lead individuals to change their views of french interests from 1951 to 1954. straightforward geopolitical pressuresdid put german rearmament on the table, but french elites consistently respondedto these pressures with the three views they had formulated on the ecsc. as of late1950 and through 1954, community advocates in the independents, mrp, radicals, udsr, socialists, and the bureaucracy called for integrating german units into asupranational european army. confederalists in the same parties and ministriespreferred to incorporate german forces into looser organizations under franco - british direction. their traditionalist peers either rejected german rearmamentoutright or favored a standard alliance framework. again, none of these actors misread their environment', 'whatever strategy he chose — schuman rallied a majority. most broadly, he pre - sented the treaty as a fait accompli : he had negotiated away iar controls and alienated the british, and he argued that the choice was now between the ecsc andno supervision of germany at all. 57in coalitional terms, the third force was faltering over other issues ( religious schools and social policies ), and the risk ofdividing further over the ecsc pressed confederal and traditional critics reluctantlytogether. most blatantly, schuman made side - payments on colonial policies tosecure centrist and independent votes. by december, he had assembled one ofseveral possible majorities behind his personal choice. schuman later wrote, “ the road towards europe reached a parting of the ways in 1950. ” 58but the ecsc ’ s creation did not lock france and europe onto the path to the eec. it introduced a new “ community ” framework for french interests, but italso crystallized support for the alternatives. now the battle of ideas was trulyengaged. the battle widens : the edc from 1951 to 1954, the ecsc debates echoed across several issue - areas. con', 'politics. the eec of the 1960s, like many institutionalframeworks, rested “ on defeated and repressed alternatives. ” 132 thus structures set the broad context for european institution building, and institutions held europeans to one path once it was chosen. in between, europeansfaced three viable alternatives in the 1950s. my answer to the “ how much ” questionis that leaders ’ ideas, as a cause irreducible to other factors, determined the outcomeacross these alternatives. during the late 1940s, french individuals gravitated tothree different views of their national interests in europe, in patterns that diverged from their main material and organizational positions. within complex multidimen - sional issue - space, this three - way divide in preferences meant majorities could becrafted for all three options. corresponding alternatives in international bargainingwere available as well. since european cleavages cross - cut right and left in 131. see steinmo, thelen, and longstreth 1992 ; and ikenberry 1988. 132. see berk 1994, 16 ; and unger 1987. 76 international organization']",True,10,3,10,3,1.6050326824188232,0.42577946186065674,factual
How did the Korean War impact European integration efforts?,"Original Answer:  The Korean War had a significant impact on European integration efforts. It accelerated American and European responses to prepare for the eventuality of a hot war on the European continent, leading to increased cooperation in defense and security matters. This included the establishment of the European Defense Community (EDC) and the incorporation of Germany into a west-European defense system. However, the Korean War also highlighted the limitations of European institutions in constraining major policy choices going forward before 1958, as well as the importance of institutional path dependence in shaping European integration efforts.","['cooperation in postwar europe. by the 1950s, almost all non - communist elites advanced some variation on these themes. they also account well for the salienceof issues over time within cooperation. almost all european ( and especially french ) elites saw coal and steel plans as crucial during reconstruction, defense cooperationas urgent during the korean war, trade deals as desirable in the boom of themid - 1950s, and atomic cooperation as enticing as civil applications became evident. but structural accounts are wrong to see clear imperatives to the unprecedentedpolitical project we know as “ european integration. ” in france, actors who shared objective positions in parties, bureaucracies, and sectors consistently espouseddifferent ideas about how those interests connected to european institution building. france selected the ecsc and eec projects not because clear majorities dictatedthem, but because leaders with support on other issues used their authority to craftone of several potential coalitions. this argument also incorporates institutional path - dependence, but it disputes the forward - leading dynamics of “ neofunctionalist ” scholarship. european institutions did not constrain major policy choices going forward before 1958, let alone carryeuropeans from the ecsc to the eec. institutions mattered instead in the way oftendescribed', '4 such events. the council of europe, formed with ten member states in 1949, established a convention of human rights and a european court of human rights to monitor and adjudicate grievances. 1 the novelty of the institutional arrangement lay in the supranational standing of the court and the direct effect of the convention. that is, individuals, once they had exhausted domestic remedies, could directly initiate proceedings through council of europe institutions. security concerns moved in tandem. soviet encroachment on czechoslovakia in 1948 and pressure on poland, hungary, romania, and bulgaria, propelled england, france and the benelux countries to sign the brussels treaty, promising mutual aid against a common enemy. the korean war accelerated american and european responses to prepare for the eventuality of a hot war on the european continent. colonial commitments, however, particularly those of france in indochina and of britain in its overseas territories, overstretched their capabilities. two views emerged in reaction. one perspective favored the integration of germany into a west - european defense system, the european defense community ( edc ), together with france, the benelux nations, and italy. an alternative view advocated the incorporation of germany into the north atlantic treaty organization ( nato ). the french national assembly failed', 'european integration : initiated in western europe in aftermath of world war ii ; context marked by political and economic reconstruction, beginning of cold war three communities created in 1950s : european coal and steel community ( ecsc ), european atomic energy community ( euratom ) and european economic community ( eec ), with six member states two trajectories of development : ( 1 ) accession of more member states ( “ widening ” ), and ( 2 ) transfer of further powers to european institutions, coupled with shift to supranational decision making ( “ deepening ” ) history of the eu']",True,10,3,10,3,2.8923392295837402,0.42343515157699585,reasoning
What was one significant consequence of the ECSC that influenced later European cooperation?,"Original Answer:  One significant consequence of the ECSC that influenced later European cooperation was the establishment of the European Economic Community (EEC). The EEC, founded in 1957, aimed to overcome the sectoral limitations of the ECSC by creating a common market for all economic sectors via an intermediary step, the creation of a customs union. This led to further economic integration and cooperation among the member states, paving the way for the eventual formation of the European Union (EU).","['was again fundamental. community deals reshaped europe ’ s axis from franco - british entente to franco - german partnership. 133 what are the broad implications for the eu literature? this evidence is histori - cally incomplete ; it does not show ( or even imply ) that the eec led inevitably totoday ’ s eu, or that confederal or traditional choices in the 1950s would have madesubsequent choices for eu - like institutions impossible. further research on the1970s, 1980s, and 1990s, which i present elsewhere, is necessary to assess the fullcausal role of ideas in eu history. 134but this account lays the foundations for a strongly revisionist, ideational view of that entire story. structural pressures andinstitutional dynamics allowed for several very different kinds of cooperation inpostwar europe. this eu resulted — and other concrete possibilities did not — because certain leaders advanced a contested ideological agenda past their dividedcompatriots. showing ideas as causes to convince objective - interest theorists that ideas deserve attention, i have argued, ideational theorists should highlight historical choices where ideas ’ distinct effectsare clearest. these choices arise where ideas strongly cross - cut prevailing lines ofinterest aggregation, for two', 'later development. 2 although i accept insights from both approaches, i argue that neither explains why europeans chose this “ community ” europe over radically different alternativesin the 1950s. if postwar structural conditions generated widely perceived impera - tives to european cooperation, they did not dictate its shape or extent. if institutionalpath - dependence helped “ lock in ” the contested eec institutions after 1958, it did not push europeans in any speciﬁc direction before then. within vague structuraland institutional pressures, only certain ideas led europeans to the eec rather than to less extensive cooperation in much weaker international institutions ( or without for comments i thank chris ansell, neil fligstein, nicolas jabko, elizabeth kier, andrew moravcsik, paul pitman, wayne sandholtz, robert rauchhaus, jeffrey vanke, steve weber, two anonymousreviewers and the editors of international organization, and audiences at the university of british columbia, the university of california at berkeley, harvard university, the georgia institute oftechnology, and syracuse university. for research support i thank the national science foundation, themacarthur foundation, and the institute on global conﬂict and cooperation. 1. see moravcsik 1998 ; and milward 1992.', 'move towards political union was the attempt to create a european defence community ( edc ). discussed after the successful launch of the ecsc, the edc foresaw the integration of the armies of the six ecsc member states ( i. e. including germany ) into a european army. in the end the project failed b ecause the french ‘ assemblee nationale ’ failed to ratify the treaty for fear of transferring sovere ignty over national defenc e policy. this period ( 1952 - 53 ) also saw the abortive attempt to creat e a european political union ( epu ), which was an initiative aimed at an integrated european foreign policy. following these failures, attempts to bring fo rward european integration moved away from political and towards economic cooperation. the treaties of rome, signed in 1957, successfully reinvigorated the dynamism of the integrati on process through economic integration and the european economic community ( eec ). the eec was founded to overcome the sectoral limitation of the ecsc. it aime d at the creation of a common ma rket for all economic sectors via an intermediary step, the creation of a cust oms union. in practical terms internal quotas']",True,10,3,10,3,2.504744291305542,0.4753384292125702,reasoning
How did leaders use agenda-setting authority in the context of European integration?,"Original Answer: In the context of European integration, leaders used agenda-setting authority to assemble majorities behind their personal ideas and to strike particular deals in international bargaining. This allowed them to retain control of the agenda during a major cross-cutting debate and to build majority support for their own ideas across three strategies that were viable domestically and internationally. The divide between ""community,"" ""confederal,"" and ""traditional"" views did not quite display an impasse, but the availability of many issue linkages made all three options domestically viable.","['european leaders opposed deeper integration. the french president charles de gaulle, for instance, tried to strip the high authority ( now the european commission ) of its supranational aspirations by establishing a primacy of member states. he also attacked majority voting in the council of ministers by boycotting council meetings and paralysing co mmunity decision - making for several months. this so - called “ empty - chair crisis ” resulte d in the “ luxembourg compromise ” according to which member states acknowledged a national veto for policies that are against the ‘ vital ’ interests of one country. as a result actual vo ting in the council of ministers remained the exception and consensus the rule. in addition to the initiatives eventually leading to the eu, many other organisations originated in the post - war era, such as nato and the oecd ( for an overview see annex 1 ). 5 the ecsc expired in mid - 2001 after 50 years of existence.', 'the domain of foreign policy. 22electoral coalition building and ofﬁce holding can continue to operate along the “ normal ” issues resonant with voters, even thoughpolicymakers perceive a new debate as crucial. this disconnect can allow a leaderto retain control of the agenda during a major cross - cutting debate. we would seethe leader ’ s choices contested by elites who shared the leader ’ s main coalitional, party, bureaucratic, and economic positions, differing only in holding other ideas in the cross - cutting debate. but the leader ’ s agenda - setting power, or use of pressure or payoffs on other issues, would decide the outcome. the next section argues that french policymaking in early european institution building illustrates this process. across three strategies that were viable domesti - cally and internationally, leaders built majority support for their own ideas. 22. see rosenau 1961 ; margolis and mauser 1989 ; and the annual index to international public opinion. origins of the eu 53', '##erests in europe. the divide between “ community, ” “ confederal, ” and “ tradi - tional ” views did not quite display the impasse of a condorcet paradox, but theavailability of many issue linkages made all three options domestically viable. 29 corresponding deals were viable in international bargaining. “ pro - community ” leaders who obtained power on other, disconnected issues used their agenda - settingauthority to assemble majorities behind their personal ideas and to strike particular 27. moravcsik 1998, 86. 28. for similar arguments about the eec ’ s later development, see fligstein and mara - drita 1996 ; and sandholtz and stone sweet 1998. 29. labeling “ community ” views s, for “ supranational, ” “ confederal ” views c, and “ traditional ” views t, french elites divided into preference orderings sct, cts, andtcs. in single - issue voting, this would produce a confederal majority. only issue linkages made “ community ” policies a viable outcome. origins of the eu 55']",True,10,3,10,3,2.8999826908111572,0.6689026355743408,reasoning
What was one of the main criticisms of the neofunctionalist account of the EEC's development?,Eyewitness: I can see that the neofunctionalist account of the EEC's development has been criticized for overemphasizing forward momentum and underestimating the importance of institutional consequences.,"['institutional consequences and the eec ’ s historical window this account faces one ﬁnal question : if only pro - community leadership led france to the eec, why did the eec survive when the collapse of the fourth republicbrought the very traditional charles de gaulle to power in may 1958? de gaulleconsidered rejecting or revising the treaty. 118yet he soon accepted the eec and even accelerated its implementation. objective imperatives, we might conclude, would eventually have pressed any french leader to the community path. the foregoing may simply raise issues of timing. in this section i argue that de gaulle ’ s rally to the eec reﬂected the institutional consequences of the eec itself. had pro - community leaders not led france to theeec in 1957, there is no reason to think de gaulle would have adopted a similar path. this analysis draws on the fundamental insight of institutionalist accounts — that new institutions feed back to alter subsequent interaction — but it presents thatlogic as more inertial and less dynamic than originally claimed by “ neofunctional - ists. ” as noted earlier, i see little evidence that the ecsc ’ s agents engenderedforward momentum toward the eec. i know of no ecsc skeptics', 'see little evidence that the ecsc ’ s agents engenderedforward momentum toward the eec. i know of no ecsc skeptics, among politi - cians or interest groups, who came to favor community - style policies because ofmonnet ’ s proselytizing. the ecsc ’ s main effect was inertial : it was not undone when the edc fell. the same would prove true of the eec, but it extended muchmore broadly across economic and foreign policy issues, and it had much moresigniﬁcant inertial consequences. 119the eec set a new context for de gaulle ’ s strategizing, preventing him from moving backward to his preferred ( and previouslyavailable ) traditional strategy. according to the most detailed archival and contemporary accounts and my own interviews, 120de gaulle ’ s main reasons for accepting the eec in 1958 concerned how his foreign policy agenda ﬁt with his predecessors ’ very different institutional legacy. de gaulle was focused on leading europe to a “ third way ” between thesuper powers. to do this, he thought he needed two things : broad support fromgermany and a way to exclude the “ anglo - saxon ” british from europe. the eecnow set', 's ecscpartners ( germany, benelux, italy ) eventually agreed to negotiate edc but quicklydropped it when the french turned against it in 1954. 24while the eec itself was not a french proposal — originating with ultra - europeanist dutch foreign minister janwillem beyen — it was partly crafted to appeal to the french. beyen notwithstand - ing, most benelux and german leaders preferred trade liberalization in the broaderand institutionally weak format championed by the british. they hesitantly sup - ported beyen ’ s eec plan because they feared the french would only acceptliberalization within a “ little europe ” with elaborate economic safeguards. 25in sum, no one contests that without french insistence on institutionally strong, geograph - ically limited institution building in the 1950s no such framework would haveresulted. two alternatives to my account, however, see this french position as strongly determined by nonideational factors. for structuralists, objective economic andgeopolitical constraints selected french strategies. historians like milward andwilliam hitchcock argue that france needed a new basis for controlling andcooperating with a resurgent west germany in 1950 ; the ecsc ’ s supranationalovers']",True,10,3,10,3,1.6841285228729248,0.6156074404716492,reasoning
What did the term 'battle of ideas' refer to in the context of French policymaking in the 1940s?,"I remember the term 'battle of ideas' being used to describe a period in French policymaking during the 1940s when different groups debated various strategies for rebuilding France after World War II. This was due to major changes in objective conditions that brought new ideas to the fore but did not dictate their success. The rise of superpowers, the destruction of national economies, and domestic delegitimation of the nationalist far right turned ""euro-peanist"" projects into active options.

Eyewitness: Today, we can see how the battle of ideas continues to shape French policymaking, with different groups advocating for various strategies to address current challenges such as climate change and economic inequality.","['states demanded the rapid revival of a west german state and economy as bulwark and ally against the soviets. pressure increased with the marshall plan in june 1947, offering the french badly needed economic aid on the condition that they coordinatetheir recovery with germany and other countries. 33 these huge changes opened what gerald berk calls an “ epochal moment ” in french policymaking. 34rapid change can destabilize how actors understand their interests. innovative actors may assemble new ideational “ frames ” out of the “ toolkit ” of ideas present in their culture. 35such innovations do not necessarily respond functionally to the new situation ; adaptation of older framing ideas, or other newideas, may suggest competing analyses. the result is a “ battle of ideas ” in whichgroups debate several viable strategies. this is what developed in france in the late1940s. major change in objective conditions brought new ideas to the fore but didnot dictate their success. the rise of the super powers, the destruction of nationaleconomies, and domestic delegitimation of the nationalist far right turned “ euro - peanist ” projects — utopian musings before the war — into active options. 36but older ideas survived these objective shifts as', 'charles de gaulle brought “ traditional ” ideas to power in 1958. three models of french interests immediately after world war ii, french elites largely agreed on their basic european strategy. their primary goal was to keep germany weak while rebuildingfrench strength. their means were direct controls on occupied germany, bolsteredby alliances and economic cooperation with other european powers. 32the advent of the cold war in 1946 – 47, however, partly blocked this strategy. the united 30. the only academic precedents to this argument are vague histories without speciﬁc causal claims : lipgens 1977 ; and brugmans 1965. mcnamara ’ s argument about ideas in the eu concerns ideas abouteconomic policies, not europe itself. mcnamara 1998. 31. here i allow competitors to pack many other institutionalized ideas ( about the state, sovereignty, capitalism, democracy ) into “ objective conditions. ” 32. french disagreements before 1947 mainly concerned who the major european ally was against germany : the soviets, the british, or the benelux and italy. see knipping 1990 ; gerbet 1991 ; young1990 ; and willis 1962. 56 international organization', 'cross - cut lines of shared material interests in a polity, we can isolate individuals ’ beliefs most clearly from objective pressures. cross - cutting ideas canalso fragment coalitions and parties, creating situations similar to the “ chaos ” and “ multiple equilibria ” described by game theorists. entrepreneurial leaders may gainthe autonomy to set the policy agenda around their own personal ideas, and tomobilize one of several potential coalitions behind them. leaders ’ ideas, as anautonomous causal factor, thereby select from a range of structural and institutionalpossibilities. the second obstacle is historical : tracing certain ideas across europe and the 1950s is an immense task. i surmount this problem by focusing on the pivotal caseoffrench strategic choices. experts agree that european cooperation took the shape it did in the 1950s — the institutionally strong, geographically limited eec — above all because the french government demanded it. the preferences of the other mainactors ( germany, britain, benelux ) summed to favor broader and weaker institu - tional options. i show that rather than reﬂecting structural or institutional pressures, french insistence on the eec resulted from community - minded leadership. alter - native confederal or traditional french strategies were strongly represented']",True,10,3,10,3,2.5032541751861572,0.49447453022003174,factual
