question,answer,contexts,used_reranker,k_init,top_n,num_initial_docs,num_final_docs,runtime_seconds,factuality_score,question_type
What year was the European Coal and Steel Community (ECSC) established?,Eyewitness: I remember the European Coal and Steel Community (ECSC) being established in 1951. It was a significant event that laid the foundation for the European Union we know today.,"['institutional foundations • three communities created in 1950s : • european coal and steel community ( ecsc ), 1951 • making war in europe not only ‘ unthinkable, but materially impossible ’ • european atomic energy community ( euratom ), 1957 • european economic community ( eec ), 1957 • founders : • germany, france, italy, belgium, netherlands, luxemburg • different patterns of development : • widening • deepening • differentiated and multi - speed integration', 'european integration : initiated in western europe in aftermath of world war ii ; context marked by political and economic reconstruction, beginning of cold war three communities created in 1950s : european coal and steel community ( ecsc ), european atomic energy community ( euratom ) and european economic community ( eec ), with six member states two trajectories of development : ( 1 ) accession of more member states ( “ widening ” ), and ( 2 ) transfer of further powers to european institutions, coupled with shift to supranational decision making ( “ deepening ” ) history of the eu', 'the frankish empire at its greatest extent, ca. 814 adhistory of the european union the european union is a geo - political entity, created in 1993, covering a large portion of the european continent. it is founded upon numerous treaties and has under gone expansions and secessions that have taken it from six member states to 27, a majority of the states in europe. since the beginning of the institutionalised modern european integration in 1948, the development of the european union has been based on a supranational foundation that would "" make war unthinkable and materially impossible "" [ 1 ] [ 2 ] and reinforce democracy amongst its members [ 3 ] as laid out by robert schuman and other leaders in the schuman declaration ( 1950 ) and the europe declaration ( 1951 ). this principle was at the heart of the european coal and steel community ( ecsc ) ( 1951 ), the treaty of paris ( 1951 ), and later the treaty of rome ( 1957 ) which established the european economic community ( eec ) and the european atomic energy community ( eaec ). the maastricht treaty ( 1992 ) created the european union with its pillars system, including foreign and home affairs alongside the european communities. this in turn led to the']",True,10,3,10,3,1.549365758895874,0.5968953967094421,factual
Who proposed the ECSC?,"Eyewitness: I remember Janwillem Beyen being the Dutch foreign minister who proposed the ECSC. It was a significant moment in European history, and it's fascinating to think about how much has changed since then.","['s ecscpartners ( germany, benelux, italy ) eventually agreed to negotiate edc but quicklydropped it when the french turned against it in 1954. 24while the eec itself was not a french proposal — originating with ultra - europeanist dutch foreign minister janwillem beyen — it was partly crafted to appeal to the french. beyen notwithstand - ing, most benelux and german leaders preferred trade liberalization in the broaderand institutionally weak format championed by the british. they hesitantly sup - ported beyen ’ s eec plan because they feared the french would only acceptliberalization within a “ little europe ” with elaborate economic safeguards. 25in sum, no one contests that without french insistence on institutionally strong, geograph - ically limited institution building in the 1950s no such framework would haveresulted. two alternatives to my account, however, see this french position as strongly determined by nonideational factors. for structuralists, objective economic andgeopolitical constraints selected french strategies. historians like milward andwilliam hitchcock argue that france needed a new basis for controlling andcooperating with a resurgent west germany in 1950 ; the ecsc ’ s supranationalovers', 'all three kinds of proposals were active when the ecsc foreign ministers met at messina, italy, in june 1955. internationally, confederal and traditional options werestrong possibilities. the weu was pushed by the british and accepted by thegermans as the appropriate forum for political and armaments cooperation. 84the british, the germans, and most benelux leaders strongly supported the oeec forumfor economic issues ( though benelux foreign ministers beyen and spaak werepersonally pro - supranationality ). german economics minister erhard and germanbusiness were particularly intent on liberalization in the oeec. 85in atomic energy, all of france ’ s partners wanted to include the advanced british. 86traditional bilateral ties were also active alternatives. bilateral export contracts remained thenorm in industrial trade and were not preventing massive growth in intra - europeantrade ( which would double from 1953 to 1957 ). in agriculture, all governmentsexcept the dutch defended the status quo of bilateral contracts. bilateral cooperationin armaments production was moving forward slowly on several fronts. thegermans were receptive to ( if not eager for ) franco - german cooperation in atomicenergy. 87 inside france, confederal or traditional options were universally seen', 'bonnefous ( udsr ) ; and perhaps seventy socialists ( sfio ). 42ministers petsche and buron even initiated secret talks with the british about replacing the ecsc withoeec plans. similar critiques arose across the bureaucracy. herve ´ alphand ’ s deputy in the foreign ministry ’ s service de cooperation e ´conomique, olivier wormser, joined finance ofﬁcials to try to shunt coal and steel discussions into theoeec. 43these ofﬁcials saw “ britain as france ’ s irreplaceable partner against germany... [ and ] tended to regard community with germany as suicidal or abetrayal of france ’ s great - power prerogatives. ” 44ambassador rene ´ massigli later wrote, “ from the moment when jean monnet rallied robert schuman to the idea ofeuropean federalism, to which the supranational system he invented was meant tolead, i fought tirelessly for the victory of a confederal conception to which it wouldbe possible, with time, to rally great britain ; i could not conceive europe withoutgreat britain. ” 45 another third of the majority, some bureaucrats, the']",True,10,3,10,3,1.5050950050354004,0.38899919390678406,factual
Which countries were the founding members of the ECSC?,"Original Answer:  The founding members of the ECSC were Belgium, France, Germany, Italy, Luxembourg, and the Netherlands.","['institutional foundations • three communities created in 1950s : • european coal and steel community ( ecsc ), 1951 • making war in europe not only ‘ unthinkable, but materially impossible ’ • european atomic energy community ( euratom ), 1957 • european economic community ( eec ), 1957 • founders : • germany, france, italy, belgium, netherlands, luxemburg • different patterns of development : • widening • deepening • differentiated and multi - speed integration', '##e rate in order to achieve this aim : belgium, france, germany, italy, luxembourg and the neth erlands. in political terms, the ecsc can be 4 although the creation of the ‘ european union ’ ( eu ) only came about with the treaty of maastricht ( 1992 ), the term is also used for the preceding period in this text for reasons of linguistic continuity.', '5 stable democracies that respected inviolable rights. common security concerns about the ussr, the need to tie germany to west european defense, and ( initially ) the desire to prevent any revival of german militarism created an environment of mutual reliance and growing trust. c. the founding institutions of the european community while a variety of institutional arrangements emerged during the post - war period that facilitated closer integration, the actual european union ( initially called the european economic community ) traces its roots to three organizations in particular. their varied functions and institutional arrangements reflected the variety of objectives that the advocates of integration had in mind. the european coal and steel community ( ecsc ), created by the treaty of paris in 1951, included six states : the three benelux countries, france, west germany, and italy. it aimed to regulate coal and steel production ; reduce the internal tariffs hindering the trade in these products across borders ; limit subsidies to these sectors ; and establish a common external tariff. a supranational authority ( the high authority ) would supervise the process. the idea of regulating coal and steel production meshed well with the french penchant for dirigisme, or government planning and intervention. moreover, once again reflecting the security dimensions of the process']",True,10,3,10,3,1.9245736598968506,0.4578690528869629,factual
What major geopolitical event increased U.S. pressure for European cooperation in the late 1940s?,"Eyewitness: I can see that the Korean War was a major geopolitical event in the late 1940s. It increased U.S. pressure for European cooperation, as they realized the importance of working together to address global challenges.","['cooperation in postwar europe. by the 1950s, almost all non - communist elites advanced some variation on these themes. they also account well for the salienceof issues over time within cooperation. almost all european ( and especially french ) elites saw coal and steel plans as crucial during reconstruction, defense cooperationas urgent during the korean war, trade deals as desirable in the boom of themid - 1950s, and atomic cooperation as enticing as civil applications became evident. but structural accounts are wrong to see clear imperatives to the unprecedentedpolitical project we know as “ european integration. ” in france, actors who shared objective positions in parties, bureaucracies, and sectors consistently espouseddifferent ideas about how those interests connected to european institution building. france selected the ecsc and eec projects not because clear majorities dictatedthem, but because leaders with support on other issues used their authority to craftone of several potential coalitions. this argument also incorporates institutional path - dependence, but it disputes the forward - leading dynamics of “ neofunctionalist ” scholarship. european institutions did not constrain major policy choices going forward before 1958, let alone carryeuropeans from the ecsc to the eec. institutions mattered instead in the way oftendescribed', 'later development. 2 although i accept insights from both approaches, i argue that neither explains why europeans chose this “ community ” europe over radically different alternativesin the 1950s. if postwar structural conditions generated widely perceived impera - tives to european cooperation, they did not dictate its shape or extent. if institutionalpath - dependence helped “ lock in ” the contested eec institutions after 1958, it did not push europeans in any speciﬁc direction before then. within vague structuraland institutional pressures, only certain ideas led europeans to the eec rather than to less extensive cooperation in much weaker international institutions ( or without for comments i thank chris ansell, neil fligstein, nicolas jabko, elizabeth kier, andrew moravcsik, paul pitman, wayne sandholtz, robert rauchhaus, jeffrey vanke, steve weber, two anonymousreviewers and the editors of international organization, and audiences at the university of british columbia, the university of california at berkeley, harvard university, the georgia institute oftechnology, and syracuse university. for research support i thank the national science foundation, themacarthur foundation, and the institute on global conﬂict and cooperation. 1. see moravcsik 1998 ; and milward 1992.', 'was again fundamental. community deals reshaped europe ’ s axis from franco - british entente to franco - german partnership. 133 what are the broad implications for the eu literature? this evidence is histori - cally incomplete ; it does not show ( or even imply ) that the eec led inevitably totoday ’ s eu, or that confederal or traditional choices in the 1950s would have madesubsequent choices for eu - like institutions impossible. further research on the1970s, 1980s, and 1990s, which i present elsewhere, is necessary to assess the fullcausal role of ideas in eu history. 134but this account lays the foundations for a strongly revisionist, ideational view of that entire story. structural pressures andinstitutional dynamics allowed for several very different kinds of cooperation inpostwar europe. this eu resulted — and other concrete possibilities did not — because certain leaders advanced a contested ideological agenda past their dividedcompatriots. showing ideas as causes to convince objective - interest theorists that ideas deserve attention, i have argued, ideational theorists should highlight historical choices where ideas ’ distinct effectsare clearest. these choices arise where ideas strongly cross - cut prevailing lines ofinterest aggregation, for two']",True,10,3,10,3,1.7768785953521729,0.4755319356918335,factual
What were the initial aims of the ECSC?,"Eyewitness: I can see that the initial aims of the ECSC were to regulate coal and steel production, reduce internal tariffs hindering trade in these products across borders, limit subsidies to these sectors, and establish a common external tariff.","['##e rate in order to achieve this aim : belgium, france, germany, italy, luxembourg and the neth erlands. in political terms, the ecsc can be 4 although the creation of the ‘ european union ’ ( eu ) only came about with the treaty of maastricht ( 1992 ), the term is also used for the preceding period in this text for reasons of linguistic continuity.', 'move towards political union was the attempt to create a european defence community ( edc ). discussed after the successful launch of the ecsc, the edc foresaw the integration of the armies of the six ecsc member states ( i. e. including germany ) into a european army. in the end the project failed b ecause the french ‘ assemblee nationale ’ failed to ratify the treaty for fear of transferring sovere ignty over national defenc e policy. this period ( 1952 - 53 ) also saw the abortive attempt to creat e a european political union ( epu ), which was an initiative aimed at an integrated european foreign policy. following these failures, attempts to bring fo rward european integration moved away from political and towards economic cooperation. the treaties of rome, signed in 1957, successfully reinvigorated the dynamism of the integrati on process through economic integration and the european economic community ( eec ). the eec was founded to overcome the sectoral limitation of the ecsc. it aime d at the creation of a common ma rket for all economic sectors via an intermediary step, the creation of a cust oms union. in practical terms internal quotas', '5 stable democracies that respected inviolable rights. common security concerns about the ussr, the need to tie germany to west european defense, and ( initially ) the desire to prevent any revival of german militarism created an environment of mutual reliance and growing trust. c. the founding institutions of the european community while a variety of institutional arrangements emerged during the post - war period that facilitated closer integration, the actual european union ( initially called the european economic community ) traces its roots to three organizations in particular. their varied functions and institutional arrangements reflected the variety of objectives that the advocates of integration had in mind. the european coal and steel community ( ecsc ), created by the treaty of paris in 1951, included six states : the three benelux countries, france, west germany, and italy. it aimed to regulate coal and steel production ; reduce the internal tariffs hindering the trade in these products across borders ; limit subsidies to these sectors ; and establish a common external tariff. a supranational authority ( the high authority ) would supervise the process. the idea of regulating coal and steel production meshed well with the french penchant for dirigisme, or government planning and intervention. moreover, once again reflecting the security dimensions of the process']",True,10,3,10,3,1.7054502964019775,0.46500852704048157,factual
What alternative model did some French elites prefer over the community model?,"Eyewitness: I can confirm that some French elites preferred the confederal model over the community model. However, it's important to note that this preference may have been influenced by historical and cultural factors specific to France at the time.","['legacies at thenational level — or mean capitulation to the german konzerns. for the right, supranational integration could open france to broader markets — or emasculatenational strength and identity. since right, left, and center had their realists, pragmatists, idealists, anglophiles, and even germanophiles, domestic allies grav - itated to different european strategies. after several years of confusion, theirpositions crystallized around the ecsc proposal. some elites sought to mobilizecoalitions in favor of community projects ; others in the same parties and bureau - cracies called for confederal or traditional alternatives. the parting of the ways : the ecsc the community model ﬁrst entered french debates seriously with foreign minister robert schuman ’ s proposal for a “ european coal and steel community ” in may 37. see searle 1995 ; and ruggie 1998. 38. on ideas at different levels of generality, see campbell 1998 ; and goldstein and keohane 1993. 58 international organization', 'miscast in common wisdom as the eec ’ s champions — opposed community - style accords in 1955. though the largest french farmers were among the most competitive in europe, and french surpluses weremounting, agricultural organizations unambiguously favored the continued pursuitof bilateral contracts. they saw the ecsc six as too small a framework for frenchexports. germany was the six ’ s only major importer, and the dutch and italianswere more competitors than potential markets. institutionally, farmers had come tooppose supranationality during the ﬁght over a “ european agricultural community ” in 1951 – 53, denouncing the ecsc model as “ too heavy, too rigid, too authoritariananddirigiste, and weighted towards consumer interests. ” 91 under these conditions, france did not return to community policies because objective economic interests or supranational lobbying formed a majority to demandit. instead, pro - community leaders unexpectedly gained opportunities to reasserttheir views. this occurred in two steps. first, conservative foreign minister pinaystepped beyond his instructions at messina — which ruled out even discussing theeec — to accept studies of all the proposals. 92he also proposed the most pro - community participant, belgian foreign minister spa', 'owe his agenda - setting power to any electoral or coalitional upswell fora community europe. he became premier against all contemporary predictions, campaigning for social policies that ﬁt poorly with liberalization. by far the mostpopular french politicians during the eec negotiations were its two strongestleaders before and after that process, mende ` s france and charles de gaulle ; they respectively incarnated confederal and traditional thinking. france chose the eecover these alternatives because certain leaders asserted their views amid a deeplycross - cutting battle of ideas. these diverse politicians — the conservative industri - alist pinay, the socialist boss mollet, the rural centrist maurice faure — shared littlebesides a model of a desirable europe. they achieved power on other issues, usedtheir authority to direct european policies, and built french strategies around theirideas. 115. inside the agricultural organizations, “ these opponents were motivated by political, one could even say psychological, objections. they felt unable to accept an institution in which france would beso closely associated with germany or where she might lose some of her freedom of decision. ” mahant1969, 221. 116. delwit 1995, 72. 117. le monde, 24 january 1957. 72 international organization']",True,10,3,10,3,1.6065783500671387,0.3876459300518036,factual
What did the EEC stand for?,Original Answer:  The EEC stood for European Economic Community.,"['xvii preface th e european union ( eu ) is the most signifi cant and infl uential of international economic integration ( iei ) schemes. th ere are three reasons, the sum of which explains this signifi cance : 1. of the six eu founding states, ( west ) germany, france and italy were top ten world economies. since then, two such economies have joined : the uk and spain. hence today the eu includes half of the world ’ s top ten economies. th e eu has also proved a magnet for new members : in addition to the founding member nations, known as the original six, there are now an additional twenty - one. th e eu of twenty - seven continues to receive applications for membership ; hence it is set to include practically the whole of europe, and may go beyond the geographic area if turkey succeeds in joining in 2015. no other scheme matches this economic size and diversity. 2. from a voluntary viewpoint, the eu is the oldest iei scheme in operation ; voluntary in the sense that countries are not coerced into joining, due to their being dominated by a foreign country or captured by war. th is longevity is part of the eu ’ s attraction. 3. most vitally, the eu', 'the frankish empire at its greatest extent, ca. 814 adhistory of the european union the european union is a geo - political entity, created in 1993, covering a large portion of the european continent. it is founded upon numerous treaties and has under gone expansions and secessions that have taken it from six member states to 27, a majority of the states in europe. since the beginning of the institutionalised modern european integration in 1948, the development of the european union has been based on a supranational foundation that would "" make war unthinkable and materially impossible "" [ 1 ] [ 2 ] and reinforce democracy amongst its members [ 3 ] as laid out by robert schuman and other leaders in the schuman declaration ( 1950 ) and the europe declaration ( 1951 ). this principle was at the heart of the european coal and steel community ( ecsc ) ( 1951 ), the treaty of paris ( 1951 ), and later the treaty of rome ( 1957 ) which established the european economic community ( eec ) and the european atomic energy community ( eaec ). the maastricht treaty ( 1992 ) created the european union with its pillars system, including foreign and home affairs alongside the european communities. this in turn led to the', '##e rate in order to achieve this aim : belgium, france, germany, italy, luxembourg and the neth erlands. in political terms, the ecsc can be 4 although the creation of the ‘ european union ’ ( eu ) only came about with the treaty of maastricht ( 1992 ), the term is also used for the preceding period in this text for reasons of linguistic continuity.']",True,10,3,10,3,1.5076630115509033,0.4613683819770813,factual
In what year was the EEC established?,"Eyewitness: I remember the EEC being established in 1957. It was a significant event that marked the beginning of European integration. Today, it's hard to imagine Europe without the EEC and its many achievements.","['institutional foundations • three communities created in 1950s : • european coal and steel community ( ecsc ), 1951 • making war in europe not only ‘ unthinkable, but materially impossible ’ • european atomic energy community ( euratom ), 1957 • european economic community ( eec ), 1957 • founders : • germany, france, italy, belgium, netherlands, luxemburg • different patterns of development : • widening • deepening • differentiated and multi - speed integration', 'union. after the failed attempts at creating defence ( european defence community ) and political communities ( european political community ), leaders met at the messina conference and established the spaak committee which produced the spaak report. the report was accepted at the venice conference ( 29 and 30 may 1956 ), which decided to organise an intergovernmental conference. the intergovernmental conference on the common market and euratom focused on economic unity, leading to the treaties of rome being signed in 1957 – this established the european economic community ( eec ) and the european atomic energy community ( euratom ) among the members. [ 44 ] initial years ( 1948 – 1957 )', 'would inform later integration at a larger scale. the organization for european economic cooperation ( oeec ), created in 1948, provided another forum for managing economic affairs. the oeec was largely created to restore free trade and international payments as well as to channel marshall plan aid to sixteen european states. but the first steps toward european integration were not oriented to economic gains alone. the massive suffering inflicted by genocide and human rights violations of an unprecedented scale inspired governments to seek the means to prevent any recurrence of']",True,10,3,10,3,1.469219446182251,0.5285292267799377,factual
Which French bureaucrat was a significant advocate for European integration?,Original Answer:  The French bureaucrat who was a significant advocate for European integration is not mentioned in the provided context.,"['european leaders opposed deeper integration. the french president charles de gaulle, for instance, tried to strip the high authority ( now the european commission ) of its supranational aspirations by establishing a primacy of member states. he also attacked majority voting in the council of ministers by boycotting council meetings and paralysing co mmunity decision - making for several months. this so - called “ empty - chair crisis ” resulte d in the “ luxembourg compromise ” according to which member states acknowledged a national veto for policies that are against the ‘ vital ’ interests of one country. as a result actual vo ting in the council of ministers remained the exception and consensus the rule. in addition to the initiatives eventually leading to the eu, many other organisations originated in the post - war era, such as nato and the oecd ( for an overview see annex 1 ). 5 the ecsc expired in mid - 2001 after 50 years of existence.', ', along with the observation of a larger and growing us market on the other side of the ocean, nourished the urge for the economic integration of the continent. [ 23 ] in 1920, advocating the creation of a european economic union, the british economist john maynard keynes wrote that "" a free trade union should be established... to impose no protectionist tariffs whatever against the produce of other members of the union. "" [ 24 ] during the same decade, the austrian richard von coudenhove - kaler gi, in light of the dissolution of the habsbur g empire, imagined as one of the first modern political unions of europe, founded the pan - europa movement. [ 25 ] his ideas influenced his contemporaries, among whom was then - prime minister of france aristide briand. as french prime minister, nobel peace prize laureate for the locarno treaties and follower of the paneuropean union aristide briand delivered a widely recognized speech at the league of nations, the precursor of the united nations, [ 26 ] in geneva on 5 september 1929 for a federal europe to secure europe and settle the historic franco - german enmity. [ 27 ] [ 28 ] world war ii from 1939 to 1945 demonstrated more than ever the horrors of', '33 ] on 19 september 1946 in a much recognized speech winston churchill reiterated his calls since 1930 for a "" european union "" and "" council of europe "", at the university of zurich. after leaving office, churchill called as a civilian for a united states of europe. coincidentally [ 34 ] parallel to his speech the hertenstein congress in the lucerne canton was being held, resulting in the union of european federalists, [ 35 ] one of the then founded and later constituting members of the european movement. richard von coudenhove - kaler gi, who successfully established during the interwar period the oldest organization for european integration, the paneuropean union, founded in june 1947 the european parliamentary union ( epu ). to ensure germany could never threaten thefrom world war i to world war ii world war ii ( 1939 – 1945 ) aftermath ( 1945 – 1948 )']",True,10,3,10,3,1.708493947982788,0.31632179021835327,factual
What was the main argument of structuralists regarding the formation of the EU?,"Eyewitness: I can see that the EU has grown significantly since its inception, and it's clear that it has responded to objective structural imperatives such as international interdependence and the need for strong institutions. However, it's also evident that subsequent steps have been heavily path-dependent and resulted in the broader European economic community (EEC) and its later development.","['showing ideas as causes : the origins of the european union craig parsons why does western europe, with its quasi - federal european union ( eu ), have international institutions that are so much more developed than those in otherregions? scholars give two main answers. for “ structuralists ” like andrew morav - csik and alan milward, the eu responded to objective structural imperatives. 1 international interdependence was particularly acute in postwar europe, so govern - ments built particularly strong institutions to meet policy challenges. for “ institu - tionalists ” in the tradition of ernst haas, structural imperatives may have driveninitial postwar institution building, but subsequent steps were heavily path - depen - dent. once some power was delegated to “ supranational ” agents in the europeancoal and steel community ( ecsc ) in 1952, those agents crafted new projects andmobilized coalitions to extend supranational institutions. from this “ spillover ” arosethe broader european economic community ( eec ) in 1958 — the direct foundationof today ’ s eu — and its later development. 2 although i accept insights from both approaches, i argue that neither explains why europeans chose this “ community ” europe over radically different alternativesin', '— decided the outcome across three widely different europes in the 1960s, and probably across even more divergent futures in subsequent decades. conclusions the origins of the european union this argument does not imply that objective structures are unimportant in eu history. structural accounts are correct to note broad trends toward liberalization and 128. until then, french farmers ’ organizations favored extending the transition - period provisions for bilateral contracts. neville - rolfe 1984, 116. 129. couve de murville 1971, 314. 130. eec negotiator marjolin wrote that had discussions continued in the oeec instead of moving to the eec in 1956, “ the germans, especially after the departure of adenauer, would probably not haveceded to the french demands on the common agricultural policy, knowing from the [ oeec ] examplethat another commercial system, excluding agriculture but giving them the same advantages that they hadfound in the common market, was possible. ” marjolin 1986, 317. origins of the eu 75', '1 the development of the european union columbia international affairs online hendrik spruyt and lucy lyons arizona state university i. introduction. the european continent has now been at peace for more than 50 years. economic cooperation and tranquility have transformed the west and central european landscapes, which for centuries had been dominated by competition and war. as we will argue, this transformation had from the very beginning multiple dimensions. economic and security concerns intermeshed with the desire to establish stable democratic regimes that respected fundamental human rights. together, the states of the european union ( eu ) form the largest economy in the world. the formation of the eu thus warrants our attention in its own right. but an analysis of how cooperation has emerged in this region also provides insights into how cooperation might emerge in other areas. ii. up from the rubble : new unity and purpose ( 1945 - 1965 ) a. historical origins before 1939, the european powers could still bask in the light of several centuries of european expansion and preeminence on the world scene. they ruled vast empires and held']",True,10,3,10,3,1.923551321029663,0.5385159254074097,reasoning
"According to the document, how did ideas influence the development of the EU?","Eyewitness: I can see that the EU has come a long way since its inception, and it's fascinating to observe how ideas have played a crucial role in shaping its development. The document highlights that the original development of the EU was based on a supranational foundation aimed at making war unthinkable and materially impossible through peaceful means of consolidation of European territories. This was achieved through dynastic unions, country-level unions, and community deals that reshaped Europe's axis from the Franco-British entente to the Franco-German partnership. Additionally, certain leaders advanced a contested ideological agenda past their divided compatriots, which allowed for several very different kinds of cooperation in postwar Europe.","['pre - christian greek, germanic, celtic, slavic and hungarian powers, khanates, or al - andalus and the sicilian emirate. apart from the ideas of federation, confederation, or customs union such as winston churchill\'s 1946 call for a "" united states of europe "", the original development of the european union was based on a supranational foundation that would "" make war unthinkable and materially impossible "" [ 1 ] [ 2 ] a peaceful means of some consolidation of european territories used to be provided by dynastic unions ; less common were country - level unions, such as the polish – lithuanian commonwealth and austro - hungarian empire. [ 15 ] development of eur ope as a r egion europe as a continent roman europes other europes ideas of eur opean unity befor e 1948', 'was again fundamental. community deals reshaped europe ’ s axis from franco - british entente to franco - german partnership. 133 what are the broad implications for the eu literature? this evidence is histori - cally incomplete ; it does not show ( or even imply ) that the eec led inevitably totoday ’ s eu, or that confederal or traditional choices in the 1950s would have madesubsequent choices for eu - like institutions impossible. further research on the1970s, 1980s, and 1990s, which i present elsewhere, is necessary to assess the fullcausal role of ideas in eu history. 134but this account lays the foundations for a strongly revisionist, ideational view of that entire story. structural pressures andinstitutional dynamics allowed for several very different kinds of cooperation inpostwar europe. this eu resulted — and other concrete possibilities did not — because certain leaders advanced a contested ideological agenda past their dividedcompatriots. showing ideas as causes to convince objective - interest theorists that ideas deserve attention, i have argued, ideational theorists should highlight historical choices where ideas ’ distinct effectsare clearest. these choices arise where ideas strongly cross - cut prevailing lines ofinterest aggregation, for two', '1 the development of the european union columbia international affairs online hendrik spruyt and lucy lyons arizona state university i. introduction. the european continent has now been at peace for more than 50 years. economic cooperation and tranquility have transformed the west and central european landscapes, which for centuries had been dominated by competition and war. as we will argue, this transformation had from the very beginning multiple dimensions. economic and security concerns intermeshed with the desire to establish stable democratic regimes that respected fundamental human rights. together, the states of the european union ( eu ) form the largest economy in the world. the formation of the eu thus warrants our attention in its own right. but an analysis of how cooperation has emerged in this region also provides insights into how cooperation might emerge in other areas. ii. up from the rubble : new unity and purpose ( 1945 - 1965 ) a. historical origins before 1939, the european powers could still bask in the light of several centuries of european expansion and preeminence on the world scene. they ruled vast empires and held']",True,10,3,10,3,2.771735191345215,0.5418950915336609,reasoning
What was the response of the British government to the ECSC proposal?,"Eyewitness: I remember the British government initially supporting the ECSC proposal, but later dropping it when France turned against it in 1954. It's fascinating to see how history has unfolded since then and how different events have shaped our world today.","['bonnefous ( udsr ) ; and perhaps seventy socialists ( sfio ). 42ministers petsche and buron even initiated secret talks with the british about replacing the ecsc withoeec plans. similar critiques arose across the bureaucracy. herve ´ alphand ’ s deputy in the foreign ministry ’ s service de cooperation e ´conomique, olivier wormser, joined finance ofﬁcials to try to shunt coal and steel discussions into theoeec. 43these ofﬁcials saw “ britain as france ’ s irreplaceable partner against germany... [ and ] tended to regard community with germany as suicidal or abetrayal of france ’ s great - power prerogatives. ” 44ambassador rene ´ massigli later wrote, “ from the moment when jean monnet rallied robert schuman to the idea ofeuropean federalism, to which the supranational system he invented was meant tolead, i fought tirelessly for the victory of a confederal conception to which it wouldbe possible, with time, to rally great britain ; i could not conceive europe withoutgreat britain. ” 45 another third of the majority, some bureaucrats, the', 's ecscpartners ( germany, benelux, italy ) eventually agreed to negotiate edc but quicklydropped it when the french turned against it in 1954. 24while the eec itself was not a french proposal — originating with ultra - europeanist dutch foreign minister janwillem beyen — it was partly crafted to appeal to the french. beyen notwithstand - ing, most benelux and german leaders preferred trade liberalization in the broaderand institutionally weak format championed by the british. they hesitantly sup - ported beyen ’ s eec plan because they feared the french would only acceptliberalization within a “ little europe ” with elaborate economic safeguards. 25in sum, no one contests that without french insistence on institutionally strong, geograph - ically limited institution building in the 1950s no such framework would haveresulted. two alternatives to my account, however, see this french position as strongly determined by nonideational factors. for structuralists, objective economic andgeopolitical constraints selected french strategies. historians like milward andwilliam hitchcock argue that france needed a new basis for controlling andcooperating with a resurgent west germany in 1950 ; the ecsc ’ s supranationalovers', 'needed a new basis for controlling andcooperating with a resurgent west germany in 1950 ; the ecsc ’ s supranationaloversight of basic industries was the straightforward solution. 26similar concerns about overseeing german military power pushed the french to the edc. theincentives of this larger delegation of sovereignty were less clear, however, and theedc died. but soon economic interests, transmitted through interest groups, refocused the french on an institutionally strong “ little europe. ” weak frenchbusiness feared british plans for broad trade liberalization, preferring a smaller andmore managed trade pact. growing farm surpluses led french farmers to insist that 23. see kersten 1988 ; milward 1988 ; ludlow 1997, 17 ; and bu ¨hrer 1995. 24. see fursdon 1980 ; and de la gorce 1979, 91 – 159. 25. see asbeek - brusse 1997, 157 ; milward 1992, 192 ; grifﬁths 1990 ; and bouwman 1995, 141. 26. milward emphasizes french economic needs for the ecsc ; hitchcock emphasizes geopolitics. see milward 1984 ; and hitchcock 1998. 54 international organization']",True,10,3,10,3,1.699908971786499,0.39769381284713745,factual
What theory suggests that ideas can become causal factors in political outcomes?,"Eyewitness: I've seen how ideas can influence political outcomes, and it's fascinating to see how they can become causal factors.","['##opean integration is one very signiﬁcant example. while such cases cannot prove that ideas matter everywhere, they should convince skeptics that ideas can be majorcauses in politics. this section ﬁrst considers how to isolate ideas ’ effects on individuals ’ views. then it suggests how individual - level ideas can affect majoroutcomes. cross - cutting ideas and individual variation cross - cutting ideas have particularly clear effects because they offer the sharpest possible contrast to the expectations of objective - interest theories. all such theoriesdeﬁne actors ’ interests in terms of objective conditions at some level of organiza - tion. for realists, individuals in a state share interests deﬁned by the distribution ofpower ; political party theorists trace members ’ interests to electoral or coalitionalconstraints ; bureaucratic theorists highlight units ’ interests within organizationalrivalries ; and liberals or marxists derive group interests from economic constraints ( in different ways ). ideational approaches posit, in contrast, that actors interpret theirinterests through ideas that can vary independently from their objective positions. their greatest divergence with objective - interest theories thus occurs where ideasvary as independently as possible from organizational lines in an arena, strongly 12. on counterfactuals and ideas', 'accept this demonstration that ideas canbe concretely displayed as autonomous causes, we can move beyond battles over whether or not ideas matter to the much more interesting questions of how much they matter in particular situations and under what conditions they matter most. 135within these debates, furthermore, the burden of proof should no longer fall disproportionately on ideational theorists. ifwe accord ideas basic credibility as distinct causes, not only must ideationaltheorists show that ideas do not reduce to objective factors, but also others must takeseriously the possibility that apparently objective interests reduce to ideas. this isprecisely the challenge constructivists have issued since the late 1980s, but it haslacked force because of lingering doubts about their causal claims. the implications go further. if this article helps convince objective - interest theorists to confront this challenge and ideational theorists to search for otherresponses to the “ how much ” problem, the gap dividing them may begin to close. we would then all face the same theoretical dilemma : the relative weighting ofstructural, institutional, and ideational causes. today ’ s rigid division of labor among the champions of each factor, with each dismissing the others as universallysecondary, could give', 'formal institutions at all ). only advocates of a new ideology of integration — what i call the “ community model ” — perceived interests in the unprecedented institutional project showcased in the ecsc and eec. had europeans followed other viable, historically active ideas about their interests in cooperation — the “ confederal ” or “ traditional ” models — they would have solved their problems through more stan - dard diplomatic instruments. today ’ s europe would reﬂect the rule, not theexception, in international relations. this argument confronts two major obstacles. the ﬁrst is theoretical : isolating ideas as causes is difﬁcult. a growing literature points to actors ’ subjective beliefs as important causes of political outcomes. 3but if ideational theorists argue persua - sively that ideas are often non - negligible factors in politics, they have troublespecifying how much ideas matter. skeptics thus remain free to dismiss ideas as residual to objective responses to structural or institutional constraints. i argue thatcertain conditions allow for more concrete and speciﬁc claims about ideas. whereideas strongly cross - cut lines of shared material interests in a polity, we can isolate individuals ’ beliefs most clearly from objective pressures. cross - cutting ideas canals']",True,10,3,10,3,2.122570276260376,0.5418225526809692,factual
What does the term 'spillover' refer to in the context of the EU's development?,"Original Answer:  In the context of the EU's development, the term 'spillover' refers to a phenomenon where cooperation on one issue leads to technical spillover in other areas, creating a cascade of ever more cooperation in many areas previously not envisioned. This can result in the creation of new projects and the mobilization of coalitions to extend supranational institutions.","['23 the increasing volume of communications would diminish tensions and divisions between populations. the result would be a security community, a community of distinct units between which war had become obsolete. such communities could amalgamate and become one ( the united kingdom, for example ), or they could be pluralistic and retain their independence ( e. g., canada and the u. s. ). in this sense, the european union might be explained as a gradual shift from state anarchy to a pluralistic security community, which in the very long run might amalgamate. functionalist theory, advocated particularly by david mitrany, also sees dynamic and increasing returns as a result of cooperation. but it does so largely from a technical perspective. cooperation on one issue will lead to technical spillover in other areas. this will create a cascade of ever more cooperation in many areas previously not envisioned. for example, if one wished to liberalize trade in coal and steel, one would soon come to the conclusion that this also would require standardization of railroad gauges, working hours, safety standards, and so forth. neofunctionalism, particularly associated with the works of ernst haas and leon lindberg, emphasizes not only the result of technical spillover but also the political dynamics involved.', 'showing ideas as causes : the origins of the european union craig parsons why does western europe, with its quasi - federal european union ( eu ), have international institutions that are so much more developed than those in otherregions? scholars give two main answers. for “ structuralists ” like andrew morav - csik and alan milward, the eu responded to objective structural imperatives. 1 international interdependence was particularly acute in postwar europe, so govern - ments built particularly strong institutions to meet policy challenges. for “ institu - tionalists ” in the tradition of ernst haas, structural imperatives may have driveninitial postwar institution building, but subsequent steps were heavily path - depen - dent. once some power was delegated to “ supranational ” agents in the europeancoal and steel community ( ecsc ) in 1952, those agents crafted new projects andmobilized coalitions to extend supranational institutions. from this “ spillover ” arosethe broader european economic community ( eec ) in 1958 — the direct foundationof today ’ s eu — and its later development. 2 although i accept insights from both approaches, i argue that neither explains why europeans chose this “ community ” europe over radically different alternativesin', 'the lisbon agenda the eu has become more inﬂuential in this area. the book is organized in 18 chapters in four parts. after an introduction explain - ing the importance of securities settlement, chapters 2 to 4 cover the early develop - ment of the system. the next three chapters deal with 1980s deregulation up to the development of the euro. the transformation of the industry following the introduc - tion of the euro is the subject of the next six chapters. finally, the eu ’ s response as it attempts to develop a european ﬁnancial integration under the lamfalussy propos - als is analysed. so overall, this book provides a detailed case study of the develop - ment of european integration in practice and is essential reading for those concerned with the operation of european ﬁnancial markets. brian ardy london south bank university680 book reviews © 2009 the author ( s ) journal compilation © 2009 blackwell publishing ltd']",True,10,3,10,3,2.506964921951294,0.6218406558036804,factual
What role did French strategic choices play in the formation of the EEC?,"I can tell you that the French government's decisions and actions were instrumental in shaping the major supranational projects of the 1950s, including the ECSC, the failed European Defense Community (EDC), and the EEC. The French proposed these projects, and their preferences and interests influenced other European governments to agree to them. Additionally, French choices can be traced to a majority of sectoral associations and their party representatives, but only supranational leadership built that majority.

Eyewitness: Today, we can see how the legacy of those decisions continues to shape the European Union in many ways.","['french ideas and the origins of the eu western europe ﬁrst developed uniquely strong international institutions in the 1950s. at the end of that decade, six governments committed to deep and broadcooperation in the eec, including the delegation of considerable powers to “ supra - national ” agents in the eec ’ s executive commission and court. experts agree that french choices were particularly important to the eec ’ s birth. all three of the major supranational projects of the 1950s — the ecsc, the failed european defense community ( edc ), and the eec — took shape because govern - ments that preferred other european projects conceded to the french. when the french proposed the ecsc in 1950, the british refused to join any supranationalplan. german and benelux leaders, though skeptical of supranationality and reluc - tant to proceed without britain, eventually followed the french lead. 23when the french proposed the edc as a similar framework for west german rearmament, allthe other europeans argued for a simpler plan within nato. france ’ s ecscpartners ( germany, benelux, italy ) eventually agreed to negotiate edc but quicklydropped it when the french turned', 'any deal include a sheltered agricultural regime. this further alienated the british ( with their commonwealth agricultural preferences ). the eec was the result : thegermans and benelux agreed to liberalization largely on french terms. thus, claimsmoravcsik, we can trace french choices to clear majorities based on objectivesocietal interests. 27 for institutionalist pioneer ernst haas, structural pressures led the french to the ecsc, but institutional feedback led on to the eec. he suggested that frenchinterest groups and parties did not spontaneously perceive interests in extending theecsc to the edc or eec. only the ecsc ’ s supranational agents led domesticgroups to perceive such interests. chief among them was jean monnet, the frenchbureaucrat who presided over the ecsc ’ s “ high authority ” from 1952 to 1955, and thereafter led a lobby called the “ action committee for the united states of europe. ” without the initial creation of supranational agents in the ecsc, impliedthis “ neofunctionalist ” account, leaders in france ( and elsewhere ) were unlikely topursue the eec. french choices can be traced to a majority of sectoral associationsand their party representatives', 'france ( and elsewhere ) were unlikely topursue the eec. french choices can be traced to a majority of sectoral associationsand their party representatives, but only supranational ( not national ) leadership builtthat majority. 28 i accept elements of both approaches but strongly revise their causal claims. the institutionalist story requires more blatant revision. between the initial, narrowecsc deal and the much more extensive eec, literally nomajor french actors shifted their policy preferences in response to supranational lobbying. nonetheless, once the broader eec bargain was struck, we need an institutionalist logic ofpath - dependence to understand why it was consolidated into europe ’ s fundamentalarchitecture in the 1960s. my qualiﬁcation of the structuralist case is less direct butno less profound. any explanation of european institution building must begin withthe economic and geopolitical context. yet structuralists overlook the immensepolitical battle that took place over different interpretations of that context. as of1950, otherwise - similar french elites debated three ideational “ models ” of theirinterests in europe. the divide between “ community, ” “ confederal, ” and “ tradi - tional ” views did not quite']",True,10,3,10,3,2.5321781635284424,0.4949430823326111,reasoning
How did the ECSC influence the later establishment of the EEC?,"Original Answer:  The ECSC influenced the later establishment of the EEC by setting a new context for de Gaulle's strategizing, preventing him from moving backward to his preferred traditional strategy. The ECSC also had significant inertial consequences and blocked backward movement from aggressive community initiatives, foreclosing previously available alternatives. The ECSC's failure to create a European Defense Community (EDC) and the abortive attempt to create a European Political Union (EPU) led to attempts to bring forward European integration moving away from political and towards economic cooperation. The treaties of Rome successfully reinvigorated the dynamism of the integration process through economic integration and the establishment of the European Economic Community (EEC).","['see little evidence that the ecsc ’ s agents engenderedforward momentum toward the eec. i know of no ecsc skeptics, among politi - cians or interest groups, who came to favor community - style policies because ofmonnet ’ s proselytizing. the ecsc ’ s main effect was inertial : it was not undone when the edc fell. the same would prove true of the eec, but it extended muchmore broadly across economic and foreign policy issues, and it had much moresigniﬁcant inertial consequences. 119the eec set a new context for de gaulle ’ s strategizing, preventing him from moving backward to his preferred ( and previouslyavailable ) traditional strategy. according to the most detailed archival and contemporary accounts and my own interviews, 120de gaulle ’ s main reasons for accepting the eec in 1958 concerned how his foreign policy agenda ﬁt with his predecessors ’ very different institutional legacy. de gaulle was focused on leading europe to a “ third way ” between thesuper powers. to do this, he thought he needed two things : broad support fromgermany and a way to exclude the “ anglo - saxon ” british from europe. the eecnow set', 'forward before 1958, let alone carryeuropeans from the ecsc to the eec. institutions mattered instead in the way oftendescribed by “ historical institutionalists ” : their inertial qualities blocked backward movement from aggressive community initiatives, foreclosing previously availablealternatives. 131before the ecsc, europe ’ s institutional terrain remained wide open. after the ecsc, confederalists and traditionalists were notpersuaded to move forward to new community projects — but in coal and steel, talk of backwardmovement to the oeec, council of europe, or bilateral options faded away. afterthe eec, new community projects received few if any major converts ( anti - supranational discourse became more dominant in de gaulle ’ s france ) — but the eec ’ s alternatives in the oeec, weu, or franco - german formats increasingly lostrelevance. french champions of further supranational projects remained a scatteredminority, but institutional inertia consolidated their broad eec victory into thefoundations of european politics. the eec of the 1960s, like many institutionalframeworks, rested “ on defeated and repressed alternatives. ” 132 thus structures set the', 'move towards political union was the attempt to create a european defence community ( edc ). discussed after the successful launch of the ecsc, the edc foresaw the integration of the armies of the six ecsc member states ( i. e. including germany ) into a european army. in the end the project failed b ecause the french ‘ assemblee nationale ’ failed to ratify the treaty for fear of transferring sovere ignty over national defenc e policy. this period ( 1952 - 53 ) also saw the abortive attempt to creat e a european political union ( epu ), which was an initiative aimed at an integrated european foreign policy. following these failures, attempts to bring fo rward european integration moved away from political and towards economic cooperation. the treaties of rome, signed in 1957, successfully reinvigorated the dynamism of the integrati on process through economic integration and the european economic community ( eec ). the eec was founded to overcome the sectoral limitation of the ecsc. it aime d at the creation of a common ma rket for all economic sectors via an intermediary step, the creation of a cust oms union. in practical terms internal quotas']",True,10,3,10,3,3.1801741123199463,0.555397093296051,multi_hop
What were the criticisms against the Schuman Plan?,"I remember the Schuman Plan being a controversial proposal at the time. It was proposed to create a European Coal and Steel Community (ECSC) that would pool the coal and steel industries of France, West Germany, and other countries under independent ""supranational"" institutions. The plan faced significant opposition from various groups, including traditionalists, communists, and interest groups. Eyewitness: Today, we can see how far we've come since then, with the European Union being a major player on the global stage.","['re ´publicain populaire, mrp ), to the centrist radicals and the union de ´mocratique et socialiste de la re ´sistance ( udsr ), to the socialists ( section franc [UNK] de l ’ internationale ouvrie ` re, sfio ) — against the communists and gaullists. 40only about a third of the majority saluted the plan, including major ﬁgures in each party : a third of the 67 independents, around paul reynaud and antoine pinay ; perhaps 50 of the 166 mrp, behindfranc [UNK] de menthon and pierre pﬂimlin ; a score of the 52 centrists, such as rene ´ mayer and rene ´ pleven ; and another 20 of the 128 socialists, around andre ´ philip and ge ´rard jacquet. schuman also drew support from some prominent bureaucrats, like diplomat herve ´ alphand and planning head jean monnet ( author of the schuman plan ). but the other two - thirds of the majority, the opposition, most high ofﬁcials, and all interest groups criticized schuman ’ s proposal. about one - third of the coalitionvoiced confederal concerns, supporting', 'whatever strategy he chose — schuman rallied a majority. most broadly, he pre - sented the treaty as a fait accompli : he had negotiated away iar controls and alienated the british, and he argued that the choice was now between the ecsc andno supervision of germany at all. 57in coalitional terms, the third force was faltering over other issues ( religious schools and social policies ), and the risk ofdividing further over the ecsc pressed confederal and traditional critics reluctantlytogether. most blatantly, schuman made side - payments on colonial policies tosecure centrist and independent votes. by december, he had assembled one ofseveral possible majorities behind his personal choice. schuman later wrote, “ the road towards europe reached a parting of the ways in 1950. ” 58but the ecsc ’ s creation did not lock france and europe onto the path to the eec. it introduced a new “ community ” framework for french interests, but italso crystallized support for the alternatives. now the battle of ideas was trulyengaged. the battle widens : the edc from 1951 to 1954, the ecsc debates echoed across several issue - areas. con', '1950. france, west germany, and other countries would pool their coal and steel industries under independent “ supranational ” institutions. structural accountspresent the schuman plan as responding directly to clear imperatives. geopoliti - cally, it initiated franco - german reconciliation while giving france oversight ofwest germany ’ s nascent foreign policy, and it responded to u. s. pressure foreuropean collaboration. economically, it secured long - term access to german coaland supervision of german heavy industry. these beneﬁts dictated that the ecscwas the “ rational ” french strategy. 39 yet structuralists overlook actual french reactions to ecsc. rather than reﬂect - ing clear preferences in parties, interest groups, or bureaucracies, schuman ’ sself - described “ leap in the dark ” provoked a deeply divided response. early supportwas weakly scattered across schuman ’ s diverse “ third force ” coalition, whichallied the full range of pro - parliamentary parties — from the conservative indepen - dents, to schuman ’ s christian democrats ( movement re ´publicain populaire, mrp ), to the centrist radicals and the union de ´mocratique et socialiste']",True,10,3,10,3,2.510385036468506,0.4492044448852539,factual
Why did the EDC fail to gain ratification in France?,"Eyewitness: I'm here at the French National Assembly, and I can confirm that the EDC failed to gain ratification in France because the French National Assembly did not approve it.","[""74 ] a proposed constitutional treaty was signed by plenipotentiaries from eu member states on 28 october 2004. the document was ratified in most member states, including two positive referendums. the referendums that were held in france and the netherlands failed however, killing off the treaty. the european council agreed that the constitution proposal would be abandoned, but most of its changes would be retained in an amending treaty. on 3 october 2005, the eu decided to officially open accession negotiations with croatia and turkey. [ 75 ] [ 76 ] on 13 december 2007 the treaty was signed, containing opt - outs for the more eurosceptic members and no state - like elements. the lisbon treaty finally came into force on 1 december 2009. it created the post of president of the european council and significantly expanded the post of high representative. after much debate about what kind of person should be president, the european council agreed on a low - key personality and chose herman van rompuy while foreign policy - novice catherine ashton became high representative. the 2009 elections again saw a victory for the european people's party, despite losing the british conservatives who formed a smaller eurosceptic european conservatives and reformists grouping with other anti - federalist right wing parties. parliament's presidency was once again"", '##elux nations, and italy. an alternative view advocated the incorporation of germany into the north atlantic treaty organization ( nato ). the french national assembly failed to ratify the edc agreement in 1954, thus foreclosing the first option. the federal republic of germany and italy thereupon signed the brussels treaty ( creating the west european union, or weu ), and german membership in nato followed. european integration thus constituted from the beginning a multi - dimensional process, driven by a variety of motives besides the prospect of economic gain. the desire for economic cooperation and the pursuit of efficiencies of scale meshed with the desire to create', '10 | egenhofer, kurpas & van schaik countries. 8 the assembly managed to agree on a draft constitutional treaty that formed the starting point and blueprint for subsequent ne gotiations between eu member states in the intergovernmental conference. the first attemp t to reach an agreement failed in december 2003, but in june 2004 under the irish eu pr esidency an agreement was reached. meanwhile the eu had also enlarged in may 2004 and accepte d ten new member states : estonia, lithuania, latvia, poland, the czech republic, slovakia, hungary, slovenia, malta and cyprus. this enlargement constituted the eu ’ s biggest enlargement ever. in january 2007, the eu finalised the enlargement round that began in the late 1990s with romania and bulgaria becoming members. as with all eu treaty reforms, the entry in to force of the constitutional treaty necessitated ratification by all eu member states – either by the national parliaments or through referenda. eighteen countries approved the treaty, of which two ( spain and luxembourg ) did so through referenda. however, the treaty never entered in to force after referenda in france and the netherlands turned out to be negative in may and june 2005. the reasons for']",True,10,3,10,3,1.5173163414001465,0.34390872716903687,multi_hop
What did the proponents of the community model advocate for in terms of European cooperation?,"Eyewitness: I can see that the community model is still being debated today, with some people arguing for its continued relevance and others questioning its effectiveness. However, it's clear that the idea of integration remains a central theme in European politics.","['formal institutions at all ). only advocates of a new ideology of integration — what i call the “ community model ” — perceived interests in the unprecedented institutional project showcased in the ecsc and eec. had europeans followed other viable, historically active ideas about their interests in cooperation — the “ confederal ” or “ traditional ” models — they would have solved their problems through more stan - dard diplomatic instruments. today ’ s europe would reﬂect the rule, not theexception, in international relations. this argument confronts two major obstacles. the ﬁrst is theoretical : isolating ideas as causes is difﬁcult. a growing literature points to actors ’ subjective beliefs as important causes of political outcomes. 3but if ideational theorists argue persua - sively that ideas are often non - negligible factors in politics, they have troublespecifying how much ideas matter. skeptics thus remain free to dismiss ideas as residual to objective responses to structural or institutional constraints. i argue thatcertain conditions allow for more concrete and speciﬁc claims about ideas. whereideas strongly cross - cut lines of shared material interests in a polity, we can isolate individuals ’ beliefs most clearly from objective pressures. cross - cutting ideas canals', 'legacies at thenational level — or mean capitulation to the german konzerns. for the right, supranational integration could open france to broader markets — or emasculatenational strength and identity. since right, left, and center had their realists, pragmatists, idealists, anglophiles, and even germanophiles, domestic allies grav - itated to different european strategies. after several years of confusion, theirpositions crystallized around the ecsc proposal. some elites sought to mobilizecoalitions in favor of community projects ; others in the same parties and bureau - cracies called for confederal or traditional alternatives. the parting of the ways : the ecsc the community model ﬁrst entered french debates seriously with foreign minister robert schuman ’ s proposal for a “ european coal and steel community ” in may 37. see searle 1995 ; and ruggie 1998. 38. on ideas at different levels of generality, see campbell 1998 ; and goldstein and keohane 1993. 58 international organization', 'later development. 2 although i accept insights from both approaches, i argue that neither explains why europeans chose this “ community ” europe over radically different alternativesin the 1950s. if postwar structural conditions generated widely perceived impera - tives to european cooperation, they did not dictate its shape or extent. if institutionalpath - dependence helped “ lock in ” the contested eec institutions after 1958, it did not push europeans in any speciﬁc direction before then. within vague structuraland institutional pressures, only certain ideas led europeans to the eec rather than to less extensive cooperation in much weaker international institutions ( or without for comments i thank chris ansell, neil fligstein, nicolas jabko, elizabeth kier, andrew moravcsik, paul pitman, wayne sandholtz, robert rauchhaus, jeffrey vanke, steve weber, two anonymousreviewers and the editors of international organization, and audiences at the university of british columbia, the university of california at berkeley, harvard university, the georgia institute oftechnology, and syracuse university. for research support i thank the national science foundation, themacarthur foundation, and the institute on global conﬂict and cooperation. 1. see moravcsik 1998 ; and milward 1992.']",True,10,3,10,3,2.264986276626587,0.5715768933296204,factual
What alternative to the EDC emerged after its failure?,"Eyewitness: I remember the EDC's failure and how it led to the creation of the European Economic Community (EEC). The EEC was founded with the goal of creating a common market for all economic sectors, which was achieved through an intermediary step, the establishment of a customs union. Although there were initial hesitations from some leaders, the EEC was supported by most Benelux and German leaders.","['move towards political union was the attempt to create a european defence community ( edc ). discussed after the successful launch of the ecsc, the edc foresaw the integration of the armies of the six ecsc member states ( i. e. including germany ) into a european army. in the end the project failed b ecause the french ‘ assemblee nationale ’ failed to ratify the treaty for fear of transferring sovere ignty over national defenc e policy. this period ( 1952 - 53 ) also saw the abortive attempt to creat e a european political union ( epu ), which was an initiative aimed at an integrated european foreign policy. following these failures, attempts to bring fo rward european integration moved away from political and towards economic cooperation. the treaties of rome, signed in 1957, successfully reinvigorated the dynamism of the integrati on process through economic integration and the european economic community ( eec ). the eec was founded to overcome the sectoral limitation of the ecsc. it aime d at the creation of a common ma rket for all economic sectors via an intermediary step, the creation of a cust oms union. in practical terms internal quotas', '. their traditionalist peers either rejected german rearmamentoutright or favored a standard alliance framework. again, none of these actors misread their environment. all three strategies were viable internationally. the community option led to the edc treaty in may 1952. itwas ratiﬁed by the other ecsc members and supported by the united states, leavingit to france to ratify or reject. a traditional solution — re - arming germany withoutnew institutions — was also clearly available, since the french alone opposed this path against u. s. and european pressure in 1950 – 51. the confederal option wasequally viable as a compromise — since this is what quickly emerged after the french rejected the edc ( see below ). all else equal, the french were selectingbetween outcomes as divergent as a european army and simple german entry intonato. the french pursued the edc through 1952 not because the third force coalition coherently supported it, but because pro - community leaders controlled the foreign - policy agenda. encouraged by monnet and alphand, schuman shifted frenchpolicies from stonewalling to pushing for an ecsc - style framework in summer1951. no one else in paris was consulted on this change. 64', 's ecscpartners ( germany, benelux, italy ) eventually agreed to negotiate edc but quicklydropped it when the french turned against it in 1954. 24while the eec itself was not a french proposal — originating with ultra - europeanist dutch foreign minister janwillem beyen — it was partly crafted to appeal to the french. beyen notwithstand - ing, most benelux and german leaders preferred trade liberalization in the broaderand institutionally weak format championed by the british. they hesitantly sup - ported beyen ’ s eec plan because they feared the french would only acceptliberalization within a “ little europe ” with elaborate economic safeguards. 25in sum, no one contests that without french insistence on institutionally strong, geograph - ically limited institution building in the 1950s no such framework would haveresulted. two alternatives to my account, however, see this french position as strongly determined by nonideational factors. for structuralists, objective economic andgeopolitical constraints selected french strategies. historians like milward andwilliam hitchcock argue that france needed a new basis for controlling andcooperating with a resurgent west germany in 1950 ; the ecsc ’ s supranationalovers']",True,10,3,10,3,2.1157946586608887,0.5191649794578552,factual
What was one major reason for the divergence in French elites' views on European integration?,"Eyewitness: I can see that the French elites' views on European integration have diverged due to their differing perceptions of its potential benefits and risks. While some view it as a means to strengthen France's economic and political power, others see it as a threat to national sovereignty and control over its overseas territories. Additionally, the bureaucrats and deputies among the independents, MRP, radicals, and socialists want to safeguard the French Union against ""Europeanization.""","['for german side - payments in investments and aid forthe french union. if with hindsight such payoffs look clearly beneﬁcial to france, many traditionalists and confederalists actually saw eec ’ s intrusion into colonialrelationships as another reason to oppose it. bureaucrats and deputies among theindependents, mrp, radicals, and socialists wanted to “ safeguard the frenchunion ” against “ europeanization. ” 112not only did liberalization threaten the territories ; even aidfrom other countries would undercut french control. finance ofﬁcials insisted well into the eec negotiations that france ’ s “ natural ally ” wasbritain, and that france should : 1 ) push for european integration in the oeec framework, trying to establish a franco - british common front.... 2 ) not discuss, even in principle, theintegration of the overseas territories of the franc zone before the principlesof european integration are established and have begun to be executed. 3 ) activate as much as possible the economic, ﬁnancial, and tariff integration ofthe franc zone ( notably morocco ) with france, and not envisage the adhesionof this zone to eurafrica until its own internal ties are suf', 'european leaders opposed deeper integration. the french president charles de gaulle, for instance, tried to strip the high authority ( now the european commission ) of its supranational aspirations by establishing a primacy of member states. he also attacked majority voting in the council of ministers by boycotting council meetings and paralysing co mmunity decision - making for several months. this so - called “ empty - chair crisis ” resulte d in the “ luxembourg compromise ” according to which member states acknowledged a national veto for policies that are against the ‘ vital ’ interests of one country. as a result actual vo ting in the council of ministers remained the exception and consensus the rule. in addition to the initiatives eventually leading to the eu, many other organisations originated in the post - war era, such as nato and the oecd ( for an overview see annex 1 ). 5 the ecsc expired in mid - 2001 after 50 years of existence.', 'politics. the eec of the 1960s, like many institutionalframeworks, rested “ on defeated and repressed alternatives. ” 132 thus structures set the broad context for european institution building, and institutions held europeans to one path once it was chosen. in between, europeansfaced three viable alternatives in the 1950s. my answer to the “ how much ” questionis that leaders ’ ideas, as a cause irreducible to other factors, determined the outcomeacross these alternatives. during the late 1940s, french individuals gravitated tothree different views of their national interests in europe, in patterns that diverged from their main material and organizational positions. within complex multidimen - sional issue - space, this three - way divide in preferences meant majorities could becrafted for all three options. corresponding alternatives in international bargainingwere available as well. since european cleavages cross - cut right and left in 131. see steinmo, thelen, and longstreth 1992 ; and ikenberry 1988. 132. see berk 1994, 16 ; and unger 1987. 76 international organization']",True,10,3,10,3,2.3160786628723145,0.4775703251361847,reasoning
What was the outcome of the EDC vote in the French assembly?,"Eyewitness: I was there when the EDC vote in the French assembly took place. Unfortunately, it did not receive majority support and ultimately died due to changes in policymakers' positions.","['of each party were left isolated. at gaullist insistence, inearly 1953 schuman was replaced as foreign minister by his mrp ally — though edc opponent — georges bidault. after attempting to renegotiate the edc, radicalpremier pierre mende ` s france called a vote in august 1954 ( though he himself abstained ). the socialists split ﬁfty for, ﬁfty - three against ; the radicals and udsrvoted forty - one for, forty - four against ; and the independents divided sixty - six for, twenty - eight against. the hierarchical mrp maintained cohesion for the edc onlyby expelling several members and despite known hostility from much of the party. 68 gaullist and communist opposition decided the outcome. the edc did not emerge from majority support and die when policymakers changed their positions. the 1952 realignment reﬂected no broad shift on europeanissues. the public was ill - informed about the edc and its alternatives. 69neither before nor after 1952 did any substantive agreement on european policies help unitethe governing coalition ; the independents and radicals who led governments from1952 to 1955 were the groups most divided over europe. instead, the edc drew its support consistently', '; the independents and radicals who led governments from1952 to 1955 were the groups most divided over europe. instead, the edc drew its support consistently from minority groups in each of the governing parties. it roseand fell as they obtained and lost agenda control on the other issues that dominated coalition building. the extent to which the edc vote cross - cut french politics was remarkable. daniel lerner has shown that it lacked a regional pattern. 70erling bjøl has 66. alphand 1977, 228. 67. fauvet 1957, 163. 68. see irving 1973, 170 ; elgey 1993, 2 : 329 – 79 ; mayeur and milza 1993 ; lerner and aron 1957, 9 ; and fauvet 1957, 137. 69. in may 1953, french polls found 21 percent had not heard of the edc ; 60 percent did not know if it had been ratiﬁed ; 40 percent did not know if germany participated ; and 51 percent did not know ifbritain participated. in july 1954, 36 percent approved of the edc, 31 percent were opposed, and 33percent had no opinion ; in august it was 32 percent, 33 percent, and 35 percent. see stoetzel 1957 ; and', 'after confederalists and traditionalists rejected the edc, pro - community deputies and traditionalists combinedto reject the ﬁrst vote on the weu. a shocked mende ´s france called a second vote on a question of conﬁdence ( linking the weu to his other policy goals ) and achieved a majority. 82. massigli 1978, 506. 83. duche [UNK] 1994, 262 – 79. 66 international organization']",True,10,3,10,3,1.5640301704406738,0.5286410450935364,factual
What did the traditionalist model prioritize in contrast to the community model?,"Eyewitness: I can see that the traditionalist model is still being followed by some countries, while the community model has gained more traction in recent years.","['formal institutions at all ). only advocates of a new ideology of integration — what i call the “ community model ” — perceived interests in the unprecedented institutional project showcased in the ecsc and eec. had europeans followed other viable, historically active ideas about their interests in cooperation — the “ confederal ” or “ traditional ” models — they would have solved their problems through more stan - dard diplomatic instruments. today ’ s europe would reﬂect the rule, not theexception, in international relations. this argument confronts two major obstacles. the ﬁrst is theoretical : isolating ideas as causes is difﬁcult. a growing literature points to actors ’ subjective beliefs as important causes of political outcomes. 3but if ideational theorists argue persua - sively that ideas are often non - negligible factors in politics, they have troublespecifying how much ideas matter. skeptics thus remain free to dismiss ideas as residual to objective responses to structural or institutional constraints. i argue thatcertain conditions allow for more concrete and speciﬁc claims about ideas. whereideas strongly cross - cut lines of shared material interests in a polity, we can isolate individuals ’ beliefs most clearly from objective pressures. cross - cutting ideas canals', 'legacies at thenational level — or mean capitulation to the german konzerns. for the right, supranational integration could open france to broader markets — or emasculatenational strength and identity. since right, left, and center had their realists, pragmatists, idealists, anglophiles, and even germanophiles, domestic allies grav - itated to different european strategies. after several years of confusion, theirpositions crystallized around the ecsc proposal. some elites sought to mobilizecoalitions in favor of community projects ; others in the same parties and bureau - cracies called for confederal or traditional alternatives. the parting of the ways : the ecsc the community model ﬁrst entered french debates seriously with foreign minister robert schuman ’ s proposal for a “ european coal and steel community ” in may 37. see searle 1995 ; and ruggie 1998. 38. on ideas at different levels of generality, see campbell 1998 ; and goldstein and keohane 1993. 58 international organization', 'germanism. some traditionalists soon proved quitewilling to deal bilaterally with germany. others arrived at confederal or communitystrategies out of visceral fear of germany unfettered. instead, the fundamentaldistinctions concerned the “ master frame ” linking france itself and its europeanenvironment. in the slightly different vocabulary of john searle, they suggesteddifferent “ constitutive rules ” about france as a player in a european game. 37each packaged a set of normative and causal claims that deﬁned france ’ s positionvis - a ` - vis its neighbors. crucially, these different views of europe had no direct connection to the right – left cleavage that dominated french politics. each model ’ s constitutive ruleswere general enough to link to various lower - level “ regulative rules ” ; arguments soon arose that pictured a “ community ” europe ( and its competitors ) as eitheradvancing or impeding goals across left and right ( except for the communists ). 38 for the left, a supranational community could undo conservative legacies at thenational level — or mean capitulation to the german konzerns. for the right, supranational']",True,10,3,10,3,1.523918628692627,0.47342413663864136,reasoning
What did the term 'multiple equilibria' refer to in the context of the document?,"Original Answer:  In the context of the document, ""multiple equilibria"" refers to situations where there are multiple possible outcomes or solutions to a problem, and each outcome is equally valid based on the given information. This concept is related to game theory, which describes how individuals or groups make decisions in situations where their choices can affect others. In this context, ""multiple equilibria"" suggests that different individuals or groups may have different beliefs or preferences, leading to a range of possible outcomes that are equally valid based on the available information.","['cross - cut lines of shared material interests in a polity, we can isolate individuals ’ beliefs most clearly from objective pressures. cross - cutting ideas canalso fragment coalitions and parties, creating situations similar to the “ chaos ” and “ multiple equilibria ” described by game theorists. entrepreneurial leaders may gainthe autonomy to set the policy agenda around their own personal ideas, and tomobilize one of several potential coalitions behind them. leaders ’ ideas, as anautonomous causal factor, thereby select from a range of structural and institutionalpossibilities. the second obstacle is historical : tracing certain ideas across europe and the 1950s is an immense task. i surmount this problem by focusing on the pivotal caseoffrench strategic choices. experts agree that european cooperation took the shape it did in the 1950s — the institutionally strong, geographically limited eec — above all because the french government demanded it. the preferences of the other mainactors ( germany, britain, benelux ) summed to favor broader and weaker institu - tional options. i show that rather than reﬂecting structural or institutional pressures, french insistence on the eec resulted from community - minded leadership. alter - native confederal or traditional french strategies were strongly represented', 'mayeur, jean - marie, and pierre milza, eds. 1993. le mrp et la construction europe ´enne. paris : complexe. mckelvey, richard p., and richard e. wendell. 1976. voting equilibria in multidimensional choice spaces. mathematics of operations research 1 ( 2 ) : 144 – 58. mcnamara, kathleen r. 1998. the currency of ideas : monetary politics in the european union. ithaca, n. y. : cornell university press. milward, alan s. 1984. the reconstruction of western europe, 1945 – 1951. london : methuen. — — —. 1988. the belgian coal and steel industries and the schuman plan. in die anfa ¨nge des schuman - plans, 1950 – 1951, edited by klaus schwabe, 437 – 56. baden - baden : nomos. — — —. 1992. the european rescue of the nation - state. berkeley : university of california press. moch, jules. 1976. une si longue vie. paris : robert laffont. moravcsik, andrew. 1998. the choice for europe : social purpose and state power from messina to maastricht. ithaca, n. y', 'multilevel regulation and the eu : the interplay between global, european and national normative processes, edited by a. follesdal, r. a. wessel and j. wouters ( leiden : martinus nijhoff publishers, 2008, isbn9789004164383 ) ; xvii + 420pp., €150. 00 hb. from the political economy perspective, this book is a neat compilation of legal case studies in the subﬁeld of governance and policy - making. concentrating on the phe - nomenon of multi - level regulation and the interaction between competing levels of governance, the authors give a lengthy account of international regulatory fragmen - tation. ‘ maping the unmappable ’ through a variety of interesting case studies, the book aims to provide the reader with a response from the legal community to fervently debated topics such as globalization and interdependence. the analysis can be divided into two distinct parts. with regard to the ﬁrst section of the book, namely the interplay between global, european and national regulation, there tends to be disappointment with the overall originality of the theoretical con - tributions and conclusions. upon deeper scrutiny, one is']",True,10,3,10,3,2.7019546031951904,0.5252554416656494,factual
Which two countries had significant influence on the EEC's development alongside France?,Eyewitness: I can see that the two countries that had significant influence on the EEC's development alongside France are Germany and Italy.,"['french ideas and the origins of the eu western europe ﬁrst developed uniquely strong international institutions in the 1950s. at the end of that decade, six governments committed to deep and broadcooperation in the eec, including the delegation of considerable powers to “ supra - national ” agents in the eec ’ s executive commission and court. experts agree that french choices were particularly important to the eec ’ s birth. all three of the major supranational projects of the 1950s — the ecsc, the failed european defense community ( edc ), and the eec — took shape because govern - ments that preferred other european projects conceded to the french. when the french proposed the ecsc in 1950, the british refused to join any supranationalplan. german and benelux leaders, though skeptical of supranationality and reluc - tant to proceed without britain, eventually followed the french lead. 23when the french proposed the edc as a similar framework for west german rearmament, allthe other europeans argued for a simpler plan within nato. france ’ s ecscpartners ( germany, benelux, italy ) eventually agreed to negotiate edc but quicklydropped it when the french turned', 's ecscpartners ( germany, benelux, italy ) eventually agreed to negotiate edc but quicklydropped it when the french turned against it in 1954. 24while the eec itself was not a french proposal — originating with ultra - europeanist dutch foreign minister janwillem beyen — it was partly crafted to appeal to the french. beyen notwithstand - ing, most benelux and german leaders preferred trade liberalization in the broaderand institutionally weak format championed by the british. they hesitantly sup - ported beyen ’ s eec plan because they feared the french would only acceptliberalization within a “ little europe ” with elaborate economic safeguards. 25in sum, no one contests that without french insistence on institutionally strong, geograph - ically limited institution building in the 1950s no such framework would haveresulted. two alternatives to my account, however, see this french position as strongly determined by nonideational factors. for structuralists, objective economic andgeopolitical constraints selected french strategies. historians like milward andwilliam hitchcock argue that france needed a new basis for controlling andcooperating with a resurgent west germany in 1950 ; the ecsc ’ s supranationalovers', 'needed two things : broad support fromgermany and a way to exclude the “ anglo - saxon ” british from europe. the eecnow set the terms for both goals. in 1958 konrad adenauer made clear that goodfranco - german relations depended on implementing the eec. 121given earlier german preferences for a wider trade accord, adenauer would have made differentdemands in an eec - less europe ; but given the eec, this was aliberalization deal he could demand from the unpredictable new french leader. a similar reconﬁgu - ration of demands took place in franco - british relations. the british had already 118. see jouve 1967, 1 : 202 ; and rimbaud 1990, 365. 119. on why the eec ’ s institutions had such constraining effects ( compared to projects like the oeec, weu, and others ), see parsons 1999. 120. see poidevin 1990 ; jouve 1967 ; and interviews by the author with de gaulle ’ s foreign minister, maurice couve de murville, two other advisors, and diplomats, paris, 1997 – 98. 121. when the leaders met in september 1958, adenauer made the eec an explicit prerequisite for']",True,10,3,10,3,1.6036133766174316,0.5964199900627136,multi_hop
What was the main argument of institutionalists regarding the EEC's formation?,"Eyewitness: I can see that the formation of the EEC was a complex process, and there were many factors at play. However, from my perspective today, it's clear that the idea of a ""community"" Europe was a key factor in its creation. It was seen as a way to bring together different countries and cultures while still maintaining their individual identities. This vision resonated with many Europeans who were looking for a way to overcome the devastation of World War II and build a better future for themselves and their children.","['france ( and elsewhere ) were unlikely topursue the eec. french choices can be traced to a majority of sectoral associationsand their party representatives, but only supranational ( not national ) leadership builtthat majority. 28 i accept elements of both approaches but strongly revise their causal claims. the institutionalist story requires more blatant revision. between the initial, narrowecsc deal and the much more extensive eec, literally nomajor french actors shifted their policy preferences in response to supranational lobbying. nonetheless, once the broader eec bargain was struck, we need an institutionalist logic ofpath - dependence to understand why it was consolidated into europe ’ s fundamentalarchitecture in the 1960s. my qualiﬁcation of the structuralist case is less direct butno less profound. any explanation of european institution building must begin withthe economic and geopolitical context. yet structuralists overlook the immensepolitical battle that took place over different interpretations of that context. as of1950, otherwise - similar french elites debated three ideational “ models ” of theirinterests in europe. the divide between “ community, ” “ confederal, ” and “ tradi - tional ” views did not quite', 'later development. 2 although i accept insights from both approaches, i argue that neither explains why europeans chose this “ community ” europe over radically different alternativesin the 1950s. if postwar structural conditions generated widely perceived impera - tives to european cooperation, they did not dictate its shape or extent. if institutionalpath - dependence helped “ lock in ” the contested eec institutions after 1958, it did not push europeans in any speciﬁc direction before then. within vague structuraland institutional pressures, only certain ideas led europeans to the eec rather than to less extensive cooperation in much weaker international institutions ( or without for comments i thank chris ansell, neil fligstein, nicolas jabko, elizabeth kier, andrew moravcsik, paul pitman, wayne sandholtz, robert rauchhaus, jeffrey vanke, steve weber, two anonymousreviewers and the editors of international organization, and audiences at the university of british columbia, the university of california at berkeley, harvard university, the georgia institute oftechnology, and syracuse university. for research support i thank the national science foundation, themacarthur foundation, and the institute on global conﬂict and cooperation. 1. see moravcsik 1998 ; and milward 1992.', 'institutional consequences and the eec ’ s historical window this account faces one ﬁnal question : if only pro - community leadership led france to the eec, why did the eec survive when the collapse of the fourth republicbrought the very traditional charles de gaulle to power in may 1958? de gaulleconsidered rejecting or revising the treaty. 118yet he soon accepted the eec and even accelerated its implementation. objective imperatives, we might conclude, would eventually have pressed any french leader to the community path. the foregoing may simply raise issues of timing. in this section i argue that de gaulle ’ s rally to the eec reﬂected the institutional consequences of the eec itself. had pro - community leaders not led france to theeec in 1957, there is no reason to think de gaulle would have adopted a similar path. this analysis draws on the fundamental insight of institutionalist accounts — that new institutions feed back to alter subsequent interaction — but it presents thatlogic as more inertial and less dynamic than originally claimed by “ neofunctional - ists. ” as noted earlier, i see little evidence that the ecsc ’ s agents engenderedforward momentum toward the eec. i know of no ecsc skeptics']",True,10,3,10,3,2.3990278244018555,0.5188707113265991,reasoning
What did the 'Third Force' in French politics represent?,"Eyewitness: I'm here in France and can tell you that the 'Third Force' is still a significant player in French politics. They are advocating for social spending preservation while pushing back against rising defense costs, but their approach has become more nuanced over time.","['the domestic – economic account argues that third force leaders conceived the edc to preserve social spending despite u. s. pressure for rising defense outlays, bysharing the latter among europeans. french support for the edc declined after early1952, when the third force was replaced by a conservative coalition with no suchsocial agenda. 62 the problem with both explanations, as suggested in older french accounts, is that neither french elites in general nor third force leaders in particular ever agreed on the edc. 63nor did any changes in constraints lead individuals to change their views of french interests from 1951 to 1954. straightforward geopolitical pressuresdid put german rearmament on the table, but french elites consistently respondedto these pressures with the three views they had formulated on the ecsc. as of late1950 and through 1954, community advocates in the independents, mrp, radicals, udsr, socialists, and the bureaucracy called for integrating german units into asupranational european army. confederalists in the same parties and ministriespreferred to incorporate german forces into looser organizations under franco - british direction. their traditionalist peers either rejected german rearmamentoutright or favored a standard alliance framework. again, none of these actors misread their environment', 'whatever strategy he chose — schuman rallied a majority. most broadly, he pre - sented the treaty as a fait accompli : he had negotiated away iar controls and alienated the british, and he argued that the choice was now between the ecsc andno supervision of germany at all. 57in coalitional terms, the third force was faltering over other issues ( religious schools and social policies ), and the risk ofdividing further over the ecsc pressed confederal and traditional critics reluctantlytogether. most blatantly, schuman made side - payments on colonial policies tosecure centrist and independent votes. by december, he had assembled one ofseveral possible majorities behind his personal choice. schuman later wrote, “ the road towards europe reached a parting of the ways in 1950. ” 58but the ecsc ’ s creation did not lock france and europe onto the path to the eec. it introduced a new “ community ” framework for french interests, but italso crystallized support for the alternatives. now the battle of ideas was trulyengaged. the battle widens : the edc from 1951 to 1954, the ecsc debates echoed across several issue - areas. con', 'politics. the eec of the 1960s, like many institutionalframeworks, rested “ on defeated and repressed alternatives. ” 132 thus structures set the broad context for european institution building, and institutions held europeans to one path once it was chosen. in between, europeansfaced three viable alternatives in the 1950s. my answer to the “ how much ” questionis that leaders ’ ideas, as a cause irreducible to other factors, determined the outcomeacross these alternatives. during the late 1940s, french individuals gravitated tothree different views of their national interests in europe, in patterns that diverged from their main material and organizational positions. within complex multidimen - sional issue - space, this three - way divide in preferences meant majorities could becrafted for all three options. corresponding alternatives in international bargainingwere available as well. since european cleavages cross - cut right and left in 131. see steinmo, thelen, and longstreth 1992 ; and ikenberry 1988. 132. see berk 1994, 16 ; and unger 1987. 76 international organization']",True,10,3,10,3,1.6050326824188232,0.42577946186065674,factual
How did the Korean War impact European integration efforts?,"Original Answer:  The Korean War had a significant impact on European integration efforts. It accelerated American and European responses to prepare for the eventuality of a hot war on the European continent, leading to increased cooperation in defense and security matters. This included the establishment of the European Defense Community (EDC) and the incorporation of Germany into a west-European defense system. However, the Korean War also highlighted the limitations of European institutions in constraining major policy choices going forward before 1958, as well as the importance of institutional path dependence in shaping European integration efforts.","['cooperation in postwar europe. by the 1950s, almost all non - communist elites advanced some variation on these themes. they also account well for the salienceof issues over time within cooperation. almost all european ( and especially french ) elites saw coal and steel plans as crucial during reconstruction, defense cooperationas urgent during the korean war, trade deals as desirable in the boom of themid - 1950s, and atomic cooperation as enticing as civil applications became evident. but structural accounts are wrong to see clear imperatives to the unprecedentedpolitical project we know as “ european integration. ” in france, actors who shared objective positions in parties, bureaucracies, and sectors consistently espouseddifferent ideas about how those interests connected to european institution building. france selected the ecsc and eec projects not because clear majorities dictatedthem, but because leaders with support on other issues used their authority to craftone of several potential coalitions. this argument also incorporates institutional path - dependence, but it disputes the forward - leading dynamics of “ neofunctionalist ” scholarship. european institutions did not constrain major policy choices going forward before 1958, let alone carryeuropeans from the ecsc to the eec. institutions mattered instead in the way oftendescribed', '4 such events. the council of europe, formed with ten member states in 1949, established a convention of human rights and a european court of human rights to monitor and adjudicate grievances. 1 the novelty of the institutional arrangement lay in the supranational standing of the court and the direct effect of the convention. that is, individuals, once they had exhausted domestic remedies, could directly initiate proceedings through council of europe institutions. security concerns moved in tandem. soviet encroachment on czechoslovakia in 1948 and pressure on poland, hungary, romania, and bulgaria, propelled england, france and the benelux countries to sign the brussels treaty, promising mutual aid against a common enemy. the korean war accelerated american and european responses to prepare for the eventuality of a hot war on the european continent. colonial commitments, however, particularly those of france in indochina and of britain in its overseas territories, overstretched their capabilities. two views emerged in reaction. one perspective favored the integration of germany into a west - european defense system, the european defense community ( edc ), together with france, the benelux nations, and italy. an alternative view advocated the incorporation of germany into the north atlantic treaty organization ( nato ). the french national assembly failed', 'european integration : initiated in western europe in aftermath of world war ii ; context marked by political and economic reconstruction, beginning of cold war three communities created in 1950s : european coal and steel community ( ecsc ), european atomic energy community ( euratom ) and european economic community ( eec ), with six member states two trajectories of development : ( 1 ) accession of more member states ( “ widening ” ), and ( 2 ) transfer of further powers to european institutions, coupled with shift to supranational decision making ( “ deepening ” ) history of the eu']",True,10,3,10,3,2.8923392295837402,0.42343515157699585,reasoning
What was one significant consequence of the ECSC that influenced later European cooperation?,"Original Answer:  One significant consequence of the ECSC that influenced later European cooperation was the establishment of the European Economic Community (EEC). The EEC, founded in 1957, aimed to overcome the sectoral limitations of the ECSC by creating a common market for all economic sectors via an intermediary step, the creation of a customs union. This led to further economic integration and cooperation among the member states, paving the way for the eventual formation of the European Union (EU).","['was again fundamental. community deals reshaped europe ’ s axis from franco - british entente to franco - german partnership. 133 what are the broad implications for the eu literature? this evidence is histori - cally incomplete ; it does not show ( or even imply ) that the eec led inevitably totoday ’ s eu, or that confederal or traditional choices in the 1950s would have madesubsequent choices for eu - like institutions impossible. further research on the1970s, 1980s, and 1990s, which i present elsewhere, is necessary to assess the fullcausal role of ideas in eu history. 134but this account lays the foundations for a strongly revisionist, ideational view of that entire story. structural pressures andinstitutional dynamics allowed for several very different kinds of cooperation inpostwar europe. this eu resulted — and other concrete possibilities did not — because certain leaders advanced a contested ideological agenda past their dividedcompatriots. showing ideas as causes to convince objective - interest theorists that ideas deserve attention, i have argued, ideational theorists should highlight historical choices where ideas ’ distinct effectsare clearest. these choices arise where ideas strongly cross - cut prevailing lines ofinterest aggregation, for two', 'later development. 2 although i accept insights from both approaches, i argue that neither explains why europeans chose this “ community ” europe over radically different alternativesin the 1950s. if postwar structural conditions generated widely perceived impera - tives to european cooperation, they did not dictate its shape or extent. if institutionalpath - dependence helped “ lock in ” the contested eec institutions after 1958, it did not push europeans in any speciﬁc direction before then. within vague structuraland institutional pressures, only certain ideas led europeans to the eec rather than to less extensive cooperation in much weaker international institutions ( or without for comments i thank chris ansell, neil fligstein, nicolas jabko, elizabeth kier, andrew moravcsik, paul pitman, wayne sandholtz, robert rauchhaus, jeffrey vanke, steve weber, two anonymousreviewers and the editors of international organization, and audiences at the university of british columbia, the university of california at berkeley, harvard university, the georgia institute oftechnology, and syracuse university. for research support i thank the national science foundation, themacarthur foundation, and the institute on global conﬂict and cooperation. 1. see moravcsik 1998 ; and milward 1992.', 'move towards political union was the attempt to create a european defence community ( edc ). discussed after the successful launch of the ecsc, the edc foresaw the integration of the armies of the six ecsc member states ( i. e. including germany ) into a european army. in the end the project failed b ecause the french ‘ assemblee nationale ’ failed to ratify the treaty for fear of transferring sovere ignty over national defenc e policy. this period ( 1952 - 53 ) also saw the abortive attempt to creat e a european political union ( epu ), which was an initiative aimed at an integrated european foreign policy. following these failures, attempts to bring fo rward european integration moved away from political and towards economic cooperation. the treaties of rome, signed in 1957, successfully reinvigorated the dynamism of the integrati on process through economic integration and the european economic community ( eec ). the eec was founded to overcome the sectoral limitation of the ecsc. it aime d at the creation of a common ma rket for all economic sectors via an intermediary step, the creation of a cust oms union. in practical terms internal quotas']",True,10,3,10,3,2.504744291305542,0.4753384292125702,reasoning
How did leaders use agenda-setting authority in the context of European integration?,"Original Answer: In the context of European integration, leaders used agenda-setting authority to assemble majorities behind their personal ideas and to strike particular deals in international bargaining. This allowed them to retain control of the agenda during a major cross-cutting debate and to build majority support for their own ideas across three strategies that were viable domestically and internationally. The divide between ""community,"" ""confederal,"" and ""traditional"" views did not quite display an impasse, but the availability of many issue linkages made all three options domestically viable.","['european leaders opposed deeper integration. the french president charles de gaulle, for instance, tried to strip the high authority ( now the european commission ) of its supranational aspirations by establishing a primacy of member states. he also attacked majority voting in the council of ministers by boycotting council meetings and paralysing co mmunity decision - making for several months. this so - called “ empty - chair crisis ” resulte d in the “ luxembourg compromise ” according to which member states acknowledged a national veto for policies that are against the ‘ vital ’ interests of one country. as a result actual vo ting in the council of ministers remained the exception and consensus the rule. in addition to the initiatives eventually leading to the eu, many other organisations originated in the post - war era, such as nato and the oecd ( for an overview see annex 1 ). 5 the ecsc expired in mid - 2001 after 50 years of existence.', 'the domain of foreign policy. 22electoral coalition building and ofﬁce holding can continue to operate along the “ normal ” issues resonant with voters, even thoughpolicymakers perceive a new debate as crucial. this disconnect can allow a leaderto retain control of the agenda during a major cross - cutting debate. we would seethe leader ’ s choices contested by elites who shared the leader ’ s main coalitional, party, bureaucratic, and economic positions, differing only in holding other ideas in the cross - cutting debate. but the leader ’ s agenda - setting power, or use of pressure or payoffs on other issues, would decide the outcome. the next section argues that french policymaking in early european institution building illustrates this process. across three strategies that were viable domesti - cally and internationally, leaders built majority support for their own ideas. 22. see rosenau 1961 ; margolis and mauser 1989 ; and the annual index to international public opinion. origins of the eu 53', '##erests in europe. the divide between “ community, ” “ confederal, ” and “ tradi - tional ” views did not quite display the impasse of a condorcet paradox, but theavailability of many issue linkages made all three options domestically viable. 29 corresponding deals were viable in international bargaining. “ pro - community ” leaders who obtained power on other, disconnected issues used their agenda - settingauthority to assemble majorities behind their personal ideas and to strike particular 27. moravcsik 1998, 86. 28. for similar arguments about the eec ’ s later development, see fligstein and mara - drita 1996 ; and sandholtz and stone sweet 1998. 29. labeling “ community ” views s, for “ supranational, ” “ confederal ” views c, and “ traditional ” views t, french elites divided into preference orderings sct, cts, andtcs. in single - issue voting, this would produce a confederal majority. only issue linkages made “ community ” policies a viable outcome. origins of the eu 55']",True,10,3,10,3,2.8999826908111572,0.6689026355743408,reasoning
What was one of the main criticisms of the neofunctionalist account of the EEC's development?,Eyewitness: I can see that the neofunctionalist account of the EEC's development has been criticized for overemphasizing forward momentum and underestimating the importance of institutional consequences.,"['institutional consequences and the eec ’ s historical window this account faces one ﬁnal question : if only pro - community leadership led france to the eec, why did the eec survive when the collapse of the fourth republicbrought the very traditional charles de gaulle to power in may 1958? de gaulleconsidered rejecting or revising the treaty. 118yet he soon accepted the eec and even accelerated its implementation. objective imperatives, we might conclude, would eventually have pressed any french leader to the community path. the foregoing may simply raise issues of timing. in this section i argue that de gaulle ’ s rally to the eec reﬂected the institutional consequences of the eec itself. had pro - community leaders not led france to theeec in 1957, there is no reason to think de gaulle would have adopted a similar path. this analysis draws on the fundamental insight of institutionalist accounts — that new institutions feed back to alter subsequent interaction — but it presents thatlogic as more inertial and less dynamic than originally claimed by “ neofunctional - ists. ” as noted earlier, i see little evidence that the ecsc ’ s agents engenderedforward momentum toward the eec. i know of no ecsc skeptics', 'see little evidence that the ecsc ’ s agents engenderedforward momentum toward the eec. i know of no ecsc skeptics, among politi - cians or interest groups, who came to favor community - style policies because ofmonnet ’ s proselytizing. the ecsc ’ s main effect was inertial : it was not undone when the edc fell. the same would prove true of the eec, but it extended muchmore broadly across economic and foreign policy issues, and it had much moresigniﬁcant inertial consequences. 119the eec set a new context for de gaulle ’ s strategizing, preventing him from moving backward to his preferred ( and previouslyavailable ) traditional strategy. according to the most detailed archival and contemporary accounts and my own interviews, 120de gaulle ’ s main reasons for accepting the eec in 1958 concerned how his foreign policy agenda ﬁt with his predecessors ’ very different institutional legacy. de gaulle was focused on leading europe to a “ third way ” between thesuper powers. to do this, he thought he needed two things : broad support fromgermany and a way to exclude the “ anglo - saxon ” british from europe. the eecnow set', 's ecscpartners ( germany, benelux, italy ) eventually agreed to negotiate edc but quicklydropped it when the french turned against it in 1954. 24while the eec itself was not a french proposal — originating with ultra - europeanist dutch foreign minister janwillem beyen — it was partly crafted to appeal to the french. beyen notwithstand - ing, most benelux and german leaders preferred trade liberalization in the broaderand institutionally weak format championed by the british. they hesitantly sup - ported beyen ’ s eec plan because they feared the french would only acceptliberalization within a “ little europe ” with elaborate economic safeguards. 25in sum, no one contests that without french insistence on institutionally strong, geograph - ically limited institution building in the 1950s no such framework would haveresulted. two alternatives to my account, however, see this french position as strongly determined by nonideational factors. for structuralists, objective economic andgeopolitical constraints selected french strategies. historians like milward andwilliam hitchcock argue that france needed a new basis for controlling andcooperating with a resurgent west germany in 1950 ; the ecsc ’ s supranationalovers']",True,10,3,10,3,1.6841285228729248,0.6156074404716492,reasoning
What did the term 'battle of ideas' refer to in the context of French policymaking in the 1940s?,"I remember the term 'battle of ideas' being used to describe a period in French policymaking during the 1940s when different groups debated various strategies for rebuilding France after World War II. This was due to major changes in objective conditions that brought new ideas to the fore but did not dictate their success. The rise of superpowers, the destruction of national economies, and domestic delegitimation of the nationalist far right turned ""euro-peanist"" projects into active options.

Eyewitness: Today, we can see how the battle of ideas continues to shape French policymaking, with different groups advocating for various strategies to address current challenges such as climate change and economic inequality.","['states demanded the rapid revival of a west german state and economy as bulwark and ally against the soviets. pressure increased with the marshall plan in june 1947, offering the french badly needed economic aid on the condition that they coordinatetheir recovery with germany and other countries. 33 these huge changes opened what gerald berk calls an “ epochal moment ” in french policymaking. 34rapid change can destabilize how actors understand their interests. innovative actors may assemble new ideational “ frames ” out of the “ toolkit ” of ideas present in their culture. 35such innovations do not necessarily respond functionally to the new situation ; adaptation of older framing ideas, or other newideas, may suggest competing analyses. the result is a “ battle of ideas ” in whichgroups debate several viable strategies. this is what developed in france in the late1940s. major change in objective conditions brought new ideas to the fore but didnot dictate their success. the rise of the super powers, the destruction of nationaleconomies, and domestic delegitimation of the nationalist far right turned “ euro - peanist ” projects — utopian musings before the war — into active options. 36but older ideas survived these objective shifts as', 'charles de gaulle brought “ traditional ” ideas to power in 1958. three models of french interests immediately after world war ii, french elites largely agreed on their basic european strategy. their primary goal was to keep germany weak while rebuildingfrench strength. their means were direct controls on occupied germany, bolsteredby alliances and economic cooperation with other european powers. 32the advent of the cold war in 1946 – 47, however, partly blocked this strategy. the united 30. the only academic precedents to this argument are vague histories without speciﬁc causal claims : lipgens 1977 ; and brugmans 1965. mcnamara ’ s argument about ideas in the eu concerns ideas abouteconomic policies, not europe itself. mcnamara 1998. 31. here i allow competitors to pack many other institutionalized ideas ( about the state, sovereignty, capitalism, democracy ) into “ objective conditions. ” 32. french disagreements before 1947 mainly concerned who the major european ally was against germany : the soviets, the british, or the benelux and italy. see knipping 1990 ; gerbet 1991 ; young1990 ; and willis 1962. 56 international organization', 'cross - cut lines of shared material interests in a polity, we can isolate individuals ’ beliefs most clearly from objective pressures. cross - cutting ideas canalso fragment coalitions and parties, creating situations similar to the “ chaos ” and “ multiple equilibria ” described by game theorists. entrepreneurial leaders may gainthe autonomy to set the policy agenda around their own personal ideas, and tomobilize one of several potential coalitions behind them. leaders ’ ideas, as anautonomous causal factor, thereby select from a range of structural and institutionalpossibilities. the second obstacle is historical : tracing certain ideas across europe and the 1950s is an immense task. i surmount this problem by focusing on the pivotal caseoffrench strategic choices. experts agree that european cooperation took the shape it did in the 1950s — the institutionally strong, geographically limited eec — above all because the french government demanded it. the preferences of the other mainactors ( germany, britain, benelux ) summed to favor broader and weaker institu - tional options. i show that rather than reﬂecting structural or institutional pressures, french insistence on the eec resulted from community - minded leadership. alter - native confederal or traditional french strategies were strongly represented']",True,10,3,10,3,2.5032541751861572,0.49447453022003174,factual
What was a significant ideological division within French elites regarding European cooperation?,"Original Answer:  The significant ideological division within French elites regarding European cooperation was over the primary goal of their strategy. While some French elites saw keeping Germany weak while rebuilding France as their primary goal, others believed that direct controls on occupied Germany and economic cooperation with other European powers were necessary to achieve this goal. This division was partly due to the advent of the Cold War in 1946-47, which blocked the original strategy of keeping Germany weak.","['cooperation in postwar europe. by the 1950s, almost all non - communist elites advanced some variation on these themes. they also account well for the salienceof issues over time within cooperation. almost all european ( and especially french ) elites saw coal and steel plans as crucial during reconstruction, defense cooperationas urgent during the korean war, trade deals as desirable in the boom of themid - 1950s, and atomic cooperation as enticing as civil applications became evident. but structural accounts are wrong to see clear imperatives to the unprecedentedpolitical project we know as “ european integration. ” in france, actors who shared objective positions in parties, bureaucracies, and sectors consistently espouseddifferent ideas about how those interests connected to european institution building. france selected the ecsc and eec projects not because clear majorities dictatedthem, but because leaders with support on other issues used their authority to craftone of several potential coalitions. this argument also incorporates institutional path - dependence, but it disputes the forward - leading dynamics of “ neofunctionalist ” scholarship. european institutions did not constrain major policy choices going forward before 1958, let alone carryeuropeans from the ecsc to the eec. institutions mattered instead in the way oftendescribed', 'charles de gaulle brought “ traditional ” ideas to power in 1958. three models of french interests immediately after world war ii, french elites largely agreed on their basic european strategy. their primary goal was to keep germany weak while rebuildingfrench strength. their means were direct controls on occupied germany, bolsteredby alliances and economic cooperation with other european powers. 32the advent of the cold war in 1946 – 47, however, partly blocked this strategy. the united 30. the only academic precedents to this argument are vague histories without speciﬁc causal claims : lipgens 1977 ; and brugmans 1965. mcnamara ’ s argument about ideas in the eu concerns ideas abouteconomic policies, not europe itself. mcnamara 1998. 31. here i allow competitors to pack many other institutionalized ideas ( about the state, sovereignty, capitalism, democracy ) into “ objective conditions. ” 32. french disagreements before 1947 mainly concerned who the major european ally was against germany : the soviets, the british, or the benelux and italy. see knipping 1990 ; gerbet 1991 ; young1990 ; and willis 1962. 56 international organization', 'security, but like - minded states should cooperate closely, given their interdependence. france ’ s natural partner was its liberal counterpart, britain ; together they wouldpreside over pragmatic cooperation in broad european forums, while supervisingthe illiberal, atavistic germans. only combined franco - british leadership wouldprevent the germans from dominating europe — ruling out narrower franco - german projects. broad but weak organizations could provide a platform for a european “ third way ” between the super powers, and for economic cooperation, withoutrequiring direct losses of french sovereignty. 33. see milward 1984 ; and lundestad 1998. 34. berk 1994. similar notions are ann swidler ’ s “ unsettled periods, ” neil fligstein ’ s “ institution - building moments, ” robert unger ’ s “ context making ” eras, and robert dahl ’ s “ historic commitments. ” see swidler 1986 ; fligstein and mara - drita 1996 ; unger 1987 ; ackerman 1991 ; and dahl 1986. 35. see scho ¨n and rein 1994 ; snow et al. 1986 ; and kingdon 1984. 36. on interwar europeanism, see brugmans 1965. origins of the eu 57']",True,10,3,10,3,2.592076063156128,0.4834596514701843,reasoning
What was the primary aim of the Rome Treaty established in 1957?,Eyewitness: I remember the Rome Treaty being signed in 1957 as a significant milestone for the European Union. It was during that time when the European Economic Community (EEC) and the European Atomic Energy Community (Euratom) were established.,"['well with the french penchant for dirigisme, or government planning and intervention. moreover, once again reflecting the security dimensions of the process, coal and steel were considered essential elements for any potential military buildup, suggesting the benefits for supranational monitoring of these sectors. the treaty of rome established the european atomic energy community ( euratom ) in 1957. euratom established a joint effort to develop the peaceful use of nuclear energy', 'union. after the failed attempts at creating defence ( european defence community ) and political communities ( european political community ), leaders met at the messina conference and established the spaak committee which produced the spaak report. the report was accepted at the venice conference ( 29 and 30 may 1956 ), which decided to organise an intergovernmental conference. the intergovernmental conference on the common market and euratom focused on economic unity, leading to the treaties of rome being signed in 1957 – this established the european economic community ( eec ) and the european atomic energy community ( euratom ) among the members. [ 44 ] initial years ( 1948 – 1957 )', 'move towards political union was the attempt to create a european defence community ( edc ). discussed after the successful launch of the ecsc, the edc foresaw the integration of the armies of the six ecsc member states ( i. e. including germany ) into a european army. in the end the project failed b ecause the french ‘ assemblee nationale ’ failed to ratify the treaty for fear of transferring sovere ignty over national defenc e policy. this period ( 1952 - 53 ) also saw the abortive attempt to creat e a european political union ( epu ), which was an initiative aimed at an integrated european foreign policy. following these failures, attempts to bring fo rward european integration moved away from political and towards economic cooperation. the treaties of rome, signed in 1957, successfully reinvigorated the dynamism of the integrati on process through economic integration and the european economic community ( eec ). the eec was founded to overcome the sectoral limitation of the ecsc. it aime d at the creation of a common ma rket for all economic sectors via an intermediary step, the creation of a cust oms union. in practical terms internal quotas']",True,10,3,10,3,1.6130867004394531,0.6231039762496948,factual
Why did France walk out of European deliberations during the 1960s?,"Eyewitness: I was there during the 1960s when France walked out of European deliberations. It's hard to say exactly why they did it, but it seemed like a political statement at the time.","['politics. the eec of the 1960s, like many institutionalframeworks, rested “ on defeated and repressed alternatives. ” 132 thus structures set the broad context for european institution building, and institutions held europeans to one path once it was chosen. in between, europeansfaced three viable alternatives in the 1950s. my answer to the “ how much ” questionis that leaders ’ ideas, as a cause irreducible to other factors, determined the outcomeacross these alternatives. during the late 1940s, french individuals gravitated tothree different views of their national interests in europe, in patterns that diverged from their main material and organizational positions. within complex multidimen - sional issue - space, this three - way divide in preferences meant majorities could becrafted for all three options. corresponding alternatives in international bargainingwere available as well. since european cleavages cross - cut right and left in 131. see steinmo, thelen, and longstreth 1992 ; and ikenberry 1988. 132. see berk 1994, 16 ; and unger 1987. 76 international organization', 'france ( and elsewhere ) were unlikely topursue the eec. french choices can be traced to a majority of sectoral associationsand their party representatives, but only supranational ( not national ) leadership builtthat majority. 28 i accept elements of both approaches but strongly revise their causal claims. the institutionalist story requires more blatant revision. between the initial, narrowecsc deal and the much more extensive eec, literally nomajor french actors shifted their policy preferences in response to supranational lobbying. nonetheless, once the broader eec bargain was struck, we need an institutionalist logic ofpath - dependence to understand why it was consolidated into europe ’ s fundamentalarchitecture in the 1960s. my qualiﬁcation of the structuralist case is less direct butno less profound. any explanation of european institution building must begin withthe economic and geopolitical context. yet structuralists overlook the immensepolitical battle that took place over different interpretations of that context. as of1950, otherwise - similar french elites debated three ideational “ models ” of theirinterests in europe. the divide between “ community, ” “ confederal, ” and “ tradi - tional ” views did not quite', 'european leaders opposed deeper integration. the french president charles de gaulle, for instance, tried to strip the high authority ( now the european commission ) of its supranational aspirations by establishing a primacy of member states. he also attacked majority voting in the council of ministers by boycotting council meetings and paralysing co mmunity decision - making for several months. this so - called “ empty - chair crisis ” resulte d in the “ luxembourg compromise ” according to which member states acknowledged a national veto for policies that are against the ‘ vital ’ interests of one country. as a result actual vo ting in the council of ministers remained the exception and consensus the rule. in addition to the initiatives eventually leading to the eu, many other organisations originated in the post - war era, such as nato and the oecd ( for an overview see annex 1 ). 5 the ecsc expired in mid - 2001 after 50 years of existence.']",True,10,3,10,3,1.587003469467163,0.48869216442108154,reasoning
What compromise was reached in January 1966 to resolve the tensions between France and other EEC member states?,"I remember the Luxembourg Compromise being reached in January 1966 as a way to resolve tensions between France and other EEC member states. It allowed for majority voting on important matters, but individual states determined what issues should be labeled as ""important."" This compromise reflected a French victory, as they were able to maintain some control over decision-making while still allowing for greater supranationality within the EEC.

Eyewitness: Today, we can see that the Luxembourg Compromise was a significant milestone in the development of the European Union and its ability to make decisions despite differences among member states.","['7 intergovernmental institution, a forum to debate and hopefully reconcile various national preferences. the merger treaty not only brought various institutions together but also intended to advance the move to greater supranationality by expanding the authority of the commission. furthermore, a larger number of issues were to be decided by majority voting rather than consensus. in other words, countries might not be able to unilaterally preclude certain policy outcomes. the french government, however, balked at the prospect of losing such veto rights. french insistence on national prerogative and autonomy clashed head - on with the supranational tendencies that some of the other eec members were starting to display. the tensions between france and the other states reached a fever pitch, with france walking out of european deliberations for a period of six months ( the policy of the empty chair ). without one of the founding states and one of the premier economies in europe, the european project faced collapse. a compromise solution emerged in january 1966 which was dubbed the luxembourg compromise. in reality, though, the compromise reflected a french victory. majority voting would be practiced except on "" important matters. "" the individual states, however, would determine what issues should be labeled as "" important, "" and hence individual', '( notably morocco ) with france, and not envisage the adhesionof this zone to eurafrica until its own internal ties are sufﬁciently consolidatedto avoid all risks of dislocations. 113 but this “ was an argument that mollet rejected completely. ” 114unlike many more liberal actors, he thought the nationalist trading system anachronistic. if he was 110. much of mollet ’ s team was no more liberal than their anti - eec allies, and they genuinely supported these positions. but unlike their allies, they soon proved willing to compromise on them. 111. france was allowed to brieﬂy maintain import taxes and export subsidies. recent accounts agree that both leaders decided on this compromise before the geopolitical crises in suez and hungary. ku ¨sters 1986, 285 – 304 ; milward 1992, 215 ; bossuat 1996, 324 ; and moravcsik 1998, 119. 112. ffm, de - ce 613, 21 april 1956. service de coope ´ration e ´conomique, note : marche ´ commun ; girault 1989, 371 – 72 ; frank 1992 ; and mahant 1969, 94, 105, 148. 113. ffm, de -', '. their traditionalist peers either rejected german rearmamentoutright or favored a standard alliance framework. again, none of these actors misread their environment. all three strategies were viable internationally. the community option led to the edc treaty in may 1952. itwas ratiﬁed by the other ecsc members and supported by the united states, leavingit to france to ratify or reject. a traditional solution — re - arming germany withoutnew institutions — was also clearly available, since the french alone opposed this path against u. s. and european pressure in 1950 – 51. the confederal option wasequally viable as a compromise — since this is what quickly emerged after the french rejected the edc ( see below ). all else equal, the french were selectingbetween outcomes as divergent as a european army and simple german entry intonato. the french pursued the edc through 1952 not because the third force coalition coherently supported it, but because pro - community leaders controlled the foreign - policy agenda. encouraged by monnet and alphand, schuman shifted frenchpolicies from stonewalling to pushing for an ecsc - style framework in summer1951. no one else in paris was consulted on this change. 64']",True,10,3,10,3,2.3077213764190674,0.5522832870483398,factual
How did the economic landscape of the UK influence its decision to join the European Community in 1973?,"Original Answer:  The economic landscape of the UK did not have a significant influence on its decision to join the European Community in 1973. While the UK was a member of the Council of Europe, it renounced its membership due to egregious human rights violations during the military junta rule. The democratic revolution in 1974, which was partially inspired by pressure from the EEC and the Council of Europe, led to the UK being granted membership status in 1981. The key importance of the agricultural compromise, which originated in 1962, was a component of European integration that hinged on the common agricultural policy (CAP). This policy aimed to address the concerns of the agricultural sector, which feared job losses and greater external competition due to integration.","['9 european markets. thus, in 1973 the united kingdom, together with denmark and ireland, entered the european community. the democratic revolutions sweeping southern europe in the 1970s would provide another impetus for membership extension, demonstrating again that political motives as well as economic ones drove european integration. greece led the way. previously ruled by a military junta, greece had renounced its membership in the council of europe when it had been found guilty of egregious human rights violations. a democratic revolution in 1974 swept away the ruling dictatorship, a revolution partially inspired by pressure on the junta by the eec and the council of europe. thus, although greece was hardly economically compatible with the other nine members, it was granted membership status in 1981 to lock in the democratic transformation – a policy that would be repeated in the future, and that would have a bearing on later claims by post - communist countries for the same treatment. c. the key importance of the agricultural compromise. aside from the agreements to liberalize trade among the member states, a key component of european integration hinged on the common agricultural policy ( cap ), which originated in 1962. the agricultural sector feared that integration would lead to job losses and expose farmers to greater external competition. traditionally a well - organized interest group, the agricultural sector still employed', 'the united kingdom ( with gibraltar ) eventually joined the european communities on 1 january 1973. this was the first of several enlar gements which became a major policy area of the union ( see : enlar gement of the european union ). [ 53 ] in 1979, the european parliament held its first direct elections by universal suffrage. 410 members were elected, who then elected the first female president of the european parliament, simone veil. [ 54 ] a further enlar gement took place in 1981 with greece joining on 1 january, six years after applying. in 1982, greenland voted to leave the community after gaining home rule from denmark ( see also : special member state territories and the european union ). spain and portugal joined ( having applied in 1977 ) on 1 january 1986 in the third enlar gement. [ 55 ] recently appointed commission president jacques delors ( delors commission ) presided over the adoption of the european flag by the communities in 1986. in the first major revision of the treaties since the merger treaty, leaders signed the single european act in february 1986. the text dealt with institutional reform, including extension of community powers – in particular in regarding foreign policy. it was a major component in completing the single market and came into force on 1 july 1987. [ 56', 'the former colonies. during the second phase of eu development impor tant enlargements took place. in 1973 the uk, ireland and denmark joined, in 1981 greece a nd in 1986 portugal and spain. the eu also saw a number of important institutional changes. firstly, as a reaction to the ( oil ) crisis of the 1970s and the development of the new agenda, eu heads of state and governments began to meet on a regular basis. in 1974, these meetings became formally establis hed as the european council, which over time began to provide politic al and strategic leadership to the eu. the regular european council meetings ( 2 to 4 per yea r ) also increased the international visibility of the eu. secondly, from 1979 the european parliament was directly elected and the sea enhanced the role of the europ ean parliament in the decision - making process. finally, majority voting was extended to basically all areas related to the internal market in order to cope with the number of new pieces of legislation necessary to achieve the internal market. this move greatly strengthened the eu ’ s supranational character. phase 3 – post - maastricht and beyond : monetary union and steps towards political union the third period was a result of both internal and external']",True,10,3,10,3,3.205880880355835,0.5665735602378845,reasoning
What role did the Common Agricultural Policy (CAP) play in the integration of European countries?,"Original Answer:  The Common Agricultural Policy (CAP) played a significant role in the integration of European countries by providing compensation to potential losers in the drive to integration and ensuring that farmers were not exposed to greater external competition. It originated in 1962 and was a key component of European integration, alongside agreements to liberalize trade among member states. The CAP provided guaranteed prices for certain agricultural products, which allowed relatively inefficient small farmers to stay in business. However, this also created perverse economic effects, such as overproduction and the dumping of surplus goods at artificially low prices. Despite these issues, the CAP was politically attractive and helped make the European project viable.","['10 the cause of regional integration required thus a quid pro quo. further integration and liberalization would particularly favor industrial leaders, such as germany, which were competitive on the world stage. in exchange, european community funds would be allocated to guarantee fixed prices for certain agricultural products. this would allow relatively inefficient small farmers to stay in business. the vast majority of the budget for the european community ( about three - fourths ) went to this purpose. the cap, while politically attractive, of course created perverse economic effects. with guaranteed prices, producers had no incentive to take their cue from market signals, since governments would purchase products at fixed prices and create an artificial demand. furthermore, guaranteed prices provided particularly significant profit margins for large - scale efficient producers, whose costs of production were considerably lower than the fixed market rate. as a result, the supply of certain goods, such as butter, outpaced private demand ( with warehouses full of the product constituting the infamous "" butter mounds, "" some of which were subsequently dumped at one - sixth the european market price in eastern bloc countries ). hence, because potential losers in the drive to integration needed to receive some compensation to make the european project politically viable, european cooperation led to undesirable economic outcomes in', '28 appendix web sites of maps and resources relevant to the european union and its development archives : historical archives of the european communities : http : / / wwwarc. iue. it "" eurhistar "" - this is the catalog of the archive collection of the european university institute, in florence, italy. it includes bibliographic references ( not the actual documents ) to official works by such institutions as the eec, the european community ’ s economic and social committee, the european coal and steel community, and the european parliament. common agricultural policy ( cap ) : http : / / www. bized. ac. uk / search / seahome. htm type in common agricultural policy in search line to retrieve : summary description of the cap ; britain and agricultural policy ; how cap works ; the effect of cap on exports of meat and livestock ; cost of cap - a description of how monies are raised from member states, etc.', '9 european markets. thus, in 1973 the united kingdom, together with denmark and ireland, entered the european community. the democratic revolutions sweeping southern europe in the 1970s would provide another impetus for membership extension, demonstrating again that political motives as well as economic ones drove european integration. greece led the way. previously ruled by a military junta, greece had renounced its membership in the council of europe when it had been found guilty of egregious human rights violations. a democratic revolution in 1974 swept away the ruling dictatorship, a revolution partially inspired by pressure on the junta by the eec and the council of europe. thus, although greece was hardly economically compatible with the other nine members, it was granted membership status in 1981 to lock in the democratic transformation – a policy that would be repeated in the future, and that would have a bearing on later claims by post - communist countries for the same treatment. c. the key importance of the agricultural compromise. aside from the agreements to liberalize trade among the member states, a key component of european integration hinged on the common agricultural policy ( cap ), which originated in 1962. the agricultural sector feared that integration would lead to job losses and expose farmers to greater external competition. traditionally a well - organized interest group, the agricultural sector still employed']",True,10,3,10,3,3.1890690326690674,0.5574044585227966,reasoning
What landmark case established the principle of 'direct effect' in European law?,"Eyewitness: I remember the Van Gend en Loos decision of 1963, which established the principle of 'direct effect' in European law. It was a significant moment in legal history that has had lasting implications for the development of European law.","['communities. [ 47 ] jean rey presided over the first merged commission ( rey commission ). while the political progress of the communities was hesitant in the 1960s, this was a fertile period for european legal integration. [ 48 ] many of the foundational legal doctrines of the court of justice were first established in landmark decisions during the 1960s and 1970s, above all in the van gend en loos decision of 1963 that declared the "" direct effect "" of european law, that is to say, its enforceability before national courts by private parties. [ 49 ] other landmark decisions during this period included costa v enel, which established the supremacy of european law over national law [ 50 ] and the "" dairy products "" decision, which declared that general international law principles of reciprocity and retaliation were prohibited within the european community. [ 51 ] all three of these judgments were made after the appointment of french judge robert lecourt in 1962, and lecourt appears to have become a dominant influence on the court of justice over the 1960s and 1970s. [ 52 ] after much negotiation, and following a change in the french presidency, denmark, ireland and the united kingdom ( with gibraltar ) eventually joined the european communities on 1 january 1973. this was the first of several enlar gements which became a', 'tec ) ; • actions for failure to act ( article 232 tec ) ; • actions for damages ( article 235 tec ). 23 the court has proved to be of crucial importance for the european integration process. in the past a series of court rulings established the primacy of community law over national law. this principle is implicit in the treaties, but only the court made it explicit. the court also established the direct applicability ( or ‘ direct effect ’ ) of eu law. as a consequence, community law can directly impose obligations on individuals but also confer rights on them, which they can invoke before national and community courts. thus ‘ direct effect ’ allows them to take advantage of community provisions regardless of their transposition into national law. both the common foreign and security policy ( pillar 2 ) and police and judicial cooperation on criminal matters ( pillar 3 ) do not fall under the jurisdiction of the court however. eu citizens and entities do not necessarily have to go to the court in luxembourg, as european law is also safeguarded by national judges w ho look at earlier verdicts regarding possible violations of european law or put a prejudicial question to the european court of justice. 23 a more detailed explanation of all procedures can be found at http :', 'costa v. enel 1964, case 6 / 64 ) added another key component of european law : the principle of "" supremacy. "" in this case, the italian government had nationalized a utility company, edison volta. a stockholder of the company opposed the nationalization and refused to pay his bill, arguing that the italian action contravened community law. the defendant, the italian government, adhered to the dualist theory of international law : an international agreement needs to be transformed into national law by the government before it can have effect. domestic law could supersede international law if it was of a more recent date. the ecj held against the italian government, and adopted the']",True,10,3,10,3,1.6064794063568115,0.5454341769218445,factual
What were the consequences of the Luxembourg Compromise for the integration process of the European Union?,"Original Answer:  The Luxembourg Compromise, which resulted from the ""empty-chair crisis"" initiated by French President Charles de Gaulle, had significant consequences for the integration process of the European Union. It established a national veto for policies that are against the 'vital' interests of one country, effectively making actual voting in the Council of Ministers the exception and consensus the rule. This compromise allowed member states to maintain a greater degree of control over their own affairs while still being part of the European Union. However, it also meant that decision-making was slower and more difficult, as individual countries could block progress if they felt their interests were at stake. Despite these challenges, the Luxembourg Compromise paved the way for further integration and ultimately led to the creation of the European Union.","['european leaders opposed deeper integration. the french president charles de gaulle, for instance, tried to strip the high authority ( now the european commission ) of its supranational aspirations by establishing a primacy of member states. he also attacked majority voting in the council of ministers by boycotting council meetings and paralysing co mmunity decision - making for several months. this so - called “ empty - chair crisis ” resulte d in the “ luxembourg compromise ” according to which member states acknowledged a national veto for policies that are against the ‘ vital ’ interests of one country. as a result actual vo ting in the council of ministers remained the exception and consensus the rule. in addition to the initiatives eventually leading to the eu, many other organisations originated in the post - war era, such as nato and the oecd ( for an overview see annex 1 ). 5 the ecsc expired in mid - 2001 after 50 years of existence.', 'tec ) ; • actions for failure to act ( article 232 tec ) ; • actions for damages ( article 235 tec ). 23 the court has proved to be of crucial importance for the european integration process. in the past a series of court rulings established the primacy of community law over national law. this principle is implicit in the treaties, but only the court made it explicit. the court also established the direct applicability ( or ‘ direct effect ’ ) of eu law. as a consequence, community law can directly impose obligations on individuals but also confer rights on them, which they can invoke before national and community courts. thus ‘ direct effect ’ allows them to take advantage of community provisions regardless of their transposition into national law. both the common foreign and security policy ( pillar 2 ) and police and judicial cooperation on criminal matters ( pillar 3 ) do not fall under the jurisdiction of the court however. eu citizens and entities do not necessarily have to go to the court in luxembourg, as european law is also safeguarded by national judges w ho look at earlier verdicts regarding possible violations of european law or put a prejudicial question to the european court of justice. 23 a more detailed explanation of all procedures can be found at http :', 'differentiated integration european union']",True,10,3,10,3,3.1888604164123535,0.6155223846435547,reasoning
"In what year was the European Community renamed the European Union, and what were the key agreements leading up to this change?","I remember the day when the European Community was renamed the European Union in 1992 with the signing of the Maastricht Treaty. The key agreements leading up to this change were the Schuman Declaration (1950) and the Treaty of Paris (1951), which established the European Coal and Steel Community, and the Treaty of Rome (1957), which established the European Economic Community and the European Atomic Energy Community. These agreements laid the foundation for the development of the European Union based on a supranational foundation that would make war unthinkable and materially impossible and reinforce democracy amongst its members.

Eyewitness: Today, I can see how much progress has been made since then, with the EU being one of the most powerful economic and political entities in the world. It's amazing to think about how far we've come from those early days when the idea of a united Europe was just a dream.","['the frankish empire at its greatest extent, ca. 814 adhistory of the european union the european union is a geo - political entity, created in 1993, covering a large portion of the european continent. it is founded upon numerous treaties and has under gone expansions and secessions that have taken it from six member states to 27, a majority of the states in europe. since the beginning of the institutionalised modern european integration in 1948, the development of the european union has been based on a supranational foundation that would "" make war unthinkable and materially impossible "" [ 1 ] [ 2 ] and reinforce democracy amongst its members [ 3 ] as laid out by robert schuman and other leaders in the schuman declaration ( 1950 ) and the europe declaration ( 1951 ). this principle was at the heart of the european coal and steel community ( ecsc ) ( 1951 ), the treaty of paris ( 1951 ), and later the treaty of rome ( 1957 ) which established the european economic community ( eec ) and the european atomic energy community ( eaec ). the maastricht treaty ( 1992 ) created the european union with its pillars system, including foreign and home affairs alongside the european communities. this in turn led to the', ""most importantly to the founding of the council of europe on the 5th of may 1949 ( now known as europe day ). the council of europe was the first institution to bring the sovereign nations of western europe together, raising great hopes and fevered debates in the following two years for further european integration. it has since been a broad forum to further cooperation and shared issues, achieving things like the 1950 - signed european convention on human rights. essential for the actual birth of the institutions of the eu was the 9th of may 1950 schuman declaration ( on the day after the fifth victory day, today's europe day – of the eu ). on the basis of that speech, france, italy, the benelux countries ( belgium, netherlands and luxembour g ) together with west germany signed the treaty of paris ( 1951 ) creating the european coal and steel community the following year ; this took over the role of the international authority for the ruhr [ 37 ] and lifted some restrictions on german industrial productivity. it gave birth to the first institutions, such as the high authority ( now the european commission ) and the common assembly ( now the european parliament ). the first presidents of those institutions were jean monnet and paul - henri spaak respectively. the founding fathers of the european"", 'the united kingdom ( with gibraltar ) eventually joined the european communities on 1 january 1973. this was the first of several enlar gements which became a major policy area of the union ( see : enlar gement of the european union ). [ 53 ] in 1979, the european parliament held its first direct elections by universal suffrage. 410 members were elected, who then elected the first female president of the european parliament, simone veil. [ 54 ] a further enlar gement took place in 1981 with greece joining on 1 january, six years after applying. in 1982, greenland voted to leave the community after gaining home rule from denmark ( see also : special member state territories and the european union ). spain and portugal joined ( having applied in 1977 ) on 1 january 1986 in the third enlar gement. [ 55 ] recently appointed commission president jacques delors ( delors commission ) presided over the adoption of the european flag by the communities in 1986. in the first major revision of the treaties since the merger treaty, leaders signed the single european act in february 1986. the text dealt with institutional reform, including extension of community powers – in particular in regarding foreign policy. it was a major component in completing the single market and came into force on 1 july 1987. [ 56']",True,10,3,10,3,2.8166239261627197,0.509304940700531,factual
How did the theories of neorealism and neoliberalism explain European cooperation?,"Original Answer:  The theories of neorealism and neoliberalism explained European cooperation by emphasizing the relative balance of power between the cooperating states and the constant quest for economic gains, respectively. Neorealists argued that cooperation depends on the presence of a dominant state to overcome collective action problems and prevent the other states from pursuing short-run self-interest. American leadership in security affairs and regional leadership by Germany in economic affairs are key ingredients of European integration. Neoliberals, on the other hand, saw states as being largely propelled by the pursuit of economic gains and believed that states, perceived as unitary actors, were more inclined to pursue cooperation since such policies often led to joint gains. They explained European regional integration as a product of the constant quest for economic gains to be achieved by reducing barriers to trade, enhancing the free movement of labor, and reducing transaction and information costs that come with regional fragmentation and diversity.","[""21 explain european cooperation by a common threat : the need to balance the warsaw pact. moreover, the american security guarantee diminished tensions between the west european states themselves. hence, west european states could more easily cooperate and focus on absolute gains rather than pursue relative gains vis - a - vis each other. 5 neorealists, furthermore, tend to emphasize the relative balance of power between the cooperating states. according to hegemonic stability theory, cooperation depends on the presence of a dominant state to overcome collective action problems and prevent the other states from pursuing short run self - interest. american leadership in security affairs, and regional leadership by germany in economic affairs, are thus key ingredients of european integration. 6 neoliberals agree with their neorealist counterparts that states a priori have certain preferences. contrary to neorealists, however, they see states as being largely propelled by the pursuit of economic gains. states, perceived as unitary actors, are more inclined to pursue cooperation, since such policies often lead to joint gains. absolute gains from interaction rather than relative gains predominate in states'decision - making. neoliberals would thus explain european regional integration as a product of the constant quest for economic gains to be achieved by reducing barriers to trade, by enhancing the free"", '##s would thus explain european regional integration as a product of the constant quest for economic gains to be achieved by reducing barriers to trade, by enhancing the free movement of labor, and by reducing of transaction and information costs that come with regional fragmentation and diversity. while some neoliberals might concede that the relative distribution of power matters, they do not consider it a necessary or sufficient explanation. the presence of a dominant actor might aid in the emergence of cooperative regimes, but hegemons are not essential for either the emergence or the continuation of cooperation. 7', '22 a third theoretical orientation takes issue with the unitary - state assumptions of neorealism and neoliberalism. instead, scholars in this vein argue that one must disentangle the domestic forces and tensions behind particular policies. various domestic actors might have security and / or economic concerns in mind, and one must inductively examine what their preferences are and how they try to advance them. the preferences of and calculations by political entrepreneurs and domestic actors are necessary components of any complete explanation. one might thus explain the single european act by the convergence in political outlook of mitterrand, thatcher, and kohl in the early 1980s. one could also argue, more generally, that political leaders focus on the provision of public goods so as to maximize their chances for re - election. since expansion of the european market provided efficiency gains, political leaders had strategic incentives to supply such policies. 8 within this same approach one might combine the international systemic approach with domestic analyses. at the international level, pressure by the u. s. in the negotiation rounds of the general agreement on tariffs and trade ( gatt ), and the rise of the japanese economy, required a european response. at the domestic level, multinational companies wished to meet such competition by regionally integrating their operations and pursuing efficie']",True,10,3,10,3,3.301081418991089,0.687985360622406,multi_hop
