question,answer,contexts,used_reranker,k_init,top_n,num_initial_docs,num_final_docs,runtime_seconds,factuality_score,question_type
What was one major reason for the divergence in French elites' views on European integration?,"Eyewitness: I can see that the French elites' views on European integration have diverged due to their differing perceptions of its potential benefits and risks. While some view it as a means to strengthen France's economic and political power, others see it as a threat to national sovereignty and control over its overseas territories. Additionally, the bureaucrats and deputies among the independents, MRP, radicals, and socialists want to safeguard the French Union against ""Europeanization.""","['for german side - payments in investments and aid forthe french union. if with hindsight such payoffs look clearly beneﬁcial to france, many traditionalists and confederalists actually saw eec ’ s intrusion into colonialrelationships as another reason to oppose it. bureaucrats and deputies among theindependents, mrp, radicals, and socialists wanted to “ safeguard the frenchunion ” against “ europeanization. ” 112not only did liberalization threaten the territories ; even aidfrom other countries would undercut french control. finance ofﬁcials insisted well into the eec negotiations that france ’ s “ natural ally ” wasbritain, and that france should : 1 ) push for european integration in the oeec framework, trying to establish a franco - british common front.... 2 ) not discuss, even in principle, theintegration of the overseas territories of the franc zone before the principlesof european integration are established and have begun to be executed. 3 ) activate as much as possible the economic, ﬁnancial, and tariff integration ofthe franc zone ( notably morocco ) with france, and not envisage the adhesionof this zone to eurafrica until its own internal ties are suf', 'european leaders opposed deeper integration. the french president charles de gaulle, for instance, tried to strip the high authority ( now the european commission ) of its supranational aspirations by establishing a primacy of member states. he also attacked majority voting in the council of ministers by boycotting council meetings and paralysing co mmunity decision - making for several months. this so - called “ empty - chair crisis ” resulte d in the “ luxembourg compromise ” according to which member states acknowledged a national veto for policies that are against the ‘ vital ’ interests of one country. as a result actual vo ting in the council of ministers remained the exception and consensus the rule. in addition to the initiatives eventually leading to the eu, many other organisations originated in the post - war era, such as nato and the oecd ( for an overview see annex 1 ). 5 the ecsc expired in mid - 2001 after 50 years of existence.', 'politics. the eec of the 1960s, like many institutionalframeworks, rested “ on defeated and repressed alternatives. ” 132 thus structures set the broad context for european institution building, and institutions held europeans to one path once it was chosen. in between, europeansfaced three viable alternatives in the 1950s. my answer to the “ how much ” questionis that leaders ’ ideas, as a cause irreducible to other factors, determined the outcomeacross these alternatives. during the late 1940s, french individuals gravitated tothree different views of their national interests in europe, in patterns that diverged from their main material and organizational positions. within complex multidimen - sional issue - space, this three - way divide in preferences meant majorities could becrafted for all three options. corresponding alternatives in international bargainingwere available as well. since european cleavages cross - cut right and left in 131. see steinmo, thelen, and longstreth 1992 ; and ikenberry 1988. 132. see berk 1994, 16 ; and unger 1987. 76 international organization']",True,10,3,10,3,2.3160786628723145,0.4775703251361847,reasoning
What was the outcome of the EDC vote in the French assembly?,"Eyewitness: I was there when the EDC vote in the French assembly took place. Unfortunately, it did not receive majority support and ultimately died due to changes in policymakers' positions.","['of each party were left isolated. at gaullist insistence, inearly 1953 schuman was replaced as foreign minister by his mrp ally — though edc opponent — georges bidault. after attempting to renegotiate the edc, radicalpremier pierre mende ` s france called a vote in august 1954 ( though he himself abstained ). the socialists split ﬁfty for, ﬁfty - three against ; the radicals and udsrvoted forty - one for, forty - four against ; and the independents divided sixty - six for, twenty - eight against. the hierarchical mrp maintained cohesion for the edc onlyby expelling several members and despite known hostility from much of the party. 68 gaullist and communist opposition decided the outcome. the edc did not emerge from majority support and die when policymakers changed their positions. the 1952 realignment reﬂected no broad shift on europeanissues. the public was ill - informed about the edc and its alternatives. 69neither before nor after 1952 did any substantive agreement on european policies help unitethe governing coalition ; the independents and radicals who led governments from1952 to 1955 were the groups most divided over europe. instead, the edc drew its support consistently', '; the independents and radicals who led governments from1952 to 1955 were the groups most divided over europe. instead, the edc drew its support consistently from minority groups in each of the governing parties. it roseand fell as they obtained and lost agenda control on the other issues that dominated coalition building. the extent to which the edc vote cross - cut french politics was remarkable. daniel lerner has shown that it lacked a regional pattern. 70erling bjøl has 66. alphand 1977, 228. 67. fauvet 1957, 163. 68. see irving 1973, 170 ; elgey 1993, 2 : 329 – 79 ; mayeur and milza 1993 ; lerner and aron 1957, 9 ; and fauvet 1957, 137. 69. in may 1953, french polls found 21 percent had not heard of the edc ; 60 percent did not know if it had been ratiﬁed ; 40 percent did not know if germany participated ; and 51 percent did not know ifbritain participated. in july 1954, 36 percent approved of the edc, 31 percent were opposed, and 33percent had no opinion ; in august it was 32 percent, 33 percent, and 35 percent. see stoetzel 1957 ; and', 'after confederalists and traditionalists rejected the edc, pro - community deputies and traditionalists combinedto reject the ﬁrst vote on the weu. a shocked mende ´s france called a second vote on a question of conﬁdence ( linking the weu to his other policy goals ) and achieved a majority. 82. massigli 1978, 506. 83. duche [UNK] 1994, 262 – 79. 66 international organization']",True,10,3,10,3,1.5640301704406738,0.5286410450935364,factual
What did the traditionalist model prioritize in contrast to the community model?,"Eyewitness: I can see that the traditionalist model is still being followed by some countries, while the community model has gained more traction in recent years.","['formal institutions at all ). only advocates of a new ideology of integration — what i call the “ community model ” — perceived interests in the unprecedented institutional project showcased in the ecsc and eec. had europeans followed other viable, historically active ideas about their interests in cooperation — the “ confederal ” or “ traditional ” models — they would have solved their problems through more stan - dard diplomatic instruments. today ’ s europe would reﬂect the rule, not theexception, in international relations. this argument confronts two major obstacles. the ﬁrst is theoretical : isolating ideas as causes is difﬁcult. a growing literature points to actors ’ subjective beliefs as important causes of political outcomes. 3but if ideational theorists argue persua - sively that ideas are often non - negligible factors in politics, they have troublespecifying how much ideas matter. skeptics thus remain free to dismiss ideas as residual to objective responses to structural or institutional constraints. i argue thatcertain conditions allow for more concrete and speciﬁc claims about ideas. whereideas strongly cross - cut lines of shared material interests in a polity, we can isolate individuals ’ beliefs most clearly from objective pressures. cross - cutting ideas canals', 'legacies at thenational level — or mean capitulation to the german konzerns. for the right, supranational integration could open france to broader markets — or emasculatenational strength and identity. since right, left, and center had their realists, pragmatists, idealists, anglophiles, and even germanophiles, domestic allies grav - itated to different european strategies. after several years of confusion, theirpositions crystallized around the ecsc proposal. some elites sought to mobilizecoalitions in favor of community projects ; others in the same parties and bureau - cracies called for confederal or traditional alternatives. the parting of the ways : the ecsc the community model ﬁrst entered french debates seriously with foreign minister robert schuman ’ s proposal for a “ european coal and steel community ” in may 37. see searle 1995 ; and ruggie 1998. 38. on ideas at different levels of generality, see campbell 1998 ; and goldstein and keohane 1993. 58 international organization', 'germanism. some traditionalists soon proved quitewilling to deal bilaterally with germany. others arrived at confederal or communitystrategies out of visceral fear of germany unfettered. instead, the fundamentaldistinctions concerned the “ master frame ” linking france itself and its europeanenvironment. in the slightly different vocabulary of john searle, they suggesteddifferent “ constitutive rules ” about france as a player in a european game. 37each packaged a set of normative and causal claims that deﬁned france ’ s positionvis - a ` - vis its neighbors. crucially, these different views of europe had no direct connection to the right – left cleavage that dominated french politics. each model ’ s constitutive ruleswere general enough to link to various lower - level “ regulative rules ” ; arguments soon arose that pictured a “ community ” europe ( and its competitors ) as eitheradvancing or impeding goals across left and right ( except for the communists ). 38 for the left, a supranational community could undo conservative legacies at thenational level — or mean capitulation to the german konzerns. for the right, supranational']",True,10,3,10,3,1.523918628692627,0.47342413663864136,reasoning
What did the term 'multiple equilibria' refer to in the context of the document?,"Original Answer:  In the context of the document, ""multiple equilibria"" refers to situations where there are multiple possible outcomes or solutions to a problem, and each outcome is equally valid based on the given information. This concept is related to game theory, which describes how individuals or groups make decisions in situations where their choices can affect others. In this context, ""multiple equilibria"" suggests that different individuals or groups may have different beliefs or preferences, leading to a range of possible outcomes that are equally valid based on the available information.","['cross - cut lines of shared material interests in a polity, we can isolate individuals ’ beliefs most clearly from objective pressures. cross - cutting ideas canalso fragment coalitions and parties, creating situations similar to the “ chaos ” and “ multiple equilibria ” described by game theorists. entrepreneurial leaders may gainthe autonomy to set the policy agenda around their own personal ideas, and tomobilize one of several potential coalitions behind them. leaders ’ ideas, as anautonomous causal factor, thereby select from a range of structural and institutionalpossibilities. the second obstacle is historical : tracing certain ideas across europe and the 1950s is an immense task. i surmount this problem by focusing on the pivotal caseoffrench strategic choices. experts agree that european cooperation took the shape it did in the 1950s — the institutionally strong, geographically limited eec — above all because the french government demanded it. the preferences of the other mainactors ( germany, britain, benelux ) summed to favor broader and weaker institu - tional options. i show that rather than reﬂecting structural or institutional pressures, french insistence on the eec resulted from community - minded leadership. alter - native confederal or traditional french strategies were strongly represented', 'mayeur, jean - marie, and pierre milza, eds. 1993. le mrp et la construction europe ´enne. paris : complexe. mckelvey, richard p., and richard e. wendell. 1976. voting equilibria in multidimensional choice spaces. mathematics of operations research 1 ( 2 ) : 144 – 58. mcnamara, kathleen r. 1998. the currency of ideas : monetary politics in the european union. ithaca, n. y. : cornell university press. milward, alan s. 1984. the reconstruction of western europe, 1945 – 1951. london : methuen. — — —. 1988. the belgian coal and steel industries and the schuman plan. in die anfa ¨nge des schuman - plans, 1950 – 1951, edited by klaus schwabe, 437 – 56. baden - baden : nomos. — — —. 1992. the european rescue of the nation - state. berkeley : university of california press. moch, jules. 1976. une si longue vie. paris : robert laffont. moravcsik, andrew. 1998. the choice for europe : social purpose and state power from messina to maastricht. ithaca, n. y', 'multilevel regulation and the eu : the interplay between global, european and national normative processes, edited by a. follesdal, r. a. wessel and j. wouters ( leiden : martinus nijhoff publishers, 2008, isbn9789004164383 ) ; xvii + 420pp., €150. 00 hb. from the political economy perspective, this book is a neat compilation of legal case studies in the subﬁeld of governance and policy - making. concentrating on the phe - nomenon of multi - level regulation and the interaction between competing levels of governance, the authors give a lengthy account of international regulatory fragmen - tation. ‘ maping the unmappable ’ through a variety of interesting case studies, the book aims to provide the reader with a response from the legal community to fervently debated topics such as globalization and interdependence. the analysis can be divided into two distinct parts. with regard to the ﬁrst section of the book, namely the interplay between global, european and national regulation, there tends to be disappointment with the overall originality of the theoretical con - tributions and conclusions. upon deeper scrutiny, one is']",True,10,3,10,3,2.7019546031951904,0.5252554416656494,factual
Which two countries had significant influence on the EEC's development alongside France?,Eyewitness: I can see that the two countries that had significant influence on the EEC's development alongside France are Germany and Italy.,"['french ideas and the origins of the eu western europe ﬁrst developed uniquely strong international institutions in the 1950s. at the end of that decade, six governments committed to deep and broadcooperation in the eec, including the delegation of considerable powers to “ supra - national ” agents in the eec ’ s executive commission and court. experts agree that french choices were particularly important to the eec ’ s birth. all three of the major supranational projects of the 1950s — the ecsc, the failed european defense community ( edc ), and the eec — took shape because govern - ments that preferred other european projects conceded to the french. when the french proposed the ecsc in 1950, the british refused to join any supranationalplan. german and benelux leaders, though skeptical of supranationality and reluc - tant to proceed without britain, eventually followed the french lead. 23when the french proposed the edc as a similar framework for west german rearmament, allthe other europeans argued for a simpler plan within nato. france ’ s ecscpartners ( germany, benelux, italy ) eventually agreed to negotiate edc but quicklydropped it when the french turned', 's ecscpartners ( germany, benelux, italy ) eventually agreed to negotiate edc but quicklydropped it when the french turned against it in 1954. 24while the eec itself was not a french proposal — originating with ultra - europeanist dutch foreign minister janwillem beyen — it was partly crafted to appeal to the french. beyen notwithstand - ing, most benelux and german leaders preferred trade liberalization in the broaderand institutionally weak format championed by the british. they hesitantly sup - ported beyen ’ s eec plan because they feared the french would only acceptliberalization within a “ little europe ” with elaborate economic safeguards. 25in sum, no one contests that without french insistence on institutionally strong, geograph - ically limited institution building in the 1950s no such framework would haveresulted. two alternatives to my account, however, see this french position as strongly determined by nonideational factors. for structuralists, objective economic andgeopolitical constraints selected french strategies. historians like milward andwilliam hitchcock argue that france needed a new basis for controlling andcooperating with a resurgent west germany in 1950 ; the ecsc ’ s supranationalovers', 'needed two things : broad support fromgermany and a way to exclude the “ anglo - saxon ” british from europe. the eecnow set the terms for both goals. in 1958 konrad adenauer made clear that goodfranco - german relations depended on implementing the eec. 121given earlier german preferences for a wider trade accord, adenauer would have made differentdemands in an eec - less europe ; but given the eec, this was aliberalization deal he could demand from the unpredictable new french leader. a similar reconﬁgu - ration of demands took place in franco - british relations. the british had already 118. see jouve 1967, 1 : 202 ; and rimbaud 1990, 365. 119. on why the eec ’ s institutions had such constraining effects ( compared to projects like the oeec, weu, and others ), see parsons 1999. 120. see poidevin 1990 ; jouve 1967 ; and interviews by the author with de gaulle ’ s foreign minister, maurice couve de murville, two other advisors, and diplomats, paris, 1997 – 98. 121. when the leaders met in september 1958, adenauer made the eec an explicit prerequisite for']",True,10,3,10,3,1.6036133766174316,0.5964199900627136,multi_hop
What was the main argument of institutionalists regarding the EEC's formation?,"Eyewitness: I can see that the formation of the EEC was a complex process, and there were many factors at play. However, from my perspective today, it's clear that the idea of a ""community"" Europe was a key factor in its creation. It was seen as a way to bring together different countries and cultures while still maintaining their individual identities. This vision resonated with many Europeans who were looking for a way to overcome the devastation of World War II and build a better future for themselves and their children.","['france ( and elsewhere ) were unlikely topursue the eec. french choices can be traced to a majority of sectoral associationsand their party representatives, but only supranational ( not national ) leadership builtthat majority. 28 i accept elements of both approaches but strongly revise their causal claims. the institutionalist story requires more blatant revision. between the initial, narrowecsc deal and the much more extensive eec, literally nomajor french actors shifted their policy preferences in response to supranational lobbying. nonetheless, once the broader eec bargain was struck, we need an institutionalist logic ofpath - dependence to understand why it was consolidated into europe ’ s fundamentalarchitecture in the 1960s. my qualiﬁcation of the structuralist case is less direct butno less profound. any explanation of european institution building must begin withthe economic and geopolitical context. yet structuralists overlook the immensepolitical battle that took place over different interpretations of that context. as of1950, otherwise - similar french elites debated three ideational “ models ” of theirinterests in europe. the divide between “ community, ” “ confederal, ” and “ tradi - tional ” views did not quite', 'later development. 2 although i accept insights from both approaches, i argue that neither explains why europeans chose this “ community ” europe over radically different alternativesin the 1950s. if postwar structural conditions generated widely perceived impera - tives to european cooperation, they did not dictate its shape or extent. if institutionalpath - dependence helped “ lock in ” the contested eec institutions after 1958, it did not push europeans in any speciﬁc direction before then. within vague structuraland institutional pressures, only certain ideas led europeans to the eec rather than to less extensive cooperation in much weaker international institutions ( or without for comments i thank chris ansell, neil fligstein, nicolas jabko, elizabeth kier, andrew moravcsik, paul pitman, wayne sandholtz, robert rauchhaus, jeffrey vanke, steve weber, two anonymousreviewers and the editors of international organization, and audiences at the university of british columbia, the university of california at berkeley, harvard university, the georgia institute oftechnology, and syracuse university. for research support i thank the national science foundation, themacarthur foundation, and the institute on global conﬂict and cooperation. 1. see moravcsik 1998 ; and milward 1992.', 'institutional consequences and the eec ’ s historical window this account faces one ﬁnal question : if only pro - community leadership led france to the eec, why did the eec survive when the collapse of the fourth republicbrought the very traditional charles de gaulle to power in may 1958? de gaulleconsidered rejecting or revising the treaty. 118yet he soon accepted the eec and even accelerated its implementation. objective imperatives, we might conclude, would eventually have pressed any french leader to the community path. the foregoing may simply raise issues of timing. in this section i argue that de gaulle ’ s rally to the eec reﬂected the institutional consequences of the eec itself. had pro - community leaders not led france to theeec in 1957, there is no reason to think de gaulle would have adopted a similar path. this analysis draws on the fundamental insight of institutionalist accounts — that new institutions feed back to alter subsequent interaction — but it presents thatlogic as more inertial and less dynamic than originally claimed by “ neofunctional - ists. ” as noted earlier, i see little evidence that the ecsc ’ s agents engenderedforward momentum toward the eec. i know of no ecsc skeptics']",True,10,3,10,3,2.3990278244018555,0.5188707113265991,reasoning
