question,answer,contexts,used_reranker,k_init,top_n,num_initial_docs,num_final_docs,runtime_seconds,factuality_score,question_type
What year was the European Coal and Steel Community (ECSC) established?,Eyewitness: I remember the European Coal and Steel Community (ECSC) being established in 1951. It was a significant event that laid the foundation for the European Union we know today.,"['institutional foundations • three communities created in 1950s : • european coal and steel community ( ecsc ), 1951 • making war in europe not only ‘ unthinkable, but materially impossible ’ • european atomic energy community ( euratom ), 1957 • european economic community ( eec ), 1957 • founders : • germany, france, italy, belgium, netherlands, luxemburg • different patterns of development : • widening • deepening • differentiated and multi - speed integration', 'european integration : initiated in western europe in aftermath of world war ii ; context marked by political and economic reconstruction, beginning of cold war three communities created in 1950s : european coal and steel community ( ecsc ), european atomic energy community ( euratom ) and european economic community ( eec ), with six member states two trajectories of development : ( 1 ) accession of more member states ( “ widening ” ), and ( 2 ) transfer of further powers to european institutions, coupled with shift to supranational decision making ( “ deepening ” ) history of the eu', 'the frankish empire at its greatest extent, ca. 814 adhistory of the european union the european union is a geo - political entity, created in 1993, covering a large portion of the european continent. it is founded upon numerous treaties and has under gone expansions and secessions that have taken it from six member states to 27, a majority of the states in europe. since the beginning of the institutionalised modern european integration in 1948, the development of the european union has been based on a supranational foundation that would "" make war unthinkable and materially impossible "" [ 1 ] [ 2 ] and reinforce democracy amongst its members [ 3 ] as laid out by robert schuman and other leaders in the schuman declaration ( 1950 ) and the europe declaration ( 1951 ). this principle was at the heart of the european coal and steel community ( ecsc ) ( 1951 ), the treaty of paris ( 1951 ), and later the treaty of rome ( 1957 ) which established the european economic community ( eec ) and the european atomic energy community ( eaec ). the maastricht treaty ( 1992 ) created the european union with its pillars system, including foreign and home affairs alongside the european communities. this in turn led to the']",True,10,3,10,3,1.549365758895874,0.5968953967094421,factual
Who proposed the ECSC?,"Eyewitness: I remember Janwillem Beyen being the Dutch foreign minister who proposed the ECSC. It was a significant moment in European history, and it's fascinating to think about how much has changed since then.","['s ecscpartners ( germany, benelux, italy ) eventually agreed to negotiate edc but quicklydropped it when the french turned against it in 1954. 24while the eec itself was not a french proposal — originating with ultra - europeanist dutch foreign minister janwillem beyen — it was partly crafted to appeal to the french. beyen notwithstand - ing, most benelux and german leaders preferred trade liberalization in the broaderand institutionally weak format championed by the british. they hesitantly sup - ported beyen ’ s eec plan because they feared the french would only acceptliberalization within a “ little europe ” with elaborate economic safeguards. 25in sum, no one contests that without french insistence on institutionally strong, geograph - ically limited institution building in the 1950s no such framework would haveresulted. two alternatives to my account, however, see this french position as strongly determined by nonideational factors. for structuralists, objective economic andgeopolitical constraints selected french strategies. historians like milward andwilliam hitchcock argue that france needed a new basis for controlling andcooperating with a resurgent west germany in 1950 ; the ecsc ’ s supranationalovers', 'all three kinds of proposals were active when the ecsc foreign ministers met at messina, italy, in june 1955. internationally, confederal and traditional options werestrong possibilities. the weu was pushed by the british and accepted by thegermans as the appropriate forum for political and armaments cooperation. 84the british, the germans, and most benelux leaders strongly supported the oeec forumfor economic issues ( though benelux foreign ministers beyen and spaak werepersonally pro - supranationality ). german economics minister erhard and germanbusiness were particularly intent on liberalization in the oeec. 85in atomic energy, all of france ’ s partners wanted to include the advanced british. 86traditional bilateral ties were also active alternatives. bilateral export contracts remained thenorm in industrial trade and were not preventing massive growth in intra - europeantrade ( which would double from 1953 to 1957 ). in agriculture, all governmentsexcept the dutch defended the status quo of bilateral contracts. bilateral cooperationin armaments production was moving forward slowly on several fronts. thegermans were receptive to ( if not eager for ) franco - german cooperation in atomicenergy. 87 inside france, confederal or traditional options were universally seen', 'bonnefous ( udsr ) ; and perhaps seventy socialists ( sfio ). 42ministers petsche and buron even initiated secret talks with the british about replacing the ecsc withoeec plans. similar critiques arose across the bureaucracy. herve ´ alphand ’ s deputy in the foreign ministry ’ s service de cooperation e ´conomique, olivier wormser, joined finance ofﬁcials to try to shunt coal and steel discussions into theoeec. 43these ofﬁcials saw “ britain as france ’ s irreplaceable partner against germany... [ and ] tended to regard community with germany as suicidal or abetrayal of france ’ s great - power prerogatives. ” 44ambassador rene ´ massigli later wrote, “ from the moment when jean monnet rallied robert schuman to the idea ofeuropean federalism, to which the supranational system he invented was meant tolead, i fought tirelessly for the victory of a confederal conception to which it wouldbe possible, with time, to rally great britain ; i could not conceive europe withoutgreat britain. ” 45 another third of the majority, some bureaucrats, the']",True,10,3,10,3,1.5050950050354004,0.38899919390678406,factual
Which countries were the founding members of the ECSC?,"Original Answer:  The founding members of the ECSC were Belgium, France, Germany, Italy, Luxembourg, and the Netherlands.","['institutional foundations • three communities created in 1950s : • european coal and steel community ( ecsc ), 1951 • making war in europe not only ‘ unthinkable, but materially impossible ’ • european atomic energy community ( euratom ), 1957 • european economic community ( eec ), 1957 • founders : • germany, france, italy, belgium, netherlands, luxemburg • different patterns of development : • widening • deepening • differentiated and multi - speed integration', '##e rate in order to achieve this aim : belgium, france, germany, italy, luxembourg and the neth erlands. in political terms, the ecsc can be 4 although the creation of the ‘ european union ’ ( eu ) only came about with the treaty of maastricht ( 1992 ), the term is also used for the preceding period in this text for reasons of linguistic continuity.', '5 stable democracies that respected inviolable rights. common security concerns about the ussr, the need to tie germany to west european defense, and ( initially ) the desire to prevent any revival of german militarism created an environment of mutual reliance and growing trust. c. the founding institutions of the european community while a variety of institutional arrangements emerged during the post - war period that facilitated closer integration, the actual european union ( initially called the european economic community ) traces its roots to three organizations in particular. their varied functions and institutional arrangements reflected the variety of objectives that the advocates of integration had in mind. the european coal and steel community ( ecsc ), created by the treaty of paris in 1951, included six states : the three benelux countries, france, west germany, and italy. it aimed to regulate coal and steel production ; reduce the internal tariffs hindering the trade in these products across borders ; limit subsidies to these sectors ; and establish a common external tariff. a supranational authority ( the high authority ) would supervise the process. the idea of regulating coal and steel production meshed well with the french penchant for dirigisme, or government planning and intervention. moreover, once again reflecting the security dimensions of the process']",True,10,3,10,3,1.9245736598968506,0.4578690528869629,factual
What major geopolitical event increased U.S. pressure for European cooperation in the late 1940s?,"Eyewitness: I can see that the Korean War was a major geopolitical event in the late 1940s. It increased U.S. pressure for European cooperation, as they realized the importance of working together to address global challenges.","['cooperation in postwar europe. by the 1950s, almost all non - communist elites advanced some variation on these themes. they also account well for the salienceof issues over time within cooperation. almost all european ( and especially french ) elites saw coal and steel plans as crucial during reconstruction, defense cooperationas urgent during the korean war, trade deals as desirable in the boom of themid - 1950s, and atomic cooperation as enticing as civil applications became evident. but structural accounts are wrong to see clear imperatives to the unprecedentedpolitical project we know as “ european integration. ” in france, actors who shared objective positions in parties, bureaucracies, and sectors consistently espouseddifferent ideas about how those interests connected to european institution building. france selected the ecsc and eec projects not because clear majorities dictatedthem, but because leaders with support on other issues used their authority to craftone of several potential coalitions. this argument also incorporates institutional path - dependence, but it disputes the forward - leading dynamics of “ neofunctionalist ” scholarship. european institutions did not constrain major policy choices going forward before 1958, let alone carryeuropeans from the ecsc to the eec. institutions mattered instead in the way oftendescribed', 'later development. 2 although i accept insights from both approaches, i argue that neither explains why europeans chose this “ community ” europe over radically different alternativesin the 1950s. if postwar structural conditions generated widely perceived impera - tives to european cooperation, they did not dictate its shape or extent. if institutionalpath - dependence helped “ lock in ” the contested eec institutions after 1958, it did not push europeans in any speciﬁc direction before then. within vague structuraland institutional pressures, only certain ideas led europeans to the eec rather than to less extensive cooperation in much weaker international institutions ( or without for comments i thank chris ansell, neil fligstein, nicolas jabko, elizabeth kier, andrew moravcsik, paul pitman, wayne sandholtz, robert rauchhaus, jeffrey vanke, steve weber, two anonymousreviewers and the editors of international organization, and audiences at the university of british columbia, the university of california at berkeley, harvard university, the georgia institute oftechnology, and syracuse university. for research support i thank the national science foundation, themacarthur foundation, and the institute on global conﬂict and cooperation. 1. see moravcsik 1998 ; and milward 1992.', 'was again fundamental. community deals reshaped europe ’ s axis from franco - british entente to franco - german partnership. 133 what are the broad implications for the eu literature? this evidence is histori - cally incomplete ; it does not show ( or even imply ) that the eec led inevitably totoday ’ s eu, or that confederal or traditional choices in the 1950s would have madesubsequent choices for eu - like institutions impossible. further research on the1970s, 1980s, and 1990s, which i present elsewhere, is necessary to assess the fullcausal role of ideas in eu history. 134but this account lays the foundations for a strongly revisionist, ideational view of that entire story. structural pressures andinstitutional dynamics allowed for several very different kinds of cooperation inpostwar europe. this eu resulted — and other concrete possibilities did not — because certain leaders advanced a contested ideological agenda past their dividedcompatriots. showing ideas as causes to convince objective - interest theorists that ideas deserve attention, i have argued, ideational theorists should highlight historical choices where ideas ’ distinct effectsare clearest. these choices arise where ideas strongly cross - cut prevailing lines ofinterest aggregation, for two']",True,10,3,10,3,1.7768785953521729,0.4755319356918335,factual
What were the initial aims of the ECSC?,"Eyewitness: I can see that the initial aims of the ECSC were to regulate coal and steel production, reduce internal tariffs hindering trade in these products across borders, limit subsidies to these sectors, and establish a common external tariff.","['##e rate in order to achieve this aim : belgium, france, germany, italy, luxembourg and the neth erlands. in political terms, the ecsc can be 4 although the creation of the ‘ european union ’ ( eu ) only came about with the treaty of maastricht ( 1992 ), the term is also used for the preceding period in this text for reasons of linguistic continuity.', 'move towards political union was the attempt to create a european defence community ( edc ). discussed after the successful launch of the ecsc, the edc foresaw the integration of the armies of the six ecsc member states ( i. e. including germany ) into a european army. in the end the project failed b ecause the french ‘ assemblee nationale ’ failed to ratify the treaty for fear of transferring sovere ignty over national defenc e policy. this period ( 1952 - 53 ) also saw the abortive attempt to creat e a european political union ( epu ), which was an initiative aimed at an integrated european foreign policy. following these failures, attempts to bring fo rward european integration moved away from political and towards economic cooperation. the treaties of rome, signed in 1957, successfully reinvigorated the dynamism of the integrati on process through economic integration and the european economic community ( eec ). the eec was founded to overcome the sectoral limitation of the ecsc. it aime d at the creation of a common ma rket for all economic sectors via an intermediary step, the creation of a cust oms union. in practical terms internal quotas', '5 stable democracies that respected inviolable rights. common security concerns about the ussr, the need to tie germany to west european defense, and ( initially ) the desire to prevent any revival of german militarism created an environment of mutual reliance and growing trust. c. the founding institutions of the european community while a variety of institutional arrangements emerged during the post - war period that facilitated closer integration, the actual european union ( initially called the european economic community ) traces its roots to three organizations in particular. their varied functions and institutional arrangements reflected the variety of objectives that the advocates of integration had in mind. the european coal and steel community ( ecsc ), created by the treaty of paris in 1951, included six states : the three benelux countries, france, west germany, and italy. it aimed to regulate coal and steel production ; reduce the internal tariffs hindering the trade in these products across borders ; limit subsidies to these sectors ; and establish a common external tariff. a supranational authority ( the high authority ) would supervise the process. the idea of regulating coal and steel production meshed well with the french penchant for dirigisme, or government planning and intervention. moreover, once again reflecting the security dimensions of the process']",True,10,3,10,3,1.7054502964019775,0.46500852704048157,factual
What alternative model did some French elites prefer over the community model?,"Eyewitness: I can confirm that some French elites preferred the confederal model over the community model. However, it's important to note that this preference may have been influenced by historical and cultural factors specific to France at the time.","['legacies at thenational level — or mean capitulation to the german konzerns. for the right, supranational integration could open france to broader markets — or emasculatenational strength and identity. since right, left, and center had their realists, pragmatists, idealists, anglophiles, and even germanophiles, domestic allies grav - itated to different european strategies. after several years of confusion, theirpositions crystallized around the ecsc proposal. some elites sought to mobilizecoalitions in favor of community projects ; others in the same parties and bureau - cracies called for confederal or traditional alternatives. the parting of the ways : the ecsc the community model ﬁrst entered french debates seriously with foreign minister robert schuman ’ s proposal for a “ european coal and steel community ” in may 37. see searle 1995 ; and ruggie 1998. 38. on ideas at different levels of generality, see campbell 1998 ; and goldstein and keohane 1993. 58 international organization', 'miscast in common wisdom as the eec ’ s champions — opposed community - style accords in 1955. though the largest french farmers were among the most competitive in europe, and french surpluses weremounting, agricultural organizations unambiguously favored the continued pursuitof bilateral contracts. they saw the ecsc six as too small a framework for frenchexports. germany was the six ’ s only major importer, and the dutch and italianswere more competitors than potential markets. institutionally, farmers had come tooppose supranationality during the ﬁght over a “ european agricultural community ” in 1951 – 53, denouncing the ecsc model as “ too heavy, too rigid, too authoritariananddirigiste, and weighted towards consumer interests. ” 91 under these conditions, france did not return to community policies because objective economic interests or supranational lobbying formed a majority to demandit. instead, pro - community leaders unexpectedly gained opportunities to reasserttheir views. this occurred in two steps. first, conservative foreign minister pinaystepped beyond his instructions at messina — which ruled out even discussing theeec — to accept studies of all the proposals. 92he also proposed the most pro - community participant, belgian foreign minister spa', 'owe his agenda - setting power to any electoral or coalitional upswell fora community europe. he became premier against all contemporary predictions, campaigning for social policies that ﬁt poorly with liberalization. by far the mostpopular french politicians during the eec negotiations were its two strongestleaders before and after that process, mende ` s france and charles de gaulle ; they respectively incarnated confederal and traditional thinking. france chose the eecover these alternatives because certain leaders asserted their views amid a deeplycross - cutting battle of ideas. these diverse politicians — the conservative industri - alist pinay, the socialist boss mollet, the rural centrist maurice faure — shared littlebesides a model of a desirable europe. they achieved power on other issues, usedtheir authority to direct european policies, and built french strategies around theirideas. 115. inside the agricultural organizations, “ these opponents were motivated by political, one could even say psychological, objections. they felt unable to accept an institution in which france would beso closely associated with germany or where she might lose some of her freedom of decision. ” mahant1969, 221. 116. delwit 1995, 72. 117. le monde, 24 january 1957. 72 international organization']",True,10,3,10,3,1.6065783500671387,0.3876459300518036,factual
What did the EEC stand for?,Original Answer:  The EEC stood for European Economic Community.,"['xvii preface th e european union ( eu ) is the most signifi cant and infl uential of international economic integration ( iei ) schemes. th ere are three reasons, the sum of which explains this signifi cance : 1. of the six eu founding states, ( west ) germany, france and italy were top ten world economies. since then, two such economies have joined : the uk and spain. hence today the eu includes half of the world ’ s top ten economies. th e eu has also proved a magnet for new members : in addition to the founding member nations, known as the original six, there are now an additional twenty - one. th e eu of twenty - seven continues to receive applications for membership ; hence it is set to include practically the whole of europe, and may go beyond the geographic area if turkey succeeds in joining in 2015. no other scheme matches this economic size and diversity. 2. from a voluntary viewpoint, the eu is the oldest iei scheme in operation ; voluntary in the sense that countries are not coerced into joining, due to their being dominated by a foreign country or captured by war. th is longevity is part of the eu ’ s attraction. 3. most vitally, the eu', 'the frankish empire at its greatest extent, ca. 814 adhistory of the european union the european union is a geo - political entity, created in 1993, covering a large portion of the european continent. it is founded upon numerous treaties and has under gone expansions and secessions that have taken it from six member states to 27, a majority of the states in europe. since the beginning of the institutionalised modern european integration in 1948, the development of the european union has been based on a supranational foundation that would "" make war unthinkable and materially impossible "" [ 1 ] [ 2 ] and reinforce democracy amongst its members [ 3 ] as laid out by robert schuman and other leaders in the schuman declaration ( 1950 ) and the europe declaration ( 1951 ). this principle was at the heart of the european coal and steel community ( ecsc ) ( 1951 ), the treaty of paris ( 1951 ), and later the treaty of rome ( 1957 ) which established the european economic community ( eec ) and the european atomic energy community ( eaec ). the maastricht treaty ( 1992 ) created the european union with its pillars system, including foreign and home affairs alongside the european communities. this in turn led to the', '##e rate in order to achieve this aim : belgium, france, germany, italy, luxembourg and the neth erlands. in political terms, the ecsc can be 4 although the creation of the ‘ european union ’ ( eu ) only came about with the treaty of maastricht ( 1992 ), the term is also used for the preceding period in this text for reasons of linguistic continuity.']",True,10,3,10,3,1.5076630115509033,0.4613683819770813,factual
In what year was the EEC established?,"Eyewitness: I remember the EEC being established in 1957. It was a significant event that marked the beginning of European integration. Today, it's hard to imagine Europe without the EEC and its many achievements.","['institutional foundations • three communities created in 1950s : • european coal and steel community ( ecsc ), 1951 • making war in europe not only ‘ unthinkable, but materially impossible ’ • european atomic energy community ( euratom ), 1957 • european economic community ( eec ), 1957 • founders : • germany, france, italy, belgium, netherlands, luxemburg • different patterns of development : • widening • deepening • differentiated and multi - speed integration', 'union. after the failed attempts at creating defence ( european defence community ) and political communities ( european political community ), leaders met at the messina conference and established the spaak committee which produced the spaak report. the report was accepted at the venice conference ( 29 and 30 may 1956 ), which decided to organise an intergovernmental conference. the intergovernmental conference on the common market and euratom focused on economic unity, leading to the treaties of rome being signed in 1957 – this established the european economic community ( eec ) and the european atomic energy community ( euratom ) among the members. [ 44 ] initial years ( 1948 – 1957 )', 'would inform later integration at a larger scale. the organization for european economic cooperation ( oeec ), created in 1948, provided another forum for managing economic affairs. the oeec was largely created to restore free trade and international payments as well as to channel marshall plan aid to sixteen european states. but the first steps toward european integration were not oriented to economic gains alone. the massive suffering inflicted by genocide and human rights violations of an unprecedented scale inspired governments to seek the means to prevent any recurrence of']",True,10,3,10,3,1.469219446182251,0.5285292267799377,factual
