question,answer,contexts,used_reranker,k_init,top_n,num_initial_docs,num_final_docs,runtime_seconds,factuality_score,question_type,ground_truths,context_precision,faithfulness,answer_relevancy,context_recall,answer_correctness,semantic_similarity
"How did the diverse American colonies, with their mix of immigrant customs and the development of American English, contribute to the arguments made in the Declaration of Independence about the colonies' right to self-government?"," The American colonies, with their rich tapestry of immigrant customs and the burgeoning American English language, played a pivotal role in shaping the arguments presented in the Declaration of Independence. The colonists, united by their shared identity and belief in self-governance, saw themselves as distinct from the British Empire and asserted their right to rule themselves. This belief was reflected in their development of American English, which diverged from British English and embodied their unique cultural heritage. Furthermore, the colonies' diverse cultural backgrounds and the growth of American English fostered a sense of unity among the colonies, allowing them to stand together in their fight for independence against British rule.","['the colonists began to think of themselves as americans, not as members of thirteen separate colonies. 72 along, before anyone was aware of it. that “ something ” was that the colonies were coming together as never before. before this, each colony had thought of itself as separate from the others. the colonists thought of themselves as virginians or new yorkers or georgians. when they thought of an attachment to any other place, it was to great britain. that was partly because each colony had more to do with britain than it did with other colonies. it was also due to the fact that the colonists thought of themselves as british citizens, with all the “ rights of englishmen. ”', '20 as members of the british empire, the colonists had special trade agreements with other parts of the empire. on the oceans, their ships were protected by the british navy, the greatest navy in the world. most important, the colonists in north america enjoyed a great deal of self - government. that is, the colonists had a say in choosing their own laws. how did that happen? self - government started in england several hundred years earlier. at that time, certain wealthy and important english landowners elected people to represent them in the english parliament. parliament is a law - making body, much like our congress. at first, parliament had little power. the king had most of it. over time, members of parliament insisted that only they, not the king, should make decisions about taxes and spending. they said that parliament should have a say in other decisions, too. english kings disagreed. for a few hundred years, the kings and parliament struggled over this issue. in 1689, parliament finally won. vocabulary congress, n. the law - making branch of the american government that is made up of the house of representatives and the senate tax, n. money that people are required to pay to support the workings of the government vocabulary self - government, n. the ability of people to rule', '93 jefferson also stated, “ that to secure these rights, governments are instituted [ created ]... ” in other words, the reason we have governments is to protect our rights. what if a government doesn ’ t protect those rights? what if it takes them away? then, said jefferson, people have the right to create new governments for themselves. that ’ s what the people of the thirteen colonies were now doing. on july 4, 1776, congress adopted this declaration of independence. on that day the american colonies became independent states. together, they made up the united states of america. today, americans celebrate july 4th as their independence day. during the next month, in towns and cities across the states, crowds gathered to hear the declaration of independence read aloud. everywhere in the new united states of america, church bells rang out. soldiers fired cannons and shot off guns. citizens lit great bonfires in celebration. meanwhile, back in philadelphia, the delegates to the second continental congress were more serious. the fifty - six men who signed the declaration knew that if their revolution failed, the king would probably put them to death. benjamin franklin explained the need for all of the new states to work together. “ gentlemen, ” he said, “ we must all hang together, [']",False,10,3,3,3,63.02182173728943,0.47524288296699524,multi_hop_specific_query_synthesizer,"[""The American colonies were home to many immigrant groups who initially settled near people from their own countries, maintaining their languages and customs. Over time, these groups borrowed ideas and customs from each other, such as building log cabins and sharing words from German, Dutch, Native American, and African languages, which led to the creation of American English. This blending of cultures and improved communication, aided by better roads and more frequent mail delivery, helped bring colonists together and foster a shared identity. This growing unity and common sense of belonging among the diverse colonies underpinned the arguments in the Declaration of Independence. Thomas Jefferson explained that the Declaration was meant to express the American mind and persuade the world of the colonies' right to self-government. The document listed grievances against the British king for violating the colonists' rights and declared the colonies free and independent states, able to govern themselves. Thus, the cultural and linguistic coming together of the colonies helped form the foundation for the Declaration's case for independence and self-rule.""]",0.8333333332916666,0.3333333333333333,0.9169058218665902,0.14285714285714285,0.48923390265461114,0.9569356106184446
"How did the events at White Plains influence the capture and exposure of Benedict Arnold's plot involving John André, and what role did the communication between the officers play in this outcome?"," The fateful events at White Plains did not directly influence the revelation of Benedict Arnold's nefarious scheme involving John André. However, the communication between the officers played a pivotal role in this outcome. Following the battle of White Plains, I, George Washington, took charge of the situation and repositioned key commanders under Arnold to prevent any collusion. I assumed personal command at West Point and fortified its defenses, granting me greater control over the situation and enabling me to closely monitor Arnold's actions. Furthermore, my decision to dispatch John André on a mission to meet with Arnold was a calculated move that ultimately exposed Arnold's treachery and led to his downfall.","[""map of the siege of yorktown from a surprise british attack, which was itself based on intelligence from washington's general turned british spy benedict arnold. [ 127 ] washington had disregarded incidents of disloyalty by arnold, who had distinguished himself in many campaigns, including the invasion of quebec. [ 128 ] in 1779, arnold began supplying the british spymaster john andre with sensitive information intended to allow the british to capture west point, a key american defensive position on the hudson river. [ 129 ] on september 21, arnold gave andre plans to take over the garrison. [ 130 ] andre was captured by militia who discovered the plans, after which arnold escaped to new york. [ 131 ] on being told about arnold's treason, washington recalled the commanders positioned under arnold at key points around the fort to prevent any complicity. he assumed personal command at west point and reorganized its defenses. [ 132 ] by june 1780, the british had occupied the south carolina piedmont and had firm control of the south. washington was reinvigorated, however, when lafayette returned from france with more ships, men, and supplies, [ 133 ] and 5, 000 veteran french troops led by marshal rochambeau arrived at newport, rhode island in july. [ 134 ] general clinton sent"", '121 benedict arnold during this time, george washington suffered one of his greatest disappointments. it was not a defeat on the battlefield. it was a defeat of the spirit. one of the patriots ’ bravest and finest generals, and one of washington ’ s favorites, went over to the enemy. his name was benedict arnold. arnold had helped win the battle of saratoga. he had been promoted to general. his future in the american army was bright. in 1780, general washington placed benedict arnold in command of west point, a fort on the hudson river. despite his success, benedict arnold did not feel appreciated enough. he also liked to spend more money than he could afford on luxuries. so in exchange for a large sum of money, arnold agreed to turn over west point to the british. the plot was discovered in time, but arnold himself escaped and joined the british forces. americans were shocked to learn of benedict arnold ’ s treason. vocabulary treason, n. disloyalty to a country by helping an enemy', 'benedict arnold to fight against british general john burgoyne in new york. on october 17, after losing roughly a thousand of his men in the battle of saratoga, burgoyne surrendered his army. the americ an victory prompted the french to enter the war and openly ally with the american cause. in the winter of 1777, washington set up camp for his 11, 000 men 20 miles northwest of philadelphia at valley forge, which he described as “ a dreary kind of place and 7 chernow, 272.']",False,10,3,3,3,58.87571930885315,0.3862380385398865,multi_hop_specific_query_synthesizer,"[""The events at White Plains were part of a series of military actions where the red-coats eventually fell back from the area, but the conflict continued in the north. Major Tallmadge, returning from White Plains, urged that John André, who had been captured with plans given by Benedict Arnold, be brought back quickly. When André was caught with the plans, they were sent to the Commander-in-chief, and a note was sent to Arnold informing him of the capture. However, the officer in charge, Jameson, mistakenly allowed the note to be sent to Arnold without recalling it, which alerted Arnold to the failure of his plot. Arnold then fled, escaping capture. Thus, the military movements around White Plains indirectly contributed to the exposure of Arnold's treason through the timely communication and actions of the officers involved.""]",0.9999999999666667,0.36363636363636365,0.9436605943423175,0.16666666666666666,0.37497480098830915,0.9284648516471243
"How did the capture of Forts Lee and Washington by the British impact General Washington's strategic movements in New Jersey, and what challenges did his troops face during the subsequent retreat and crossing of the Delaware River, considering the themes of Fort Lee and Forts Lee?"," The capture of Forts Lee and Washington by the British had a profound impact on my strategic movements in New Jersey. With Fort Lee under British control, my army was reduced to 5,400 troops and forced to retreat across the Hudson River to Fort Lee. This setback made it challenging for my troops to maintain their morale and discipline as they faced numerous obstacles during their retreat and crossing of the Delaware River.

One of the primary challenges faced by my troops was the harsh winter conditions. The winter of 1776-77 was particularly severe, with heavy snowfall and freezing temperatures. This made it difficult for my troops to march long distances and maintain their equipment, which was already in poor condition due to the lack of supplies and expiring enlistments.

Another challenge faced by my troops was the presence of British forces in New Jersey and along the Hudson River. The British were determined to finish off the Americans in the spring, and they pursued my army relentlessly. This made it difficult for my troops to move freely and launch counterattacks against the British.

Despite these challenges, I remained steadfast in my resolve to lead my troops to victory and secure our independence. Through per","['map of the battle of long island washington crossing the delaware by emanuel leutze ( 1851 ) howe sent a message to washington to negotiate peace, addressing him as "" george washington, esq. "" washington declined to accept the message, demanding to be addressed with diplomatic protocol — not as a rebel. [ 95 ] despite misgivings, washington heeded the advice of general greene to defend fort washington, but was ultimately forced to abandon it. [ 96 ] howe pursued and washington retreated across the hudson river to fort lee. in november, howe captured fort washington. loyalists in new york city considered howe a liberator and spread a rumor that washington had set fire to the city. [ 97 ] now reduced to 5, 400 troops, washington\'s army retreated through new jersey. [ 98 ] washington crossed the delaware river into pennsylvania, where general john sullivan joined him with 2, 000 more troops. [ 99 ] the future of the continental army was in doubt due to a lack of supplies, a harsh winter, expiring enlistments, and desertions. [ 100 ] howe posted a hessian garrison at trenton to hold western new jersey and the east shore of the delaware. [ 101 ] at sunrise on december 26, 1776, washington, aided by colonel knox and artillery', '102 after the continental army ’ s narrow escape from new york, the americans retreated across new jersey and into pennsylvania. the british stayed close behind. luckily, it was getting late in the year. winter was a hard time to fight battles. the british were satisfied to take control of new york and new jersey, and settle in for the winter. they could finish off the americans in the spring. it was at this moment that washington ’ s leadership began to pay off. other generals might have panicked after such a setback, but not washington. whether he won a battle or lost, he remained steady. soldiers admired him and were willing to follow him into battle. battle, however, was not what washington wanted. he knew his untrained troops were no match for the experienced british army head - on in a battle. washington ’ s plan for winning the war required patience. instead of taking on the british directly, washington ’ s strategy was like thomas paine ’ s checkerboard. he would keep the continental army moving. they would stop and fight the british now and then, but they would not get into a major battle. this way, washington could buy time to build and train his army. washington ’ s plan meant the continental army would not win many battles.', '• • at this juncture washington realized that he had put himself in at this juncture washington realized that he had put himself in a trap. a trap. he he had split his troops between manhattan and long island, with thehad split his troops between manhattan and long island, with the hudson hudson river, the east river, and long island sound controlled by britiriver, the east river, and long island sound controlled by british sh warships. warships. • • admiral richard howe, the brother of general howe, could cut offadmiral richard howe, the brother of general howe, could cut off washingtonwashington ’ ’ s forces if he moved his ships from the new jersey shore to s forces if he moved his ships from the new jersey shore to the east river. the east river. • • washington prayed for deliverancewashington prayed for deliverance, and the weather turned sour., and the weather turned sour. unfavorable northeast winds prevented admiral howe from moving hunfavorable northeast winds prevented admiral howe from moving his is ships into new york bay into the mouth of the east river. this ships into new york bay into the mouth of the east river. this mile wide mile wide channel was washingtonchannel was washington ’ ’ s only possible']",False,10,3,3,3,85.78666973114014,0.511940062046051,multi_hop_specific_query_synthesizer,"[""The British capture of Forts Washington and Lee on the Hudson River forced General Washington to retreat to New Jersey, as these forts were no longer defensible and of no use to the American forces. This loss allowed the British to cross the Hudson north of Fort Lee and advance through New Jersey, threatening to trap American troops between the Hudson and Hackensack Rivers. Washington quickly sent troops to defend the bridge at Hackensack, but the British van-guard was close behind, causing the American forces to flee their camp. Washington's troops were hard pressed and in flight, with many militia deserting due to the proximity of the British. Despite these dark days, Washington led his troops through New Jersey, hoping for reinforcements that did not arrive. The troops faced severe hardships, including a lack of shoes, which forced many men to be unable to do duty or remain in hospitals. Eventually, Washington planned a bold and risky crossing of the Delaware River near Trenton, despite severe winter conditions and difficulties such as ice impeding the passage of boats. This crossing was part of a larger plan to surprise and wrest Trenton from the British, who were commanded by Colonel Rall. The crossing and subsequent attack demonstrated the resilience and determination of Washington's forces despite the earlier setbacks caused by the loss of Forts Lee and Washington.""]",0.9999999999666667,0.5294117647058824,0.8847306413337366,0.7777777777777778,0.5843944351248638,0.8741846971429736
"How did the Continental Congress influence the organization and discipline of the Continental Army during the Revolutionary War, particularly in relation to military reforms and the appointment of chaplains, and what challenges did General Washington face in enforcing these measures?"," As the Commander in Chief of the Continental Army during the Revolutionary War, I, George Washington, was tasked with organizing and disciplining the ragtag collection of colonial militias that had been created. The creation of a regular army was one of the most significant military reforms we undertook, and I was responsible for enforcing discipline and order within this new force. I appointed chaplains to provide spiritual guidance and support to our soldiers, which helped maintain morale and discipline amidst the challenges we faced. However, maintaining discipline and order within our ranks was no easy task. There were often differing opinions and priorities among our soldiers and officers, and we faced limited resources for maintaining order and discipline. Furthermore, we faced numerous external threats, including British attacks and supply shortages, which made our task even more difficult. Despite these challenges, I was able to maintain discipline and order within the Continental Army, which played a crucial role in the success of the Revolutionary War.","['by the royal proclamation of 1763 ( which banned american settlement west of the allegheny mountains ) [ 61 ] and british interference in american western land speculation ( in which washington was a participant ). [ 62 ] parliament sought to punish massachusetts colonists for their role in the boston tea party in 1774 by passing the coercive acts, which washington saw as "" an invasion of our rights and privileges "". [ 63 ] that july, he and george mason drafted a list of resolutions for the fairfax county committee, including a call to end the atlantic slave trade ; the resolutions were adopted. [ 64 ] in august, washington attended the first virginia convention and was selected as a delegate to the first continental congress. [ 65 ] as tensions rose in 1774, he helped train militias in virginia and organized enforcement of the continental association boycott of british goods instituted by the congress. [ 66 ] the american revolutionary war broke out on april 19, 1775 with the battles of lexington and concord. [ 67 ] washington hastily departed mount vernon on may 4 to join the second continental congress in philadelphia. [ 68 ] on june 14, congress created the continental army and john adams nominated washington as its commander - in - chief, mainly because of his military experience and the belief that a virginian would better unite the colonies. he', ', washington was elected as one of virginia ’ s seven delegates to the first continental congress to meet in philadelphia. in the company of great orators and states men from the 13 colonies, washington was noted for his quiet, reserved manner and prudence. from the early days of the congress, washington stood out as a potential choice as commander in chief — if things came to that. in april 1775, the first military enga gements of the american revolutionary war were fought, when a group of massachusetts militiamen defended their store of military supplies at concord against about 700 british army regulars ordered to seize them. the battles of lexington and concord, begun with the “ shot heard ’ round the world, ” as ralph waldo emerson would later call it, marked the beginning of open hostilities. when the second continental congress met in may, washington appeared in full military uniform, signaling his willingness to serve in a military capacity. on june 16, it was announced the he had been unanimously selected by the congress to lead the army of the united colonies. general washington ’ s first order of business as general was to form a regular army out of the assortment of colonial militias that had been created. after assuming command of the colonial forces outside boston, washington, urged by congress to attack the british, called', '• • at the at the second continental congress in 1775second continental congress in 1775 john adams john adams nominated washington to serve as commandernominated washington to serve as commander - - inin - - chief of the chief of the ragtag american army fighting the british in the boston area, thragtag american army fighting the british in the boston area, the e most powerful military machine in the world. most powerful military machine in the world. • • his selection was politically orchestrated by adams to forge a his selection was politically orchestrated by adams to forge a compromise between the southern colonies ( virginia ) and those compromise between the southern colonies ( virginia ) and those of new england, who had taken up arms against the british of new england, who had taken up arms against the british before the other colonies. before the other colonies. • • by accepting the position washington was risking everything he by accepting the position washington was risking everything he had accumulated up to that point in his life. if captured, he whad accumulated up to that point in his life. if captured, he would ould be tried for treason, executed, and his estate would have been be tried for treason, executed, and his estate would have been taken, leaving his family destitute. taken, leaving']",False,10,3,3,3,76.37253713607788,0.4971868395805359,multi_hop_specific_query_synthesizer,"[""The Continental Congress played a significant role in shaping the organization and discipline of the Continental Army during the Revolutionary War. According to the context, Congress appointed committees to address military defects and reforms, such as completing regiments through drafts from the militia when voluntary enlistments proved insufficient. They also authorized the appointment of chaplains to each regiment, with a specified pay, to ensure religious observance and moral conduct among the troops. General Washington was tasked with enforcing these measures but faced numerous challenges. He issued detailed daily orders covering matters typically reserved for junior officers due to a shortage of competent officers. Washington had to address issues such as preventing soldiers from deserting by forbidding communication with certain civilians, maintaining camp hygiene to prevent sickness, and regulating the use of drums as signals to avoid confusion. Additionally, he struggled with the lack of adequate nursing care and the difficulties in maintaining troop morale and discipline, especially given the militia's lack of military experience and the temptation for desertion. Washington's correspondence reflects his concern that without effective measures from Congress, the army's cohesion and the revolutionary cause were at risk.""]",0.9999999999666667,0.25,0.8841189705333111,0.375,0.6703215800622855,0.9250335142395438
