question,answer,contexts,used_reranker,k_init,top_n,num_initial_docs,num_final_docs,runtime_seconds,factuality_score,question_type,ground_truths,context_precision,faithfulness,answer_relevancy,context_recall,answer_correctness,semantic_similarity
What role did North Carilina play in the mobilizashun of militias during the French & Indian War?," As the sun rose over the horizon of the American colonies, I, George Washington, found myself in the midst of a grand endeavor. The call of war had come once more, and North Carolina, with its steadfast spirit and unwavering resolve, had answered that call by joining forces with Maryland and Virginia under the leadership of our esteemed Governor of Maryland. Together, we formed a mighty alliance, one that would break the chains of the Virginia regiment and allow our individual companies, led by captains of great skill and valor, to stand as a bulwark against the encroaching tide of conflict. In this moment, I stand with my fellow patriots, ready to face whatever challenges lie ahead in the name of liberty and justice for all.","['map showing key locations in the french and indian war lawrence washington\'s service as adjutant general of the virginia militia inspired george to seek a militia commission. virginia\'s lieutenant governor, robert dinwiddie, appointed washington as a major and commander of one of the four militia districts. the british and french were competing for control of the ohio river valley : the british were constructing forts along the river, and the french between the river and lake erie. [ 17 ] in october 1753, dinwiddie appointed washington as a special envoy to demand the french forces vacate land that was claimed by the british. washington was also directed to make peace with the iroquois confederacy and to gather intelligence about the french forces. [ 18 ] washington met with iroquois leader tanacharison at logstown. [ 19 ] washington said that at this meeting tanacharison named him conotocaurius. this name, meaning "" devourer of villages "", had previously been given to his great - grandfather john washington in the late 17th century by the susquehannock. [ 20 ] washington\'s party reached the ohio river in november 1753 and was intercepted by a french patrol. the party was escorted to fort le boeuf, where washington was received in a friendly manner.', 'breakup of the virginia breakup of the virginia regiment and regiment and resignation on eve of resignation on eve of french & indian warfrench & indian war • • on the heels of the fort necessity fiasco came the on the heels of the fort necessity fiasco came the mobilization of state militias called by the governors mobilization of state militias called by the governors of maryland, virginia and north carolina to combine of maryland, virginia and north carolina to combine their forces under the maryland governor. their forces under the maryland governor. • • this had the effect of breaking the virginia regiment this had the effect of breaking the virginia regiment into individual companies, commanded by captains. into individual companies, commanded by captains. • • since washington would be demoted three ranks, he since washington would be demoted three ranks, he resigned from the virginia militia and again took up resigned from the virginia militia and again took up residence at mt. vernon. residence at mt. vernon.', 'colonial colonel and colonial colonel and national hero national hero • • upon their return to virginia washington was the subject of upon their return to virginia washington was the subject of considerable acclaim. braddockconsiderable acclaim. braddock ’ ’ s aides aide - - dede - - camp, major camp, major ormeorme,, described him as an example of described him as an example of “ “ the greatest courage and the greatest courage and resolutionresolution ” ”.. • • governor dinwiddie again established the virginia regiment and governor dinwiddie again established the virginia regiment and named young named young washington as its colonelwashington as its colonel. during. during 17551755 - - 5656 washington established a chain of farwashington established a chain of far - - flung outposts. flung outposts. • • in in may 1756may 1756 the english declared war on france and in the colonies the english declared war on france and in the colonies this became known as the this became known as the “ “ french & indian warfrench & indian war ” ”,, whereupon the whereupon the french province of canada fell to the english. french province of canada fell to the english. • • washington hoped his efforts would secure him a commission']",False,10,3,3,3,54.765511989593506,0.5354664921760559,single_hop_specifc_query_synthesizer,"['During the French & Indian War, the governors of Maryland, Virginia, and North Carolina mobilized their state militias to combine their forces under the Maryland Governor. This mobilization had the effect of breaking the Virginia Regiment into individual companies commanded by captains.']",0.49999999995,0.0,0.879867944545753,1.0,0.5952374308241557,0.8808772540521818
"Could you provide a detailed account of Washington's role and experiences during the Braddock Expedition, highlighting the challenges he faced and his contributions to the campaign?"," In the annals of history, I, George Washington, stand as a testament to the indomitable spirit of perseverance and leadership. During the Braddock Expedition, I played a pivotal role as an aide to General Edward Braddock, who led a British expedition to expel the French from Fort Duquesne and the Ohio Country. My counsel led Braddock to split the army into one main column and a smaller ""flying column."" However, my own health was frail, and I did not initially accompany the expedition forces. When I rejoined Braddock at Monongahela, still ill, our fate was sealed as the French and their Indian allies ambushed the divided army in the Battle of the Monongahela. Braddock met his end in that fateful day, but I rallied the survivors and formed a rear guard, allowing the remnants of our force to retreat. Despite facing challenges such as overconfidence and a sluggish pace through the uncharted wilderness, my contributions to the campaign were manifold: my recommendation to split the army and my steadfast leadership in forming a rear guard after Braddock's demise.","['the french and indian war. [ 32 ] in 1755, washington volunteered as an aide to general edward braddock, who led a british expedition to expel the french from fort duquesne and the ohio country. [ 33 ] on washington\'s recommendation, braddock split the army into one main column and a smaller "" flying column "". [ 34 ] washington was suffering from severe dysentery so did not initially travel with the expedition forces. when he rejoined braddock at monongahela, still very ill, the french and their indian allies ambushed the divided army. two - thirds of the british force became casualties in the ensuing battle of the monongahela, and braddock was killed. under the command of lieutenant colonel thomas gage, washington rallied the survivors and formed a rear guard, allowing the remnants of the force to retreat. [ 35 ] during the engagement, washington had two horses shot out from under him, and his hat and coat were pierced by bullets. [ 36 ] his conduct redeemed his reputation among critics of his command in the battle of fort necessity, [ 37 ] but he was not included by the succeeding commander ( colonel thomas dunbar ) in planning subsequent operations. [ 38 ] the virginia regiment was reconstituted in august 1755,', 'famous roster of participantsfamous roster of participants • • the braddock expedition included the braddock expedition included washingtonwashington, daniel boone,, daniel boone, majmaj horatio horatio gatesgates,, majmaj thomas gagethomas gage, christopher gist,, christopher gist, dr. james dr. james craikcraik,, daniel morgandaniel morgan,, cptcpt. roger. roger morris, george morris, george croghancroghan,, adam stephenadam stephen,, charles leecharles lee, and indian chief pontiac., and indian chief pontiac. • • eight of these became generals in the eight of these became generals in the american revolution, one camerican revolution, one c - - inin - - c of the c of the british forces, two considered for cbritish forces, two considered for c - - inin - - c of c of american forces, and one became president american forces, and one became president of the united statesof the united states', 'overconfidence and a overconfidence and a snailsnail ’ ’ s pace through the s pace through the unblazedunblazed wildernesswilderness • • instead of heeding washingtoninstead of heeding washington ’ ’ s advice to dispense with wagons, s advice to dispense with wagons, braddock set about to pull everything he was accustomed to braddock set about to pull everything he was accustomed to carrying through the carrying through the unblazedunblazed wilderness. wilderness. • • his force soon became badly dispersed over a distance of almost his force soon became badly dispersed over a distance of almost 20 miles! washington continued advising against using wagons, 20 miles! washington continued advising against using wagons, but braddock refused his every suggestion. but braddock refused his every suggestion. • • discouraged, washington contracted a severe case of dysentery discouraged, washington contracted a severe case of dysentery and was obliged to ride in a wagon in the rear of the traveling and was obliged to ride in a wagon in the rear of the traveling force. force. • • braddock eventually relented and adopted washingtonbraddock eventually relented and adopted washington ’ ’ s s suggestion to take an advance force of 1200']",False,10,3,3,3,84.42023992538452,0.5213297009468079,single_hop_specifc_query_synthesizer,"['During the Braddock Expedition, Washington played a significant role despite numerous challenges. Initially, General Braddock refused Washington\'s advice to dispense with wagons, insisting on pulling all his accustomed equipment through the unblazed wilderness, which caused the force to become badly dispersed over almost 20 miles. Washington continued to advise against using wagons, but Braddock rejected his suggestions. Discouraged and suffering from severe dysentery, Washington was forced to ride in a wagon at the rear of the traveling force. Eventually, Braddock relented and adopted Washington\'s suggestion to send an advance force of 1,200 men forward without wagons, leaving Washington behind. However, this advance force was harassed by marauding Indians who took scalps, terrifying the British regulars. Washington regained enough strength to rejoin Braddock on July 8th along the Monongahela River, about 12 miles upstream of The Forks of the Ohio. On July 9th, the English force, spread out over a mile-long track, attempted to ford the Monongahela twice while sending Major Gage forward with an advance force to protect the fords from ambush. Around 2:30 PM, Gage\'s troops were ambushed, causing the terrified redcoats to break ranks and retreat in confusion. Braddock and other officers tried to calm the men but failed. The British officers, except for Washington, were either wounded or killed. Colonial troops attempted to fight the French on their own terms in the woods but were mistakenly fired upon by their British allies. Despite the defeat being one of the worst in British colonial history, Washington emerged as a ""bullet proof hero of the Monongahela.""']",0.9999999999666667,0.6428571428571429,0.9187201211243606,0.38461538461538464,0.44445050321487367,0.9206591557166376
What role Fort Duquesne play in Washington's 4th trip?," Fort Duquesne, a strategic outpost of the British Empire, bore witness to my fourth expedition, as it was the focal point of a three-pronged offensive launched by the enemy. My mission was to join forces with the British troops stationed there, but alas, I arrived too late. The fort had already been captured by the French and renamed Fort Duquesne. Undeterred, I pressed on with my small contingent, only to be met with defeat and capture at the Battle of Fort Duquesne in 1758. The lessons learned from this fateful encounter would later inform my strategy and leadership during the American Revolutionary War.","['washingtonwashington ’ ’ s fourth trip to s fourth trip to the forks of the ohiothe forks of the ohio • • between between august 1757august 1757 and and april 1758april 1758 he again contracted dysentery and he again contracted dysentery and was forced to convalesce at mt. vernon before returning to duty was forced to convalesce at mt. vernon before returning to duty just in just in time for the last british expedition to the forks of the ohio ( htime for the last british expedition to the forks of the ohio ( his 4th trip ). is 4th trip ). • • the english mounted an allthe english mounted an all - - out threeout three - - pronged offensive, one of which pronged offensive, one of which was aimed at fort duquesne, at the confluence of the allegheny awas aimed at fort duquesne, at the confluence of the allegheny and nd monongahela rivers ( in present day pittsburgh ). monongahela rivers ( in present day pittsburgh ). • • to washingtonto washington ’ ’ s delight, the english had finally decided to recognize the s delight, the english had finally decided to recognize the rank precedence of colonial field officers in comparison to', 'george washington was proud to be an officer in the virginia militia. 29 this, virginia would have more control of the ohio river and the smaller rivers that flowed from and fed into the larger river. one year later, in 1754, he sent george washington to the west again. this time washington led a force of 150 men. the british had built a small fort in western pennsylvania on the site of present - day pittsburgh. the fort sat where two rivers come together to form the ohio river. washington was to join forces with the british soldiers at the fort. before he arrived, washington learned that the french had already captured the british fort and renamed it fort duquesne ( / doo * kayn / ). in time, george washington would become a great general, but in 1754, he was young and inexperienced. he made a number of mistakes. washington did not have enough men to drive the french out of the fort. the wisest thing to do would have been to return to virginia. instead, he continued on with his small force. vocabulary general, n. the main leader of an army', ""not included by the succeeding commander ( colonel thomas dunbar ) in planning subsequent operations. [ 38 ] the virginia regiment was reconstituted in august 1755, and dinwiddie appointed washington its commander, again with the rank of colonel. washington clashed over seniority almost immediately, this time with captain john dagworthy, who commanded a detachment of marylanders at the regiment's headquarters in fort cumberland. [ 39 ] washington, impatient for an offensive against fort duquesne, was convinced braddock would have granted him a royal commission and pressed his case in february 1756 with braddock's successor as commander - in - chief, william shirley, and again in january 1757 with shirley's successor, lord loudoun. loudoun humiliated washington, refused him a royal commission, and agreed only to relieve him of the responsibility of manning fort cumberland. [ 40 ] in 1758, the virginia regiment was assigned to the british forbes expedition to capture fort duquesne. [ 41 ] [ 31 ] general john forbes took washington's advice on some aspects of the expedition but rejected his opinion on the best route to the fort. [ 42 ] forbes nevertheless made washington a brevet brigadier general and gave him command of one of the three brigades that was assigned to assault the""]",False,10,3,3,3,56.76952314376831,0.44143667817115784,single_hop_specifc_query_synthesizer,"['Fort Duquesne was the target of the last British expedition to the Forks of the Ohio, led by British Brigadier John Forbes with Washington as a Colonel under his command. The expedition aimed to capture Fort Duquesne, located at the confluence of the Allegheny and Monongahela Rivers in present-day Pittsburgh.']",0.9999999999666667,0.5555555555555556,0.8958365076755105,1.0,0.4921715073006421,0.909948248896193
how george washington early military career and washington expedition to ohio country show his rise to fame and military skill?," As I embarked upon my early military journey, I demonstrated my prowess in leadership and strategic thinking through my exploits in the Ohio country. In 1754, I led a force of 150 men to join forces with British soldiers at a fort in western Pennsylvania. Despite my initial missteps and the insufficient number of men at my disposal, I was able to gain valuable experience and recognition as a military leader through my leadership and strategic thinking in battle. This recognition ultimately paved the way for my rise to fame and command of the Continental Army during the American Revolution, where I would lead our brave forces to victory against the tyranny of the British Empire.","['on july 3, 1775, george washington took command of the continental army. 85 man to lead the continental army, as it came to be called. he had gained his military experience in the french and indian war. after that, he returned to mount vernon, virginia, to run his plantation. he was a member of the virginia house of burgesses and a supporter of the patriot cause. he was also among the best - known and wealthiest men in the colonies. everyone admired him for his devotion to duty, his cool head, and strong will. it was settled. washington would command the continental army, and its first troops would be the massachusetts militiamen camped around boston. they might be needed for action soon. more british soldiers were arriving in the colonies. washington headed to massachusetts to take charge of the militia. before his arrival, though, the american soldiers fought an important battle near boston. two hills overlook the city of boston : bunker hill and breed ’ s hill. every general knows that it ’ s a great advantage to control the high ground. from the top of a hill, you can fire down at the enemy below — especially if you have cannons. meanwhile, the enemy has to fight', 'mount rushmore national memorial washington is one of the most influential figures in american history. [ 321 ] virginia\'s governor henry lee eulogized him as "" first in war, first in peace, and first in the hearts of his countrymen "". [ 31 ] polls have consistently placed washington among the highest - ranked of presidents. [ 322 ] [ 323 ] [ 324 ] washington became an international symbol for liberation and nationalism as the leader of the first successful revolution against a colonial empire. [ 325 ] in 1879, congress proclaimed washington\'s birthday to be a federal holiday. [ 326 ] in 1976, he was posthumously appointed general of the armies of the united states during the american bicentennial. president gerald ford stated that washington would "" rank first among all officers of the army, past and present "". [ m ] [ 328 ] on march 13, 1978, washington was officially promoted by the army. [ 329 ] in 1809, mason locke weems wrote a hagiographic biography to honor washington. [ 330 ] chernow maintains that weems attempted to humanize washington, inspire "" patriotism and morality "", and foster "" enduring myths "", such as that of washington\'s refusal to lie about damaging his father\'s cherry tree. [ 331 ] [', 'george washington was proud to be an officer in the virginia militia. 29 this, virginia would have more control of the ohio river and the smaller rivers that flowed from and fed into the larger river. one year later, in 1754, he sent george washington to the west again. this time washington led a force of 150 men. the british had built a small fort in western pennsylvania on the site of present - day pittsburgh. the fort sat where two rivers come together to form the ohio river. washington was to join forces with the british soldiers at the fort. before he arrived, washington learned that the french had already captured the british fort and renamed it fort duquesne ( / doo * kayn / ). in time, george washington would become a great general, but in 1754, he was young and inexperienced. he made a number of mistakes. washington did not have enough men to drive the french out of the fort. the wisest thing to do would have been to return to virginia. instead, he continued on with his small force. vocabulary general, n. the main leader of an army']",False,10,3,3,3,53.97444796562195,0.4991859495639801,multi_hop_abstract_query_synthesizer,"[""George Washington's early military career began in 1753 when, inspired by his stepbrother and supported by influential patrons, he was appointed district adjutant for the Northern Neck of Virginia, becoming a major in the Virginia militia just before his 21st birthday. In 1754, he was assigned to explore the Ohio Country to determine if the French were building forts there. During this expedition, despite harsh winter conditions, Washington made contact with local Iroquois and reached the French Fort Le Boeuf, where he demanded the French leave. His detailed report and map of the expedition were published widely, bringing him considerable notoriety. Later that year, as a newly promoted Lieutenant Colonel, Washington led a force to confront the French, ambushing a French diplomatic party and killing its leader, which triggered a French retaliation. Washington hastily built Fort Necessity but was forced to surrender after a French attack. Although this expedition was a military failure, it raised Washington's profile both in the Colonies and abroad. His early military actions, including his detailed reporting and leadership in the Ohio Country, demonstrated his military skill and helped establish his reputation, setting the stage for his later prominence.""]",0.8333333332916666,0.75,0.8440269281323557,0.5,0.3519567160977416,0.8934357552388124
