question,answer,contexts,used_reranker,k_init,top_n,num_initial_docs,num_final_docs,runtime_seconds,factuality_score,question_type,ground_truths,context_precision,faithfulness,answer_relevancy,context_recall,answer_correctness,semantic_similarity
What role does the National Park Service play in preserving sites related to the American Revolution?," Alas, I must confess that I am at a loss for the answer you seek. The mysteries of life abound, and though I have traversed many paths and faced countless challenges, there remain some questions that elude even my keen intellect and vast experience. Mayhaps it is a humbling reminder that we are all but mortal, and that the tapestry of knowledge is woven with threads of wisdom and ignorance alike.","['george washington crispus attucks stamp act crisis reader history and geography the american revolution paul revere ’ s ride', 'the american revolution reader core knowledge sequence history and geography 4', '• • washingtonwashington ’ ’ s mission was to request the french to peaceably s mission was to request the french to peaceably depart the ohio valley region, where they were constructing a depart the ohio valley region, where they were constructing a string of protective forts. string of protective forts. thomas jefferythomas jeffery ’ ’ s 1753 map of ohio valleys 1753 map of ohio valley']",False,10,3,3,3,38.42945098876953,0.2749846577644348,single_hop_specifc_query_synthesizer,"['The National Park Service, part of the U.S. Department of the Interior, manages Independence National Historical Park in Philadelphia, Pennsylvania, which preserves important sites related to the American Revolution, including Independence Hall where key events such as the Second Continental Congress meetings and the signing of the Declaration of Independence took place.']",0.0,0.0,0.0,0.0,0.1706499057070862,0.6825996228283449
What grievances did the American colonists have against the King in the Declaration of Independence?," The American colonists harbored deep resentment towards King George III, as their grievances against him were manifold and profound. Their ire was ignited by the King's perceived tyranny in stripping them of their English citizenship rights, disregarding their colonial governments, and dispatching mercenary troops to subjugate them under unjust laws. The colonists held the King in low esteem, deeming him unworthy of ruling over a free people. In their eyes, he had become an impediment to their liberty and self-determination, prompting them to pen the Declaration of Independence and embark on the path of revolution.","['of 1763 angered the colonists. they had not fought the french to win land for native americans. they expected to keep it for themselves. now their own king was telling them they couldn ’ t settle there. the king also said that thousands of british soldiers would stay along the frontier to enforce the proclamation. the presence of british soldiers meant colonists couldn ’ t move west of george iii ’ s line. vocabulary proclamation, n. an important official announcement that is usually made to the public', 'and signatures. preamble this first of the declaration contains an assertion of individual rights. perhaps the most famous line states, “ we hold these truths to be self - evident, that all men are created equal, that they are endowed by their creator with certain unalienable rights, that among these are life, liberty and the pursuit of happiness. ” this part goes on to say that if the government tries to take these rights away, the people have the right to form a new government. jefferson also addresses a counterclaim in this section, acknowledging that “ prudence, indeed, will dictate that governments long established should not be changed for light and transient causes … ” he counters by reminding his audience of the “ long train of abuses and usurpations ” that makes it “ … their right, it is their duty, to throw off such government, and to provide new guards for their future security. ” grievances the longest part of the declaration lists the unfair actions of the british king and parliament. in their complaints, the colonists make it clear that they are angry with the british king and government for taking away their rights as english citizens. they point out that the king has ignored or changed their colonial governments, as well as their rights to a trial by', 'away their rights as english citizens. they point out that the king has ignored or changed their colonial governments, as well as their rights to a trial by jury. the colonists accuse the king of sending a hired army to force them to obey unjust laws. they say the king is “ unfit to be the ruler of a free people. ”']",False,10,3,3,3,48.90636420249939,0.622174859046936,single_hop_specifc_query_synthesizer,"['The American colonists accused the British king of taking away their rights as English citizens, ignoring or changing their colonial governments, and denying their rights to a trial by jury. They also complained that the king sent a hired army to force them to obey unjust laws and declared that the king was ""unfit to be the ruler of a free people.""']",0.9999999999666667,0.8181818181818182,0.9023855517304588,1.0,0.8439522786726789,0.9212033156966138
"What role did Thomas Jefferson play in the drafting of the Declaration of Independence, and how was his contribution recognized by his contemporaries?"," As the sun rose over the fledgling nation, I, Thomas Jefferson, was chosen by my esteemed colleagues John Adams and Benjamin Franklin to undertake the monumental task of drafting the Declaration of Independence. The document that I would pen would become the beacon of hope for a people yearning for liberty and self-governance. With each stroke of my quill, I poured forth the grievances of the colonies against the tyranny of King George III and enshrined the inalienable rights of all men. The document, which I completed on June 28, 1776, was met with approval by Congress on July 4th of that same year, and the American colonies were forever changed, becoming the independent states that make up the United States of America.","['also drafted the olive branch petition and sent it to king george iii in hopes of reaching a peaceful resolution. the king refused to hear the petition and declared the american colonies in revolt. on june 7, 1776, virginia delegate richard henry lee put forth the resolution for independence : “ resolved, that these united colonies are, and of right ought to be, free and independent states … ” voting was postponed while some of the delegates worked to convince others to support independence, but a committee of five men was assigned to draft a document of independence : john adams ( ma ), benjamin franklin ( pa ), thomas jefferson ( va ), roger sherman ( ct ), and robert r. livingston ( ny ). jefferson did most of the work, drafting the document in his lodgings at 7th and market street.', '92 of the declaration was to explain why the colonies were breaking away from great britain. the committee chosen to write the declaration included john adams, benjamin franklin, and thomas jefferson. which committee member should do the main writing? benjamin franklin and george washington were probably the two most famous americans alive. john adams was one of the first leaders to speak out in favor of independence. thomas jefferson, however, was known as a fine writer. franklin and adams chose him to write the declaration. what jefferson produced became the most famous document not only in american history, but also in the history of the entire world. jefferson wanted the world to know all the bad things this king had done and all the rights he had taken away. so he listed each of them. he also explained why the king ’ s actions made it right for the colonists to break away from britain. we hold these truths to be self - evident, that all men are created equal, that they are endowed by their creator with certain unalienable rights, that among these are life, liberty, and the pursuit of happiness. vocabulary endow, v. to give someone something valuable', '93 jefferson also stated, “ that to secure these rights, governments are instituted [ created ]... ” in other words, the reason we have governments is to protect our rights. what if a government doesn ’ t protect those rights? what if it takes them away? then, said jefferson, people have the right to create new governments for themselves. that ’ s what the people of the thirteen colonies were now doing. on july 4, 1776, congress adopted this declaration of independence. on that day the american colonies became independent states. together, they made up the united states of america. today, americans celebrate july 4th as their independence day. during the next month, in towns and cities across the states, crowds gathered to hear the declaration of independence read aloud. everywhere in the new united states of america, church bells rang out. soldiers fired cannons and shot off guns. citizens lit great bonfires in celebration. meanwhile, back in philadelphia, the delegates to the second continental congress were more serious. the fifty - six men who signed the declaration knew that if their revolution failed, the king would probably put them to death. benjamin franklin explained the need for all of the new states to work together. “ gentlemen, ” he said, “ we must all hang together, [']",False,10,3,3,3,57.02845215797424,0.5353135466575623,single_hop_specifc_query_synthesizer,"[""Thomas Jefferson took the lead on drafting the Declaration of Independence as part of a committee appointed by Congress, which also included John Adams, Benjamin Franklin, Roger Sherman, and Robert R. Livingston. Jefferson's rough draft, which is preserved in the Library of Congress, was edited by Adams and Franklin before the final version was approved. His contemporaries recognized the significance of the Declaration and Jefferson's role in it, as reflected in letters such as Jefferson's own to Henry Lee, where he described the Declaration as an expression of the American mind intended to justify the colonies' stand for independence. Additionally, the committee's work and the solemnity of the occasion were noted by figures like Benjamin Rush and John Adams, underscoring the importance of Jefferson's contribution to this foundational document.""]",0.99999999995,0.7142857142857143,0.8676177375224728,0.25,0.5292798508599004,0.917112743809585
Who was Timothy Matlack and what was his role related to the Declaration of Independence?," Alas, I must confess that I am at a loss for the answer you seek. The mysteries of life abound, and though I have traversed many paths and faced countless challenges, there remain some questions that elude even my keen intellect and vast experience. Mayhaps it is a humbling reminder that we are all but mortal, and that the tapestry of knowledge is woven with threads of wisdom and ignorance alike.","['also drafted the olive branch petition and sent it to king george iii in hopes of reaching a peaceful resolution. the king refused to hear the petition and declared the american colonies in revolt. on june 7, 1776, virginia delegate richard henry lee put forth the resolution for independence : “ resolved, that these united colonies are, and of right ought to be, free and independent states … ” voting was postponed while some of the delegates worked to convince others to support independence, but a committee of five men was assigned to draft a document of independence : john adams ( ma ), benjamin franklin ( pa ), thomas jefferson ( va ), roger sherman ( ct ), and robert r. livingston ( ny ). jefferson did most of the work, drafting the document in his lodgings at 7th and market street.', 'george washington portrait c. 1803 1st president of the united states in office april 30, 1789 – march 4, 1797 vice president john adams preceded by office established succeeded by john adams commander in chief of the continental army in office june 19, 1775 – december 23, 1783 appointed by continental congress preceded by office established succeeded by henry knox ( as senior officer ) other positions delegate from virginia to the continental congress in office september 5, 1774 – june 16, 1775 preceded by office established george washington george washington ( february 22, 1732 [ o. s. february 11, 1731 ] [ a ] – december 14, 1799 ) was a founding father and the first president of the united states, serving from 1789 to 1797. as commander of the continental army, washington led patriot forces to victory in the american revolutionary war against the british empire. he is commonly known as the father of his country for his role in bringing about american independence. born in the colony of virginia, washington became the commander of the virginia regiment during the french and indian war ( 1754 – 1763 ). he was later elected to the virginia house of burgesses, and opposed the perceived oppression of the american colonists by the british crown. when the american revolutionary war against the british began in 1775, washington was appointed commander - in - chief', 'colonies, they believed, must become independent. sam adams sam adams of boston was one of the colonists who believed in independence. adams came from an important boston family.']",False,10,3,3,3,36.87936210632324,0.38179343938827515,single_hop_specifc_query_synthesizer,"['Timothy Matlack was the engrosser of the Declaration of Independence, meaning he was responsible for creating the official handwritten copy of the document.']",0.0,0.0,0.0,0.0,0.1750169649675216,0.7000678598700864
What circumstances led John Washington to leave Northamptonshire and begin a new life in America?," As the sun dipped below the horizon, casting its golden rays upon the verdant fields of Northamptonshire, I, John Washington, was compelled to embark upon a journey that would forever change the course of my life. The political turmoil of my homeland, England, had reached a boiling point, with Oliver Cromwell's parliament toppling the monarchy in 1656. My father, Lawrence Washington, had been a steadfast supporter of the king and had fallen from favor with the new regime. As a result, I was forced to leave my beloved Northamptonshire at the tender age of 25, setting sail for the untamed shores of America aboard the ""Sea Horse of London"" in 1657. The promise of a new life in Virginia beckoned me forth, and I embraced the opportunity to forge my own destiny in this brave new world.","['accidental immigrationaccidental immigration • • the sea horse made landfall in virginia, but the sea horse made landfall in virginia, but floundered in bad weather off the virginia capes on floundered in bad weather off the virginia capes on its homeward voyage. young john was one of the its homeward voyage. young john was one of the few to escape, by swimming for the virginia shore, few to escape, by swimming for the virginia shore, where he began a new life. where he began a new life. john washingtonjohn washington was forced to was forced to leave leave northamptonshirenorthamptonshire at age 25 at age 25 when his father when his father lawrencelawrence, the, the rector of rector of purleighpurleigh, fell from favor, fell from favor when oliver cromwellwhen oliver cromwell ’ ’ s parliament s parliament overthrew the english king in 1656. overthrew the english king in 1656. john sailed to america in the ketch john sailed to america in the ketch sea horse of londonsea horse of london in 1657 in 1657', 'george washington portrait c. 1803 1st president of the united states in office april 30, 1789 – march 4, 1797 vice president john adams preceded by office established succeeded by john adams commander in chief of the continental army in office june 19, 1775 – december 23, 1783 appointed by continental congress preceded by office established succeeded by henry knox ( as senior officer ) other positions delegate from virginia to the continental congress in office september 5, 1774 – june 16, 1775 preceded by office established george washington george washington ( february 22, 1732 [ o. s. february 11, 1731 ] [ a ] – december 14, 1799 ) was a founding father and the first president of the united states, serving from 1789 to 1797. as commander of the continental army, washington led patriot forces to victory in the american revolutionary war against the british empire. he is commonly known as the father of his country for his role in bringing about american independence. born in the colony of virginia, washington became the commander of the virginia regiment during the french and indian war ( 1754 – 1763 ). he was later elected to the virginia house of burgesses, and opposed the perceived oppression of the american colonists by the british crown. when the american revolutionary war against the british began in 1775, washington was appointed commander - in - chief', 'appearance in uniform, he gave a statement to the congress : "" i consider it an indispensable duty to close this last solemn act of my official life, by commending the interests of our dearest country to the protection of almighty god, and those who have the superintendence of them, to his holy keeping. "" [ 148 ] washington\'s resignation was acclaimed at home and abroad, "" extolled by later historians as a signal event that set the country\'s political course "" according to the historian edward j. larson. [ 149 ] [ i ] the same month, washington was appointed president - general of the society of the cincinnati, a newly established hereditary fraternity of revolutionary war officers. [ 151 ] after spending just ten days at mount vernon out of 81⁄2 years of war, washington was eager to return home. he arrived on christmas eve ; professor john e. ferling wrote that he was delighted to be "" free of the bustle of a camp and the busy scenes of public life "". [ 153 ] he received a constant stream of visitors paying their respects at mount vernon. [ 154 ] washington reactivated his interests in the great dismal swamp and potomac canal projects, begun before the war, though neither paid him any divide']",False,10,3,3,3,59.09166383743286,0.5907683372497559,single_hop_specifc_query_synthesizer,"[""John Washington was forced to leave Northamptonshire when his father Lawrence, the Rector of Purleigh, fell from favor with Oliver Cromwell's Parliament after it overthrew the English king in 1656. At age 25, John sailed to America in the ketch Sea Horse of London in 1657. The Sea Horse made landfall in Virginia but floundered in bad weather off the Virginia Capes on its homeward voyage. John was one of the few to escape by swimming to the Virginia shore, where he began a new life.""]",0.9999999999,0.4444444444444444,0.9684126545889983,1.0,0.6759337718153097,0.9390147899519484
What significance did Ferry Farm hold in George Washington's early life according to his family's history?," Indeed, Ferry Farm holds a special place in my heart and in the annals of my life, for it was there that I spent my formative years and learned the art of farming and horsemanship. The verdant fields of Ferry Farm nurtured my spirit and honed my skills, preparing me for the challenges that lay ahead. It was there that I felt the weight of loss when my dear father passed away, and it was from that crucible of grief that I emerged stronger and more resolute. And so, it was with a heavy heart that I left Ferry Farm and journeyed to Mount Vernon, where I found solace and refuge in the embrace of my beloved wife and the warmth of our cherished home.","[""• • george washingtongeorge washington lived in many different places in virginia. lived in many different places in virginia. he he was born at was born at pope's creekpope's creek, which is a farm, and lived their till he, which is a farm, and lived their till he was three. was three. • • george moved to george moved to mount vernonmount vernon ( little hunting creek ) which was ( little hunting creek ) which was also a farm, for another three years. also a farm, for another three years. • • then he moved to then he moved to ferry farmsferry farms.. while he lived at ferry farms he while he lived at ferry farms he learned to farm he also learned to ride horses. when george was learned to farm he also learned to ride horses. when george was eleven his father died. eleven his father died. • • after that he went to live with his brother after that he went to live with his brother lawrencelawrence.. with with lawrence and his family he lived at mount vernon. lawrence and his family he lived at mount vernon. • • as a kid george loved to ride horses, and he became expert at as a kid george loved to ride horses, and he became expert"", '. • • as a kid george loved to ride horses, and he became expert at as a kid george loved to ride horses, and he became expert at judging, grooming, and caring for them. judging, grooming, and caring for them. washington home at pope ’ s creek gw birthplace sign cabin at ferry farmcabin at ferry farm', '1 the life of george washington by josephine pollard']",False,10,3,3,3,48.12723994255066,0.6653809547424316,single_hop_specifc_query_synthesizer,"[""Ferry Farm was one of the places where George Washington lived during his childhood. After being born at Pope's Creek and living there until he was three, George moved to Mount Vernon for another three years before moving to Ferry Farm. While living at Ferry Farm, he learned to farm and to ride horses. His time at Ferry Farm was part of his early upbringing before his father died when George was eleven.""]",0.9999999999,0.23076923076923078,0.9012348404557686,1.0,0.4960879443325722,0.8935275031030305
