question,answer,contexts,used_reranker,k_init,top_n,num_initial_docs,num_final_docs,runtime_seconds,factuality_score,question_type,ground_truths,context_precision,faithfulness,answer_relevancy,context_recall,answer_correctness,semantic_similarity
"How did George Washington's early military leadership during the French and Indian War, including his relations and negotiations with Native Americans, influence his development of military strategy and tactics to address the challenges of frontier warfare and logistics?"," As I stood on the precipice of my military career, I was honed by the fires of conflict and diplomacy in my role as adjutant general of the Virginia militia and later as a special envoy to demand the French forces vacate land claimed by the British. Through these experiences, I gained a profound understanding of the challenges of frontier warfare and logistics, and the importance of effective communication, negotiation, and diplomacy in resolving conflicts with Native Americans and other stakeholders.

My interactions with Native Americans during my mission to demand the French forces vacate land claimed by the British gave me invaluable insights into their culture, customs, and motivations. I learned that in order to achieve common goals and avoid conflict, it was essential to build trust and rapport with them. This knowledge influenced my approach to military strategy and tactics, as I recognized the importance of understanding and adapting to local conditions and cultures in order to succeed in frontier warfare.

As I continued my military journey, I carried these lessons with me and applied them in my leadership of the Continental Army during the Revolutionary War. Through my experience and wisdom, I was able to guide my troops to victory and establish the United States as","['the french and indian war. [ 32 ] in 1755, washington volunteered as an aide to general edward braddock, who led a british expedition to expel the french from fort duquesne and the ohio country. [ 33 ] on washington\'s recommendation, braddock split the army into one main column and a smaller "" flying column "". [ 34 ] washington was suffering from severe dysentery so did not initially travel with the expedition forces. when he rejoined braddock at monongahela, still very ill, the french and their indian allies ambushed the divided army. two - thirds of the british force became casualties in the ensuing battle of the monongahela, and braddock was killed. under the command of lieutenant colonel thomas gage, washington rallied the survivors and formed a rear guard, allowing the remnants of the force to retreat. [ 35 ] during the engagement, washington had two horses shot out from under him, and his hat and coat were pierced by bullets. [ 36 ] his conduct redeemed his reputation among critics of his command in the battle of fort necessity, [ 37 ] but he was not included by the succeeding commander ( colonel thomas dunbar ) in planning subsequent operations. [ 38 ] the virginia regiment was reconstituted in august 1755,', 'map showing key locations in the french and indian war lawrence washington\'s service as adjutant general of the virginia militia inspired george to seek a militia commission. virginia\'s lieutenant governor, robert dinwiddie, appointed washington as a major and commander of one of the four militia districts. the british and french were competing for control of the ohio river valley : the british were constructing forts along the river, and the french between the river and lake erie. [ 17 ] in october 1753, dinwiddie appointed washington as a special envoy to demand the french forces vacate land that was claimed by the british. washington was also directed to make peace with the iroquois confederacy and to gather intelligence about the french forces. [ 18 ] washington met with iroquois leader tanacharison at logstown. [ 19 ] washington said that at this meeting tanacharison named him conotocaurius. this name, meaning "" devourer of villages "", had previously been given to his great - grandfather john washington in the late 17th century by the susquehannock. [ 20 ] washington\'s party reached the ohio river in november 1753 and was intercepted by a french patrol. the party was escorted to fort le boeuf, where washington was received in a friendly manner.', 'chapter 5 the french and indian war a war in the colonies washington ’ s small battle against the french started the french and indian war. on one side was france, their french colonists in north america, and their native american allies. on the other side was great britain, their british colonists in north america, and their native american allies. great britain and france had been fighting each other on and off for nearly a hundred years. no one was surprised that they were at war again. the two european countries had colonies all over the world. both wanted to control the other ’ s colonies. it was no surprise when the war that began in north america spread to two other continents and the atlantic, pacific, and indian oceans. in europe and asia, the war was called the seven years ’ war. in north america, it was called the french and indian war. 32 the big question how did the british defeat the french in the french and indian war?']",True,10,3,10,3,114.35244083404541,0.6183258891105652,multi_hop_abstract_query_synthesizer,"[""During the French and Indian War, George Washington demonstrated early military leadership that was shaped significantly by his experiences with Native Americans and the difficulties of frontier warfare. In one instance, Washington and his companion Gist managed a tense encounter with a Native American by using negotiation and strategic deception to avoid conflict, showing his early skill in relations and diplomacy with Native peoples. Washington also led a force of raw troops who were difficult to manage, relying on the guidance of experienced officers like Van Braam and Native allies such as Half-King. He learned the importance of securing Native cooperation through gifts, as Native guides would not assist without compensation, reflecting the complexities of frontier alliances. Washington's tactical acumen was evident in his surprise attack on the French camp, where he coordinated with Native warriors to outflank and rout the enemy, marking the first bloodshed of the war and demonstrating his ability to integrate irregular warfare tactics suited to the frontier environment. He faced severe logistical challenges, including harsh terrain, scarce provisions, and the need to build roads and forts under threat of enemy and Native attacks. Washington's efforts to maintain troop morale and discipline among poorly equipped and reluctant soldiers further honed his leadership. These experiences during the French and Indian War provided Washington with critical knowledge of military strategy and tactics adapted to frontier conditions, including the use of guerrilla-style engagements, the necessity of Native alliances, and the management of supply and movement in difficult wilderness terrain. This foundation influenced his later command decisions and contributed to his reputation as a capable and resilient military leader.""]",0.9999999999666667,0.09090909090909091,0.8488318721960001,0.4444444444444444,0.4347501776287287,0.881779665464242
"how did george washington show early military leadership by managing raw troops and negotiating with native americans during the french and indian war, especially given the challenges of frontier warfare and logistics?"," As the sun rose over the rugged terrain of the French and Indian War, I, George Washington, found myself in the midst of a crucible of conflict and challenge. As adjutant general of the Virginia militia and a special envoy to demand the French forces vacate land claimed by the British and make peace with the Iroquois confederacy, I was tasked with managing raw troops and navigating complex diplomatic and cultural differences with the native Americans. Despite the daunting challenges of frontier warfare and logistics, I was able to rally the survivors of the battle of the Monongahela and form a rear guard, allowing the remnants of the force to retreat. Through these trials and tribulations, I honed my skills in leadership and diplomacy, laying the groundwork for my future military and political success.","['on july 3, 1775, george washington took command of the continental army. 85 man to lead the continental army, as it came to be called. he had gained his military experience in the french and indian war. after that, he returned to mount vernon, virginia, to run his plantation. he was a member of the virginia house of burgesses and a supporter of the patriot cause. he was also among the best - known and wealthiest men in the colonies. everyone admired him for his devotion to duty, his cool head, and strong will. it was settled. washington would command the continental army, and its first troops would be the massachusetts militiamen camped around boston. they might be needed for action soon. more british soldiers were arriving in the colonies. washington headed to massachusetts to take charge of the militia. before his arrival, though, the american soldiers fought an important battle near boston. two hills overlook the city of boston : bunker hill and breed ’ s hill. every general knows that it ’ s a great advantage to control the high ground. from the top of a hill, you can fire down at the enemy below — especially if you have cannons. meanwhile, the enemy has to fight', 'the french and indian war. [ 32 ] in 1755, washington volunteered as an aide to general edward braddock, who led a british expedition to expel the french from fort duquesne and the ohio country. [ 33 ] on washington\'s recommendation, braddock split the army into one main column and a smaller "" flying column "". [ 34 ] washington was suffering from severe dysentery so did not initially travel with the expedition forces. when he rejoined braddock at monongahela, still very ill, the french and their indian allies ambushed the divided army. two - thirds of the british force became casualties in the ensuing battle of the monongahela, and braddock was killed. under the command of lieutenant colonel thomas gage, washington rallied the survivors and formed a rear guard, allowing the remnants of the force to retreat. [ 35 ] during the engagement, washington had two horses shot out from under him, and his hat and coat were pierced by bullets. [ 36 ] his conduct redeemed his reputation among critics of his command in the battle of fort necessity, [ 37 ] but he was not included by the succeeding commander ( colonel thomas dunbar ) in planning subsequent operations. [ 38 ] the virginia regiment was reconstituted in august 1755,', 'map showing key locations in the french and indian war lawrence washington\'s service as adjutant general of the virginia militia inspired george to seek a militia commission. virginia\'s lieutenant governor, robert dinwiddie, appointed washington as a major and commander of one of the four militia districts. the british and french were competing for control of the ohio river valley : the british were constructing forts along the river, and the french between the river and lake erie. [ 17 ] in october 1753, dinwiddie appointed washington as a special envoy to demand the french forces vacate land that was claimed by the british. washington was also directed to make peace with the iroquois confederacy and to gather intelligence about the french forces. [ 18 ] washington met with iroquois leader tanacharison at logstown. [ 19 ] washington said that at this meeting tanacharison named him conotocaurius. this name, meaning "" devourer of villages "", had previously been given to his great - grandfather john washington in the late 17th century by the susquehannock. [ 20 ] washington\'s party reached the ohio river in november 1753 and was intercepted by a french patrol. the party was escorted to fort le boeuf, where washington was received in a friendly manner.']",True,10,3,10,3,80.67535281181335,0.5305819511413574,multi_hop_abstract_query_synthesizer,"[""George Washington showed early military leadership during the French and Indian War by taking charge of a force of raw troops who were difficult to manage, as many were unwilling to serve and those who did were often poorly equipped and undisciplined. Despite these challenges, Washington remained calm and firm, acting like a father figure to his men, reading to them on Sundays, and earning their respect through his conduct. He relied on experienced aides like Van-Braam for training and used scouts and red-men as guides, though he had to negotiate carefully with Native Americans, who demanded gifts to serve as guides and scouts. Washington promised gifts such as a fine white shirt and a great-coat to secure their cooperation. He also coordinated with Native American leaders like Half-King, who provided valuable intelligence and support in combat. Washington led his men through difficult terrain, slow marches, and shortages of food and supplies, often pushing his troops to clear roads and build forts under harsh conditions. He demonstrated military strategy and tactics by planning ambushes, such as the attack on the French camp where he coordinated movements with Half-King's braves, and by fortifying positions like Fort Necessity under siege. Throughout, Washington faced the challenges of frontier warfare and logistics, including rough roads, scarce provisions, and the need to maintain morale among a diverse and often reluctant force, yet he persevered and gained fame for his nerve, pluck, and leadership.""]",0.9999999999666667,0.5454545454545454,0.8951444560195688,0.875,0.4196561828462635,0.9093939621542845
"How did George Washington's early military leadership demonstrate effective military strategy and tactics in the conflict between French and British forces, particularly in relation to his negotiations and relations with Native Americans during the challenges of frontier warfare and logistics?"," As I strode forth upon the battlefield of Fort Duquesne, I, George Washington, found myself in the midst of a conflict between French and British forces. My keen military acumen and strategic prowess were soon put to the test as I served under General Edward Braddock, who led a British expedition to expel the French from the Ohio Country. My recommendation to split the army into two columns allowed me to rally the survivors and form a rear guard after the battle of the Monongahela, where two-thirds of the British force became casualties and Braddock was tragically killed.

During my tenure as Adjutant General of the Virginia Militia, I inspired others to seek a militia commission and was appointed as a major and commander of one of the four militia districts. My negotiations with Native Americans, particularly my meeting with Iroquois leader Tanacharison at Logstown, demonstrated my ability to gather intelligence and make peace with the iroquois confederacy, which was crucial in the competition for control of the Ohio River Valley between the British and French forces. Through my military leadership and diplomatic skills, I played a pivotal role in shaping the course","['a conduct friendly and impartial toward the belligerent powers "" while warning americans not to intervene in the conflict. [ 204 ] although washington recognized france\'s revolutionary government, he eventually asked that the french minister to the united states, edmond - charles genet, be recalled. [ 205 ] genet was a diplomatic troublemaker who was openly hostile toward washington\'s neutrality policy. he procured four american ships as privateers to strike at spanish forces ( british allies ) in florida while organizing militias to strike at other british possessions. however, his efforts failed to draw the united states into the conflict. [ 206 ] during his second term washington faced two major domestic conflicts. the first was the whiskey rebellion ( 1791 – 1794 ), a pennsylvania revolt against liquor taxation. washington mobilized a militia and personally commanded an expedition against the rebels which suppressed the insurgency. [ 207 ] [ 31 ] the second was the northwest indian war between white settlers and native americans who were supported second term', 'the french and indian war. [ 32 ] in 1755, washington volunteered as an aide to general edward braddock, who led a british expedition to expel the french from fort duquesne and the ohio country. [ 33 ] on washington\'s recommendation, braddock split the army into one main column and a smaller "" flying column "". [ 34 ] washington was suffering from severe dysentery so did not initially travel with the expedition forces. when he rejoined braddock at monongahela, still very ill, the french and their indian allies ambushed the divided army. two - thirds of the british force became casualties in the ensuing battle of the monongahela, and braddock was killed. under the command of lieutenant colonel thomas gage, washington rallied the survivors and formed a rear guard, allowing the remnants of the force to retreat. [ 35 ] during the engagement, washington had two horses shot out from under him, and his hat and coat were pierced by bullets. [ 36 ] his conduct redeemed his reputation among critics of his command in the battle of fort necessity, [ 37 ] but he was not included by the succeeding commander ( colonel thomas dunbar ) in planning subsequent operations. [ 38 ] the virginia regiment was reconstituted in august 1755,', 'map showing key locations in the french and indian war lawrence washington\'s service as adjutant general of the virginia militia inspired george to seek a militia commission. virginia\'s lieutenant governor, robert dinwiddie, appointed washington as a major and commander of one of the four militia districts. the british and french were competing for control of the ohio river valley : the british were constructing forts along the river, and the french between the river and lake erie. [ 17 ] in october 1753, dinwiddie appointed washington as a special envoy to demand the french forces vacate land that was claimed by the british. washington was also directed to make peace with the iroquois confederacy and to gather intelligence about the french forces. [ 18 ] washington met with iroquois leader tanacharison at logstown. [ 19 ] washington said that at this meeting tanacharison named him conotocaurius. this name, meaning "" devourer of villages "", had previously been given to his great - grandfather john washington in the late 17th century by the susquehannock. [ 20 ] washington\'s party reached the ohio river in november 1753 and was intercepted by a french patrol. the party was escorted to fort le boeuf, where washington was received in a friendly manner.']",True,10,3,10,3,111.22661900520325,0.4843483865261078,multi_hop_abstract_query_synthesizer,"[""George Washington's early military leadership was marked by his ability to navigate the complex challenges of frontier warfare, including difficult logistics and relations with Native Americans. In his mission to deliver a note from the French chief to Governor Dinwiddie, Washington endured severe hardships such as crossing icy rivers and traveling through hostile territory, demonstrating his resilience and determination. When leading troops against the French, Washington faced raw and undisciplined men but relied on the guidance of experienced officers like VanBraam and the support of Native American allies such as Half-King. He skillfully combined military tactics with diplomacy, as seen when he negotiated with a Native American guide by promising gifts to secure his assistance, acknowledging the importance of Native cooperation. Washington also coordinated with Native allies in ambushing French forces, leading to the first bloodshed of the conflict at the skirmish where French leader Jumonville was killed. Despite being young and inexperienced, Washington showed calmness and courage under fire, earning respect for his leadership. He adapted to the challenges of frontier warfare by building fortifications like Fort Necessity under dire conditions, managing scarce food supplies, and maintaining troop morale. His strategic use of terrain and coordination with Native forces exemplified effective military tactics in a difficult and fluid conflict between French and British forces on the frontier.""]",0.9999999999666667,0.75,0.871920857068218,0.125,0.4214422685844263,0.8962953901271788
