question,answer,contexts,used_reranker,k_init,top_n,num_initial_docs,num_final_docs,runtime_seconds,factuality_score,question_type,ground_truths,context_precision,faithfulness,answer_relevancy,context_recall,answer_correctness,semantic_similarity
What role did North Carilina play in the mobilizashun of militias during the French & Indian War?," As the sun rose over the Carolinas, I, George Washington, witnessed the spirit of unity and determination among the people of North Carolina. Their resolve to stand tall in the face of adversity led them to play a pivotal role in the mobilization of militias during the French & Indian War. By combining their forces under the steadfast leadership of their governor and breaking the Virginia regiment into individual companies, commanded by captains, they demonstrated their unwavering commitment to protect their land and people. The echoes of their valor still resonate through the annals of history, a testament to their indomitable spirit and their unwavering loyalty to their fellow Americans.","['breakup of the virginia breakup of the virginia regiment and regiment and resignation on eve of resignation on eve of french & indian warfrench & indian war • • on the heels of the fort necessity fiasco came the on the heels of the fort necessity fiasco came the mobilization of state militias called by the governors mobilization of state militias called by the governors of maryland, virginia and north carolina to combine of maryland, virginia and north carolina to combine their forces under the maryland governor. their forces under the maryland governor. • • this had the effect of breaking the virginia regiment this had the effect of breaking the virginia regiment into individual companies, commanded by captains. into individual companies, commanded by captains. • • since washington would be demoted three ranks, he since washington would be demoted three ranks, he resigned from the virginia militia and again took up resigned from the virginia militia and again took up residence at mt. vernon. residence at mt. vernon.', 'a conduct friendly and impartial toward the belligerent powers "" while warning americans not to intervene in the conflict. [ 204 ] although washington recognized france\'s revolutionary government, he eventually asked that the french minister to the united states, edmond - charles genet, be recalled. [ 205 ] genet was a diplomatic troublemaker who was openly hostile toward washington\'s neutrality policy. he procured four american ships as privateers to strike at spanish forces ( british allies ) in florida while organizing militias to strike at other british possessions. however, his efforts failed to draw the united states into the conflict. [ 206 ] during his second term washington faced two major domestic conflicts. the first was the whiskey rebellion ( 1791 – 1794 ), a pennsylvania revolt against liquor taxation. washington mobilized a militia and personally commanded an expedition against the rebels which suppressed the insurgency. [ 207 ] [ 31 ] the second was the northwest indian war between white settlers and native americans who were supported second term', 'chapter 5 the french and indian war a war in the colonies washington ’ s small battle against the french started the french and indian war. on one side was france, their french colonists in north america, and their native american allies. on the other side was great britain, their british colonists in north america, and their native american allies. great britain and france had been fighting each other on and off for nearly a hundred years. no one was surprised that they were at war again. the two european countries had colonies all over the world. both wanted to control the other ’ s colonies. it was no surprise when the war that began in north america spread to two other continents and the atlantic, pacific, and indian oceans. in europe and asia, the war was called the seven years ’ war. in north america, it was called the french and indian war. 32 the big question how did the british defeat the french in the french and indian war?']",True,10,3,10,3,50.774035930633545,0.6449049115180969,single_hop_specifc_query_synthesizer,"['During the French & Indian War, the governors of Maryland, Virginia, and North Carolina mobilized their state militias to combine their forces under the Maryland Governor. This mobilization had the effect of breaking the Virginia Regiment into individual companies commanded by captains.']",0.9999999999,0.125,0.9377770001056899,1.0,0.4231411378277111,0.89256394037234
"Could you provide a detailed account of Washington's role and experiences during the Braddock Expedition, highlighting the challenges he faced and his contributions to the campaign?"," In the annals of history, I, George Washington, have been recorded as a valiant soldier and steadfast leader, who, in 1755, volunteered my services as an aide to General Edward Braddock during the Braddock Expedition. My role in that campaign was of great significance, as I recommended that Braddock split the army into one main column and a smaller ""flying column."" However, my own health was in decline, and I was unable to accompany the expedition forces initially. When I rejoined Braddock at Monongahela, still afflicted by severe dysentery, our forces were ambushed by the French and their Indian allies. The battle of the Monongahela was a catastrophe for the British, with two-thirds of the force becoming casualties. Despite my own illness and being vastly outnumbered, I rallied the survivors and formed a rear guard, allowing the remnants of our force to retreat. In the heat of battle, two of my horses were shot and my hat and coat were pierced by bullets. Yet, my steadfastness and courage in the face of adversity served to redeem my reputation","['the french and indian war. [ 32 ] in 1755, washington volunteered as an aide to general edward braddock, who led a british expedition to expel the french from fort duquesne and the ohio country. [ 33 ] on washington\'s recommendation, braddock split the army into one main column and a smaller "" flying column "". [ 34 ] washington was suffering from severe dysentery so did not initially travel with the expedition forces. when he rejoined braddock at monongahela, still very ill, the french and their indian allies ambushed the divided army. two - thirds of the british force became casualties in the ensuing battle of the monongahela, and braddock was killed. under the command of lieutenant colonel thomas gage, washington rallied the survivors and formed a rear guard, allowing the remnants of the force to retreat. [ 35 ] during the engagement, washington had two horses shot out from under him, and his hat and coat were pierced by bullets. [ 36 ] his conduct redeemed his reputation among critics of his command in the battle of fort necessity, [ 37 ] but he was not included by the succeeding commander ( colonel thomas dunbar ) in planning subsequent operations. [ 38 ] the virginia regiment was reconstituted in august 1755,', 'famous roster of participantsfamous roster of participants • • the braddock expedition included the braddock expedition included washingtonwashington, daniel boone,, daniel boone, majmaj horatio horatio gatesgates,, majmaj thomas gagethomas gage, christopher gist,, christopher gist, dr. james dr. james craikcraik,, daniel morgandaniel morgan,, cptcpt. roger. roger morris, george morris, george croghancroghan,, adam stephenadam stephen,, charles leecharles lee, and indian chief pontiac., and indian chief pontiac. • • eight of these became generals in the eight of these became generals in the american revolution, one camerican revolution, one c - - inin - - c of the c of the british forces, two considered for cbritish forces, two considered for c - - inin - - c of c of american forces, and one became president american forces, and one became president of the united statesof the united states', '“ “ seeking knowledge of seeking knowledge of the military artthe military art ” ” • • in in march 1755march 1755 he received a reply from braddockhe received a reply from braddock ’ ’ s aides aide - - dede - - camp camp informing him that it was the generalinforming him that it was the general ’ ’ s desire s desire to to “ “ join braddockjoin braddock ’ ’ s s entourageentourage ” ”, without official rank. braddock, without official rank. braddock ’ ’ s staff had been impressed by s staff had been impressed by what they had learned of washington in williamsburg, and knew thwhat they had learned of washington in williamsburg, and knew they ey could benefit from his navigational skills and experience in reacould benefit from his navigational skills and experience in reaching the ching the forks of the ohio. forks of the ohio. • • in late march braddockin late march braddock ’ ’ s forces assembled at alexandria and washington s forces assembled at alexandria and washington was offered a was offered a brevet captaincy in the english armybrevet captaincy in the english army, but politely refused,, but politely refused, preferring to serve as a volunteer and hoping']",True,10,3,10,3,102.96303510665894,0.5820662379264832,single_hop_specifc_query_synthesizer,"['During the Braddock Expedition, Washington played a significant role despite numerous challenges. Initially, General Braddock refused Washington\'s advice to dispense with wagons, insisting on pulling all his accustomed equipment through the unblazed wilderness, which caused the force to become badly dispersed over almost 20 miles. Washington continued to advise against using wagons, but Braddock rejected his suggestions. Discouraged and suffering from severe dysentery, Washington was forced to ride in a wagon at the rear of the traveling force. Eventually, Braddock relented and adopted Washington\'s suggestion to send an advance force of 1,200 men forward without wagons, leaving Washington behind. However, this advance force was harassed by marauding Indians who took scalps, terrifying the British regulars. Washington regained enough strength to rejoin Braddock on July 8th along the Monongahela River, about 12 miles upstream of The Forks of the Ohio. On July 9th, the English force, spread out over a mile-long track, attempted to ford the Monongahela twice while sending Major Gage forward with an advance force to protect the fords from ambush. Around 2:30 PM, Gage\'s troops were ambushed, causing the terrified redcoats to break ranks and retreat in confusion. Braddock and other officers tried to calm the men but failed. The British officers, except for Washington, were either wounded or killed. Colonial troops attempted to fight the French on their own terms in the woods but were mistakenly fired upon by their British allies. Despite the defeat being one of the worst in British colonial history, Washington emerged as a ""bullet proof hero of the Monongahela.""']",0.9999999999666667,0.8666666666666667,0.9150790403603691,0.46153846153846156,0.5881226245471934,0.9177078894931214
What role Fort Duquesne play in Washington's 4th trip?," As I strode forth on my fourth expedition, I found myself confronted by the relentless onslaught of the English, who sought to expel the French from their domain in this region. In response, I constructed a makeshift fortress, christened Fort Necessity, in close proximity to their stronghold. There, my valiant comrades and I engaged in a fierce battle that raged for nine arduous hours before we were compelled to relinquish our position. The French commander dispatched an emissary to draft a missive elucidating the reasons for our engagement, and I affixed my signature to it, thereby permitting our captives to return to their homeland.","['washingtonwashington ’ ’ s fourth trip to s fourth trip to the forks of the ohiothe forks of the ohio • • between between august 1757august 1757 and and april 1758april 1758 he again contracted dysentery and he again contracted dysentery and was forced to convalesce at mt. vernon before returning to duty was forced to convalesce at mt. vernon before returning to duty just in just in time for the last british expedition to the forks of the ohio ( htime for the last british expedition to the forks of the ohio ( his 4th trip ). is 4th trip ). • • the english mounted an allthe english mounted an all - - out threeout three - - pronged offensive, one of which pronged offensive, one of which was aimed at fort duquesne, at the confluence of the allegheny awas aimed at fort duquesne, at the confluence of the allegheny and nd monongahela rivers ( in present day pittsburgh ). monongahela rivers ( in present day pittsburgh ). • • to washingtonto washington ’ ’ s delight, the english had finally decided to recognize the s delight, the english had finally decided to recognize the rank precedence of colonial field officers in comparison to', '30 along the way, washington ’ s troops surprised and defeated a group of thirty french soldiers, killing ten of them. the french at fort duquesne had many more men than washington had, and they had shawnee and delaware native american allies as well. they were sure to send out a larger force from the fort to deal with washington ’ s virginians. realizing this, washington built a makeshift camp southeast of the french stronghold. his men called the camp “ fort necessity. ” the spot washington chose for fort necessity was a low piece of ground. soon after the french attacked, it began to rain heavily. before long, washington ’ s men, their guns, and their gunpowder were soaked with the rain that collected in the low area where the fort was built. the virginians fought bravely, but after nine hours, washington was forced to surrender. the french commander instructed an assistant to prepare a statement explaining why the fighting had taken place. the statement said, “ we, the virginians, are the ones who started the fighting. it was all our fault. ” the french commander read the statement and handed it to washington. “ sign, ” he said. “ sign, or i will not allow the prisoners to return to virginia. ” washington signed, and the', 'first expedition to the forks of the ohiofirst expedition to the forks of the ohio • • washingtonwashington ’ ’ s party reached s party reached fort fort leboeufleboeuf on on december 12december 12thth, 1753, 1753 where washington presented where washington presented governor dinwiddiegovernor dinwiddie ’ ’ s demand for marquis duquesne, s demand for marquis duquesne, the french governor of canada. the french governor of canada. • • the fortthe fort ’ ’ s commander said he would forward the s commander said he would forward the message to his superiors and pen a reply for young message to his superiors and pen a reply for young washington to take back to governor dinwiddie in washington to take back to governor dinwiddie in williamsburg. williamsburg. • • 10 days later washington was given a sealed 10 days later washington was given a sealed envelope with the french response, which envelope with the french response, which washington did not open, but delivered to washington did not open, but delivered to williamsburg. in his response the french commander williamsburg. in his response the french commander politely refused to the english request to retire from politely refused to the english request to retire from the region, given his superior strength']",True,10,3,10,3,63.763144969940186,0.4481157660484314,single_hop_specifc_query_synthesizer,"['Fort Duquesne was the target of the last British expedition to the Forks of the Ohio, led by British Brigadier John Forbes with Washington as a Colonel under his command. The expedition aimed to capture Fort Duquesne, located at the confluence of the Allegheny and Monongahela Rivers in present-day Pittsburgh.']",0.9999999999,0.7777777777777778,0.8179449271374554,1.0,0.20593174858387853,0.8237269943355141
how george washington early military career and washington expedition to ohio country show his rise to fame and military skill?," As I embarked upon my journey in the realm of arms and leadership, my exploits in the Virginia militia and my triumphant expedition against the French in Ohio served to forge my reputation as a master of military strategy and prowess. My keen eye for terrain and my unwavering accuracy in mapping the unknown lands of Ohio were testaments to my innate abilities as a commander and explorer. Furthermore, my successful command of the Continental Army during the American Revolution cemented my legacy as a great general and leader, guiding our young nation through the crucible of war and emerging triumphant.","['george washington was proud to be an officer in the virginia militia. 29 this, virginia would have more control of the ohio river and the smaller rivers that flowed from and fed into the larger river. one year later, in 1754, he sent george washington to the west again. this time washington led a force of 150 men. the british had built a small fort in western pennsylvania on the site of present - day pittsburgh. the fort sat where two rivers come together to form the ohio river. washington was to join forces with the british soldiers at the fort. before he arrived, washington learned that the french had already captured the british fort and renamed it fort duquesne ( / doo * kayn / ). in time, george washington would become a great general, but in 1754, he was young and inexperienced. he made a number of mistakes. washington did not have enough men to drive the french out of the fort. the wisest thing to do would have been to return to virginia. instead, he continued on with his small force. vocabulary general, n. the main leader of an army', 'on july 3, 1775, george washington took command of the continental army. 85 man to lead the continental army, as it came to be called. he had gained his military experience in the french and indian war. after that, he returned to mount vernon, virginia, to run his plantation. he was a member of the virginia house of burgesses and a supporter of the patriot cause. he was also among the best - known and wealthiest men in the colonies. everyone admired him for his devotion to duty, his cool head, and strong will. it was settled. washington would command the continental army, and its first troops would be the massachusetts militiamen camped around boston. they might be needed for action soon. more british soldiers were arriving in the colonies. washington headed to massachusetts to take charge of the militia. before his arrival, though, the american soldiers fought an important battle near boston. two hills overlook the city of boston : bunker hill and breed ’ s hill. every general knows that it ’ s a great advantage to control the high ground. from the top of a hill, you can fire down at the enemy below — especially if you have cannons. meanwhile, the enemy has to fight', 'washington drew a washington drew a remarkably accurate remarkably accurate map of the french map of the french forts along the upper forts along the upper ohio river in his ohio river in his journal. this journal. this illustrated his value as illustrated his value as a pathfinder and a pathfinder and military officer, military officer, bringing him bringing him considerable notoriety considerable notoriety at age 22. at age 22. surveying surveying background background proves valuableproves valuable']",True,10,3,10,3,61.051278829574585,0.5086429119110107,multi_hop_abstract_query_synthesizer,"[""George Washington's early military career began in 1753 when, inspired by his stepbrother and supported by influential patrons, he was appointed district adjutant for the Northern Neck of Virginia, becoming a major in the Virginia militia just before his 21st birthday. In 1754, he was assigned to explore the Ohio Country to determine if the French were building forts there. During this expedition, despite harsh winter conditions, Washington made contact with local Iroquois and reached the French Fort Le Boeuf, where he demanded the French leave. His detailed report and map of the expedition were published widely, bringing him considerable notoriety. Later that year, as a newly promoted Lieutenant Colonel, Washington led a force to confront the French, ambushing a French diplomatic party and killing its leader, which triggered a French retaliation. Washington hastily built Fort Necessity but was forced to surrender after a French attack. Although this expedition was a military failure, it raised Washington's profile both in the Colonies and abroad. His early military actions, including his detailed reporting and leadership in the Ohio Country, demonstrated his military skill and helped establish his reputation, setting the stage for his later prominence.""]",0.9999999999666667,0.4,0.8377148042045168,0.125,0.4195491633250983,0.8889397308782794
