question,answer,contexts,used_reranker,k_init,top_n,num_initial_docs,num_final_docs,runtime_seconds,factuality_score,question_type,ground_truths,context_precision,faithfulness,answer_relevancy,context_recall,answer_correctness,semantic_similarity
What role does the National Park Service play in preserving sites related to the American Revolution?," As the guardian of our nation's heritage, the National Park Service stands sentinel over the hallowed grounds that bear witness to the indomitable spirit of the American Revolution. Established in 1916, this noble institution has been entrusted with the solemn responsibility of safeguarding and preserving over 400 sites that pay tribute to the pivotal moments, personalities, and ideals that have shaped our great nation. Through its tireless efforts, the National Park Service endeavors to protect these invaluable treasures, enlighten visitors about their historical significance, and foster conservation initiatives that will ensure their enduring legacy for generations to come.","['1 argument writing lesson background information national park service u. s. department of the interior independence national historical park philadelphia, pennsylvania american revolution overview the revolutionary war ( 1775 - 1783 ) began as a conflict between great britain and her north american colonies. it ended as a global war, pitting european powers against each other in a time of intense imperial rivalry. in the end, the american colonies gained their independence, ruling themselves under the “ firm league of friendship ” known as the articles of confederation. in 1789, the u. s. constitution – establishing the legislative, executive, and judicial branches - superseded the articles of confederation. timeline of major american revolution actions : • april 19, 1775 : first shots fired at lexington and concord in massachusetts. no one knows who fired first – the british troops or the colonists. • may 10, 1775 : second continental congress convenes in the pennsylvania state house ( now known as independence hall ). • july 2, 1776 : second continental congress approves the resolution for independence. • october 17, 1777 : british general burgoyne and 6, 000 british troops surrender to the americans at saratoga, new york. • february 6, 1778 : the united states and france enter into an alliance. • may 12, 1780 : fighting shifts south as the', 'the american revolution reader', 'enslaved person who fought for the king. the patriots had their own sources of help. the patriot side also had support from african americans. it had important support from women, too. women played many roles in the american revolution. working in army camps,']",True,10,3,10,3,68.05664587020874,0.5237095355987549,single_hop_specifc_query_synthesizer,"['The National Park Service, part of the U.S. Department of the Interior, manages Independence National Historical Park in Philadelphia, Pennsylvania, which preserves important sites related to the American Revolution, including Independence Hall where key events such as the Second Continental Congress meetings and the signing of the Declaration of Independence took place.']",0.9999999999,0.0,0.9217528662945217,1.0,0.716477938884661,0.8659117555386443
What grievances did the American colonists have against the King in the Declaration of Independence?," The American colonists, in their quest for liberty and self-determination, laid forth their grievances against the monarch in the Declaration of Independence. They accused the King of disregarding their colonial governments and their rights to a trial by jury. Furthermore, they claimed that the King was sending mercenaries to enforce unjust laws and was unfit to rule over a free people. The colonists also highlighted that the King had taken away their English citizenship and that they had the right to establish a new government if their rights were threatened by the existing one.","['chapter 14 the great declaration coming to a decision by the start of 1776, the argument with great britain had lasted more than ten years. the fighting had gone on for almost one. still, many colonists weren ’ t sure whether they really wanted independence. a number of colonists opposed independence. these people were called loyalists. loyalists belonged to different religions and came from different social classes. they had different reasons for their loyalty. some loyalists made their decision for economic reasons. some chose the british side for political reasons. others followed religious or personal values. but all loyalists agreed on one thing : the need to stay faithful to the king and to great britain. no colony had ever broken away from a mother country. giving up a place in the world ’ s greatest empire and all the advantages of being part of it — was that really a smart idea? on the other hand, patriots 88 the big question what was the declaration of independence? vocabulary loyalist, n. a person living in the colonies who did not support the american cause and remained loyal to great britain', 'away their rights as english citizens. they point out that the king has ignored or changed their colonial governments, as well as their rights to a trial by jury. the colonists accuse the king of sending a hired army to force them to obey unjust laws. they say the king is “ unfit to be the ruler of a free people. ”', 'and signatures. preamble this first of the declaration contains an assertion of individual rights. perhaps the most famous line states, “ we hold these truths to be self - evident, that all men are created equal, that they are endowed by their creator with certain unalienable rights, that among these are life, liberty and the pursuit of happiness. ” this part goes on to say that if the government tries to take these rights away, the people have the right to form a new government. jefferson also addresses a counterclaim in this section, acknowledging that “ prudence, indeed, will dictate that governments long established should not be changed for light and transient causes … ” he counters by reminding his audience of the “ long train of abuses and usurpations ” that makes it “ … their right, it is their duty, to throw off such government, and to provide new guards for their future security. ” grievances the longest part of the declaration lists the unfair actions of the british king and parliament. in their complaints, the colonists make it clear that they are angry with the british king and government for taking away their rights as english citizens. they point out that the king has ignored or changed their colonial governments, as well as their rights to a trial by']",True,10,3,10,3,75.64511704444885,0.5352712273597717,single_hop_specifc_query_synthesizer,"['The American colonists accused the British king of taking away their rights as English citizens, ignoring or changing their colonial governments, and denying their rights to a trial by jury. They also complained that the king sent a hired army to force them to obey unjust laws and declared that the king was ""unfit to be the ruler of a free people.""']",0.5833333333041666,0.875,0.9622559579084037,1.0,0.7382279950059717,0.9529119800238867
"What role did Thomas Jefferson play in the drafting of the Declaration of Independence, and how was his contribution recognized by his contemporaries?"," As the sun rose over the horizon of a new nation, I, Thomas Jefferson, was chosen by my esteemed colleagues John Adams and Benjamin Franklin to pen the most resolute declaration of our collective grievances against the tyranny of King George III. My quill danced across parchment, immortalizing the injustices inflicted upon our people and enshrining the principles of liberty and equality that would come to define our great nation. The document, which I named the Declaration of Independence, was met with approval by Congress and signed by 50 of the 56 delegates present, with Thomas Mckean, the 56th signer, being the last to affix his mark. The echoes of my words continue to resonate through the ages, a testament to the enduring power of the human spirit and its unwavering pursuit of freedom.","['also drafted the olive branch petition and sent it to king george iii in hopes of reaching a peaceful resolution. the king refused to hear the petition and declared the american colonies in revolt. on june 7, 1776, virginia delegate richard henry lee put forth the resolution for independence : “ resolved, that these united colonies are, and of right ought to be, free and independent states … ” voting was postponed while some of the delegates worked to convince others to support independence, but a committee of five men was assigned to draft a document of independence : john adams ( ma ), benjamin franklin ( pa ), thomas jefferson ( va ), roger sherman ( ct ), and robert r. livingston ( ny ). jefferson did most of the work, drafting the document in his lodgings at 7th and market street.', '92 of the declaration was to explain why the colonies were breaking away from great britain. the committee chosen to write the declaration included john adams, benjamin franklin, and thomas jefferson. which committee member should do the main writing? benjamin franklin and george washington were probably the two most famous americans alive. john adams was one of the first leaders to speak out in favor of independence. thomas jefferson, however, was known as a fine writer. franklin and adams chose him to write the declaration. what jefferson produced became the most famous document not only in american history, but also in the history of the entire world. jefferson wanted the world to know all the bad things this king had done and all the rights he had taken away. so he listed each of them. he also explained why the king ’ s actions made it right for the colonists to break away from britain. we hold these truths to be self - evident, that all men are created equal, that they are endowed by their creator with certain unalienable rights, that among these are life, liberty, and the pursuit of happiness. vocabulary endow, v. to give someone something valuable', 'jefferson takes the lead on the project. adams and franklin make a few edits. jefferson ’ s rough draft is in the library of congress. • july 1, 1776 : vote on the resolution for independence. nine colonies vote for it, 2 against it ( pa and sc ), 1 abstained ( ny ), and one was deadlocked ( de ). vote to be retaken the next day. • july 2, 1776 : 12 of the 13 colonies vote for the resolution, with ny abstaining. congress declares the resolution to be in effect. • july 2 - 4, 1776 : congress debates the content of the declaration of independence. • july 4, 1776 : congress approves the declaration of independence and orders it printed. philadelphia printer john dunlap prints about 200 copies. fewer than 30 survive today. • july 19, 1776 : congress ordered the declaration engrossed for signatures. title is changed from “ a declaration by the representatives of the united states of america in general congress assembled ” to “ the unanimous declaration of the thirteen united states of america. ” • august 2, 1776 : declaration signed by ( most likely ) 50 of the 56 signers. five more signed later in 1776. thomas mckean, the 56th signer, signed']",True,10,3,10,3,82.85906982421875,0.5381960272789001,single_hop_specifc_query_synthesizer,"[""Thomas Jefferson took the lead on drafting the Declaration of Independence as part of a committee appointed by Congress, which also included John Adams, Benjamin Franklin, Roger Sherman, and Robert R. Livingston. Jefferson's rough draft, which is preserved in the Library of Congress, was edited by Adams and Franklin before the final version was approved. His contemporaries recognized the significance of the Declaration and Jefferson's role in it, as reflected in letters such as Jefferson's own to Henry Lee, where he described the Declaration as an expression of the American mind intended to justify the colonies' stand for independence. Additionally, the committee's work and the solemnity of the occasion were noted by figures like Benjamin Rush and John Adams, underscoring the importance of Jefferson's contribution to this foundational document.""]",0.9999999999666667,0.6666666666666666,0.8875363806059154,0.5,0.5148658036196408,0.9056170606324095
Who was Timothy Matlack and what was his role related to the Declaration of Independence?," As the ink flowed from my quill, I, Timothy Matlack, brought forth the immortal words of the Declaration of Independence, a testament to the unyielding spirit of a people yearning for liberty. On the hallowed grounds of Independence Hall, my hand, guided by the wisdom of Congress and the resolve of the signatories, engrossed the document in a script befitting its gravity. As the final stroke of my quill graced the parchment, I felt the weight of history resting upon my shoulders, for I had etched the birth of a nation into the annals of time. And so it was, on August 2, 1776, that 50 of the 56 delegates signed their names to this monumental document, a beacon of hope for generations to come.","['2 on july 2, 1776, the second continental congress voted to adopt lee ’ s resolution for independence. this is the day that john adams thought should be celebrated with “ pomp and parade, with shews, games, sports, guns, bells, bonfires and illuminations from one end of this continent to the other from this time forward forever more. ” ( john adams to abigail adams, july 3, 1776 ) between july 2 and july 4, congress argued over every word in jefferson ’ s draft of the declaration, making numerous changes. on july 4, congress voted again – this time to approve the wording of the declaration of independence. they didn ’ t actually sign the document that day. after new york ’ s delegates received instructions from home to vote for independence ( they had initially abstained ), the document was sent to timothy matlack to be engrossed ( handwritten ). fifty of the 56 men signed the engrossed declaration of independence inside independence hall on august 2, 1776. the declaration of independence as an argument looking back on the declaration of independence almost 50 years later, thomas jefferson explained that the document ’ s purpose was never meant to be thoroughly original ; its purpose wasn ’ t to articulate anything that hadn ’ t be said', '92 of the declaration was to explain why the colonies were breaking away from great britain. the committee chosen to write the declaration included john adams, benjamin franklin, and thomas jefferson. which committee member should do the main writing? benjamin franklin and george washington were probably the two most famous americans alive. john adams was one of the first leaders to speak out in favor of independence. thomas jefferson, however, was known as a fine writer. franklin and adams chose him to write the declaration. what jefferson produced became the most famous document not only in american history, but also in the history of the entire world. jefferson wanted the world to know all the bad things this king had done and all the rights he had taken away. so he listed each of them. he also explained why the king ’ s actions made it right for the colonists to break away from britain. we hold these truths to be self - evident, that all men are created equal, that they are endowed by their creator with certain unalienable rights, that among these are life, liberty, and the pursuit of happiness. vocabulary endow, v. to give someone something valuable', 'also drafted the olive branch petition and sent it to king george iii in hopes of reaching a peaceful resolution. the king refused to hear the petition and declared the american colonies in revolt. on june 7, 1776, virginia delegate richard henry lee put forth the resolution for independence : “ resolved, that these united colonies are, and of right ought to be, free and independent states … ” voting was postponed while some of the delegates worked to convince others to support independence, but a committee of five men was assigned to draft a document of independence : john adams ( ma ), benjamin franklin ( pa ), thomas jefferson ( va ), roger sherman ( ct ), and robert r. livingston ( ny ). jefferson did most of the work, drafting the document in his lodgings at 7th and market street.']",True,10,3,10,3,89.79551887512207,0.5772358775138855,single_hop_specifc_query_synthesizer,"['Timothy Matlack was the engrosser of the Declaration of Independence, meaning he was responsible for creating the official handwritten copy of the document.']",0.9999999999,0.2,0.8532208621980676,1.0,0.46903714531051366,0.8762373814705778
What circumstances led John Washington to leave Northamptonshire and begin a new life in America?," In the tempestuous seas of political turmoil, my father, Lawrence Washington, found himself at odds with the ruling tide of Oliver Cromwell's parliament. As the storm clouds gathered and the English crown was toppled in 1656, our family was cast adrift from our ancestral home in Northamptonshire. I, John Washington, was but 25 years old when I was compelled to set sail for America aboard the ""Sea Horse of London,"" seeking refuge from the tumult that had torn me from my birthright. And so began my journey into the unknown, a voyage that would lead me to the verdant shores of Virginia and the promise of a new life in this brave new world.","['accidental immigrationaccidental immigration • • the sea horse made landfall in virginia, but the sea horse made landfall in virginia, but floundered in bad weather off the virginia capes on floundered in bad weather off the virginia capes on its homeward voyage. young john was one of the its homeward voyage. young john was one of the few to escape, by swimming for the virginia shore, few to escape, by swimming for the virginia shore, where he began a new life. where he began a new life. john washingtonjohn washington was forced to was forced to leave leave northamptonshirenorthamptonshire at age 25 at age 25 when his father when his father lawrencelawrence, the, the rector of rector of purleighpurleigh, fell from favor, fell from favor when oliver cromwellwhen oliver cromwell ’ ’ s parliament s parliament overthrew the english king in 1656. overthrew the english king in 1656. john sailed to america in the ketch john sailed to america in the ketch sea horse of londonsea horse of london in 1657 in 1657', 'appearance in uniform, he gave a statement to the congress : "" i consider it an indispensable duty to close this last solemn act of my official life, by commending the interests of our dearest country to the protection of almighty god, and those who have the superintendence of them, to his holy keeping. "" [ 148 ] washington\'s resignation was acclaimed at home and abroad, "" extolled by later historians as a signal event that set the country\'s political course "" according to the historian edward j. larson. [ 149 ] [ i ] the same month, washington was appointed president - general of the society of the cincinnati, a newly established hereditary fraternity of revolutionary war officers. [ 151 ] after spending just ten days at mount vernon out of 81⁄2 years of war, washington was eager to return home. he arrived on christmas eve ; professor john e. ferling wrote that he was delighted to be "" free of the bustle of a camp and the busy scenes of public life "". [ 153 ] he received a constant stream of visitors paying their respects at mount vernon. [ 154 ] washington reactivated his interests in the great dismal swamp and potomac canal projects, begun before the war, though neither paid him any divide', 'page | 1 a short biography of george washington “ more than most, washington ’ s biography is the story of a man constructing himself. ” — w. w. abbot1 early life america ’ s first president was born on february 22, 1732 2 to augustine washington ( 1694 – 1743 ) and his se cond wife, mary ball washington ( 1708 – 89 ), at their family plantation at popes creek, westmoreland county, virginia. together with his four siblings ( elizabeth, samuel, john augustine, and charles ; a fifth, mildred, died as an infant ), george spent much of his childhood on the move with his family. ( george also had three stepsiblings from his father ’ s previous marriage : lawrence and augustine ii — respectively 14 and 12 years george ’ s senior — and jane, who died when george was two. ) when he was three, the fami ly relocated 60 miles upstream to their home at little hunting creek on the potomac ( later named mount vernon ) ; three years later, they moved once more, this time to a smaller plot of land on the rappahannock river near fredericksburg that was close to an iron furnace george ’ s father was then managing. when washington, at age 11, lost his father']",True,10,3,10,3,77.61000299453735,0.5543312430381775,single_hop_specifc_query_synthesizer,"[""John Washington was forced to leave Northamptonshire when his father Lawrence, the Rector of Purleigh, fell from favor with Oliver Cromwell's Parliament after it overthrew the English king in 1656. At age 25, John sailed to America in the ketch Sea Horse of London in 1657. The Sea Horse made landfall in Virginia but floundered in bad weather off the Virginia Capes on its homeward voyage. John was one of the few to escape by swimming to the Virginia shore, where he began a new life.""]",0.9999999999,1.0,0.9342538101656702,1.0,0.7955558452306705,0.932173211074723
What significance did Ferry Farm hold in George Washington's early life according to his family's history?," The verdant fields of Ferry Farm played a pivotal role in shaping the young George Washington, as his family's history recounts. It was there that he first learned the art of farming and honed his skills in equestrian prowess, his small hands guided by the steady hand of his father. When tragedy struck and his father's spirit ascended to the heavens, George found solace and guidance in the embrace of his brother Lawrence at Mount Vernon. There, under the watchful gaze of the mighty oak tree that stands as a testament to their shared legacy, George continued to cultivate his talents and lay the foundation for a life dedicated to the pursuit of liberty and the betterment of his fellow man.","[""• • george washingtongeorge washington lived in many different places in virginia. lived in many different places in virginia. he he was born at was born at pope's creekpope's creek, which is a farm, and lived their till he, which is a farm, and lived their till he was three. was three. • • george moved to george moved to mount vernonmount vernon ( little hunting creek ) which was ( little hunting creek ) which was also a farm, for another three years. also a farm, for another three years. • • then he moved to then he moved to ferry farmsferry farms.. while he lived at ferry farms he while he lived at ferry farms he learned to farm he also learned to ride horses. when george was learned to farm he also learned to ride horses. when george was eleven his father died. eleven his father died. • • after that he went to live with his brother after that he went to live with his brother lawrencelawrence.. with with lawrence and his family he lived at mount vernon. lawrence and his family he lived at mount vernon. • • as a kid george loved to ride horses, and he became expert at as a kid george loved to ride horses, and he became expert"", '. • • as a kid george loved to ride horses, and he became expert at as a kid george loved to ride horses, and he became expert at judging, grooming, and caring for them. judging, grooming, and caring for them. washington home at pope ’ s creek gw birthplace sign cabin at ferry farmcabin at ferry farm', 'page | 1 a short biography of george washington “ more than most, washington ’ s biography is the story of a man constructing himself. ” — w. w. abbot1 early life america ’ s first president was born on february 22, 1732 2 to augustine washington ( 1694 – 1743 ) and his se cond wife, mary ball washington ( 1708 – 89 ), at their family plantation at popes creek, westmoreland county, virginia. together with his four siblings ( elizabeth, samuel, john augustine, and charles ; a fifth, mildred, died as an infant ), george spent much of his childhood on the move with his family. ( george also had three stepsiblings from his father ’ s previous marriage : lawrence and augustine ii — respectively 14 and 12 years george ’ s senior — and jane, who died when george was two. ) when he was three, the fami ly relocated 60 miles upstream to their home at little hunting creek on the potomac ( later named mount vernon ) ; three years later, they moved once more, this time to a smaller plot of land on the rappahannock river near fredericksburg that was close to an iron furnace george ’ s father was then managing. when washington, at age 11, lost his father']",True,10,3,10,3,82.97862601280212,0.6281248927116394,single_hop_specifc_query_synthesizer,"[""Ferry Farm was one of the places where George Washington lived during his childhood. After being born at Pope's Creek and living there until he was three, George moved to Mount Vernon for another three years before moving to Ferry Farm. While living at Ferry Farm, he learned to farm and to ride horses. His time at Ferry Farm was part of his early upbringing before his father died when George was eleven.""]",0.8333333332916666,0.3333333333333333,0.9700411625706166,1.0,0.5576154527432515,0.9261139848860496
