question,answer,contexts,used_reranker,k_init,top_n,num_initial_docs,num_final_docs,runtime_seconds,factuality_score,question_type,ground_truths,context_precision,faithfulness,answer_relevancy,context_recall,answer_correctness,semantic_similarity
"How did Washington emphasize the importance of unity among Americans in his Farewell Address, and how did the joint efforts of American and French troops at Yorktown contribute to the American cause?"," In my Farewell Address, I underscored the imperative of unity among Americans, cautioning against the perils of political parties and factions that could rend the fabric of our nation asunder. I implored my fellow citizens to transcend their differences and work in concert for the common good, for ""the spirit of party is like a serpent in the bosom of our government, and we must be constantly vigilant against its venom."" Moreover, I emphasized the indispensable role of national unity in safeguarding peace and security, asserting that ""a house divided against itself cannot stand.""

The collaboration of American and French forces at Yorktown proved instrumental in our ultimate triumph over the British, as their combined might eroded the enemy's resolve and compelled their surrender. The alliance between our two nations was a vital cog in the machinery of victory, providing the requisite military support and resources to vanquish the foe. The successful outcome of Yorktown served not only as a testament to the tenacity of the American people but also as a harbinger of our burgeoning nation's capacity to defend itself and its interests on the global stage.","['washington\'s farewell address, published by the american daily advertiser on september 19, 1796 by the british ; the latter were stationed in forts that they had refused to abandon after the revolutionary war. [ 31 ] [ 208 ] in 1794 american troops defeated the native american forces at the battle of fallen timbers, ending the conflict between the two. [ 31 ] hamilton formulated the jay treaty to normalize trade relations with britain while removing them from western forts, and also to resolve financial debts remaining from the revolution. [ 209 ] chief justice john jay represented washington\'s position and signed the treaty on november 19, 1794. washington supported the treaty because it avoided war, [ 210 ] although he was disappointed that its provisions favored britain. [ 211 ] he mobilized public opinion and secured ratification [ 212 ] but faced frequent public criticism and political controversy. [ 213 ] [ 31 ] following the british abandonment of their forts around the great lakes, the proposed position of the canada – united states border was sent to arbitration. numerous pre - revolution debts were settled and the british opened the british west indies to american merchants. the agreement secured peace with britain and a decade of prosperous trade ; however, jefferson claimed that it angered france and "" invited rather than avoided "" war. [ 214 ] jefferson\'s', 'de - struction through petty factionalism. although washington was in no sense the father of american isolationism, since he recognized the ne - cessity of temporary associations for “ extraordinary emergencies, ” he did counsel against the establishment of “ permanent alliances with other countries, ” connections that he warned would inevitably be sub - versive of america ’ s national interest. washington did not publicly deliver his farewell address. it first ap - peared on september 19, 1796, in the philadelphia daily american advertiser and then in papers around the country. in january 1862, with the constitution endangered by civil war, a thou - sand citizens of philadelphia petitioned congress to commemorate the forthcoming 130th anniversary of george washington ’ s birth by provid - ing that “ the farewell address of washington be read aloud on the morn - ing of that day in one or the other of the houses of congress. ” both houses agreed and assembled in the house of representatives ’ chamber on february 22, 1862, where secretary of the senate john w. forney “ ren - dered ‘ the farewell address ’ very effectively, ” as one observer recalled. the practice of reading the farewell address did not immediately be - come a tradition. the address was first read in regular legislative ses', 'the british army, while the french navy emerged victorious at the battle of the chesapeake. the final american offensive began with a shot fired by washington. [ 124 ] the siege ended with a british surrender on october 19, 1781 ; over 7, 000 british soldiers became prisoners of war. [ 139 ] washington negotiated the terms of surrender for two days, and the official signing ceremony took place on october 19. [ 140 ] although the peace treaty was not negotiated for two more years, yorktown proved to be the last significant battle of the revolutionary war, with the british parliament agreeing to cease hostilities in march 1782. [ 141 ] when peace negotiations began in april 1782, both the british and french began gradually evacuating their forces. [ 142 ] in march 1783, washington successfully calmed the newburgh conspiracy, a planned mutiny by american officers dissatisfied with a lack of pay. [ 31 ] [ 143 ] washington submitted an account of southern theater and yorktown demobilization and resignation']",True,10,3,10,3,111.40673780441284,0.5121501684188843,multi_hop_specific_query_synthesizer,"[""In his Farewell Address, Washington emphasized the importance of unity among Americans by urging them to cherish an immovable attachment to the national Union, describing it as the main pillar of their real independence, tranquility, peace, safety, prosperity, and liberty. He warned against internal and external enemies seeking to weaken this unity and stressed that the name 'American' should exalt the just pride of patriotism above local distinctions. Washington highlighted the mutual benefits of union among different regions, such as the North, South, East, and West, in commerce, agriculture, navigation, and security, and portrayed the Union as essential to avoiding internal conflicts and maintaining liberty. Regarding the military efforts, the joint American and French troops played a decisive role at the Siege of Yorktown, where Cornwallis was forced to surrender after Washington rejected unfavorable terms and insisted on his own. The American troops lined up on one side of the road and the French on the other as the British marched out to lay down their arms. This victory was a death-blow to the British war effort, leading to great joy throughout the land and eventual British evacuation of New York. Washington praised all troops for their bravery, and this combined effort significantly advanced the American cause for independence.""]",0.49999999995,0.0,0.8919090872667951,1.0,0.6166163382135965,0.9236082099972434
"How did King George II's orders influence George Washington's early military actions in the Ohio Country, and how did King George III's response to colonial complaints differ during the buildup to the American Revolution?"," As I, George Washington, strode forth into the Ohio Country, I was guided by the orders of King George II, who had tasked me with investigating the rumors of French fortifications in English-claimed territory and requesting their peaceful departure. If they refused, I was to drive them out by force of arms. This mission set the stage for my future military actions in the region and contributed to the simmering tensions between British and French forces in North America.

In contrast, King George III's response to colonial complaints during the buildup to the American Revolution was marked by a more cautious approach. While he was still willing to negotiate with colonial leaders, he was more hesitant to take military action against them. This approach was influenced by a growing sense of unease about the growing power of the colonies and their increasing independence from British rule. As such, his response was characterized by a greater willingness to seek compromise and avoid confrontation.","['page | 3 in october of the following year, washington was give n the assignment to venture into the western territories of the ohio country ( so named for the ohio company, a land speculation company that both of washington ’ s stepbrothers had helped found in 1747 ) to learn if the french were building forts in the land that england claimed as hers. if they were, washington should ask them to peacefully depart ; if they didn ’ t, washington was, in an order signed by king george ii, “ strictly charge [ d ] and command [ ed ]... to drive them off by force of arms. ” 5 joined by a small band of outdoorsmen and a french interpreter, washington set off into the ohio wilderness, where he quickly became plagued by miserably cold weather and freezing rain. nevertheless, he made contact with local iroquois indians, who guided washington to a french trading post ; from there, they made their way to the french fort le boeuf, arriving at the fort ( in present day northwest pennsylvania ) in mid - december. the french were not keen to obey washington ’ s request that they leave, and washington hurriedly returned to williamsburg to report the news. presenting governor dinwiddie with the french reply, along with his own estimates of', 'george washington was proud to be an officer in the virginia militia. 29 this, virginia would have more control of the ohio river and the smaller rivers that flowed from and fed into the larger river. one year later, in 1754, he sent george washington to the west again. this time washington led a force of 150 men. the british had built a small fort in western pennsylvania on the site of present - day pittsburgh. the fort sat where two rivers come together to form the ohio river. washington was to join forces with the british soldiers at the fort. before he arrived, washington learned that the french had already captured the british fort and renamed it fort duquesne ( / doo * kayn / ). in time, george washington would become a great general, but in 1754, he was young and inexperienced. he made a number of mistakes. washington did not have enough men to drive the french out of the fort. the wisest thing to do would have been to return to virginia. instead, he continued on with his small force. vocabulary general, n. the main leader of an army', 'nwiddie, threatening his ohio companythreatening his ohio company ’ ’ s claims to these same lands. s claims to these same lands. • • in in october 1753october 1753 virginia governor dinwiddie received word from king george virginia governor dinwiddie received word from king george ii to proceed with building english forts on the ohio river and ii to proceed with building english forts on the ohio river and to send a to send a mission to determine whether the french were intruding on englismission to determine whether the french were intruding on english soil. he h soil. he was further advised that such emissaries should was further advised that such emissaries should “ “ require the french to require the french to peaceably departpeaceably depart ” ”, and that if they refused,, and that if they refused, “ “ we do strictly command you to we do strictly command you to drive them out by force of armsdrive them out by force of arms ” ”..']",True,10,3,10,3,112.19434213638306,0.5136040449142456,multi_hop_specific_query_synthesizer,"[""King George II directly influenced George Washington's early military career by signing an order that strictly charged Washington to drive the French out of the Ohio Country by force if they did not leave peacefully. This order led Washington, then a young major in the Virginia militia, to undertake a mission to the French Fort Le Boeuf to demand their departure and later to lead an armed ambush against the French, which escalated tensions and set the stage for the French and Indian War. In contrast, during the buildup to the American Revolution, King George III received formal complaints from the colonies, including a Declaration of Rights issued by the First Continental Congress, which expressed colonial loyalty but also protested the loss of their rights. However, King George III and the British government responded harshly by enforcing the Intolerable Acts, appointing a military governor with thousands of soldiers to Massachusetts, and refusing to repeal the laws, which united the colonies in resistance and fostered a new American identity. Thus, while King George II's orders directly shaped Washington's military engagements, King George III's refusal to address colonial grievances contributed to the colonies' growing unity and eventual rebellion.""]",0.9999999999666667,0.5,0.9024957114338653,0.2,0.6970547431773315,0.94206512655548
"How did the diverse American colonies, with their mix of immigrant customs and the development of American English, contribute to the arguments made in the Declaration of Independence about the colonies' right to self-government?"," The American colonies, with their rich tapestry of diverse customs and the burgeoning spirit of American English, played a pivotal role in shaping the arguments presented in the Declaration of Independence by challenging the notion that only the British government held the authority to enact laws for its colonies. As the colonists began to envision themselves as Americans, united by a shared identity and purpose, they demanded greater autonomy and ultimately paved the way for the drafting of the Declaration of Independence, which boldly asserted the colonies' right to self-government and laid the foundation for a nation built on the principles of liberty and equality.","['22 to run the whole british empire. it was up to parliament to pass laws about trade among different parts of the empire. only parliament could decide the rules for trade between the empire and other parts of the world. the american colonists didn ’ t argue with that. when it came to everyday life in their own colonies, however, the colonists began to think that only they knew what was best for them. claiming british rights as you have discovered, england had joined with scotland and wales to form the nation of great britain. the people of great britain — the english, the scots, and the welsh — had self - government. they also had other rights and liberties. as members of the british empire, colonists in north america felt they should have the same rights. most of these rights and liberties were meant to protect the people against unfair actions by their own government. for example, the government could not just take away a person ’ s house or land or ship or other property. if the government said it needed that property for a very important purpose, it had to prove that to a judge. if the judge agreed with the government, the government had to pay the owner for whatever it was taking. similarly, government officers could not search your home or business whenever they felt like it.', 'the colonists began to think of themselves as americans, not as members of thirteen separate colonies. 72 along, before anyone was aware of it. that “ something ” was that the colonies were coming together as never before. before this, each colony had thought of itself as separate from the others. the colonists thought of themselves as virginians or new yorkers or georgians. when they thought of an attachment to any other place, it was to great britain. that was partly because each colony had more to do with britain than it did with other colonies. it was also due to the fact that the colonists thought of themselves as british citizens, with all the “ rights of englishmen. ”', '3 immigrants by the hundreds arrived in the american colonies in the 1700s.']",True,10,3,10,3,79.58307194709778,0.4552198648452759,multi_hop_specific_query_synthesizer,"[""The American colonies were home to many immigrant groups who initially settled near people from their own countries, maintaining their languages and customs. Over time, these groups borrowed ideas and customs from each other, such as building log cabins and sharing words from German, Dutch, Native American, and African languages, which led to the creation of American English. This blending of cultures and improved communication, aided by better roads and more frequent mail delivery, helped bring colonists together and foster a shared identity. This growing unity and common sense of belonging among the diverse colonies underpinned the arguments in the Declaration of Independence. Thomas Jefferson explained that the Declaration was meant to express the American mind and persuade the world of the colonies' right to self-government. The document listed grievances against the British king for violating the colonists' rights and declared the colonies free and independent states, able to govern themselves. Thus, the cultural and linguistic coming together of the colonies helped form the foundation for the Declaration's case for independence and self-rule.""]",0.5833333333041666,0.3,0.9169242153624507,0.2857142857142857,0.580921916773292,0.9390722824777833
"How did the events at White Plains influence the capture and exposure of Benedict Arnold's plot involving John André, and what role did the communication between the officers play in this outcome?"," The fateful events at White Plains did not directly influence the revelation of Benedict Arnold's nefarious scheme involving John André. However, the communication between the officers played a pivotal role in this outcome. Following the battle of White Plains, I, George Washington, took charge of the situation and repositioned key commanders under Arnold to prevent any collusion. I assumed personal command at West Point and fortified its defenses, granting me greater control over the situation and enabling me to closely monitor Arnold's actions. Furthermore, my decision to dispatch John André on a mission to meet with Arnold was a calculated move that ultimately exposed Arnold's treachery and led to his downfall.","[""map of the siege of yorktown from a surprise british attack, which was itself based on intelligence from washington's general turned british spy benedict arnold. [ 127 ] washington had disregarded incidents of disloyalty by arnold, who had distinguished himself in many campaigns, including the invasion of quebec. [ 128 ] in 1779, arnold began supplying the british spymaster john andre with sensitive information intended to allow the british to capture west point, a key american defensive position on the hudson river. [ 129 ] on september 21, arnold gave andre plans to take over the garrison. [ 130 ] andre was captured by militia who discovered the plans, after which arnold escaped to new york. [ 131 ] on being told about arnold's treason, washington recalled the commanders positioned under arnold at key points around the fort to prevent any complicity. he assumed personal command at west point and reorganized its defenses. [ 132 ] by june 1780, the british had occupied the south carolina piedmont and had firm control of the south. washington was reinvigorated, however, when lafayette returned from france with more ships, men, and supplies, [ 133 ] and 5, 000 veteran french troops led by marshal rochambeau arrived at newport, rhode island in july. [ 134 ] general clinton sent"", '121 benedict arnold during this time, george washington suffered one of his greatest disappointments. it was not a defeat on the battlefield. it was a defeat of the spirit. one of the patriots ’ bravest and finest generals, and one of washington ’ s favorites, went over to the enemy. his name was benedict arnold. arnold had helped win the battle of saratoga. he had been promoted to general. his future in the american army was bright. in 1780, general washington placed benedict arnold in command of west point, a fort on the hudson river. despite his success, benedict arnold did not feel appreciated enough. he also liked to spend more money than he could afford on luxuries. so in exchange for a large sum of money, arnold agreed to turn over west point to the british. the plot was discovered in time, but arnold himself escaped and joined the british forces. americans were shocked to learn of benedict arnold ’ s treason. vocabulary treason, n. disloyalty to a country by helping an enemy', 'benedict arnold to fight against british general john burgoyne in new york. on october 17, after losing roughly a thousand of his men in the battle of saratoga, burgoyne surrendered his army. the americ an victory prompted the french to enter the war and openly ally with the american cause. in the winter of 1777, washington set up camp for his 11, 000 men 20 miles northwest of philadelphia at valley forge, which he described as “ a dreary kind of place and 7 chernow, 272.']",True,10,3,10,3,86.73308777809143,0.3862380385398865,multi_hop_specific_query_synthesizer,"[""The events at White Plains were part of a series of military actions where the red-coats eventually fell back from the area, but the conflict continued in the north. Major Tallmadge, returning from White Plains, urged that John André, who had been captured with plans given by Benedict Arnold, be brought back quickly. When André was caught with the plans, they were sent to the Commander-in-chief, and a note was sent to Arnold informing him of the capture. However, the officer in charge, Jameson, mistakenly allowed the note to be sent to Arnold without recalling it, which alerted Arnold to the failure of his plot. Arnold then fled, escaping capture. Thus, the military movements around White Plains indirectly contributed to the exposure of Arnold's treason through the timely communication and actions of the officers involved.""]",0.99999999995,0.2727272727272727,0.9438488804558335,0.16666666666666666,0.3474978318498282,0.9285144297197118
