question,answer,contexts,used_reranker,k_init,top_n,num_initial_docs,num_final_docs,runtime_seconds,factuality_score,question_type,context_precision,faithfulness,answer_relevancy,context_recall,answer_correctness,answer_similarity
What did the proponents of the community model advocate for in terms of European cooperation?,"I believe that the community model is the best way to solve Europe's problems and reflect the rule, not the exception, in international relations. However, there are two major obstacles to this argument: theoretical difficulties in isolating ideas as causes and skepticism about the importance of ideas in politics. The proponents of the community model believe that certain conditions allow for more concrete and specific claims about ideas, such as when ideas strongly cross-cut lines of shared material interests in a polity.","['formal institutions at all ). only advocates of a new ideology of integration — what i call the “ community model ” — perceived interests in the unprecedented institutional project showcased in the ecsc and eec. had europeans followed other viable, historically active ideas about their interests in cooperation — the “ confederal ” or “ traditional ” models — they would have solved their problems through more stan - dard diplomatic instruments. today ’ s europe would reﬂect the rule, not theexception, in international relations. this argument confronts two major obstacles. the ﬁrst is theoretical : isolating ideas as causes is difﬁcult. a growing literature points to actors ’ subjective beliefs as important causes of political outcomes. 3but if ideational theorists argue persua - sively that ideas are often non - negligible factors in politics, they have troublespecifying how much ideas matter. skeptics thus remain free to dismiss ideas as residual to objective responses to structural or institutional constraints. i argue thatcertain conditions allow for more concrete and speciﬁc claims about ideas. whereideas strongly cross - cut lines of shared material interests in a polity, we can isolate individuals ’ beliefs most clearly from objective pressures. cross - cutting ideas canals', 'legacies at thenational level — or mean capitulation to the german konzerns. for the right, supranational integration could open france to broader markets — or emasculatenational strength and identity. since right, left, and center had their realists, pragmatists, idealists, anglophiles, and even germanophiles, domestic allies grav - itated to different european strategies. after several years of confusion, theirpositions crystallized around the ecsc proposal. some elites sought to mobilizecoalitions in favor of community projects ; others in the same parties and bureau - cracies called for confederal or traditional alternatives. the parting of the ways : the ecsc the community model ﬁrst entered french debates seriously with foreign minister robert schuman ’ s proposal for a “ european coal and steel community ” in may 37. see searle 1995 ; and ruggie 1998. 38. on ideas at different levels of generality, see campbell 1998 ; and goldstein and keohane 1993. 58 international organization', 'later development. 2 although i accept insights from both approaches, i argue that neither explains why europeans chose this “ community ” europe over radically different alternativesin the 1950s. if postwar structural conditions generated widely perceived impera - tives to european cooperation, they did not dictate its shape or extent. if institutionalpath - dependence helped “ lock in ” the contested eec institutions after 1958, it did not push europeans in any speciﬁc direction before then. within vague structuraland institutional pressures, only certain ideas led europeans to the eec rather than to less extensive cooperation in much weaker international institutions ( or without for comments i thank chris ansell, neil fligstein, nicolas jabko, elizabeth kier, andrew moravcsik, paul pitman, wayne sandholtz, robert rauchhaus, jeffrey vanke, steve weber, two anonymousreviewers and the editors of international organization, and audiences at the university of british columbia, the university of california at berkeley, harvard university, the georgia institute oftechnology, and syracuse university. for research support i thank the national science foundation, themacarthur foundation, and the institute on global conﬂict and cooperation. 1. see moravcsik 1998 ; and milward 1992.']",True,10,3,10,3,3.091543436050415,0.5715768933296204,factual,0.0,0.8,0.8330224331650227,1.0,0.20377323478337223,0.8150929391334889
What alternative to the EDC emerged after its failure?,"I remember that after the EDC failed, an alternative to European integration was proposed in the form of the European Economic Community (EEC). The goal of the EEC was to overcome the limitations of the ECSC and create a common market for all economic sectors through an intermediary step, which was the creation of a customs union. This idea was partly aimed at appealing to the French and was supported by most Benelux and German leaders, despite their initial hesitation.","['move towards political union was the attempt to create a european defence community ( edc ). discussed after the successful launch of the ecsc, the edc foresaw the integration of the armies of the six ecsc member states ( i. e. including germany ) into a european army. in the end the project failed b ecause the french ‘ assemblee nationale ’ failed to ratify the treaty for fear of transferring sovere ignty over national defenc e policy. this period ( 1952 - 53 ) also saw the abortive attempt to creat e a european political union ( epu ), which was an initiative aimed at an integrated european foreign policy. following these failures, attempts to bring fo rward european integration moved away from political and towards economic cooperation. the treaties of rome, signed in 1957, successfully reinvigorated the dynamism of the integrati on process through economic integration and the european economic community ( eec ). the eec was founded to overcome the sectoral limitation of the ecsc. it aime d at the creation of a common ma rket for all economic sectors via an intermediary step, the creation of a cust oms union. in practical terms internal quotas', '. their traditionalist peers either rejected german rearmamentoutright or favored a standard alliance framework. again, none of these actors misread their environment. all three strategies were viable internationally. the community option led to the edc treaty in may 1952. itwas ratiﬁed by the other ecsc members and supported by the united states, leavingit to france to ratify or reject. a traditional solution — re - arming germany withoutnew institutions — was also clearly available, since the french alone opposed this path against u. s. and european pressure in 1950 – 51. the confederal option wasequally viable as a compromise — since this is what quickly emerged after the french rejected the edc ( see below ). all else equal, the french were selectingbetween outcomes as divergent as a european army and simple german entry intonato. the french pursued the edc through 1952 not because the third force coalition coherently supported it, but because pro - community leaders controlled the foreign - policy agenda. encouraged by monnet and alphand, schuman shifted frenchpolicies from stonewalling to pushing for an ecsc - style framework in summer1951. no one else in paris was consulted on this change. 64', 's ecscpartners ( germany, benelux, italy ) eventually agreed to negotiate edc but quicklydropped it when the french turned against it in 1954. 24while the eec itself was not a french proposal — originating with ultra - europeanist dutch foreign minister janwillem beyen — it was partly crafted to appeal to the french. beyen notwithstand - ing, most benelux and german leaders preferred trade liberalization in the broaderand institutionally weak format championed by the british. they hesitantly sup - ported beyen ’ s eec plan because they feared the french would only acceptliberalization within a “ little europe ” with elaborate economic safeguards. 25in sum, no one contests that without french insistence on institutionally strong, geograph - ically limited institution building in the 1950s no such framework would haveresulted. two alternatives to my account, however, see this french position as strongly determined by nonideational factors. for structuralists, objective economic andgeopolitical constraints selected french strategies. historians like milward andwilliam hitchcock argue that france needed a new basis for controlling andcooperating with a resurgent west germany in 1950 ; the ecsc ’ s supranationalovers']",True,10,3,10,3,2.713256359100342,0.5191649794578552,factual,0.9999999999666667,1.0,0.8819511760826436,,0.2055414668496336,0.8221658673985344
What was one major reason for the divergence in French elites' views on European integration?,"Well, I believe that one of the main reasons for the differences in opinions among French elites regarding European integration is due to their varying perspectives on the advantages and disadvantages associated with it. Some saw it as a way to enhance France's economic and political influence, while others viewed it as a potential threat to national sovereignty and control over its overseas territories. Furthermore, the bureaucrats and deputies from the various groups, including the independents, MRP, radicals, and socialists, were concerned about protecting the French Union from being ""Europeanized.""","['for german side - payments in investments and aid forthe french union. if with hindsight such payoffs look clearly beneﬁcial to france, many traditionalists and confederalists actually saw eec ’ s intrusion into colonialrelationships as another reason to oppose it. bureaucrats and deputies among theindependents, mrp, radicals, and socialists wanted to “ safeguard the frenchunion ” against “ europeanization. ” 112not only did liberalization threaten the territories ; even aidfrom other countries would undercut french control. finance ofﬁcials insisted well into the eec negotiations that france ’ s “ natural ally ” wasbritain, and that france should : 1 ) push for european integration in the oeec framework, trying to establish a franco - british common front.... 2 ) not discuss, even in principle, theintegration of the overseas territories of the franc zone before the principlesof european integration are established and have begun to be executed. 3 ) activate as much as possible the economic, ﬁnancial, and tariff integration ofthe franc zone ( notably morocco ) with france, and not envisage the adhesionof this zone to eurafrica until its own internal ties are suf', 'european leaders opposed deeper integration. the french president charles de gaulle, for instance, tried to strip the high authority ( now the european commission ) of its supranational aspirations by establishing a primacy of member states. he also attacked majority voting in the council of ministers by boycotting council meetings and paralysing co mmunity decision - making for several months. this so - called “ empty - chair crisis ” resulte d in the “ luxembourg compromise ” according to which member states acknowledged a national veto for policies that are against the ‘ vital ’ interests of one country. as a result actual vo ting in the council of ministers remained the exception and consensus the rule. in addition to the initiatives eventually leading to the eu, many other organisations originated in the post - war era, such as nato and the oecd ( for an overview see annex 1 ). 5 the ecsc expired in mid - 2001 after 50 years of existence.', 'politics. the eec of the 1960s, like many institutionalframeworks, rested “ on defeated and repressed alternatives. ” 132 thus structures set the broad context for european institution building, and institutions held europeans to one path once it was chosen. in between, europeansfaced three viable alternatives in the 1950s. my answer to the “ how much ” questionis that leaders ’ ideas, as a cause irreducible to other factors, determined the outcomeacross these alternatives. during the late 1940s, french individuals gravitated tothree different views of their national interests in europe, in patterns that diverged from their main material and organizational positions. within complex multidimen - sional issue - space, this three - way divide in preferences meant majorities could becrafted for all three options. corresponding alternatives in international bargainingwere available as well. since european cleavages cross - cut right and left in 131. see steinmo, thelen, and longstreth 1992 ; and ikenberry 1988. 132. see berk 1994, 16 ; and unger 1987. 76 international organization']",True,10,3,10,3,3.0904994010925293,0.4775703251361847,reasoning,0.9999999999666667,1.0,0.9512837695827234,,0.5198952835072956,0.8795811340291824
What was the outcome of the EDC vote in the French assembly?,I don't know the answer.,"['of each party were left isolated. at gaullist insistence, inearly 1953 schuman was replaced as foreign minister by his mrp ally — though edc opponent — georges bidault. after attempting to renegotiate the edc, radicalpremier pierre mende ` s france called a vote in august 1954 ( though he himself abstained ). the socialists split ﬁfty for, ﬁfty - three against ; the radicals and udsrvoted forty - one for, forty - four against ; and the independents divided sixty - six for, twenty - eight against. the hierarchical mrp maintained cohesion for the edc onlyby expelling several members and despite known hostility from much of the party. 68 gaullist and communist opposition decided the outcome. the edc did not emerge from majority support and die when policymakers changed their positions. the 1952 realignment reﬂected no broad shift on europeanissues. the public was ill - informed about the edc and its alternatives. 69neither before nor after 1952 did any substantive agreement on european policies help unitethe governing coalition ; the independents and radicals who led governments from1952 to 1955 were the groups most divided over europe. instead, the edc drew its support consistently', '; the independents and radicals who led governments from1952 to 1955 were the groups most divided over europe. instead, the edc drew its support consistently from minority groups in each of the governing parties. it roseand fell as they obtained and lost agenda control on the other issues that dominated coalition building. the extent to which the edc vote cross - cut french politics was remarkable. daniel lerner has shown that it lacked a regional pattern. 70erling bjøl has 66. alphand 1977, 228. 67. fauvet 1957, 163. 68. see irving 1973, 170 ; elgey 1993, 2 : 329 – 79 ; mayeur and milza 1993 ; lerner and aron 1957, 9 ; and fauvet 1957, 137. 69. in may 1953, french polls found 21 percent had not heard of the edc ; 60 percent did not know if it had been ratiﬁed ; 40 percent did not know if germany participated ; and 51 percent did not know ifbritain participated. in july 1954, 36 percent approved of the edc, 31 percent were opposed, and 33percent had no opinion ; in august it was 32 percent, 33 percent, and 35 percent. see stoetzel 1957 ; and', 'after confederalists and traditionalists rejected the edc, pro - community deputies and traditionalists combinedto reject the ﬁrst vote on the weu. a shocked mende ´s france called a second vote on a question of conﬁdence ( linking the weu to his other policy goals ) and achieved a majority. 82. massigli 1978, 506. 83. duche [UNK] 1994, 262 – 79. 66 international organization']",True,10,3,10,3,1.9024832248687744,0.5286410450935364,factual,0.9999999999666667,,0.0,,0.6843423004301885,0.7373692017207543
What did the traditionalist model prioritize in contrast to the community model?,"I understand that the traditionalist model emphasizes the connection between France and its European surroundings, while the community model focuses on the guidelines defining France's role in a European context.","['legacies at thenational level — or mean capitulation to the german konzerns. for the right, supranational integration could open france to broader markets — or emasculatenational strength and identity. since right, left, and center had their realists, pragmatists, idealists, anglophiles, and even germanophiles, domestic allies grav - itated to different european strategies. after several years of confusion, theirpositions crystallized around the ecsc proposal. some elites sought to mobilizecoalitions in favor of community projects ; others in the same parties and bureau - cracies called for confederal or traditional alternatives. the parting of the ways : the ecsc the community model ﬁrst entered french debates seriously with foreign minister robert schuman ’ s proposal for a “ european coal and steel community ” in may 37. see searle 1995 ; and ruggie 1998. 38. on ideas at different levels of generality, see campbell 1998 ; and goldstein and keohane 1993. 58 international organization', 'germanism. some traditionalists soon proved quitewilling to deal bilaterally with germany. others arrived at confederal or communitystrategies out of visceral fear of germany unfettered. instead, the fundamentaldistinctions concerned the “ master frame ” linking france itself and its europeanenvironment. in the slightly different vocabulary of john searle, they suggesteddifferent “ constitutive rules ” about france as a player in a european game. 37each packaged a set of normative and causal claims that deﬁned france ’ s positionvis - a ` - vis its neighbors. crucially, these different views of europe had no direct connection to the right – left cleavage that dominated french politics. each model ’ s constitutive ruleswere general enough to link to various lower - level “ regulative rules ” ; arguments soon arose that pictured a “ community ” europe ( and its competitors ) as eitheradvancing or impeding goals across left and right ( except for the communists ). 38 for the left, a supranational community could undo conservative legacies at thenational level — or mean capitulation to the german konzerns. for the right, supranational', 'plans. but though centrist majorities allowed for community choices, they never demanded that strategy. the conventional wisdom that european policies served as functional “ glue ” for centrist majorities reverses the real dynamic. far from beingunited over europe, the center was the part of french politics most divided over europe. only the communist and gaullist extremes had united ( traditional ) euro - pean preferences. all the parties in between included community advocates, confederalists, and traditionalists. consequently, not only did community plans nothelp any centrist leader form a majority, but committing to anyeuropean track provoked opposition from at least half the leader ’ s electoral allies. schuman couldpass the ecsc only by expending political capital from other issues. the same wastrue for mende ` s france with the weu and mollet with the eec. centrist majorities created permissive conditions for community policies, but they did not cause them. how exactly did french choices matter for european outcomes? french commu - nity strategies led to automatic liberalization, plans for a cap, an atomic researchpool, and other projects under supranational institutions among the six. a confed - eral strategy, by contrast']",True,10,3,10,3,2.10481071472168,0.5113573670387268,reasoning,0.0,1.0,0.8873738961435684,,0.20552199231812163,0.8220879692724865
What did the term 'multiple equilibria' refer to in the context of the document?,"In the context of the document, ""multiple equilibria"" refers to a situation where there are multiple possible solutions or outcomes to a problem or decision-making process. This concept is discussed in the chapter ""Voting Equilibria in Multidimensional Choice Spaces"" by Richard P. McKelvey and Richard E. Wendell, which examines how voting systems can lead to different equilibria depending on the number of dimensions involved in the choice space.","['mayeur, jean - marie, and pierre milza, eds. 1993. le mrp et la construction europe ´enne. paris : complexe. mckelvey, richard p., and richard e. wendell. 1976. voting equilibria in multidimensional choice spaces. mathematics of operations research 1 ( 2 ) : 144 – 58. mcnamara, kathleen r. 1998. the currency of ideas : monetary politics in the european union. ithaca, n. y. : cornell university press. milward, alan s. 1984. the reconstruction of western europe, 1945 – 1951. london : methuen. — — —. 1988. the belgian coal and steel industries and the schuman plan. in die anfa ¨nge des schuman - plans, 1950 – 1951, edited by klaus schwabe, 437 – 56. baden - baden : nomos. — — —. 1992. the european rescue of the nation - state. berkeley : university of california press. moch, jules. 1976. une si longue vie. paris : robert laffont. moravcsik, andrew. 1998. the choice for europe : social purpose and state power from messina to maastricht. ithaca, n. y', 'multilevel regulation and the eu : the interplay between global, european and national normative processes, edited by a. follesdal, r. a. wessel and j. wouters ( leiden : martinus nijhoff publishers, 2008, isbn9789004164383 ) ; xvii + 420pp., €150. 00 hb. from the political economy perspective, this book is a neat compilation of legal case studies in the subﬁeld of governance and policy - making. concentrating on the phe - nomenon of multi - level regulation and the interaction between competing levels of governance, the authors give a lengthy account of international regulatory fragmen - tation. ‘ maping the unmappable ’ through a variety of interesting case studies, the book aims to provide the reader with a response from the legal community to fervently debated topics such as globalization and interdependence. the analysis can be divided into two distinct parts. with regard to the ﬁrst section of the book, namely the interplay between global, european and national regulation, there tends to be disappointment with the overall originality of the theoretical con - tributions and conclusions. upon deeper scrutiny, one is', 'is referred to the most rel - evant research publications in the fi eld and these are fully set out in the bibliography at the end of the book. nevertheless, there are also guides to further reading at the end of each chapter, but no guides to other texts, since it is not our task to supply them, especially when this book is a pioneer in its fi eld and covers more than one fi eld of study – it is not confi ned to economics. th e book is written in such a way that pure theory and measurement techniques are confi ned to separate chapters. th is means that the policy chapters should be accessible to all readers. however, it also means that those who seek a rigorous, yet brief, background on international economic integration can fi nd it handily in the same book. moreover, as my contributors will no doubt attest, my editing style has been to ensure that the book reads as a whole, not as a collection of independent articles, each contributed for its own sake. th is has been ensured through thorough editing and consultation with the contributors, cross - referencing, allowing repetition only where absolutely necessary, logical sequencing and a setting which begins with an introductory chapter and fi nishes with one on the future of the']",True,10,3,10,3,2.797032594680786,0.5031105279922485,factual,0.0,0.6666666666666666,0.9882398539331438,1.0,0.5852868469217483,0.8411473876869928
