question,answer,contexts,used_reranker,k_init,top_n,num_initial_docs,num_final_docs,runtime_seconds,factuality_score,question_type
What year was the European Coal and Steel Community (ECSC) established?,I established the European Coal and Steel Community (ECSC) in 1951.,"['C. The Founding Institutions of the European Community\nWhile a variety of institutional arrangements emerged during the post-war period that\nfacilitated closer integration, the actual European Union (initially called the European\nEconomic Community) traces its roots to three organizations in particular. Their varied\nfunctions and institutional arrangements reflected the variety of objectives that the advocates\nof integration had in mind. The European Coal and Steel Community (ECSC), created by the Treaty of Paris in\n1951, included six states: the three Benelux countries, France, West Germany, and Italy. It\naimed to regulate coal and steel production; reduce the internal tariffs hindering the trade in\nthese products across borders; limit subsidies to these sectors; and establish a common\nexternal tariff. A supranational authority (the High Authority) would supervise the process. The idea of regulating coal and steel production meshed well with the French penchant for\ndirigisme , or government planning and intervention. Moreover, once again reflecting the\nsecurity dimensions of the process, coal and steel were considered essential elements for any\npotential military buildup, suggesting the benefits for supranational monitoring of these\nsectors. The Treaty of Rome established the European Atomic Energy Community (Euratom)\nin 1957. Euratom established a joint effort to develop the peaceful use of nuclear energy', 'Institutional foundations•Three Communities created in 1950s: •European Coal and Steel Community (ECSC),1951•making war in Europe not only ‘unthinkable, but materially impossible’•European Atomic Energy Community (Euratom), 1957•European Economic Community (EEC), 1957•Founders:•Germany, France, Italy, Belgium, Netherlands, Luxemburg•Different patterns of development:•Widening•Deepening•Differentiated and multi-speed integration \n', '\uf0d8European integration:  Initiated in Western Europe in \naftermath of World War II; context marked by political \nand economic reconstruction, beginning of Cold War  \n\uf0d8Three Communities created in 1950s:  European Coal \nand Steel Community (ECSC),  European Atomic Energy \nCommunity ( Euratom ) and European Economic \nCommunity (EEC), with six member states  \n\uf0d8Two trajectories of development:  (1) Accession of more \nmember states (“widening”), and (2) transfer of further \npowers to European institutions, coupled with shift to \nsupranational decision making (“deepening”)  History of the EU  ']",False,10,3,10,3,0.9972279071807861,0.5795487761497498,factual
Who proposed the ECSC?,I remember that the ECSC was proposed by the French government.,"['French Ideas and the Origins of the EU\nWestern Europe ﬁrst developed uniquely strong international institutions in the\n1950s. At the end of that decade, six governments committed to deep and broadcooperation in the EEC, including the delegation of considerable powers to “supra-\nnational” agents in the EEC’s executive commission and court. Experts agree that French choices were particularly important to the EEC’s birth. All three of the major supranational projects of the 1950s—the ECSC, the failed\nEuropean Defense Community (EDC), and the EEC—took shape because govern-ments that preferred other European projects conceded to the French. When the\nFrench proposed the ECSC in 1950, the British refused to join any supranationalplan. German and Benelux leaders, though skeptical of supranationality and reluc-tant to proceed without Britain, eventually followed the French lead. 23When the\nFrench proposed the EDC as a similar framework for West German rearmament, allthe other Europeans argued for a simpler plan within NATO. France’s ECSCpartners (Germany, Benelux, Italy) eventually agreed to negotiate EDC but quicklydropped it when the French turned against it in 1954. 24While the EEC itself was not\na French proposal—originating with ultra-Europeanist Dutch foreign minister JanWillem Beyen—it was partly crafted to appeal to the French. Beyen notwithstand-ing, most Benelux and German leaders preferred trade liberalization in the broaderand institutionally weak format championed by the British. They hesitantly sup-ported Beyen’s EEC plan because they feared the French would only acceptliberalization within a “little Europe” with elaborate economic safeguards. 25In sum,\nno one contests that without French insistence on institutionally strong, geograph-ically limited institution building in the 1950s no such framework would haveresulted. Two alternatives to my account, however, see this French position as strongly\ndetermined by nonideational factors. For structuralists, objective economic andgeopolitical constraints selected French strategies. Historians like Milward andWilliam Hitchcock argue that France needed a new basis for controlling andcooperating with a resurgent West Germany in 1950; the ECSC’s supranationaloversight of basic industries was the straightforward solution. 26Similar concerns\nabout overseeing German military power pushed the French to the EDC. Theincentives of this larger delegation of sovereignty were less clear, however, and theEDC died. But soon economic interests, transmitted through interest groups,refocused the French on an institutionally strong “little Europe.” Weak Frenchbusiness feared British plans for broad trade liberalization, preferring a smaller andmore managed trade pact. Growing farm surpluses led French farmers to insist that\n23. See Kersten 1988; Milward 1988; Ludlow 1997, 17; and Bu ¨hrer 1995.', 'Some elites sought to mobilizecoalitions in favor of community projects; others in the same parties and bureau-cracies called for confederal or traditional alternatives. The Parting of the Ways: The ECSC\nThe community model ﬁrst entered French debates seriously with Foreign Minister\nRobert Schuman’s proposal for a “European Coal and Steel Community” in May\n37. See Searle 1995; and Ruggie 1998.', 'With its ru lings the ECJ helped to make \nup for deadlock on the political scene, wher e some European leaders opposed deeper \nintegration. The French President Charles De Gaulle, for instance, tried to strip the High \nAuthority (now the European Commission) of its  supranational aspirations by establishing a \nprimacy of member states. He also attacked majority voting in the Council of Ministers by \nboycotting Council meetings and paralysing Co mmunity decision-making for several months. This so-called “empty-chair crisis” resulte d in the “Luxembourg compromise” according to \nwhich member states acknowledged a national veto  for policies that are against the ‘vital’ \ninterests of one country. As a result actual vo ting in the Council of Ministers remained the \nexception and consensus the rule. In addition to the initiatives eventually leading to  the EU, many other organisations originated \nin the post-war era, such as NATO and the OECD (for an overview see Annex 1). 5 The ECSC expired in mid-2001 after 50 years of existence.']",False,10,3,10,3,1.0011894702911377,0.4760642349720001,factual
Which countries were the founding members of the ECSC?,"I remember that the ECSC was founded by Belgium, the Netherlands, and Luxembourg, along with France, West Germany, and Italy.","[""The EU inherited many of its present organisations ,\ninstitutions , and responsibilities from the European Communities  (EC), which were founded in the 1950s in the spirit of the\nSchuman Declaration . Legend:\n  S: signing\n  F: entry into force\n  T: termination\n  E: expiry\n    de facto supersession\n  Rel. w/ EC/EU framework:\n   de facto inside\n   outside         \n  EUROPEAN  U NION (E\n EUROPEAN  C OMMUNITIES  (EC) (Pillar I)\nEuropean Atomic Energy Community\n(EAEC or EURA TOM)\n / \n  / \n  / \n  European Coal\nand Steel Community  (ECSC) \n  European Economic Community\n(EEC)  \n \n     Schengen RulesEuropean Community\n(EC)\nTREVIJustice\nand\nHome\nAffairs\n(JHA,\npillar\nIII) \n \n  / \n North\nAtlantic Treaty\nOrganisation  (NATO)[Cont.]Police and Judicial\nCo-operation in\nCriminal Matters\n(PJCC, pillar III )\n \nAnglo-French\nalliance[Defence arm\nhanded to NATO]European Political Co-\noperation  (EPC) Common Foreign and\nSecurity Policy\n(CFSP , pillar II )\n Western Union  (WU)\n / \n  Western\nEuropean Union  (WEU)[Tasks defined following the WEU's 1984\nreactivation handed to the EU]\n  \n[Social, cultural tasks\nhanded to CoE][Cont.]         \n   \n  Council of Europe  (CoE)Entente Cordiale\nS: 8 April 1904\nDunkirk T reaty[i]\nS: 4 March 1947\nF: 8 September 1947\nE: 8 September 1997\nBrussels T reaty[i]\nS: 17 March 1948\nF: 25 August 1948\nT: 30 June 2011\nLondon  and Washington  treaties[i]\nS: 5 May/4 April 1949\nF: 3 August/24 August 1949\nParis treaties: ECSC  and EDC[ii]\nS: 18 April 1951/27 May 1952\nF: 23 July 1952/ ? E: 23 July 2002/—\nProtocol Modifying and\nCompleting the Brussels T reaty[i]\nS: 23 October 1954\nF: 6 May 1955\nRome treaties: EEC and EAEC\nS: 25 March 1957\nF: 1 January 1958\nWEU-CoE agreement[i]\nS: 21 October 1959\nF: 1 January 1960\nBrussels (Merger) Treaty[iii]\nS: 8 April 1965\nF: 1 July 1967\nDavignon report\nS: 27 October 1970\nEuropean Council conclusions\nS: 2 December 1975\nSingle European Act (SEA)\nS: 17/28 February 1986\nF: 1 July 1987\nSchengen Agreement  and Convention\nS: 14 June 1985/19 June 1990\nF: 26 March 1995\nMaastricht Treaty[iv][v]\nS: 7 February 1992\nF: 1 November 1993\nAmsterdam Treaty\nS: 2 October 1997\nF: 1 May 1999\nNice Treaty\nS: 26 February 2001\nF: 1 February 2003\ni. Although not EU treaties per se , these treaties af fected the development  of the EU defence arm, a main part of the CFSP . The Franco-British\nalliance established by the Dunkirk Treaty was de facto  superseded by WU. The CFSP  pillar was bolstered by some of the security structures\nthat had been established within the remit of the 1955 Modified Brussels Treaty  (MBT). The Brussels Treaty was terminated  in 2011,Reform\nStructural evolution"", 'C. The Founding Institutions of the European Community\nWhile a variety of institutional arrangements emerged during the post-war period that\nfacilitated closer integration, the actual European Union (initially called the European\nEconomic Community) traces its roots to three organizations in particular. Their varied\nfunctions and institutional arrangements reflected the variety of objectives that the advocates\nof integration had in mind. The European Coal and Steel Community (ECSC), created by the Treaty of Paris in\n1951, included six states: the three Benelux countries, France, West Germany, and Italy. It\naimed to regulate coal and steel production; reduce the internal tariffs hindering the trade in\nthese products across borders; limit subsidies to these sectors; and establish a common\nexternal tariff. A supranational authority (the High Authority) would supervise the process. The idea of regulating coal and steel production meshed well with the French penchant for\ndirigisme , or government planning and intervention. Moreover, once again reflecting the\nsecurity dimensions of the process, coal and steel were considered essential elements for any\npotential military buildup, suggesting the benefits for supranational monitoring of these\nsectors. The Treaty of Rome established the European Atomic Energy Community (Euratom)\nin 1957. Euratom established a joint effort to develop the peaceful use of nuclear energy', 'The Frankish Empire at its greatest\nextent, ca. 814 ADHistory of the European Union\nThe European Union  is a geo-political  entity , created in 1993, covering a large portion of the European continent . It is founded upon numerous treaties and has\nunder gone expansions and secessions that have taken it from six member states  to 27, a majority of the states in Europe. Since the beginning of the institutionalised modern European integration in 1948, the development of the European Union has been based on a supranational\nfoundation that would ""make war unthinkable and materially impossible""[1][2] and reinforce democracy amongst its members[3] as laid out by Robert Schuman\nand other leaders in the Schuman Declaration  (1950) and the Europe Declaration  (1951). This principle was at the heart of the European Coal and Steel\nCommunity  (ECSC) (1951), the Treaty of Paris (1951) , and later the Treaty of Rome  (1957) which established the European Economic Community  (EEC) and\nthe European Atomic Energy Community  (EAEC). The Maastricht Treaty  (1992) created the European Union  with its pillars system , including foreign and\nhome affairs alongside the European Communities . This in turn led to the creation of the single European currency , the euro (launched 1999). The ECSC\nexpired in 2002. The Maastricht Treaty  has been amended by the treaties of Amsterdam  (1997), Nice  (2001) and Lisbon  (2007), the latter merging the three\npillars into a single legal entity , though the EAEC has maintained a distinct legal identity despite sharing members and institutions. The known world in Ancient Greece  was differentiated into three landmass es: Asia, ""Libya "" (Africa ) and Europe , giving rise to identifying the Europea n\nlandmass as a coherent area, a continent .']",False,10,3,10,3,1.2912490367889404,0.502529501914978,factual
What major geopolitical event increased U.S. pressure for European cooperation in the late 1940s?,"Well, I remember that the major geopolitical event that increased U.S. pressure for European cooperation in the late 1940s was the formation of the Soviet Union as a superpower after World War II and its subsequent expansionist policies, particularly in Eastern Europe. This led to the Cold War and the need for Western powers to form alliances and institutions to counter Soviet influence and maintain peace.","['Most European countries failed to maintain their Great Power\nstatus, with the exception of the Soviet Union , which became a superpower after World War II and maintained that status for\n45 years. This left two rival ideologically opposed superpowers.[29]\nWith large scale war being waged in Europe once again in the 1930s and becoming World War II, the question of what to\nfight against and what for, had to be agreed on. A first agreement was the Declaration of St James\'s Palace  of 1941, when\nEurope\'s resistance  gathered in London. This was expanded on by the 1941 Atlantic Charter , establishing the Allies  and their\ncommon goals, inciting a new wave of global international institutions like the United Nations  (founded 1945 ) or the\nBretton Woods System  (1944).[30]\nDuring the 1943 Moscow Conference  and Tehran Conference  plans to establish joint institutions for a post-war\nworld and Europe became increasingly an agenda. This led to a decision at the Yalta Conference  in 1944 to form a\nEuropean Advisory Commission , later replaced by the Council of Foreign Ministers  and the Allied Control Council ,\nfollowing the German surrender and the Potsdam Agreement  in 1945. With war still raging, resistance movem ents formulated their vision of a post-war Europe, the Ventotene prison\nManifesto  of 1941 by Altiero Spinelli  propagated European integration through the Italian Resistance  and after 1943\nthrough the Italian European Federalist Movement . In March 1943, in a radio address, the United Kingdom \'s leader\nSir Winston Churchill  spoke warmly of ""restoring the true greatness of Europe"" once victory had been  achieved, and\nmused on the post-war creation of a ""Council of Europe"" which would bring the European nations together to build\npeace.[31][32]\nBy the end of the war European integrat ion became seen as an antidote to the extreme nationalism  which caused the\nwar.[33] On 19 September 1946 in a much recognized speech Winston Churchill  reiterated his calls since 1930 for a ""European Union"" and ""Council of Europe"",\nat the University of Zürich . After leaving office, Churchill called as a civilian for a United States of Europe . Coincidentally[34] parallel to his speech the\nHertenstein Congress  in the Lucerne Canton  was being held, resulting in the Union of European Federalists ,[35] one of the then founded and later constituting\nmembers of the European Movement . Richard von Coudenhove-Kaler gi, who successfully established during the interwar period  the oldest organization for\nEuropean integration, the Paneuropean Union , founded in June 1947 the European Parliamentary Union  (EPU). To ensure Germany could never threaten theFrom World War I to World War II\nWorld War II (1939–1945)\nAftermath (1945–1948)', 'The rationale for the treaty was the threat of a potential future military attack,\nspecifically a Soviet one in practice, though publicised under the disguise of a German one, according to the official\nstatements. Immediately following the February 1948 coup d\'état  by the Communist Party of Czechoslovakia , the\nLondon Six-Power Conference  was held, resulting in the Soviet  boycott of the Allied Control Council and its\nincapacitation, an event marking the beginning of the Cold War. The remainder of the year 1948 marked the\nbeginning of the institutionalised modern European integration. With the start of the Cold War, the Treaty of Brussels  was signed in 1948 establishing the Western Union  (WU) as\nthe first organisation, followed by the International Authority for the Ruhr . In the same year, the Organization for\nEuropean Economic Co-operation , the predecessor of the OECD, was also founded to manage the Marshall Plan;\nthe Eastern Bloc  responded with establishing the Comecon . A pivotal moment in European integration was the Hague Congress  of May 1948, as it led to the creation of the\nEuropean Movement International , the College of Europe[39] and most importantly to the founding of the Council of\nEurope  on the 5th of May 1949 (now known as Europe Day). The Council of Europe was the first institution to\nbring the sovereign nations of Western Europe together , raising great hopes and fevered debates in the following two\nyears for further European integration. It has since been a broad forum to further cooperation and shared issues,\nachieving things like the 1950-signed European Convention on Human Rights . Essential for the actual birth of the institutions of the EU was the 9th of\nMay 1950 Schuman Declaration  (on the day after the fifth Victory Day,\ntoday\'s Europe day – of the EU). On the basis of that speech, France,\nItaly, the Benelux  countries (Belgium, Netherlands and Luxembour g)\ntogether with West Germany  signed the Treaty of Paris (1951)  creating\nthe European Coal and Steel Community  the following year; this took\nover the role of the International Authority for the Ruhr[37] and lifted\nsome restrictions on German industrial productivity . It gave birth to the\nfirst institutions, such as the High Authority (now the European\nCommission ) and the Common Assembly (now the European\nParliament ). The first presidents of those institutions were Jean Monnet\nand Paul-Henri Spaak  respectively . The founding fathers of the\nEuropean Union  understood that coal and steel were the two industries\nessential for waging war, and believed that by tying their national industries together , a future war between their\nnations became much less likely .[40] Backed by the Marshall Plan with large funds coming from the United States since 1948, the ECSC became  a milestone\norganization, enabling European economic development and integration and being the origin of the main institutions of the EU such as the European\nCommission  and Parliament .[41]\nThe formation of the European Coal and Steel Community was advanced by American  Secretary of State Geor ge C. Marshall . His namesake plan to rebuild\nEurope  in the wake of World War II contributed more than $100 billion in today\'s  dollars to the Europeans, helping to feed Europeans, deliver steel to rebuild\nindustries, provide coal to warm homes, and construct dams to help provide power . In doing so, the Marshall Plan encouraged the integration of European\npowers into the European Coal and Steel Community , the precursor to present-day European Union, by illustrating the effects of economic integration and the\nneed for coordination. The potency of the Marshall Plan caused former German  Chancellor Helmut Schmidt  to remark in 1997 that ""America should not forget\nthat the development of the European Union is one of its greatest achievements. Without the Marshall Plan it perhaps would never have come to that.""[42][43]\nParalleling Schuman, the Pleven Plan of 1951 tried, but failed to tie the institutions of the developing European community under the European Political\nCommunity , which was to include the also proposed  European Defence Community , an alternative to West Germany  joining NATO which was established 1949\nunder the Truman Doctrine . In 1954 the Western European Union  was founded, after NATO took over competences from the WU, and West Germany joined. This prompted the Soviet Union  to form the Warsaw Pact  in 1955, allowing it to enforce its standing in Eastern Europe . The attempt to turn the Saar protectorate  into a ""European territory"" was rejected by a referendum in 1955.', 'Winston Churchill (right, during the\nAtlantic Conference), consistent advocate\nof continental European integration, later\nalong with his son-in-law Duncan Sandys\nFlag of the Western Union\nMeeting in the Hall of Knights in The\nHague, during the Congress of Europe (9\nMay 1948)\nRobert Schuman proposed the Coal and\nSteel Community in May 1950.peace again, its heavy industry was partly dismantled (See: Allied plans for German industry after World War II) and\nits main coal-producing regions were either awarded to neighbouring count ries (Silesia ), managed as separate\ndirectly by an occupying power ( Saarland )[36] or put under international control ( Ruhr area ).[37][38]\nThough by 1947 a growing rift between the western Allied Powers and the Soviet Union  became evident as a result\nof the rigged 1947 Polish legislative election  which constituted an open breach of the Yalta Agreement , followed by\nthe announcement of the Truman Doctrine  on 12 March 1947. On 4 March 1947 France and the United Kingdom\nsigned the Treaty of Dunkirk  for mutual assistance in the event of future military aggression in the aftermath of\nWorld War II against any of the pair.']",False,10,3,10,3,1.9969892501831055,0.5360748171806335,factual
