question,answer,contexts,used_reranker,k_init,top_n,num_initial_docs,num_final_docs,runtime_seconds,factuality_score,question_type
What alternative to the EDC emerged after its failure?,"I remember that after the EDC failed, a confederal alternative was proposed. This idea involved incorporating German forces into looser organizations under Franco-British direction. The traditionalists in our parties and ministries preferred this option over rearming Germany without new institutions.","['consequently dissolving the WEU, as the mutual defence clause  that the Lisbon Treaty provided for EU was considered to render the WEU\nsuperfluous. The EU thus de facto  superseded the WEU. ii. Plans to establish a European Political Community  (EPC) were shelved following the French failure to ratify the Treaty establishing the\nEuropean Defence Community  (EDC). The EPC would have combined the ECSC and the EDC. iii. The European Communities  obtained common institutions and a shared legal personality  (i.e. ability to e.g. sign treaties in their own right).', 'demonstrated the same within the parties and their currents.71Sectorally, while the\nFrench aeronautical and electronic industries would receive guaranteed contractsfrom a European Army, many of their political representatives (like Gaullist deputyand aircraft magnate Marcel Dassault) opposed the EDC for traditional reasons. 72\nSectors like textiles and steel stood to lose from the EDC, and their businessassociations campaigned aggressively for rejection. But many of their normalpolitical mouthpieces (Independents like Pinay or Andre ´ Mutter) were EDC sup-\nporters. 73As Lerner summarized, “the traditional universe of internal French\npolitics, and the new universe of political sentiment evoked by EDC, simply do notcoincide.”\n74\nMassive interpretive evidence corroborates the pattern of cross-cutting mobiliza-\ntion: These actors uniformly described their debates as ideological. One anti-EDCSocialist wrote, “The Europeans displayed a kind of passion. They didn’t toleratethe smallest discussion. One was or was not European. It was religion overecumenism.”\n75Raymond Aron noted, “The difﬁculty seems to me to have been that\nfor the theoreticians of Europe, the whole meaning of EDC was in its supranation-ality. They were more attached to this principle than to reality. On the other hand,the EDC opponents were more against the principle than against the reality. Theformer dreamed about a European State of the Six growing out of EDC; the latterimagined this with horror.”\n76A pro-EDC MRP member concluded, “To speak of a\nEuropean party, of a European majority, is to pose the question badly. The Europeanideal does not unite parties. It unites men across the barriers of parties.”\n77\nThe EDC’s defeat highlighted that pro-community elites were scattered across\nparties. Their strategy was not a domestic “equilibrium” without support acrossother issues. It could be adopted only if they obtained power on other cleavages. Forthe moment, they had little to show for their efforts. The ECSC was a narrowsectoral organization that had stimulated as much hostility as support for suprana-tionality. In August 1954, almost everyone thought the community adventure hadended. Choosing the Community Model: The EEC\nJust as the ECSC’s victory sparked several community projects, the EDC’s fall\nreenergized confederal and traditional plans. Premier Mende `s France—a confeder-\nalist who declared in August 1954 that “The axiom of French policy must be to stick\n71. Bjøl 1966, 169.', 'The domestic–economic account argues that Third Force leaders conceived the\nEDC to preserve social spending despite U.S. pressure for rising defense outlays, bysharing the latter among Europeans. French support for the EDC declined after early1952, when the Third Force was replaced by a conservative coalition with no suchsocial agenda. 62\nThe problem with both explanations, as suggested in older French accounts, is\nthat neither French elites in general nor Third Force leaders in particular ever agreed\non the EDC.63Nor did any changes in constraints lead individuals to change their\nviews of French interests from 1951 to 1954. Straightforward geopolitical pressuresdid put German rearmament on the table, but French elites consistently respondedto these pressures with the three views they had formulated on the ECSC. As of late1950 and through 1954, community advocates in the Independents, MRP, Radicals,UDSR, Socialists, and the bureaucracy called for integrating German units into asupranational European Army. Confederalists in the same parties and ministriespreferred to incorporate German forces into looser organizations under Franco-British direction. Their traditionalist peers either rejected German rearmamentoutright or favored a standard alliance framework. Again, none of these actors misread their environment. All three strategies were\nviable internationally. The community option led to the EDC treaty in May 1952. Itwas ratiﬁed by the other ECSC members and supported by the United States, leavingit to France to ratify or reject. A traditional solution—re-arming Germany withoutnew institutions—was also clearly available, since the French alone opposed this\npath against U.S. and European pressure in 1950–51. The confederal option wasequally viable as a compromise—since this is what quickly emerged after the\nFrench rejected the EDC (see below). All else equal, the French were selectingbetween outcomes as divergent as a European Army and simple German entry intoNATO. The French pursued the EDC through 1952 not because the Third Force coalition\ncoherently supported it, but because pro-community leaders controlled the foreign-policy agenda. Encouraged by Monnet and Alphand, Schuman shifted Frenchpolicies from stonewalling to pushing for an ECSC-style framework in summer1951. No one else in Paris was consulted on this change. 64Monnet played a key role\nin convincing U.S. leaders to focus on the EDC rather than the NATO track.65At\nhome, the shift to a community strategy soon led Third Force traditionalists andconfederalists to abandon Schuman. As they feared, in late 1951 the British ruledout joining any supranational solution. Schuman and Alphand also steadily con-ceded more generous terms to Germany within the EDC. By early 1952, tradition-alists were denouncing the EDC, and large confederalist groups among the Inde-\n62. Pitman 1998.']",False,10,3,10,3,1.5909266471862793,0.33082178235054016,factual
What was one major reason for the divergence in French elites' views on European integration?,"I believe that the Cold War, which began in 1946-47, played a significant role in shaping the views of French elites on European integration. At the time, their primary objective was to keep Germany weak while rebuilding France, and the conflict partially hindered this goal.","['Where possible I offer numbers to substantiate cross-cutting patterns,but my interview, archival, and secondary sources often sustain only estimates. Fewprecise ﬁgures are available. In France, leaders deliberately avoided divisiveparliamentary votes that contrasted European alternatives. Most votes were calledafter policy choices, when leaders engaged coalitional pressures and side-payments\nto assemble support. Similarly, public opinion polls never contrasted policy options.They show mainly that many voters liked “Europe,” but knew little of Europeanalternatives. Nonetheless, I submit, the evidence strongly supports my analysis. The section ﬁrst presents how a new French debate emerged in the late 1940s. Then it narrates the French choices leading to the ECSC, EDC, and EEC. Finally,it considers why, if only “community” ideas led France to the EEC, these institu-tions survived when Charles de Gaulle brought “traditional” ideas to power in 1958. Three Models of French Interests\nImmediately after World War II, French elites largely agreed on their basic\nEuropean strategy. Their primary goal was to keep Germany weak while rebuildingFrench strength. Their means were direct controls on occupied Germany, bolsteredby alliances and economic cooperation with other European powers. 32The advent\nof the Cold War in 1946–47, however, partly blocked this strategy. The United\n30. The only academic precedents to this argument are vague histories without speciﬁc causal claims:\nLipgens 1977; and Brugmans 1965. McNamara’s argument about ideas in the EU concerns ideas abouteconomic policies, not Europe itself. McNamara 1998.', 'The ﬁrst is theoretical: Isolating\nideas as causes is difﬁcult. A growing literature points to actors’ subjective beliefs\nas important causes of political outcomes. 3But if ideational theorists argue persua-\nsively that ideas are often non-negligible factors in politics, they have troublespecifying how much ideas matter. Skeptics thus remain free to dismiss ideas as\nresidual to objective responses to structural or institutional constraints. I argue thatcertain conditions allow for more concrete and speciﬁc claims about ideas. Whereideas strongly cross-cut lines of shared material interests in a polity, we can isolate\nindividuals’ beliefs most clearly from objective pressures. Cross-cutting ideas canalso fragment coalitions and parties, creating situations similar to the “chaos” and“multiple equilibria” described by game theorists. Entrepreneurial leaders may gainthe autonomy to set the policy agenda around their own personal ideas, and tomobilize one of several potential coalitions behind them. Leaders’ ideas, as anautonomous causal factor, thereby select from a range of structural and institutionalpossibilities. The second obstacle is historical: Tracing certain ideas across Europe and the\n1950s is an immense task. I surmount this problem by focusing on the pivotal caseofFrench strategic choices. Experts agree that European cooperation took the shape\nit did in the 1950s—the institutionally strong, geographically limited EEC—above\nall because the French government demanded it. The preferences of the other mainactors (Germany, Britain, Benelux) summed to favor broader and weaker institu-tional options. I show that rather than reﬂecting structural or institutional pressures,French insistence on the EEC resulted from community-minded leadership. Alter-native confederal or traditional French strategies were strongly represented and at\nleast as viable domestically and internationally and would have oriented European\nbargaining to different outcomes. The differences between the EEC and thesealternatives display the range across which French community ideas mattered. Ideas and the “How Much?” Problem\nIdeas are subjective claims about descriptions of the world, causal relationships, orthe normative legitimacy of certain actions. The basic reasons to suspect that ideas\n3.', 'any deal include a sheltered agricultural regime. This further alienated the British\n(with their Commonwealth agricultural preferences). The EEC was the result: TheGermans and Benelux agreed to liberalization largely on French terms. Thus, claimsMoravcsik, we can trace French choices to clear majorities based on objectivesocietal interests. 27\nFor institutionalist pioneer Ernst Haas, structural pressures led the French to the\nECSC, but institutional feedback led on to the EEC. He suggested that Frenchinterest groups and parties did not spontaneously perceive interests in extending theECSC to the EDC or EEC. Only the ECSC’s supranational agents led domesticgroups to perceive such interests. Chief among them was Jean Monnet, the Frenchbureaucrat who presided over the ECSC’s “High Authority” from 1952 to 1955, and\nthereafter led a lobby called the “Action Committee for the United States of\nEurope.” Without the initial creation of supranational agents in the ECSC, impliedthis “neofunctionalist” account, leaders in France (and elsewhere) were unlikely topursue the EEC. French choices can be traced to a majority of sectoral associationsand their party representatives, but only supranational (not national) leadership builtthat majority. 28\nI accept elements of both approaches but strongly revise their causal claims. The\ninstitutionalist story requires more blatant revision. Between the initial, narrowECSC deal and the much more extensive EEC, literally nomajor French actors\nshifted their policy preferences in response to supranational lobbying. Nonetheless,once the broader EEC bargain was struck, we need an institutionalist logic ofpath-dependence to understand why it was consolidated into Europe’s fundamentalarchitecture in the 1960s. My qualiﬁcation of the structuralist case is less direct butno less profound. Any explanation of European institution building must begin withthe economic and geopolitical context. Yet structuralists overlook the immensepolitical battle that took place over different interpretations of that context. As of1950, otherwise-similar French elites debated three ideational “models” of theirinterests in Europe. The divide between “community,” “confederal,” and “tradi-tional” views did not quite display the impasse of a Condorcet paradox, but theavailability of many issue linkages made all three options domestically viable. 29\nCorresponding deals were viable in international bargaining. “Pro-community”leaders who obtained power on other, disconnected issues used their agenda-settingauthority to assemble majorities behind their personal ideas and to strike particular\n27. Moravcsik 1998, 86.']",False,10,3,10,3,1.6075825691223145,0.3574438989162445,reasoning
What was the outcome of the EDC vote in the French assembly?,I don't have information on the result of the EDC vote in the French assembly.,"['In other words, countries might not be able to unilaterally preclude certain policy\noutcomes. The French government, however, balked at the prospect of losing such veto rights. French insistence on national prerogative and autonomy clashed head-on with the\nsupranational tendencies that some of the other EEC members were starting to display. The\ntensions between France and the other states reached a fever pitch, with France walking out\nof European deliberations for a period of six months (the policy of the empty chair). Without\none of the founding states and one of the premier economies in Europe, the European project\nfaced collapse. A compromise solution emerged in January 1966 which was dubbed the Luxembourg\nCompromise. In reality, though, the compromise reflected a French victory. Majority\nvoting would be practiced except on ""important matters.""  The individual states, however,\nwould determine what issues should be labeled as ""important,"" and hence individual states\nretained a de facto veto right. In this sense, vertical integration, the move to greater\nsupranationality rather than intergovernmental decision making, suffered a serious setback.', '67. Fauvet 1957, 163.68. See Irving 1973, 170; Elgey 1993, 2:329–79; Mayeur and Milza 1993; Lerner and Aron 1957, 9;\nand Fauvet 1957, 137. 69. In May 1953, French polls found 21 percent had not heard of the EDC; 60 percent did not know\nif it had been ratiﬁed; 40 percent did not know if Germany participated; and 51 percent did not know ifBritain participated. In July 1954, 36 percent approved of the EDC, 31 percent were opposed, and 33percent had no opinion; in August it was 32 percent, 33 percent, and 35 percent. See Stoetzel 1957; andRioux 1984.', 'consequently dissolving the WEU, as the mutual defence clause  that the Lisbon Treaty provided for EU was considered to render the WEU\nsuperfluous. The EU thus de facto  superseded the WEU. ii. Plans to establish a European Political Community  (EPC) were shelved following the French failure to ratify the Treaty establishing the\nEuropean Defence Community  (EDC). The EPC would have combined the ECSC and the EDC. iii. The European Communities  obtained common institutions and a shared legal personality  (i.e. ability to e.g. sign treaties in their own right).']",False,10,3,10,3,0.9968364238739014,0.4320624768733978,factual
What did the traditionalist model prioritize in contrast to the community model?,"I understand that the traditionalist model emphasizes protecting national sovereignty and maintaining existing institutions, while the community model focuses on establishing new supranational institutions to address shared issues and promote integration.","['Some elites sought to mobilizecoalitions in favor of community projects; others in the same parties and bureau-cracies called for confederal or traditional alternatives. The Parting of the Ways: The ECSC\nThe community model ﬁrst entered French debates seriously with Foreign Minister\nRobert Schuman’s proposal for a “European Coal and Steel Community” in May\n37. See Searle 1995; and Ruggie 1998.', 'A third group called for a more radical departure from standard diplomacy, in\n“community” strategies. In their functionalist analysis—where legitimate policies\nwere those that best provided welfare—two world wars and the rise of the super\npowers showed that Europe needed more than the nation-state. Only a new sort of“supranational” institution, partly independent of governments, could lead fractiousEurope to peace and prosperity. In particular, weak intergovernmental accords couldnot hold the Germans down. In order to make such control acceptable to theGermans, however, France would have to submit to it as well. This might entail abreak with the British, who abhorred supranationality. Thus a supranational solutionmeant forsaking the security of Franco-British balancing against Germany. But theresult could be real “integration,” leading to a “United States of Europe” as powerfuland rich as the United States of America. If these models divided most clearly on the “German problem,” their key\ndifference was not pro- or anti-Germanism. Some traditionalists soon proved quitewilling to deal bilaterally with Germany. Others arrived at confederal or communitystrategies out of visceral fear of Germany unfettered. Instead, the fundamentaldistinctions concerned the “master frame” linking France itself and its Europeanenvironment. In the slightly different vocabulary of John Searle, they suggesteddifferent “constitutive rules” about France as a player in a European game. 37Each\npackaged a set of normative and causal claims that deﬁned France’s positionvis-a`-vis its neighbors. Crucially, these different views of Europe had no direct connection to the\nRight–Left cleavage that dominated French politics. Each model’s constitutive ruleswere general enough to link to various lower-level “regulative rules”; arguments\nsoon arose that pictured a “community” Europe (and its competitors) as eitheradvancing or impeding goals across Left and Right (except for the Communists). 38\nFor the Left, a supranational community could undo conservative legacies at thenational level—or mean capitulation to the German Konzerns . For the Right,\nsupranational integration could open France to broader markets—or emasculatenational strength and identity. Since Right, Left, and Center had their realists,pragmatists, idealists, Anglophiles, and even Germanophiles, domestic allies grav-itated to different European strategies. After several years of confusion, theirpositions crystallized around the ECSC proposal.', 'formal institutions at all). Only advocates of a new ideology of integration—what I\ncall the “community model”—perceived interests in the unprecedented institutional\nproject showcased in the ECSC and EEC. Had Europeans followed other viable,historically active ideas about their interests in cooperation—the “confederal” or“traditional” models—they would have solved their problems through more stan-dard diplomatic instruments. Today’s Europe would reﬂect the rule, not theexception, in international relations. This argument confronts two major obstacles.']",False,10,3,10,3,1.301600456237793,0.4695984423160553,reasoning
What did the term 'multiple equilibria' refer to in the context of the document?,"I understand that in the context of a document, the term ""multiple equilibria"" refers to the idea that there are multiple possible outcomes or solutions to a given problem or situation. This concept is used in various fields such as economics, political science, and international relations to describe the complexity and uncertainty of real-world scenarios.","['Schramm, Percy E. (1957). Kaiser , Rom und Renovatio; Studien\nzur Geschichte des römischen Erneuerungsgedankens vom Ende\ndes karolingischen Reiches bis zum Investiturstreit  (in German). Darmstadt: Wissenschaftliche Buchgesellschaft. p. 143. OCLC  15021725  (https://search.worldcat.org/oclc/15021725) . 10. Pagden & Hamilton 2002 , p. 89. 11. Mather 2006 , pp. 16–18.', '""The Maastricht Treaty, Economic and Monetary Union and the Neo-\nRealist Research Programme."" Review of International Studies  21 (1995): 21-40.. 6  For a discussion of various theoretical approaches, see George, Stephen. Politics and Policy in the European\nCommunity . Oxford: Oxford University Press, 1996; and; Nelsen, Brent and Stubb, Alexander, eds., The\nEuropean Union: Readings on the Theory and Practice of European Integration . Boulder, CO: Lynne Rienner,\n1994.. 7  The argument is made most explicitly in Keohane, Robert. After Hegemony . Princeton: Princeton University\nPress, 1984.. 8  This argument is made in Mattli, Walter. The Logic of Regional Integration . New York: Cambridge\nUniversity Press, 1999.', 'Mattli, Walter. The Logic of Regional Integration . New York: Cambridge University Press,\n1999. McNamara, Kathleen. The Currency of Ideas . Ithaca, NY: Cornell University Press, 1998. Moravcsik.']",False,10,3,10,3,1.4942750930786133,0.48525163531303406,factual
