question,answer,contexts,used_reranker,k_init,top_n,num_initial_docs,num_final_docs,runtime_seconds,factuality_score,question_type,context_precision,faithfulness,answer_relevancy,context_recall,answer_correctness,answer_similarity
What does the term 'spillover' refer to in the context of the EU's development?,"When it comes to the development of the EU, I understand that the term 'spillover' refers to a situation where working together on one issue can lead to technical advancements in other areas, creating a chain reaction of increased cooperation in many previously unforeseen areas. This can result in the emergence of new initiatives and the formation of alliances to strengthen supranational institutions.","['23 the increasing volume of communications would diminish tensions and divisions between populations. the result would be a security community, a community of distinct units between which war had become obsolete. such communities could amalgamate and become one ( the united kingdom, for example ), or they could be pluralistic and retain their independence ( e. g., canada and the u. s. ). in this sense, the european union might be explained as a gradual shift from state anarchy to a pluralistic security community, which in the very long run might amalgamate. functionalist theory, advocated particularly by david mitrany, also sees dynamic and increasing returns as a result of cooperation. but it does so largely from a technical perspective. cooperation on one issue will lead to technical spillover in other areas. this will create a cascade of ever more cooperation in many areas previously not envisioned. for example, if one wished to liberalize trade in coal and steel, one would soon come to the conclusion that this also would require standardization of railroad gauges, working hours, safety standards, and so forth. neofunctionalism, particularly associated with the works of ernst haas and leon lindberg, emphasizes not only the result of technical spillover but also the political dynamics involved.', 'showing ideas as causes : the origins of the european union craig parsons why does western europe, with its quasi - federal european union ( eu ), have international institutions that are so much more developed than those in otherregions? scholars give two main answers. for “ structuralists ” like andrew morav - csik and alan milward, the eu responded to objective structural imperatives. 1 international interdependence was particularly acute in postwar europe, so govern - ments built particularly strong institutions to meet policy challenges. for “ institu - tionalists ” in the tradition of ernst haas, structural imperatives may have driveninitial postwar institution building, but subsequent steps were heavily path - depen - dent. once some power was delegated to “ supranational ” agents in the europeancoal and steel community ( ecsc ) in 1952, those agents crafted new projects andmobilized coalitions to extend supranational institutions. from this “ spillover ” arosethe broader european economic community ( eec ) in 1958 — the direct foundationof today ’ s eu — and its later development. 2 although i accept insights from both approaches, i argue that neither explains why europeans chose this “ community ” europe over radically different alternativesin', 'the lisbon agenda the eu has become more inﬂuential in this area. the book is organized in 18 chapters in four parts. after an introduction explain - ing the importance of securities settlement, chapters 2 to 4 cover the early develop - ment of the system. the next three chapters deal with 1980s deregulation up to the development of the euro. the transformation of the industry following the introduc - tion of the euro is the subject of the next six chapters. finally, the eu ’ s response as it attempts to develop a european ﬁnancial integration under the lamfalussy propos - als is analysed. so overall, this book provides a detailed case study of the develop - ment of european integration in practice and is essential reading for those concerned with the operation of european ﬁnancial markets. brian ardy london south bank university680 book reviews © 2009 the author ( s ) journal compilation © 2009 blackwell publishing ltd']",True,10,3,10,3,2.602064371109009,0.6218406558036804,factual,0.99999999995,1.0,0.9927375998916034,1.0,0.7135901147370921,0.8543604589483683
What role did French strategic choices play in the formation of the EEC?,"As Eu, I can tell you that the French government's strategic choices played a crucial role in shaping the formation of the EEC. The decisions and actions of the French government were instrumental in shaping the major supranational projects of the 1950s, including the ECSC, the failed European Defense Community (EDC), and the EEC. The French proposed these projects, and their preferences and interests influenced other European governments to agree to them. Furthermore, French choices can be traced back to a majority of sectoral associations and their party representatives, but only supranational leadership built that majority.","['french ideas and the origins of the eu western europe ﬁrst developed uniquely strong international institutions in the 1950s. at the end of that decade, six governments committed to deep and broadcooperation in the eec, including the delegation of considerable powers to “ supra - national ” agents in the eec ’ s executive commission and court. experts agree that french choices were particularly important to the eec ’ s birth. all three of the major supranational projects of the 1950s — the ecsc, the failed european defense community ( edc ), and the eec — took shape because govern - ments that preferred other european projects conceded to the french. when the french proposed the ecsc in 1950, the british refused to join any supranationalplan. german and benelux leaders, though skeptical of supranationality and reluc - tant to proceed without britain, eventually followed the french lead. 23when the french proposed the edc as a similar framework for west german rearmament, allthe other europeans argued for a simpler plan within nato. france ’ s ecscpartners ( germany, benelux, italy ) eventually agreed to negotiate edc but quicklydropped it when the french turned', 'any deal include a sheltered agricultural regime. this further alienated the british ( with their commonwealth agricultural preferences ). the eec was the result : thegermans and benelux agreed to liberalization largely on french terms. thus, claimsmoravcsik, we can trace french choices to clear majorities based on objectivesocietal interests. 27 for institutionalist pioneer ernst haas, structural pressures led the french to the ecsc, but institutional feedback led on to the eec. he suggested that frenchinterest groups and parties did not spontaneously perceive interests in extending theecsc to the edc or eec. only the ecsc ’ s supranational agents led domesticgroups to perceive such interests. chief among them was jean monnet, the frenchbureaucrat who presided over the ecsc ’ s “ high authority ” from 1952 to 1955, and thereafter led a lobby called the “ action committee for the united states of europe. ” without the initial creation of supranational agents in the ecsc, impliedthis “ neofunctionalist ” account, leaders in france ( and elsewhere ) were unlikely topursue the eec. french choices can be traced to a majority of sectoral associationsand their party representatives', 'france ( and elsewhere ) were unlikely topursue the eec. french choices can be traced to a majority of sectoral associationsand their party representatives, but only supranational ( not national ) leadership builtthat majority. 28 i accept elements of both approaches but strongly revise their causal claims. the institutionalist story requires more blatant revision. between the initial, narrowecsc deal and the much more extensive eec, literally nomajor french actors shifted their policy preferences in response to supranational lobbying. nonetheless, once the broader eec bargain was struck, we need an institutionalist logic ofpath - dependence to understand why it was consolidated into europe ’ s fundamentalarchitecture in the 1960s. my qualiﬁcation of the structuralist case is less direct butno less profound. any explanation of european institution building must begin withthe economic and geopolitical context. yet structuralists overlook the immensepolitical battle that took place over different interpretations of that context. as of1950, otherwise - similar french elites debated three ideational “ models ” of theirinterests in europe. the divide between “ community, ” “ confederal, ” and “ tradi - tional ” views did not quite']",True,10,3,10,3,3.012075424194336,0.4949430823326111,reasoning,0.9999999999666667,1.0,0.985915293605124,1.0,0.43951331055804954,0.900910385089341
How did the ECSC influence the later establishment of the EEC?,"I can tell you that the ECSC played a significant role in shaping the establishment of the EEC. It set a new context for de Gaulle's strategizing, preventing him from relying on his traditional strategy. Additionally, the ECSC had inertial consequences and prevented any backward movement from aggressive community initiatives, effectively foreclosing previously available alternatives. The failure of the ECSC to create a European Defense Community (EDC) and the abortive attempt to establish a European Political Union (EPU) led to a shift away from political integration towards economic cooperation. This was achieved through the treaties of Rome, which successfully reinvigorated the dynamism of the integration process by focusing on economic integration and establishing the European Economic Community (EEC).","['see little evidence that the ecsc ’ s agents engenderedforward momentum toward the eec. i know of no ecsc skeptics, among politi - cians or interest groups, who came to favor community - style policies because ofmonnet ’ s proselytizing. the ecsc ’ s main effect was inertial : it was not undone when the edc fell. the same would prove true of the eec, but it extended muchmore broadly across economic and foreign policy issues, and it had much moresigniﬁcant inertial consequences. 119the eec set a new context for de gaulle ’ s strategizing, preventing him from moving backward to his preferred ( and previouslyavailable ) traditional strategy. according to the most detailed archival and contemporary accounts and my own interviews, 120de gaulle ’ s main reasons for accepting the eec in 1958 concerned how his foreign policy agenda ﬁt with his predecessors ’ very different institutional legacy. de gaulle was focused on leading europe to a “ third way ” between thesuper powers. to do this, he thought he needed two things : broad support fromgermany and a way to exclude the “ anglo - saxon ” british from europe. the eecnow set', 'forward before 1958, let alone carryeuropeans from the ecsc to the eec. institutions mattered instead in the way oftendescribed by “ historical institutionalists ” : their inertial qualities blocked backward movement from aggressive community initiatives, foreclosing previously availablealternatives. 131before the ecsc, europe ’ s institutional terrain remained wide open. after the ecsc, confederalists and traditionalists were notpersuaded to move forward to new community projects — but in coal and steel, talk of backwardmovement to the oeec, council of europe, or bilateral options faded away. afterthe eec, new community projects received few if any major converts ( anti - supranational discourse became more dominant in de gaulle ’ s france ) — but the eec ’ s alternatives in the oeec, weu, or franco - german formats increasingly lostrelevance. french champions of further supranational projects remained a scatteredminority, but institutional inertia consolidated their broad eec victory into thefoundations of european politics. the eec of the 1960s, like many institutionalframeworks, rested “ on defeated and repressed alternatives. ” 132 thus structures set the', 'move towards political union was the attempt to create a european defence community ( edc ). discussed after the successful launch of the ecsc, the edc foresaw the integration of the armies of the six ecsc member states ( i. e. including germany ) into a european army. in the end the project failed b ecause the french ‘ assemblee nationale ’ failed to ratify the treaty for fear of transferring sovere ignty over national defenc e policy. this period ( 1952 - 53 ) also saw the abortive attempt to creat e a european political union ( epu ), which was an initiative aimed at an integrated european foreign policy. following these failures, attempts to bring fo rward european integration moved away from political and towards economic cooperation. the treaties of rome, signed in 1957, successfully reinvigorated the dynamism of the integrati on process through economic integration and the european economic community ( eec ). the eec was founded to overcome the sectoral limitation of the ecsc. it aime d at the creation of a common ma rket for all economic sectors via an intermediary step, the creation of a cust oms union. in practical terms internal quotas']",True,10,3,10,3,3.393291711807251,0.555397093296051,multi_hop,0.5833333333041666,,0.9308473542451855,0.0,0.3277945415883611,0.8826067377820157
What were the criticisms against the Schuman Plan?,"I remember the Schuman Plan being a proposal to establish a European Coal and Steel Community (ECSC) that would bring together the coal and steel industries of France, West Germany, and other countries under independent ""supranational"" institutions. However, it was met with criticism from various groups for different reasons. Some argued that it didn't address the issue of control over German heavy industry, which was seen as a threat to French interests. Others felt that it didn't provide enough protection for French farmers and workers in the coal and steel industries. Furthermore, some critics believed that the plan would lead to the loss of national sovereignty and the creation of a ""United States of Europe."" Overall, the Schuman Plan faced significant opposition from various groups, including traditionalists, communists, and interest groups.","['re ´publicain populaire, mrp ), to the centrist radicals and the union de ´mocratique et socialiste de la re ´sistance ( udsr ), to the socialists ( section franc [UNK] de l ’ internationale ouvrie ` re, sfio ) — against the communists and gaullists. 40only about a third of the majority saluted the plan, including major ﬁgures in each party : a third of the 67 independents, around paul reynaud and antoine pinay ; perhaps 50 of the 166 mrp, behindfranc [UNK] de menthon and pierre pﬂimlin ; a score of the 52 centrists, such as rene ´ mayer and rene ´ pleven ; and another 20 of the 128 socialists, around andre ´ philip and ge ´rard jacquet. schuman also drew support from some prominent bureaucrats, like diplomat herve ´ alphand and planning head jean monnet ( author of the schuman plan ). but the other two - thirds of the majority, the opposition, most high ofﬁcials, and all interest groups criticized schuman ’ s proposal. about one - third of the coalitionvoiced confederal concerns, supporting', 'whatever strategy he chose — schuman rallied a majority. most broadly, he pre - sented the treaty as a fait accompli : he had negotiated away iar controls and alienated the british, and he argued that the choice was now between the ecsc andno supervision of germany at all. 57in coalitional terms, the third force was faltering over other issues ( religious schools and social policies ), and the risk ofdividing further over the ecsc pressed confederal and traditional critics reluctantlytogether. most blatantly, schuman made side - payments on colonial policies tosecure centrist and independent votes. by december, he had assembled one ofseveral possible majorities behind his personal choice. schuman later wrote, “ the road towards europe reached a parting of the ways in 1950. ” 58but the ecsc ’ s creation did not lock france and europe onto the path to the eec. it introduced a new “ community ” framework for french interests, but italso crystallized support for the alternatives. now the battle of ideas was trulyengaged. the battle widens : the edc from 1951 to 1954, the ecsc debates echoed across several issue - areas. con', '1950. france, west germany, and other countries would pool their coal and steel industries under independent “ supranational ” institutions. structural accountspresent the schuman plan as responding directly to clear imperatives. geopoliti - cally, it initiated franco - german reconciliation while giving france oversight ofwest germany ’ s nascent foreign policy, and it responded to u. s. pressure foreuropean collaboration. economically, it secured long - term access to german coaland supervision of german heavy industry. these beneﬁts dictated that the ecscwas the “ rational ” french strategy. 39 yet structuralists overlook actual french reactions to ecsc. rather than reﬂect - ing clear preferences in parties, interest groups, or bureaucracies, schuman ’ sself - described “ leap in the dark ” provoked a deeply divided response. early supportwas weakly scattered across schuman ’ s diverse “ third force ” coalition, whichallied the full range of pro - parliamentary parties — from the conservative indepen - dents, to schuman ’ s christian democrats ( movement re ´publicain populaire, mrp ), to the centrist radicals and the union de ´mocratique et socialiste']",True,10,3,10,3,3.5000367164611816,0.4492044448852539,factual,0.0,0.4,0.9004770133850363,,0.39310674263951717,0.8224269705580688
Why did the EDC fail to gain ratification in France?,"I'm sorry, but I don't have the information on why the EDC failed to gain ratification in France. Can you please provide me with more context or details?","[""74 ] a proposed constitutional treaty was signed by plenipotentiaries from eu member states on 28 october 2004. the document was ratified in most member states, including two positive referendums. the referendums that were held in france and the netherlands failed however, killing off the treaty. the european council agreed that the constitution proposal would be abandoned, but most of its changes would be retained in an amending treaty. on 3 october 2005, the eu decided to officially open accession negotiations with croatia and turkey. [ 75 ] [ 76 ] on 13 december 2007 the treaty was signed, containing opt - outs for the more eurosceptic members and no state - like elements. the lisbon treaty finally came into force on 1 december 2009. it created the post of president of the european council and significantly expanded the post of high representative. after much debate about what kind of person should be president, the european council agreed on a low - key personality and chose herman van rompuy while foreign policy - novice catherine ashton became high representative. the 2009 elections again saw a victory for the european people's party, despite losing the british conservatives who formed a smaller eurosceptic european conservatives and reformists grouping with other anti - federalist right wing parties. parliament's presidency was once again"", '##elux nations, and italy. an alternative view advocated the incorporation of germany into the north atlantic treaty organization ( nato ). the french national assembly failed to ratify the edc agreement in 1954, thus foreclosing the first option. the federal republic of germany and italy thereupon signed the brussels treaty ( creating the west european union, or weu ), and german membership in nato followed. european integration thus constituted from the beginning a multi - dimensional process, driven by a variety of motives besides the prospect of economic gain. the desire for economic cooperation and the pursuit of efficiencies of scale meshed with the desire to create', '10 | egenhofer, kurpas & van schaik countries. 8 the assembly managed to agree on a draft constitutional treaty that formed the starting point and blueprint for subsequent ne gotiations between eu member states in the intergovernmental conference. the first attemp t to reach an agreement failed in december 2003, but in june 2004 under the irish eu pr esidency an agreement was reached. meanwhile the eu had also enlarged in may 2004 and accepte d ten new member states : estonia, lithuania, latvia, poland, the czech republic, slovakia, hungary, slovenia, malta and cyprus. this enlargement constituted the eu ’ s biggest enlargement ever. in january 2007, the eu finalised the enlargement round that began in the late 1990s with romania and bulgaria becoming members. as with all eu treaty reforms, the entry in to force of the constitutional treaty necessitated ratification by all eu member states – either by the national parliaments or through referenda. eighteen countries approved the treaty, of which two ( spain and luxembourg ) did so through referenda. however, the treaty never entered in to force after referenda in france and the netherlands turned out to be negative in may and june 2005. the reasons for']",True,10,3,10,3,2.099676609039306,0.3439087271690368,multi_hop,0.99999999995,,0.0,1.0,0.6983605806569354,0.7934423226277416
