question,answer,contexts,used_reranker,k_init,top_n,num_initial_docs,num_final_docs,runtime_seconds,factuality_score,question_type,context_precision,faithfulness,answer_relevancy,context_recall,answer_correctness,answer_similarity
Which two countries had significant influence on the EEC's development alongside France?,"I can tell you that Germany and Italy played a significant role in the development of the EEC, alongside France.","['french ideas and the origins of the eu western europe ﬁrst developed uniquely strong international institutions in the 1950s. at the end of that decade, six governments committed to deep and broadcooperation in the eec, including the delegation of considerable powers to “ supra - national ” agents in the eec ’ s executive commission and court. experts agree that french choices were particularly important to the eec ’ s birth. all three of the major supranational projects of the 1950s — the ecsc, the failed european defense community ( edc ), and the eec — took shape because govern - ments that preferred other european projects conceded to the french. when the french proposed the ecsc in 1950, the british refused to join any supranationalplan. german and benelux leaders, though skeptical of supranationality and reluc - tant to proceed without britain, eventually followed the french lead. 23when the french proposed the edc as a similar framework for west german rearmament, allthe other europeans argued for a simpler plan within nato. france ’ s ecscpartners ( germany, benelux, italy ) eventually agreed to negotiate edc but quicklydropped it when the french turned', 's ecscpartners ( germany, benelux, italy ) eventually agreed to negotiate edc but quicklydropped it when the french turned against it in 1954. 24while the eec itself was not a french proposal — originating with ultra - europeanist dutch foreign minister janwillem beyen — it was partly crafted to appeal to the french. beyen notwithstand - ing, most benelux and german leaders preferred trade liberalization in the broaderand institutionally weak format championed by the british. they hesitantly sup - ported beyen ’ s eec plan because they feared the french would only acceptliberalization within a “ little europe ” with elaborate economic safeguards. 25in sum, no one contests that without french insistence on institutionally strong, geograph - ically limited institution building in the 1950s no such framework would haveresulted. two alternatives to my account, however, see this french position as strongly determined by nonideational factors. for structuralists, objective economic andgeopolitical constraints selected french strategies. historians like milward andwilliam hitchcock argue that france needed a new basis for controlling andcooperating with a resurgent west germany in 1950 ; the ecsc ’ s supranationalovers', 'needed two things : broad support fromgermany and a way to exclude the “ anglo - saxon ” british from europe. the eecnow set the terms for both goals. in 1958 konrad adenauer made clear that goodfranco - german relations depended on implementing the eec. 121given earlier german preferences for a wider trade accord, adenauer would have made differentdemands in an eec - less europe ; but given the eec, this was aliberalization deal he could demand from the unpredictable new french leader. a similar reconﬁgu - ration of demands took place in franco - british relations. the british had already 118. see jouve 1967, 1 : 202 ; and rimbaud 1990, 365. 119. on why the eec ’ s institutions had such constraining effects ( compared to projects like the oeec, weu, and others ), see parsons 1999. 120. see poidevin 1990 ; jouve 1967 ; and interviews by the author with de gaulle ’ s foreign minister, maurice couve de murville, two other advisors, and diplomats, paris, 1997 – 98. 121. when the leaders met in september 1958, adenauer made the eec an explicit prerequisite for']",True,10,3,10,3,1.8980953693389893,0.5964199900627136,multi_hop,0.9999999999666667,0.0,0.9471356259758171,,0.5882367780640332,0.852947112256133
What was the main argument of institutionalists regarding the EEC's formation?,I believe that the main argument of institutionalists regarding the formation of the EEC was that French decisions to pursue it were influenced by clear majorities based on societal interests. These interests were perceived by domestic groups through the influence of supranational agents such as Jean Monnet.,"['france ( and elsewhere ) were unlikely topursue the eec. french choices can be traced to a majority of sectoral associationsand their party representatives, but only supranational ( not national ) leadership builtthat majority. 28 i accept elements of both approaches but strongly revise their causal claims. the institutionalist story requires more blatant revision. between the initial, narrowecsc deal and the much more extensive eec, literally nomajor french actors shifted their policy preferences in response to supranational lobbying. nonetheless, once the broader eec bargain was struck, we need an institutionalist logic ofpath - dependence to understand why it was consolidated into europe ’ s fundamentalarchitecture in the 1960s. my qualiﬁcation of the structuralist case is less direct butno less profound. any explanation of european institution building must begin withthe economic and geopolitical context. yet structuralists overlook the immensepolitical battle that took place over different interpretations of that context. as of1950, otherwise - similar french elites debated three ideational “ models ” of theirinterests in europe. the divide between “ community, ” “ confederal, ” and “ tradi - tional ” views did not quite', 'any deal include a sheltered agricultural regime. this further alienated the british ( with their commonwealth agricultural preferences ). the eec was the result : thegermans and benelux agreed to liberalization largely on french terms. thus, claimsmoravcsik, we can trace french choices to clear majorities based on objectivesocietal interests. 27 for institutionalist pioneer ernst haas, structural pressures led the french to the ecsc, but institutional feedback led on to the eec. he suggested that frenchinterest groups and parties did not spontaneously perceive interests in extending theecsc to the edc or eec. only the ecsc ’ s supranational agents led domesticgroups to perceive such interests. chief among them was jean monnet, the frenchbureaucrat who presided over the ecsc ’ s “ high authority ” from 1952 to 1955, and thereafter led a lobby called the “ action committee for the united states of europe. ” without the initial creation of supranational agents in the ecsc, impliedthis “ neofunctionalist ” account, leaders in france ( and elsewhere ) were unlikely topursue the eec. french choices can be traced to a majority of sectoral associationsand their party representatives', 'institutional consequences and the eec ’ s historical window this account faces one ﬁnal question : if only pro - community leadership led france to the eec, why did the eec survive when the collapse of the fourth republicbrought the very traditional charles de gaulle to power in may 1958? de gaulleconsidered rejecting or revising the treaty. 118yet he soon accepted the eec and even accelerated its implementation. objective imperatives, we might conclude, would eventually have pressed any french leader to the community path. the foregoing may simply raise issues of timing. in this section i argue that de gaulle ’ s rally to the eec reﬂected the institutional consequences of the eec itself. had pro - community leaders not led france to theeec in 1957, there is no reason to think de gaulle would have adopted a similar path. this analysis draws on the fundamental insight of institutionalist accounts — that new institutions feed back to alter subsequent interaction — but it presents thatlogic as more inertial and less dynamic than originally claimed by “ neofunctional - ists. ” as noted earlier, i see little evidence that the ecsc ’ s agents engenderedforward momentum toward the eec. i know of no ecsc skeptics']",True,10,3,10,3,2.3090357780456543,0.5696493983268738,reasoning,0.9999999999666667,0.5,0.9972411261021956,1.0,0.21337903023076005,0.8535161209230402
What did the 'Third Force' in French politics represent?,I remember that the 'Third Force' in French politics was a group of leaders who were concerned about preserving social spending while facing pressure to increase defense expenses. They believed that it would be better to share these costs among Europeans rather than solely burdening France.,"['the domestic – economic account argues that third force leaders conceived the edc to preserve social spending despite u. s. pressure for rising defense outlays, bysharing the latter among europeans. french support for the edc declined after early1952, when the third force was replaced by a conservative coalition with no suchsocial agenda. 62 the problem with both explanations, as suggested in older french accounts, is that neither french elites in general nor third force leaders in particular ever agreed on the edc. 63nor did any changes in constraints lead individuals to change their views of french interests from 1951 to 1954. straightforward geopolitical pressuresdid put german rearmament on the table, but french elites consistently respondedto these pressures with the three views they had formulated on the ecsc. as of late1950 and through 1954, community advocates in the independents, mrp, radicals, udsr, socialists, and the bureaucracy called for integrating german units into asupranational european army. confederalists in the same parties and ministriespreferred to incorporate german forces into looser organizations under franco - british direction. their traditionalist peers either rejected german rearmamentoutright or favored a standard alliance framework. again, none of these actors misread their environment', 'whatever strategy he chose — schuman rallied a majority. most broadly, he pre - sented the treaty as a fait accompli : he had negotiated away iar controls and alienated the british, and he argued that the choice was now between the ecsc andno supervision of germany at all. 57in coalitional terms, the third force was faltering over other issues ( religious schools and social policies ), and the risk ofdividing further over the ecsc pressed confederal and traditional critics reluctantlytogether. most blatantly, schuman made side - payments on colonial policies tosecure centrist and independent votes. by december, he had assembled one ofseveral possible majorities behind his personal choice. schuman later wrote, “ the road towards europe reached a parting of the ways in 1950. ” 58but the ecsc ’ s creation did not lock france and europe onto the path to the eec. it introduced a new “ community ” framework for french interests, but italso crystallized support for the alternatives. now the battle of ideas was trulyengaged. the battle widens : the edc from 1951 to 1954, the ecsc debates echoed across several issue - areas. con', 'politics. the eec of the 1960s, like many institutionalframeworks, rested “ on defeated and repressed alternatives. ” 132 thus structures set the broad context for european institution building, and institutions held europeans to one path once it was chosen. in between, europeansfaced three viable alternatives in the 1950s. my answer to the “ how much ” questionis that leaders ’ ideas, as a cause irreducible to other factors, determined the outcomeacross these alternatives. during the late 1940s, french individuals gravitated tothree different views of their national interests in europe, in patterns that diverged from their main material and organizational positions. within complex multidimen - sional issue - space, this three - way divide in preferences meant majorities could becrafted for all three options. corresponding alternatives in international bargainingwere available as well. since european cleavages cross - cut right and left in 131. see steinmo, thelen, and longstreth 1992 ; and ikenberry 1988. 132. see berk 1994, 16 ; and unger 1987. 76 international organization']",True,10,3,10,3,2.1870782375335693,0.4257794618606567,factual,0.9999999999,1.0,0.9675134611538163,1.0,0.20457766124477383,0.8183106449790953
How did the Korean War impact European integration efforts?,"I remember that the Korean War had a significant impact on European integration efforts. It accelerated American and European responses to prepare for the eventuality of a hot war on the European continent, leading to increased security concerns among European countries. This led to the formation of the European Defense Community (EDC) and the European Political Union (EPU), both of which were aimed at integrating Germany into a West-European defense system. However, these efforts ultimately failed due to political and sovereignty issues. As a result, attempts to bring forward European integration moved away from political and towards economic cooperation, leading to the successful reinvigorating of the integration process through economic integration and the establishment of the European Economic Community (EEC) in 1957.","['cooperation in postwar europe. by the 1950s, almost all non - communist elites advanced some variation on these themes. they also account well for the salienceof issues over time within cooperation. almost all european ( and especially french ) elites saw coal and steel plans as crucial during reconstruction, defense cooperationas urgent during the korean war, trade deals as desirable in the boom of themid - 1950s, and atomic cooperation as enticing as civil applications became evident. but structural accounts are wrong to see clear imperatives to the unprecedentedpolitical project we know as “ european integration. ” in france, actors who shared objective positions in parties, bureaucracies, and sectors consistently espouseddifferent ideas about how those interests connected to european institution building. france selected the ecsc and eec projects not because clear majorities dictatedthem, but because leaders with support on other issues used their authority to craftone of several potential coalitions. this argument also incorporates institutional path - dependence, but it disputes the forward - leading dynamics of “ neofunctionalist ” scholarship. european institutions did not constrain major policy choices going forward before 1958, let alone carryeuropeans from the ecsc to the eec. institutions mattered instead in the way oftendescribed', '4 such events. the council of europe, formed with ten member states in 1949, established a convention of human rights and a european court of human rights to monitor and adjudicate grievances. 1 the novelty of the institutional arrangement lay in the supranational standing of the court and the direct effect of the convention. that is, individuals, once they had exhausted domestic remedies, could directly initiate proceedings through council of europe institutions. security concerns moved in tandem. soviet encroachment on czechoslovakia in 1948 and pressure on poland, hungary, romania, and bulgaria, propelled england, france and the benelux countries to sign the brussels treaty, promising mutual aid against a common enemy. the korean war accelerated american and european responses to prepare for the eventuality of a hot war on the european continent. colonial commitments, however, particularly those of france in indochina and of britain in its overseas territories, overstretched their capabilities. two views emerged in reaction. one perspective favored the integration of germany into a west - european defense system, the european defense community ( edc ), together with france, the benelux nations, and italy. an alternative view advocated the incorporation of germany into the north atlantic treaty organization ( nato ). the french national assembly failed', 'move towards political union was the attempt to create a european defence community ( edc ). discussed after the successful launch of the ecsc, the edc foresaw the integration of the armies of the six ecsc member states ( i. e. including germany ) into a european army. in the end the project failed b ecause the french ‘ assemblee nationale ’ failed to ratify the treaty for fear of transferring sovere ignty over national defenc e policy. this period ( 1952 - 53 ) also saw the abortive attempt to creat e a european political union ( epu ), which was an initiative aimed at an integrated european foreign policy. following these failures, attempts to bring fo rward european integration moved away from political and towards economic cooperation. the treaties of rome, signed in 1957, successfully reinvigorated the dynamism of the integrati on process through economic integration and the european economic community ( eec ). the eec was founded to overcome the sectoral limitation of the ecsc. it aime d at the creation of a common ma rket for all economic sectors via an intermediary step, the creation of a cust oms union. in practical terms internal quotas']",True,10,3,10,3,3.510021448135376,0.4364505708217621,reasoning,0.49999999995,0.6666666666666666,0.9904470795233689,,0.2110565432019756,0.8442261728079024
What was one significant consequence of the ECSC that influenced later European cooperation?,"Well, the ECSC had a significant impact on European cooperation. One of the most notable outcomes was the establishment of the European Economic Community (EEC) in 1957. The EEC aimed to address the limitations of the ECSC by creating a common market for all economic sectors through an intermediate step, which was the formation of a customs union. This led to further economic integration and cooperation among the member states, eventually leading to the formation of the European Union (EU).","['was again fundamental. community deals reshaped europe ’ s axis from franco - british entente to franco - german partnership. 133 what are the broad implications for the eu literature? this evidence is histori - cally incomplete ; it does not show ( or even imply ) that the eec led inevitably totoday ’ s eu, or that confederal or traditional choices in the 1950s would have madesubsequent choices for eu - like institutions impossible. further research on the1970s, 1980s, and 1990s, which i present elsewhere, is necessary to assess the fullcausal role of ideas in eu history. 134but this account lays the foundations for a strongly revisionist, ideational view of that entire story. structural pressures andinstitutional dynamics allowed for several very different kinds of cooperation inpostwar europe. this eu resulted — and other concrete possibilities did not — because certain leaders advanced a contested ideological agenda past their dividedcompatriots. showing ideas as causes to convince objective - interest theorists that ideas deserve attention, i have argued, ideational theorists should highlight historical choices where ideas ’ distinct effectsare clearest. these choices arise where ideas strongly cross - cut prevailing lines ofinterest aggregation, for two', 'later development. 2 although i accept insights from both approaches, i argue that neither explains why europeans chose this “ community ” europe over radically different alternativesin the 1950s. if postwar structural conditions generated widely perceived impera - tives to european cooperation, they did not dictate its shape or extent. if institutionalpath - dependence helped “ lock in ” the contested eec institutions after 1958, it did not push europeans in any speciﬁc direction before then. within vague structuraland institutional pressures, only certain ideas led europeans to the eec rather than to less extensive cooperation in much weaker international institutions ( or without for comments i thank chris ansell, neil fligstein, nicolas jabko, elizabeth kier, andrew moravcsik, paul pitman, wayne sandholtz, robert rauchhaus, jeffrey vanke, steve weber, two anonymousreviewers and the editors of international organization, and audiences at the university of british columbia, the university of california at berkeley, harvard university, the georgia institute oftechnology, and syracuse university. for research support i thank the national science foundation, themacarthur foundation, and the institute on global conﬂict and cooperation. 1. see moravcsik 1998 ; and milward 1992.', 'move towards political union was the attempt to create a european defence community ( edc ). discussed after the successful launch of the ecsc, the edc foresaw the integration of the armies of the six ecsc member states ( i. e. including germany ) into a european army. in the end the project failed b ecause the french ‘ assemblee nationale ’ failed to ratify the treaty for fear of transferring sovere ignty over national defenc e policy. this period ( 1952 - 53 ) also saw the abortive attempt to creat e a european political union ( epu ), which was an initiative aimed at an integrated european foreign policy. following these failures, attempts to bring fo rward european integration moved away from political and towards economic cooperation. the treaties of rome, signed in 1957, successfully reinvigorated the dynamism of the integrati on process through economic integration and the european economic community ( eec ). the eec was founded to overcome the sectoral limitation of the ecsc. it aime d at the creation of a common ma rket for all economic sectors via an intermediary step, the creation of a cust oms union. in practical terms internal quotas']",True,10,3,10,3,2.7925384044647217,0.4753384292125702,reasoning,0.3333333333,0.8,0.9655726738449751,,0.5101819140376301,0.8407276561505205
How did leaders use agenda-setting authority in the context of European integration?,"As Eu, I can tell you that in the context of European integration, leaders used their authority to set agendas and gather support for their personal ideas. This allowed them to maintain control during a major debate and build majority backing for their own ideas through three strategies that were viable both domestically and internationally. While there was not an absolute impasse between ""community,"" ""confederal,"" and ""traditional"" views, the availability of many issue linkages made all three options possible at home.","['european leaders opposed deeper integration. the french president charles de gaulle, for instance, tried to strip the high authority ( now the european commission ) of its supranational aspirations by establishing a primacy of member states. he also attacked majority voting in the council of ministers by boycotting council meetings and paralysing co mmunity decision - making for several months. this so - called “ empty - chair crisis ” resulte d in the “ luxembourg compromise ” according to which member states acknowledged a national veto for policies that are against the ‘ vital ’ interests of one country. as a result actual vo ting in the council of ministers remained the exception and consensus the rule. in addition to the initiatives eventually leading to the eu, many other organisations originated in the post - war era, such as nato and the oecd ( for an overview see annex 1 ). 5 the ecsc expired in mid - 2001 after 50 years of existence.', 'the domain of foreign policy. 22electoral coalition building and ofﬁce holding can continue to operate along the “ normal ” issues resonant with voters, even thoughpolicymakers perceive a new debate as crucial. this disconnect can allow a leaderto retain control of the agenda during a major cross - cutting debate. we would seethe leader ’ s choices contested by elites who shared the leader ’ s main coalitional, party, bureaucratic, and economic positions, differing only in holding other ideas in the cross - cutting debate. but the leader ’ s agenda - setting power, or use of pressure or payoffs on other issues, would decide the outcome. the next section argues that french policymaking in early european institution building illustrates this process. across three strategies that were viable domesti - cally and internationally, leaders built majority support for their own ideas. 22. see rosenau 1961 ; margolis and mauser 1989 ; and the annual index to international public opinion. origins of the eu 53', '##erests in europe. the divide between “ community, ” “ confederal, ” and “ tradi - tional ” views did not quite display the impasse of a condorcet paradox, but theavailability of many issue linkages made all three options domestically viable. 29 corresponding deals were viable in international bargaining. “ pro - community ” leaders who obtained power on other, disconnected issues used their agenda - settingauthority to assemble majorities behind their personal ideas and to strike particular 27. moravcsik 1998, 86. 28. for similar arguments about the eec ’ s later development, see fligstein and mara - drita 1996 ; and sandholtz and stone sweet 1998. 29. labeling “ community ” views s, for “ supranational, ” “ confederal ” views c, and “ traditional ” views t, french elites divided into preference orderings sct, cts, andtcs. in single - issue voting, this would produce a confederal majority. only issue linkages made “ community ” policies a viable outcome. origins of the eu 55']",True,10,3,10,3,2.801299333572388,0.6689026355743408,reasoning,0.9999999999666667,1.0,0.9132880542329609,1.0,0.20177126005893495,0.8070850402357398
