question,answer,contexts,used_reranker,k_init,top_n,num_initial_docs,num_final_docs,runtime_seconds,factuality_score,question_type
What was the main argument of structuralists regarding the formation of the EU?,I believe that the formation of the EU was driven by the need for governments to build strong institutions in order to address the policy challenges they faced due to the acute international interdependence of postwar Europe.,"['Showing Ideas as Causes: The\nOrigins of the European Union\nCraig Parsons\nWhy does Western Europe, with its quasi-federal European Union (EU), have\ninternational institutions that are so much more developed than those in otherregions? Scholars give two main answers. For “structuralists” like Andrew Morav-csik and Alan Milward, the EU responded to objective structural imperatives. 1\nInternational interdependence was particularly acute in postwar Europe, so govern-ments built particularly strong institutions to meet policy challenges. For “institu-tionalists” in the tradition of Ernst Haas, structural imperatives may have driveninitial postwar institution building, but subsequent steps were heavily path-depen-dent. Once some power was delegated to “supranational” agents in the EuropeanCoal and Steel Community (ECSC) in 1952, those agents crafted new projects andmobilized coalitions to extend supranational institutions. From this “spillover” arosethe broader European Economic Community (EEC) in 1958—the direct foundationof today’s EU—and its later development. 2\nAlthough I accept insights from both approaches, I argue that neither explains\nwhy Europeans chose this “community” Europe over radically different alternativesin the 1950s. If postwar structural conditions generated widely perceived impera-tives to European cooperation, they did not dictate its shape or extent. If institutionalpath-dependence helped “lock in” the contested EEC institutions after 1958, it did\nnot push Europeans in any speciﬁc direction before then. Within vague structuraland institutional pressures, only certain ideas led Europeans to the EEC rather than\nto less extensive cooperation in much weaker international institutions (or without\nFor comments I thank Chris Ansell, Neil Fligstein, Nicolas Jabko, Elizabeth Kier, Andrew Moravcsik,\nPaul Pitman, Wayne Sandholtz, Robert Rauchhaus, Jeffrey Vanke, Steve Weber, two anonymousreviewers and the editors of International Organization , and audiences at the University of British\nColumbia, the University of California at Berkeley, Harvard University, the Georgia Institute ofTechnology, and Syracuse University. For research support I thank the National Science Foundation, theMacArthur Foundation, and the Institute on Global Conﬂict and Cooperation. 1.', 'any deal include a sheltered agricultural regime. This further alienated the British\n(with their Commonwealth agricultural preferences). The EEC was the result: TheGermans and Benelux agreed to liberalization largely on French terms. Thus, claimsMoravcsik, we can trace French choices to clear majorities based on objectivesocietal interests. 27\nFor institutionalist pioneer Ernst Haas, structural pressures led the French to the\nECSC, but institutional feedback led on to the EEC. He suggested that Frenchinterest groups and parties did not spontaneously perceive interests in extending theECSC to the EDC or EEC. Only the ECSC’s supranational agents led domesticgroups to perceive such interests. Chief among them was Jean Monnet, the Frenchbureaucrat who presided over the ECSC’s “High Authority” from 1952 to 1955, and\nthereafter led a lobby called the “Action Committee for the United States of\nEurope.” Without the initial creation of supranational agents in the ECSC, impliedthis “neofunctionalist” account, leaders in France (and elsewhere) were unlikely topursue the EEC. French choices can be traced to a majority of sectoral associationsand their party representatives, but only supranational (not national) leadership builtthat majority. 28\nI accept elements of both approaches but strongly revise their causal claims. The\ninstitutionalist story requires more blatant revision. Between the initial, narrowECSC deal and the much more extensive EEC, literally nomajor French actors\nshifted their policy preferences in response to supranational lobbying. Nonetheless,once the broader EEC bargain was struck, we need an institutionalist logic ofpath-dependence to understand why it was consolidated into Europe’s fundamentalarchitecture in the 1960s. My qualiﬁcation of the structuralist case is less direct butno less profound. Any explanation of European institution building must begin withthe economic and geopolitical context. Yet structuralists overlook the immensepolitical battle that took place over different interpretations of that context. As of1950, otherwise-similar French elites debated three ideational “models” of theirinterests in Europe. The divide between “community,” “confederal,” and “tradi-tional” views did not quite display the impasse of a Condorcet paradox, but theavailability of many issue linkages made all three options domestically viable. 29\nCorresponding deals were viable in international bargaining. “Pro-community”leaders who obtained power on other, disconnected issues used their agenda-settingauthority to assemble majorities behind their personal ideas and to strike particular\n27. Moravcsik 1998, 86.', 'The rationale for the treaty was the threat of a potential future military attack,\nspecifically a Soviet one in practice, though publicised under the disguise of a German one, according to the official\nstatements. Immediately following the February 1948 coup d\'état  by the Communist Party of Czechoslovakia , the\nLondon Six-Power Conference  was held, resulting in the Soviet  boycott of the Allied Control Council and its\nincapacitation, an event marking the beginning of the Cold War. The remainder of the year 1948 marked the\nbeginning of the institutionalised modern European integration. With the start of the Cold War, the Treaty of Brussels  was signed in 1948 establishing the Western Union  (WU) as\nthe first organisation, followed by the International Authority for the Ruhr . In the same year, the Organization for\nEuropean Economic Co-operation , the predecessor of the OECD, was also founded to manage the Marshall Plan;\nthe Eastern Bloc  responded with establishing the Comecon . A pivotal moment in European integration was the Hague Congress  of May 1948, as it led to the creation of the\nEuropean Movement International , the College of Europe[39] and most importantly to the founding of the Council of\nEurope  on the 5th of May 1949 (now known as Europe Day). The Council of Europe was the first institution to\nbring the sovereign nations of Western Europe together , raising great hopes and fevered debates in the following two\nyears for further European integration. It has since been a broad forum to further cooperation and shared issues,\nachieving things like the 1950-signed European Convention on Human Rights . Essential for the actual birth of the institutions of the EU was the 9th of\nMay 1950 Schuman Declaration  (on the day after the fifth Victory Day,\ntoday\'s Europe day – of the EU). On the basis of that speech, France,\nItaly, the Benelux  countries (Belgium, Netherlands and Luxembour g)\ntogether with West Germany  signed the Treaty of Paris (1951)  creating\nthe European Coal and Steel Community  the following year; this took\nover the role of the International Authority for the Ruhr[37] and lifted\nsome restrictions on German industrial productivity . It gave birth to the\nfirst institutions, such as the High Authority (now the European\nCommission ) and the Common Assembly (now the European\nParliament ). The first presidents of those institutions were Jean Monnet\nand Paul-Henri Spaak  respectively . The founding fathers of the\nEuropean Union  understood that coal and steel were the two industries\nessential for waging war, and believed that by tying their national industries together , a future war between their\nnations became much less likely .[40] Backed by the Marshall Plan with large funds coming from the United States since 1948, the ECSC became  a milestone\norganization, enabling European economic development and integration and being the origin of the main institutions of the EU such as the European\nCommission  and Parliament .[41]\nThe formation of the European Coal and Steel Community was advanced by American  Secretary of State Geor ge C. Marshall . His namesake plan to rebuild\nEurope  in the wake of World War II contributed more than $100 billion in today\'s  dollars to the Europeans, helping to feed Europeans, deliver steel to rebuild\nindustries, provide coal to warm homes, and construct dams to help provide power . In doing so, the Marshall Plan encouraged the integration of European\npowers into the European Coal and Steel Community , the precursor to present-day European Union, by illustrating the effects of economic integration and the\nneed for coordination. The potency of the Marshall Plan caused former German  Chancellor Helmut Schmidt  to remark in 1997 that ""America should not forget\nthat the development of the European Union is one of its greatest achievements. Without the Marshall Plan it perhaps would never have come to that.""[42][43]\nParalleling Schuman, the Pleven Plan of 1951 tried, but failed to tie the institutions of the developing European community under the European Political\nCommunity , which was to include the also proposed  European Defence Community , an alternative to West Germany  joining NATO which was established 1949\nunder the Truman Doctrine . In 1954 the Western European Union  was founded, after NATO took over competences from the WU, and West Germany joined. This prompted the Soviet Union  to form the Warsaw Pact  in 1955, allowing it to enforce its standing in Eastern Europe . The attempt to turn the Saar protectorate  into a ""European territory"" was rejected by a referendum in 1955.']",False,10,3,10,3,1.4161944389343262,0.5583707690238953,reasoning
"According to the document, how did ideas influence the development of the EU?","I believe that ideas played a significant role in the development of the EU. The document suggests that certain leaders advanced contested ideological agendas past their divided compatriots, which allowed for several very different kinds of cooperation in postwar Europe. This EU was not the result of any objective constraints dictating individual positions, but rather because of these leaders' distinct beliefs. Additionally, cross-cutting ideas allow us to separate ideational variation in individuals' views from their objective context, and divided preferences create ""multiple equilibria"" in coalitional terms.","['was again fundamental. Community deals reshaped Europe’s axis from Franco-\nBritish entente to Franco-German partnership.133\nWhat are the broad implications for the EU literature? This evidence is histori-\ncally incomplete; it does not show (or even imply) that the EEC led inevitably totoday’s EU, or that confederal or traditional choices in the 1950s would have madesubsequent choices for EU-like institutions impossible. Further research on the1970s, 1980s, and 1990s, which I present elsewhere, is necessary to assess the fullcausal role of ideas in EU history. 134But this account lays the foundations for a\nstrongly revisionist, ideational view of that entire story. Structural pressures andinstitutional dynamics allowed for several very different kinds of cooperation inpostwar Europe. This EU resulted—and other concrete possibilities did not—\nbecause certain leaders advanced a contested ideological agenda past their dividedcompatriots. Showing Ideas as Causes\nTo convince objective-interest theorists that ideas deserve attention, I have argued,\nideational theorists should highlight historical choices where ideas’ distinct effectsare clearest. These choices arise where ideas strongly cross-cut prevailing lines ofinterest aggregation, for two reasons that other scholars have noted. First, as hintedat in some comparative studies, cross-cutting ideas allow us to separate ideationalvariation in individuals’ views from the individuals’ objective context. Cross-\ncutting divides alone cannot display ideas; they merely show a range of debate overwhich objective constraints are notdictating individual positions. This approach\nalso requires interpretive evidence that individuals diverge because they holddifferent beliefs. Second, as developed in the literature on “cycling” and “chaos,”divided preferences create “multiple equilibria” in coalitional terms. Especially inmultidimensional issue space, individual leaders may gain the autonomy to buildmajorities around their personal ideas. This argument should have direct applications in other contexts.', '———. 1997. Social Theory of International Politics . New York: Cambridge University Press. Willis, F. Roy. 1962. The French in Germany, 1945–1949 . Stanford, Calif.: Stanford University Press. ———. 1968. France, Germany, and the New Europe, 1945 –1967 . Stanford, Calif.: Stanford University\nPress. Winand, Pascaline. 1993. Eisenhower, Kennedy, and the United States of Europe . New York: St. Martin’s Press. Yee, Albert S. 1996. The Causal Effects of Ideas on Policies. International Organization 50 (1):69–108. Young, John W. 1995. British Ofﬁcials and European Integration, 1944–60. In Building Postwar\nEurope: National Decision-Makers and European Institutions, 1948–63 , edited by Anne Deighton,\n87–106. New York: St.', 'Ludlow, Peter (2004), The making of the new Europe , EuroComment, Brussels. Norman, Peter (2005), The Accidental Constitution , 2nd Edition, EuroComment, Brussels. Nugent, Neill (2006), The Government and Politics of the European Union , London: Palgrave \nMacmillan (6th edition). Pelkmans, Jacques (2006), European Integration – Me thods and Economic Analysis , Pearson \nEducation, (3rd edition). Renda, Andrea (2006), Impact Assessment in the EU: The State of the Art and the Art of the \nState , CEPS Paperback, Centre for European Policy Studies, Brussels. Richardson, Jeremy (2006), European Union: Power and policy-making , New York: Routledge \n(3rd edition). Van Schaik, Louise et al. (2006 ), Policy Coherence for Development in the Council: Strategies \nfor the way forward , CEPS Paperback, Centre for European Policy Studies, Brussels. Wallace, Helen, William Wallace and Mark A. Pollack (2005), Policy-Making in the European \nUnion , Oxford: Oxford University Press. Wiener, Antje and Thomas Diez (2004), European Integration Theory , Oxford: Oxford \nUniversity Press. ']",False,10,3,10,3,2.1881823539733887,0.504555344581604,reasoning
What was the response of the British government to the ECSC proposal?,I remember that the British government did not agree to any supranational plan proposed by the ECSC.,"['French Ideas and the Origins of the EU\nWestern Europe ﬁrst developed uniquely strong international institutions in the\n1950s. At the end of that decade, six governments committed to deep and broadcooperation in the EEC, including the delegation of considerable powers to “supra-\nnational” agents in the EEC’s executive commission and court. Experts agree that French choices were particularly important to the EEC’s birth. All three of the major supranational projects of the 1950s—the ECSC, the failed\nEuropean Defense Community (EDC), and the EEC—took shape because govern-ments that preferred other European projects conceded to the French. When the\nFrench proposed the ECSC in 1950, the British refused to join any supranationalplan. German and Benelux leaders, though skeptical of supranationality and reluc-tant to proceed without Britain, eventually followed the French lead. 23When the\nFrench proposed the EDC as a similar framework for West German rearmament, allthe other Europeans argued for a simpler plan within NATO. France’s ECSCpartners (Germany, Benelux, Italy) eventually agreed to negotiate EDC but quicklydropped it when the French turned against it in 1954. 24While the EEC itself was not\na French proposal—originating with ultra-Europeanist Dutch foreign minister JanWillem Beyen—it was partly crafted to appeal to the French. Beyen notwithstand-ing, most Benelux and German leaders preferred trade liberalization in the broaderand institutionally weak format championed by the British. They hesitantly sup-ported Beyen’s EEC plan because they feared the French would only acceptliberalization within a “little Europe” with elaborate economic safeguards. 25In sum,\nno one contests that without French insistence on institutionally strong, geograph-ically limited institution building in the 1950s no such framework would haveresulted. Two alternatives to my account, however, see this French position as strongly\ndetermined by nonideational factors. For structuralists, objective economic andgeopolitical constraints selected French strategies. Historians like Milward andWilliam Hitchcock argue that France needed a new basis for controlling andcooperating with a resurgent West Germany in 1950; the ECSC’s supranationaloversight of basic industries was the straightforward solution. 26Similar concerns\nabout overseeing German military power pushed the French to the EDC. Theincentives of this larger delegation of sovereignty were less clear, however, and theEDC died. But soon economic interests, transmitted through interest groups,refocused the French on an institutionally strong “little Europe.” Weak Frenchbusiness feared British plans for broad trade liberalization, preferring a smaller andmore managed trade pact. Growing farm surpluses led French farmers to insist that\n23. See Kersten 1988; Milward 1988; Ludlow 1997, 17; and Bu ¨hrer 1995.', 'to Great Britain”—moved quickly to frame German rearmament in a Franco-\nBritish-led intergovernmental organization, the “Western European Union”(WEU). 78The EDC signatories and Britain drafted the much looser WEU deal in\nfour weeks. French confederalists were ecstatic. One Socialist rejoiced, “Theaccords deliver us from the Europe of Six and the risks of German hegemony whichit contained; today it is the Europe of Seven!”\n79In 1955, they hoped to expand the\nWEU to cooperation in arms production and foreign policy, refounding Europe ona “Franco-Anglo-German triangle.”\n80Parallel plans emerged for OEEC cooperation\nin atomic energy, classic energy, and transports. Traditionalists in every party, meanwhile, rejected the WEU or accepted it with\nreluctance, seeing it (like they saw the EDC) as an “Anglo-Saxon” plot relegating\nFrance to a nonglobal role in minor European organizations.81France needed to\nassert itself as a global power; technical European problems could be handled instandard bilateral deals. French business, bureaucrats in the technical ministries, andtraditional politicians on the Right and the Left pushed to develop new bilateralaccords in trade, atomic energy, armaments production, and transports in 1954–55.They focused especially on new ties with the rising German economy, showing thattraditionalists too acknowledged environmental change. All French elites sawincentives to cooperate with Germany, but they still differed over how to do so. Community advocates also rejoined the fray in early 1955. Like their peers, they\nsaw incentives to cooperation in atomic and classic energy, armaments, andtransports. But their solutions were to extend or imitate the ECSC. Foreign MinisterAntoine Pinay (Independent), an EDC champion, considered several such options,though he feared that supranational initiatives were impossible after the EDC. 82\nThen bureaucrat-turned-activist Monnet focused pro-community attention on plansfor an atomic energy community (“Euratom”). French anti-supranationalism could\nbe overcome, argued Monnet, by capitalizing on widespread faith in an impendingatomic-energy revolution, fear of a separate German atomic program, and the appealof sharing expensive atomic investments. Since these reasons appealed less to otherEuropeans—who preferred atomic cooperation with the more advanced British or\nAmericans—Monnet reluctantly agreed to package Euratom with a Benelux plan for\na “European Economic Community” of trade liberalization within managed safe-guards. 83\n78. The WEU extended the earlier “Brussels Pact” between France, Britain, and the Benelux to\nGermany and Italy. It had a ministerial council and consultative assembly, and it oversaw limits onGerman military production. Within its limits, Germany joined NATO. See Girault 1991; Bossuat 1994,168; Soutou 1987 and 1996, 28; and Calandri 1995.', 'Institutional Consequences and the EEC’s Historical Window\nThis account faces one ﬁnal question: If only pro-community leadership led France\nto the EEC, why did the EEC survive when the collapse of the Fourth Republicbrought the very traditional Charles de Gaulle to power in May 1958? De Gaulleconsidered rejecting or revising the treaty. 118Yet he soon accepted the EEC and\neven accelerated its implementation. Objective imperatives, we might conclude,would eventually have pressed any French leader to the community path. The\nforegoing may simply raise issues of timing. In this section I argue that de Gaulle’s rally to the EEC reﬂected the institutional\nconsequences of the EEC itself. Had pro-community leaders not led France to theEEC in 1957, there is no reason to think de Gaulle would have adopted a similar\npath. This analysis draws on the fundamental insight of institutionalist accounts—that new institutions feed back to alter subsequent interaction—but it presents thatlogic as more inertial and less dynamic than originally claimed by “neofunctional-ists.” As noted earlier, I see little evidence that the ECSC’s agents engenderedforward momentum toward the EEC. I know of no ECSC skeptics, among politi-\ncians or interest groups, who came to favor community-style policies because ofMonnet’s proselytizing. The ECSC’s main effect was inertial: It was not undone\nwhen the EDC fell. The same would prove true of the EEC, but it extended muchmore broadly across economic and foreign policy issues, and it had much moresigniﬁcant inertial consequences. 119The EEC set a new context for de Gaulle’s\nstrategizing, preventing him from moving backward to his preferred (and previouslyavailable) traditional strategy. According to the most detailed archival and contemporary accounts and my own\ninterviews,\n120de Gaulle’s main reasons for accepting the EEC in 1958 concerned\nhow his foreign policy agenda ﬁt with his predecessors’ very different institutional\nlegacy. De Gaulle was focused on leading Europe to a “third way” between thesuper powers. To do this, he thought he needed two things: broad support fromGermany and a way to exclude the “Anglo-Saxon” British from Europe. The EECnow set the terms for both goals. In 1958 Konrad Adenauer made clear that goodFranco-German relations depended on implementing the EEC. 121Given earlier\nGerman preferences for a wider trade accord, Adenauer would have made differentdemands in an EEC-less Europe; but given the EEC, this was aliberalization deal\nhe could demand from the unpredictable new French leader. A similar reconﬁgu-ration of demands took place in Franco-British relations. The British had already\n118. See Jouve 1967, 1:202; and Rimbaud 1990, 365.']",False,10,3,10,3,1.2055423259735107,0.4638032913208008,factual
