question,answer,contexts,used_reranker,k_init,top_n,num_initial_docs,num_final_docs,runtime_seconds,factuality_score,question_type
What did the term 'battle of ideas' refer to in the context of French policymaking in the 1940s?,"I remember the term 'battle of ideas' being used in the context of French policymaking during the 1940s. It was a time when different groups were debating various strategies for postwar European cooperation. These strategies were based on competing analyses and did not necessarily respond effectively to the new situation. The battle of ideas was a result of major changes such as the Marshall Plan, which offered economic aid to France on the condition that they coordinated their recovery with Germany and other countries. Additionally, the rise of superpowers, the destruction of national economies, and domestic delegitimation of the nationalist far Right turned ""Euro-peanist"" projects into active options.","['States demanded the rapid revival of a West German state and economy as bulwark\nand ally against the Soviets. Pressure increased with the Marshall Plan in June 1947,offering the French badly needed economic aid on the condition that they coordinatetheir recovery with Germany and other countries. 33\nThese huge changes opened what Gerald Berk calls an “epochal moment” in\nFrench policymaking.34Rapid change can destabilize how actors understand their\ninterests. Innovative actors may assemble new ideational “frames” out of the “toolkit” of ideas present in their culture. 35Such innovations do not necessarily respond\nfunctionally to the new situation; adaptation of older framing ideas, or other newideas, may suggest competing analyses. The result is a “battle of ideas” in whichgroups debate several viable strategies. This is what developed in France in the late1940s. Major change in objective conditions brought new ideas to the fore but didnot dictate their success. The rise of the super powers, the destruction of nationaleconomies, and domestic delegitimation of the nationalist far Right turned “Euro-peanist” projects—utopian musings before the war—into active options. 36But older\nideas survived these objective shifts as well. The battle over postwar Europeremained to be fought. Some French elites held to traditional strategies. They retained a familiar realist\nanalysis, with legitimacy and security located in the independent nation-state. If theattempt to block Germany’s recovery had been frustrated, traditional optionsremained. Some direct controls on Germany could still be salvaged; military and\neconomic alliances with other powers could still be sought; if necessary, bilateraldeals could even be struck with the Germans themselves. All would uphold thebalance of European power, protecting French interests better than uncontrollableinternational organizations. This was also more worthy of “great power” France,\nwhose independence was sacrosanct, and whose peers were the United States, theUnited Kingdom, and the USSR—not the other Europeans. Another group favored “confederal” strategies. They based their analysis on\nliberal thinking: The nation-state remained the source of legitimacy and security,\nbut like-minded states should cooperate closely, given their interdependence.France’s natural partner was its liberal counterpart, Britain; together they wouldpreside over pragmatic cooperation in broad European forums, while supervisingthe illiberal, atavistic Germans. Only combined Franco-British leadership wouldprevent the Germans from dominating Europe—ruling out narrower Franco-German\nprojects. Broad but weak organizations could provide a platform for a European“third way” between the super powers, and for economic cooperation, withoutrequiring direct losses of French sovereignty. 33. See Milward 1984; and Lundestad 1998. 34.', 'The ﬁrst is theoretical: Isolating\nideas as causes is difﬁcult. A growing literature points to actors’ subjective beliefs\nas important causes of political outcomes. 3But if ideational theorists argue persua-\nsively that ideas are often non-negligible factors in politics, they have troublespecifying how much ideas matter. Skeptics thus remain free to dismiss ideas as\nresidual to objective responses to structural or institutional constraints. I argue thatcertain conditions allow for more concrete and speciﬁc claims about ideas. Whereideas strongly cross-cut lines of shared material interests in a polity, we can isolate\nindividuals’ beliefs most clearly from objective pressures. Cross-cutting ideas canalso fragment coalitions and parties, creating situations similar to the “chaos” and“multiple equilibria” described by game theorists. Entrepreneurial leaders may gainthe autonomy to set the policy agenda around their own personal ideas, and tomobilize one of several potential coalitions behind them. Leaders’ ideas, as anautonomous causal factor, thereby select from a range of structural and institutionalpossibilities. The second obstacle is historical: Tracing certain ideas across Europe and the\n1950s is an immense task. I surmount this problem by focusing on the pivotal caseofFrench strategic choices. Experts agree that European cooperation took the shape\nit did in the 1950s—the institutionally strong, geographically limited EEC—above\nall because the French government demanded it. The preferences of the other mainactors (Germany, Britain, Benelux) summed to favor broader and weaker institu-tional options. I show that rather than reﬂecting structural or institutional pressures,French insistence on the EEC resulted from community-minded leadership. Alter-native confederal or traditional French strategies were strongly represented and at\nleast as viable domestically and internationally and would have oriented European\nbargaining to different outcomes. The differences between the EEC and thesealternatives display the range across which French community ideas mattered. Ideas and the “How Much?” Problem\nIdeas are subjective claims about descriptions of the world, causal relationships, orthe normative legitimacy of certain actions. The basic reasons to suspect that ideas\n3.', 'Where possible I offer numbers to substantiate cross-cutting patterns,but my interview, archival, and secondary sources often sustain only estimates. Fewprecise ﬁgures are available. In France, leaders deliberately avoided divisiveparliamentary votes that contrasted European alternatives. Most votes were calledafter policy choices, when leaders engaged coalitional pressures and side-payments\nto assemble support. Similarly, public opinion polls never contrasted policy options.They show mainly that many voters liked “Europe,” but knew little of Europeanalternatives. Nonetheless, I submit, the evidence strongly supports my analysis. The section ﬁrst presents how a new French debate emerged in the late 1940s. Then it narrates the French choices leading to the ECSC, EDC, and EEC. Finally,it considers why, if only “community” ideas led France to the EEC, these institu-tions survived when Charles de Gaulle brought “traditional” ideas to power in 1958. Three Models of French Interests\nImmediately after World War II, French elites largely agreed on their basic\nEuropean strategy. Their primary goal was to keep Germany weak while rebuildingFrench strength. Their means were direct controls on occupied Germany, bolsteredby alliances and economic cooperation with other European powers. 32The advent\nof the Cold War in 1946–47, however, partly blocked this strategy. The United\n30. The only academic precedents to this argument are vague histories without speciﬁc causal claims:\nLipgens 1977; and Brugmans 1965. McNamara’s argument about ideas in the EU concerns ideas abouteconomic policies, not Europe itself. McNamara 1998.']",False,10,3,10,3,2.685948371887207,0.5409557819366455,factual
What was a significant ideological division within French elites regarding European cooperation?,"I remember that in the late 1940s, there was a significant ideological division among French elites regarding European cooperation. This division emerged as individuals within France gravitated towards three different views of their national interests in Europe, which diverged from their main material and organizational positions. These three views were: direct controls on occupied Germany, alliances and economic cooperation with other European powers, and community-based solutions for European integration.","['cooperation in postwar Europe. By the 1950s, almost all non-Communist elites\nadvanced some variation on these themes. They also account well for the salienceof issues over time within cooperation. Almost all European (and especially French)elites saw coal and steel plans as crucial during reconstruction, defense cooperationas urgent during the Korean War, trade deals as desirable in the boom of themid-1950s, and atomic cooperation as enticing as civil applications became evident.But structural accounts are wrong to see clear imperatives to the unprecedentedpolitical project we know as “European integration.” In France, actors who shared\nobjective positions in parties, bureaucracies, and sectors consistently espouseddifferent ideas about how those interests connected to European institution building.France selected the ECSC and EEC projects not because clear majorities dictatedthem, but because leaders with support on other issues used their authority to craftone of several potential coalitions. This argument also incorporates institutional path-dependence, but it disputes the\nforward-leading dynamics of “neofunctionalist” scholarship. European institutions\ndid not constrain major policy choices going forward before 1958, let alone carryEuropeans from the ECSC to the EEC. Institutions mattered instead in the way oftendescribed by “historical institutionalists”: Their inertial qualities blocked backward\nmovement from aggressive community initiatives, foreclosing previously availablealternatives. 131Before the ECSC, Europe’s institutional terrain remained wide open. After the ECSC, confederalists and traditionalists were notpersuaded to move\nforward to new community projects—but in coal and steel, talk of backwardmovement to the OEEC, Council of Europe, or bilateral options faded away. Afterthe EEC, new community projects received few if any major converts (anti-supranational discourse became more dominant in de Gaulle’s France)—but the\nEEC’s alternatives in the OEEC, WEU, or Franco-German formats increasingly lostrelevance. French champions of further supranational projects remained a scatteredminority, but institutional inertia consolidated their broad EEC victory into thefoundations of European politics. The EEC of the 1960s, like many institutionalframeworks, rested “on defeated and repressed alternatives.”\n132\nThus structures set the broad context for European institution building, and\ninstitutions held Europeans to one path once it was chosen. In between, Europeansfaced three viable alternatives in the 1950s. My answer to the “how much” questionis that leaders’ ideas, as a cause irreducible to other factors, determined the outcomeacross these alternatives. During the late 1940s, French individuals gravitated tothree different views of their national interests in Europe, in patterns that diverged\nfrom their main material and organizational positions. Within complex multidimen-sional issue-space, this three-way divide in preferences meant majorities could becrafted for all three options. Corresponding alternatives in international bargainingwere available as well. Since European cleavages cross-cut Right and Left in\n131. See Steinmo, Thelen, and Longstreth 1992; and Ikenberry 1988.', 'Where possible I offer numbers to substantiate cross-cutting patterns,but my interview, archival, and secondary sources often sustain only estimates. Fewprecise ﬁgures are available. In France, leaders deliberately avoided divisiveparliamentary votes that contrasted European alternatives. Most votes were calledafter policy choices, when leaders engaged coalitional pressures and side-payments\nto assemble support. Similarly, public opinion polls never contrasted policy options.They show mainly that many voters liked “Europe,” but knew little of Europeanalternatives. Nonetheless, I submit, the evidence strongly supports my analysis. The section ﬁrst presents how a new French debate emerged in the late 1940s. Then it narrates the French choices leading to the ECSC, EDC, and EEC. Finally,it considers why, if only “community” ideas led France to the EEC, these institu-tions survived when Charles de Gaulle brought “traditional” ideas to power in 1958. Three Models of French Interests\nImmediately after World War II, French elites largely agreed on their basic\nEuropean strategy. Their primary goal was to keep Germany weak while rebuildingFrench strength. Their means were direct controls on occupied Germany, bolsteredby alliances and economic cooperation with other European powers. 32The advent\nof the Cold War in 1946–47, however, partly blocked this strategy. The United\n30. The only academic precedents to this argument are vague histories without speciﬁc causal claims:\nLipgens 1977; and Brugmans 1965. McNamara’s argument about ideas in the EU concerns ideas abouteconomic policies, not Europe itself. McNamara 1998.', 'Mahant, Edelgard. 1969. French and German Attitudes to the Negotiations About the European\nEconomic Community, 1955–1957. Ph.D.']",False,10,3,10,3,1.8106093406677246,0.5009235143661499,reasoning
What was the primary aim of the Rome Treaty established in 1957?,"I remember that the main goal of the Rome Treaty, which was signed in 1957, was to create the European Economic Community (EEC) and the European Atomic Energy Community (Euratom). This project was led by France and Germany, who were among the six member nations.","['Treaties:\nHistorical:\nhttp://europa.eu.int/abc/obj/treaties/en/entoc.htm\nIncludes:\n1) Treaty establishing the European Atomic Energy Community (""Treaty of Rome,""\nsigned in Rome on 25 March 1957)', '6\nwithin the six member nations, although France and Germany largely drove the project. France wished to mobilize German capital and know-how. The Federal Republic,\nconversely, wished to develop nuclear energy use, but could only do so within an\ninternational context so as to avoid arousing concerns with its wartime past. Efficiencies of\nscale also provided a sound economic rationale for cooperation. And without entrenched\ndomestic bureaucracies, international cooperation was easier to come by than in other, more\nestablished sectors of the economy. The Rome treaty also established the European Economic Community (EEC) proper,\nwhich would later become synonymous with the entire integration project. It aimed to\nachieve, first, a customs union – the reduction of internal tariffs and the creation of a\ncommon external tariff. Second, it targeted the issues of unfair competition and subsidies,\nand thus tried to begin the process that would lead towards a true common market. III.', 'The Saar was to have been governed by a statute\nsupervised by a European Commissioner reporting to the Council of Ministers of the Western European Union . After the failed attempts at creating defence (European Defence Community) and political communities (European Political Community), leaders met at the\nMessina Conference  and established the Spaak Committee  which produced the Spaak report . The report was accepted at the Venice Conference  (29 and 30 May\n1956), which decided to organise an Intergovernmental Conference . The Intergovernmental Conference on the Common Market and Euratom  focused on\neconomic unity , leading to the Treaties of Rome  being signed in 1957 – this established the European Economic Community  (EEC) and the European Atomic\nEnergy Community  (Euratom) among the members.[44]Initial years (1948–1957)']",False,10,3,10,3,1.3881916999816895,0.6183204054832458,factual
Why did France walk out of European deliberations during the 1960s?,I'm not sure.,"['In other words, countries might not be able to unilaterally preclude certain policy\noutcomes. The French government, however, balked at the prospect of losing such veto rights. French insistence on national prerogative and autonomy clashed head-on with the\nsupranational tendencies that some of the other EEC members were starting to display. The\ntensions between France and the other states reached a fever pitch, with France walking out\nof European deliberations for a period of six months (the policy of the empty chair). Without\none of the founding states and one of the premier economies in Europe, the European project\nfaced collapse. A compromise solution emerged in January 1966 which was dubbed the Luxembourg\nCompromise. In reality, though, the compromise reflected a French victory. Majority\nvoting would be practiced except on ""important matters.""  The individual states, however,\nwould determine what issues should be labeled as ""important,"" and hence individual states\nretained a de facto veto right. In this sense, vertical integration, the move to greater\nsupranationality rather than intergovernmental decision making, suffered a serious setback.', '2\nthe fate of nations across the globe in sway. Six years later, war, foreign occupation, and\nutter destruction had changed the political landscape of Europe forever. The colonies had\ntaken the opportunity to seek independence, domestic economies were in shambles, and\ngovernments were starved for resources. For a while, delusions compounded material destruction. France, occupied for five\nyears, challenged in its East Asian and Middle Eastern possessions, and split by domestic\ncleavages during the war, nevertheless still claimed to be one of the foremost global powers. Indeed, it even sought to reduce Germany after World War II by bringing key areas under\nFrench control in a manner reminiscent of the Versailles Treaty of 1918. England too\nbelieved it would still play a global role, even if it had to do so in a reconstructed\nCommonwealth rather than ruling over an outright empire. Even small powers, such as the\nNetherlands and Belgium, imagined they still had an extra-European role to play in the East\nIndies and Africa. Such delusions soon faced harsh realities. French economic revival hinged on\nAmerican support, but Washington had vastly different plans than Paris regarding German\nrevival and the future of the French Empire. The other powers would similarly have to\nrecognize that, in the incipient Cold War, the U.S. could dictate its divergent preferences on\nempire, the European role abroad, and economic protectionism. Moreover, in the Cold War\nof nuclear superpowers, it was clear that England, France, and Germany could only be minor\nplayers. They lacked the forces for conventional deterrence against a Soviet attack, and had\nno nuclear capabilities of their own in the late 1940s and early 50s. Several concerns thus came to inform the preferences of the greater powers in\nEurope.', 'Where possible I offer numbers to substantiate cross-cutting patterns,but my interview, archival, and secondary sources often sustain only estimates. Fewprecise ﬁgures are available. In France, leaders deliberately avoided divisiveparliamentary votes that contrasted European alternatives. Most votes were calledafter policy choices, when leaders engaged coalitional pressures and side-payments\nto assemble support. Similarly, public opinion polls never contrasted policy options.They show mainly that many voters liked “Europe,” but knew little of Europeanalternatives. Nonetheless, I submit, the evidence strongly supports my analysis. The section ﬁrst presents how a new French debate emerged in the late 1940s. Then it narrates the French choices leading to the ECSC, EDC, and EEC. Finally,it considers why, if only “community” ideas led France to the EEC, these institu-tions survived when Charles de Gaulle brought “traditional” ideas to power in 1958. Three Models of French Interests\nImmediately after World War II, French elites largely agreed on their basic\nEuropean strategy. Their primary goal was to keep Germany weak while rebuildingFrench strength. Their means were direct controls on occupied Germany, bolsteredby alliances and economic cooperation with other European powers. 32The advent\nof the Cold War in 1946–47, however, partly blocked this strategy. The United\n30. The only academic precedents to this argument are vague histories without speciﬁc causal claims:\nLipgens 1977; and Brugmans 1965. McNamara’s argument about ideas in the EU concerns ideas abouteconomic policies, not Europe itself. McNamara 1998.']",False,10,3,10,3,0.9145939350128174,0.42707085609436035,reasoning
